### ISSUE TITLE
k3s + calico: calico-node won't start

### ISSUE THREAD

**Issue by vzuevsky** [projectcalico/calico#5056]
I installed everything vanilla as per https://docs.projectcalico.org/getting-started/kubernetes/k3s/quickstart
```
curl -sfL https://get.k3s.io | K3S_KUBECONFIG_MODE="644" INSTALL_K3S_EXEC="--flannel-backend=none --cluster-cidr=192.168.0.0/16 --disable-network-policy --disable=traefik" sh -

kubectl apply -f https://docs.projectcalico.org/manifests/calico.yaml
```
The result:

```
# kubectl get pods
NAME                                       READY   STATUS              RESTARTS   AGE
calico-kube-controllers-75f8f6cc59-wq8cd   0/1     ContainerCreating   0          18h
local-path-provisioner-5ff76fc89d-kvkqj    0/1     ContainerCreating   0          19h
metrics-server-86cbb8457f-b545d            0/1     ContainerCreating   0          19h
coredns-7448499f4d-85m6f                   0/1     ContainerCreating   0          19h
calico-node-798xc                          0/1     CrashLoopBackOff    337        18h
```

Apparently, the cause is this:
```
2021-11-03 20:33:37.329 [INFO][9] startup/startup.go 416: Hit error connecting to datastore - retry error=Get "https://10.43.0.1:443/api/v1/nodes/foo": dial tcp 10.43.0.1:443: i/o timeout
2021-11-03 20:34:08.329 [INFO][9] startup/startup.go 416: Hit error connecting to datastore - retry error=Get "https://10.43.0.1:443/api/v1/nodes/foo": dial tcp 10.43.0.1:443: i/o timeout
```
And packet exchange:
```
19:30:00.191039 IP eth0ip.47124 > eth0ip.6443: Flags [S], seq 807312227, win 64240, options [mss 1460,sackOK,TS val 2781880977 ecr 0,nop,wscale 7], length 0
19:30:00.191055 IP eth0ip.6443 > eth0ip.47124: Flags [S.], seq 4174686549, ack 807312228, win 65483, options [mss 65495,sackOK,TS val 1695681239 ecr 2781880977,nop,wscale 7], length 0
19:30:00.191062 IP eth0ip.47124 > eth0ip.6443: Flags [R], seq 807312228, win 0, length 0
```

I noticed that there's no any network bridges being created - is that expected? Redacted:
```
# ip addr show
1: lo: <LOOPBACK,UP,LOWER_UP> mtu 65536 qdisc noqueue state UNKNOWN group default qlen 1000
    link/loopback 00:00:00:00:00:00 brd 00:00:00:00:00:00
    inet 127.0.0.1/8 scope host lo
       valid_lft forever preferred_lft forever
    inet6 ::1/128 scope host
       valid_lft forever preferred_lft forever
2: eno1: <BROADCAST,MULTICAST> mtu 1500 qdisc noop state DOWN group default qlen 1000
    link/ether b0:7b:25:b5:64:b4 brd ff:ff:ff:ff:ff:ff
3: eno2: <BROADCAST,MULTICAST> mtu 1500 qdisc noop state DOWN group default qlen 1000
    link/ether b0:7b:25:b5:64:b5 brd ff:ff:ff:ff:ff:ff
4: enp65s0f0: <BROADCAST,MULTICAST,UP,LOWER_UP> mtu 1500 qdisc mq state UP group default qlen 1000
    link/ether b8:ce:f6:19:00:b2 brd ff:ff:ff:ff:ff:ff
    inet *.206.10/28 brd *.206.15 scope global enp65s0f0
       valid_lft forever preferred_lft forever
    inet 10.255.113.6/24 brd 10.255.113.255 scope global enp65s0f0
       valid_lft forever preferred_lft forever
    inet6 *:3::a/64 scope global
       valid_lft forever preferred_lft forever
    inet6 fe80::bace:f6ff:fe19:b2/64 scope link
       valid_lft forever preferred_lft forever
5: enp65s0f1: <BROADCAST,MULTICAST> mtu 1500 qdisc noop state DOWN group default qlen 1000
    link/ether b8:ce:f6:19:00:b3 brd ff:ff:ff:ff:ff:ff
6: docker0: <NO-CARRIER,BROADCAST,MULTICAST,UP> mtu 1500 qdisc noqueue state DOWN group default
    link/ether 02:42:49:b2:5c:13 brd ff:ff:ff:ff:ff:ff
    inet 172.17.0.1/16 brd 172.17.255.255 scope global docker0
       valid_lft forever preferred_lft forever
```
## Expected Behavior

Network stack should be configured to allow this connection?

I could not find any reference to CIDR 10.43/16 and `--cluster-cidr=192.168.0.0/16` was specified. How CIDR 10.43/16 came about - is it documented somewhere?

## Current Behavior

CIDR 10.43/16 wouldn't clash with anything anyway, but connection between calico-node and api server cannot be established.

## Possible Solution
n/a

## Your Environment
bare metal
* Calico version docker.io/calico/node:v3.20.2
* Orchestrator version (e.g. kubernetes, mesos, rkt): k3s v1.21.5+k3s2 (724ef700)
* Operating System and version: Ubuntu 18.04.5 LTS

**Comment by vzuevsky** [comment]
Ok. This issue can be marked as solved. I have found offending rule based on the investigation provided above:
```
iptables -t raw -D CUSTOM_OUTPUT_CHAIN -o lo -j NOTRACK
```
The theory behind it was that DNAT comes in as stateful with implied conntrack, unless... someone helpfully made an exemption from tracking in the raw table.
