### ISSUE TITLE
Master node cannot ping newly created Pods

### ISSUE THREAD

**Issue by matakasi** [projectcalico/calico#4131]
This is a new deployment of a kubernetes cluster with 1 master and 2 workers.

I cannot reach the pods newly created from the Master node, but there is not issue reaching the same pod from any of my Worker nodes.

## Expected Behavior

The master node should be able to reach the pods on the Workers.
Pings should not fail, and curl command should open the content of the web server (nginx).

## Current Behavior

Ping from the Master to any pods hangs,

```
--- 192.168.2.7 ping statistics ---
2792 packets transmitted, 0 received, 100% packet loss, time 2857984ms
```

There is no echo reply from the Pods to the Master,

```
k8sn01:~$ sudo tcpdump -nn icmp
[sudo] password for student: 
tcpdump: verbose output suppressed, use -v or -vv for full protocol decode
listening on flannel.1, link-type EN10MB (Ethernet), capture size 262144 bytes
09:40:37.884814 IP 192.168.0.0 > 192.168.2.7: ICMP echo request, id 16, seq 50, length 64
09:40:38.908823 IP 192.168.0.0 > 192.168.2.7: ICMP echo request, id 16, seq 51, length 64
09:40:39.932835 IP 192.168.0.0 > 192.168.2.7: ICMP echo request, id 16, seq 52, length 64
09:40:40.956843 IP 192.168.0.0 > 192.168.2.7: ICMP echo request, id 16, seq 53, length 64
09:40:41.980805 IP 192.168.0.0 > 192.168.2.7: ICMP echo request, id 16, seq 54, length 64
```

When I ping 192.168.2.7 from k8sn02, I do have an echo reply.

```
k8sn02:~$ sudo tcpdump -nn icmp 
[sudo] password for student: 
tcpdump: verbose output suppressed, use -v or -vv for full protocol decode
listening on flannel.1, link-type EN10MB (Ethernet), capture size 262144 bytes
09:43:25.787558 IP 192.168.1.0 > 192.168.2.7: ICMP echo request, id 9, seq 58, length 64
09:43:25.788134 IP 192.168.2.7 > 192.168.1.0: ICMP echo reply, id 9, seq 58, length 64
09:43:26.811509 IP 192.168.1.0 > 192.168.2.7: ICMP echo request, id 9, seq 59, length 64
09:43:26.812000 IP 192.168.2.7 > 192.168.1.0: ICMP echo reply, id 9, seq 59, length 64
09:43:27.835543 IP 192.168.1.0 > 192.168.2.7: ICMP echo request, id 9, seq 60, length 64
09:43:27.835979 IP 192.168.2.7 > 192.168.1.0: ICMP echo reply, id 9, seq 60, length 64
```

## Possible Solution

I noticed that this route is missing from both nodes:
192.168.0.0/24 via 192.168.0.0 dev flannel.1 onlink

```
k8sn01:~$ ip route
default via 192.168.0.1 dev ens18 proto dhcp src 192.168.0.200 metric 100 
172.17.0.0/16 dev docker0 proto kernel scope link src 172.17.0.1 linkdown 
192.168.0.0/24 dev ens18 proto kernel scope link src 192.168.0.200 
192.168.0.1 dev ens18 proto dhcp scope link src 192.168.0.200 metric 100 
192.168.0.2 dev cali02e04fd6db8 scope link 
192.168.1.0/24 via 192.168.1.0 dev flannel.1 onlink 
192.168.2.0/24 via 192.168.2.0 dev flannel.1 onlink 

k8sn02:~$ ip route
default via 192.168.0.1 dev ens18 proto dhcp src 192.168.0.201 metric 100 
172.17.0.0/16 dev docker0 proto kernel scope link src 172.17.0.1 linkdown 
192.168.0.0/24 dev ens18 proto kernel scope link src 192.168.0.201 
192.168.0.1 dev ens18 proto dhcp scope link src 192.168.0.201 metric 100 
192.168.1.3 dev cali731b4106e23 scope link 
192.168.1.7 dev cali63d4a091157 scope link 
192.168.2.0/24 via 192.168.2.0 dev flannel.1 onlink 

k8sn03:~$ ip route
default via 192.168.0.1 dev ens18 proto dhcp src 192.168.0.202 metric 100 
172.17.0.0/16 dev docker0 proto kernel scope link src 172.17.0.1 linkdown 
192.168.0.0/24 dev ens18 proto kernel scope link src 192.168.0.202 
192.168.0.1 dev ens18 proto dhcp scope link src 192.168.0.202 metric 100 
192.168.1.0/24 via 192.168.1.0 dev flannel.1 onlink 
192.168.2.4 dev cali5727df77a53 scope link 
192.168.2.7 dev cali6854d2a2ae4 scope link
```

## Steps to Reproduce (for bugs)

1. Build a new kubernetes cluster with kubeadm, and join the workers to the master node
2. Apply the canal yaml configuration file to the master node
```
k8sn01:~$ curl https://docs.projectcalico.org/manifests/canal.yaml -O
k8sn01:~$ kubectl apply -f canal.yaml
```
3. deploy a pod

```
k8sn01:~$ kubectl get pods -o wide
NAME        READY   STATUS    RESTARTS   AGE   IP            NODE     NOMINATED NODE   READINESS GATES
nginx-app   1/1     Running   0          11h   192.168.1.7   k8sn02   <none>           <none>
pingtest    1/1     Running   0          11h   192.168.2.7   k8sn03   <none>           <none>

```
4. Run a ping to the pod/or curl the its ip address from the master

## Context

Manage all the pods from the Master node, instead of switching to a worker on every configuration change, to check the result.

## Your Environment

* Calico version: I am not sure - it should be the latest one, as I downloaded the yaml file directly from the project
* Orchestrator version (e.g. kubernetes, mesos, rkt): kubernetes 1.19.3
* Operating System and version: Ubuntu 20.04.1 LTS
* Link to your project (optional):

```
Conditions:
  Type                 Status  LastHeartbeatTime                 LastTransitionTime                Reason                       Message
  ----                 ------  -----------------                 ------------------                ------                       -------
  NetworkUnavailable   False   Wed, 28 Oct 2020 21:57:24 +0000   Wed, 28 Oct 2020 21:57:24 +0000   FlannelIsUp                  Flannel is running on this node
  MemoryPressure       False   Thu, 29 Oct 2020 09:58:20 +0000   Mon, 19 Oct 2020 18:26:11 +0000   KubeletHasSufficientMemory   kubelet has sufficient memory available
  DiskPressure         False   Thu, 29 Oct 2020 09:58:20 +0000   Mon, 19 Oct 2020 18:26:11 +0000   KubeletHasNoDiskPressure     kubelet has no disk pressure
  PIDPressure          False   Thu, 29 Oct 2020 09:58:20 +0000   Mon, 19 Oct 2020 18:26:11 +0000   KubeletHasSufficientPID      kubelet has sufficient PID available
  Ready                True    Thu, 29 Oct 2020 09:58:20 +0000   Mon, 19 Oct 2020 18:56:29 +0000   KubeletReady                 kubelet is posting ready status. AppArmor enabled
Addresses:
  InternalIP:  192.168.0.200
  Hostname:    k8sn01
Capacity:
  cpu:                2
  ephemeral-storage:  19475088Ki
  hugepages-2Mi:      0
  memory:             4030576Ki
  pods:               110
Allocatable:
  cpu:                2
  ephemeral-storage:  17948241072
  hugepages-2Mi:      0
  memory:             3928176Ki
  pods:               110
System Info:
  Machine ID:                 1ab07247d00b473f9625c5ab810e540b
  System UUID:                1ab07247-d00b-473f-9625-c5ab810e540b
  Boot ID:                    9781375f-502c-4190-89a9-b21ce0e0c6c0
  Kernel Version:             5.4.0-52-generic
  OS Image:                   Ubuntu 20.04.1 LTS
  Operating System:           linux
  Architecture:               amd64
  Container Runtime Version:  docker://19.3.13
  Kubelet Version:            v1.19.3
  Kube-Proxy Version:         v1.19.3
PodCIDR:                      192.168.0.0/24
```

**Comment by matakasi** [comment]
Fixed - the host network clashes with the pod network.

**Comment by sfahmi** [comment]
Hi
I am facing same issue using flannel. How to check if the host network clashes with the pod network.
