### ISSUE TITLE
Routing table source IP address selection when running multi NIC Nodes

### ISSUE THREAD

**Issue by jonatasbaldin** [projectcalico/calico#10750]
### Issue

The Node (kubelet) cannot reach the Pod's liveness/readiness ports (connection timeout), with that, the Pods cannot start.

Kubelet log:
```
Jul 30 17:38:19 k8s-j-calico-002-cp-aa9a7 kubelet[20646]: I0730 17:38:19.401065   20646 prober.go:107] "Probe failed" probeType="Readiness" pod="kube-system/coredns-57d9878b98-d576n" podUID="49f8ecdf-7869-43f9-af5e-40c92211c050" containerName="coredns" probeResult="failure" output="Get \"http://192.168.26.4:8181/ready\": context deadline exceeded (Client.Timeout exceeded while awaiting headers)"
```

Pod Event:
```
Warning  Unhealthy  27m (x40 over 3h20m)     kubelet  Liveness probe failed: Get "http://192.168.255.3:8080/health": dial tcp 192.168.255.3:8080: i/o timeout (Client.Timeout exceeded while awaiting headers)
```

- The Node can ping the Pod's IP address

- Other Pods can ping the Pod's IP address AND access the port configured in the liveness/readiness probes

- A Node can access the liveness/readiness Ports on Pod's IP that are running _on other Nodes_; but cannot reach the liveness/readiness ports on a Pod running on itself

- There are no Network Policies blocking the traffic (no Network Policies at all)

- Nodes are able to reach liveness/readiness on Pods with `hostNetwork: true` (calico-node, apiserver etc); these Pods are running just fine

**How can I investigate this?**

**If more information is needed, please let me know**.

### Configurations
FelixConfiguration:
```
spec:
  bpfConnectTimeLoadBalancing: TCP
  bpfEnabled: true
  bpfHostNetworkedNATWithoutCTLB: Enabled
  bpfLogLevel: ""
  floatingIPs: Disabled
  healthPort: 9099
  logSeverityScreen: Info
  nftablesMode: Disabled
  reportingInterval: 0s
  vxlanVNI: 4096
```

Installation:
```
  calicoNetwork:
    bgp: Enabled
    hostPorts: Enabled
    ipPools:
    - allowedUses:
      - Workload
      - Tunnel
      assignmentMode: Automatic
      blockSize: 24
      cidr: 192.168.0.0/16
      disableBGPExport: false
      disableNewAllocations: false
      encapsulation: VXLANCrossSubnet
      name: default-ipv4-ippool
      natOutgoing: Enabled
      nodeSelector: all()
    linuxDataplane: BPF
    multiInterfaceMode: None
    nodeAddressAutodetectionV4:
      cidrs:
      - 172.87.32.0/20
      - 172.87.0.0/20
      - 172.87.16.0/20
      firstFound: false
    windowsDataplane: Disabled
  cni:
    ipam:
      type: Calico
    type: Calico
  controlPlaneReplicas: 2
  flexVolumePath: /usr/libexec/kubernetes/kubelet-plugins/volume/exec/
  imagePullSecrets: []
  kubeletVolumePluginPath: /var/lib/kubelet
  kubernetesProvider: ""
  logging:
    cni:
      logFileMaxAgeDays: 30
      logFileMaxCount: 10
      logFileMaxSize: 100Mi
      logSeverity: Info
  nodeUpdateStrategy:
    rollingUpdate:
      maxUnavailable: 1
    type: RollingUpdate
  nonPrivileged: Disabled
  variant: Calico
```

IPPool:
```
spec:
  allowedUses:
  - Workload
  - Tunnel
  assignmentMode: Automatic
  blockSize: 24
  cidr: 192.168.0.0/16
  ipipMode: Never
  natOutgoing: true
  nodeSelector: all()
  vxlanMode: CrossSubnet
```

Network Interfaces:
```
1: lo: <LOOPBACK,UP,LOWER_UP> mtu 65536 qdisc noqueue state UNKNOWN group default qlen 1000
    link/loopback 00:00:00:00:00:00 brd 00:00:00:00:00:00
    inet 127.0.0.1/8 scope host lo
       valid_lft forever preferred_lft forever
    inet6 ::1/128 scope host 
       valid_lft forever preferred_lft forever
2: ens3: <BROADCAST,MULTICAST,UP,LOWER_UP> mtu 1500 qdisc prio state UP group default qlen 1000
    link/ether fa:16:3e:99:f8:41 brd ff:ff:ff:ff:ff:ff
    altname enp0s3
    inet 172.26.18.119/25 metric 100 brd 172.26.18.127 scope global dynamic ens3
       valid_lft 30923sec preferred_lft 30923sec
    inet6 2801:80:3eaf:8285::228/128 scope global noprefixroute 
       valid_lft forever preferred_lft forever
    inet6 fe80::f816:3eff:fe99:f841/64 scope link 
       valid_lft forever preferred_lft forever
3: usr-proj-nic: <BROADCAST,MULTICAST,UP,LOWER_UP> mtu 1500 qdisc prio state UP group default qlen 1000
    link/ether fa:16:3e:89:94:d6 brd ff:ff:ff:ff:ff:ff
    inet 172.87.1.232/20 metric 100 brd 172.87.15.255 scope global dynamic usr-proj-nic
       valid_lft 30955sec preferred_lft 30955sec
    inet6 2801:80:3eaf:8241::434/128 scope global noprefixroute 
       valid_lft forever preferred_lft forever
    inet6 fe80::f816:3eff:fe89:94d6/64 scope link 
       valid_lft forever preferred_lft forever
4: cali0b2ec8b8452@if2: <BROADCAST,MULTICAST,UP,LOWER_UP> mtu 1500 qdisc noqueue state UP group default qlen 1000
    link/ether ee:ee:ee:ee:ee:ee brd ff:ff:ff:ff:ff:ff link-netns cni-661fbe23-2f0e-e2c7-4d4e-476acff9fdbd
    inet6 fe80::ecee:eeff:feee:eeee/64 scope link 
       valid_lft forever preferred_lft forever
5: bpfout.cali@bpfin.cali: <BROADCAST,MULTICAST,UP,LOWER_UP> mtu 1450 qdisc noqueue state UP group default qlen 1000
    link/ether 2e:f9:02:26:6c:c8 brd ff:ff:ff:ff:ff:ff
    inet6 fe80::b0b4:79ff:fe8f:ad63/64 scope link 
       valid_lft forever preferred_lft forever
6: bpfin.cali@bpfout.cali: <BROADCAST,MULTICAST,UP,LOWER_UP> mtu 1450 qdisc noqueue state UP group default qlen 1000
    link/ether aa:23:93:05:6c:95 brd ff:ff:ff:ff:ff:ff
    inet6 fe80::a823:93ff:fe05:6c95/64 scope link 
       valid_lft forever preferred_lft forever
7: vxlan.calico: <BROADCAST,MULTICAST,UP,LOWER_UP> mtu 1450 qdisc noqueue state UNKNOWN group default qlen 1000
    link/ether 66:a3:76:20:69:b2 brd ff:ff:ff:ff:ff:ff
    inet 192.168.26.0/32 scope global vxlan.calico
       valid_lft forever preferred_lft forever
    inet6 fe80::64a3:76ff:fe20:69b2/64 scope link 
       valid_lft forever preferred_lft forever
8: caliecf45ad96ab@if2: <BROADCAST,MULTICAST,UP,LOWER_UP> mtu 1450 qdisc noqueue state UP group default qlen 1000
    link/ether ee:ee:ee:ee:ee:ee brd ff:ff:ff:ff:ff:ff link-netns cni-efb29cd2-347c-922a-be69-b4cf0feaeefe
    inet6 fe80::ecee:eeff:feee:eeee/64 scope link 
       valid_lft forever preferred_lft forever
9: cali10a62e45b3e@if2: <BROADCAST,MULTICAST,UP,LOWER_UP> mtu 1450 qdisc noqueue state UP group default qlen 1000
    link/ether ee:ee:ee:ee:ee:ee brd ff:ff:ff:ff:ff:ff link-netns cni-2f78a781-19d2-2f0a-e184-17940d7dba93
    inet6 fe80::ecee:eeff:feee:eeee/64 scope link 
       valid_lft forever preferred_lft forever
10: cali791918e076a@if2: <BROADCAST,MULTICAST,UP,LOWER_UP> mtu 1450 qdisc noqueue state UP group default qlen 1000
    link/ether ee:ee:ee:ee:ee:ee brd ff:ff:ff:ff:ff:ff link-netns cni-836688e5-0d80-3feb-21aa-2fa7ad9d1d13
    inet6 fe80::ecee:eeff:feee:eeee/64 scope link 
       valid_lft forever preferred_lft forever
```

/etc/cni/net.d/10-calico.conflist:
```
{
                          "name": "k8s-pod-network",
                          "cniVersion": "0.3.1",
                          "plugins": [{"container_settings":{"allow_ip_forwarding":false},"datastore_type":"kube
rnetes","endpoint_status_dir":"/var/run/calico/endpoint-status","ipam":{"assign_ipv4":"true","assign_ipv6":"fals
e","type":"calico-ipam"},"kubernetes":{"k8s_api_root":"https://<redacted>:6443","kubeconfig":"/etc/cni/net.d/
calico-kubeconfig"},"log_file_max_age":30,"log_file_max_count":10,"log_file_max_size":100,"log_file_path":"/var/
log/calico/cni/cni.log","log_level":"Info","mtu":0,"nodename_file_optional":false,"policy":{"type":"k8s"},"polic
y_setup_timeout_seconds":0,"type":"calico"},{"capabilities":{"portMappings":true},"snat":true,"type":"portmap"}]
}
```

## Your Environment

* Calico version: v.3.30.2
* Calico dataplane (bpf, nftables, iptables, windows etc.): BPF
* Orchestrator version (e.g. kubernetes, openshift, etc.): Kubernetes 1.30.10 (on-prem)
* Operating System and version: Ubuntu 22.04.5

**Comment by jonatasbaldin** [comment]
More information.

My Control Planes have 2 NICs and my Workers have only 1 NIC; only the CPs are having this issue.

With a tcpdump, on the CP, I was able to verify that traffic from the Node to the Pod's port is going out through the wrong interface (in this case, `ens3`):
```
root@k8s-j-calico-002-cp-aa9a7:/# tcpdump -i any -n port 9153
tcpdump: data link type LINUX_SLL2
tcpdump: verbose output suppressed, use -v[v]... for full protocol decode
listening on any, link-type LINUX_SLL2 (Linux cooked v2), snapshot length 262144 bytes


18:37:42.249867 ens3  Out IP 172.26.18.119.35596 > 192.168.26.7.9153: Flags [S], seq 3575812221, win 64240, options [mss 1460,sackOK,TS val 967744664 ecr 0,nop,wscale 7], length 0
18:37:43.263264 ens3  Out IP 172.26.18.119.35596 > 192.168.26.7.9153: Flags [S], seq 3575812221, win 64240, options [mss 1460,sackOK,TS val 967745678 ecr 0,nop,wscale 7], length 0
18:37:45.279265 ens3  Out IP 172.26.18.119.35596 > 192.168.26.7.9153: Flags [S], seq 3575812221, win 64240, options [mss 1460,sackOK,TS val 967747694 ecr 0,nop,wscale 7], length 0
```

On a Worker, when I try to access the liveness/readiness port on a Pod running on itself, the traffic goes through other interface:
```
root@k8s-j-calico-002-np01-e3010:/# tcpdump -i any -n port 8080
tcpdump: data link type LINUX_SLL2
tcpdump: verbose output suppressed, use -v[v]... for full protocol decode
listening on any, link-type LINUX_SLL2 (Linux cooked v2), snapshot length 262144 bytes

18:44:31.019207 calic553330abdb Out IP 172.87.16.222.56000 > 192.168.89.2.8080: Flags [S], seq 1022281467, win 64860, options [mss 1410,sackOK,TS val 535062688 ecr 0,nop,wscale 7], length 0
18:44:31.019233 calic553330abdb In  IP 192.168.89.2.8080 > 172.87.16.222.56000: Flags [S.], seq 3056556962, ack 1022281468, win 64308, options [mss 1410,sackOK,TS val 2131164871 ecr 535062688,nop,wscale 7], length 0
18:44:31.019260 calic553330abdb Out IP 172.87.16.222.56000 > 192.168.89.2.8080: Flags [.], ack 1, win 507, options [nop,nop,TS val 535062689 ecr 2131164871], length 0
18:44:31.554876 calic553330abdb Out IP 172.87.16.222.56000 > 192.168.89.2.8080: Flags [P.], seq 1:3, ack 1, win 507, options [nop,nop,TS val 535063224 ecr 2131164871], length 2: HTTP
18:44:31.554894 calic553330abdb In  IP 192.168.89.2.8080 > 172.87.16.222.56000: Flags [.], ack 3, win 503, options [nop,nop,TS val 2131165407 ecr 535063224], length 0

...
```

I believe that the CP, for having 2 NICs, have some wrong configuration.

The `nodeAddressAutodetectionV4` configuration has only the CIDRs belonging to the correct NICs (and not the ens3 one).

```    nodeAddressAutodetectionV4:
      cidrs:
      - 172.87.32.0/20
      - 172.87.0.0/20
      - 172.87.16.0/20
      firstFound: false
```

**Comment by jonatasbaldin** [comment]
More information.

When doing a telnet to the Pod's liveness/readiness port from the wrong interface (ens3), it doesn't work. From the correct interface (usr-proj-nic), it works (and the traffic goes out through the cali* interface).

```
root@k8s-j-calico-002-cp-aa9a7:/# telnet -b 172.26.18.119 192.168.26.7 91
53
Trying 192.168.26.7...


^]^C
root@k8s-j-calico-002-cp-aa9a7:/# telnet -b 172.87.1.232 192.168.26.7 9153
Trying 192.168.26.7...
Connected to 192.168.26.7.
Escape character is '^]'.
^C^]
telnet> Connection closed.
```

```
root@k8s-j-calico-002-cp-aa9a7:/# tcpdump -i any -n port 9153
tcpdump: data link type LINUX_SLL2
tcpdump: verbose output suppressed, use -v[v]... for full protocol decode
listening on any, link-type LINUX_SLL2 (Linux cooked v2), snapshot length 262144 bytes

19:00:40.932024 ens3  Out IP 172.26.18.119.40173 > 192.168.26.7.9153: Flags [S], seq 3013250355, win 64240, options [mss 1460,sackOK,TS val 969123346 ecr 0,nop,wscale 7], length 0
19:00:41.951272 ens3  Out IP 172.26.18.119.40173 > 192.168.26.7.9153: Flags [S], seq 3013250355, win 64240, options [mss 1460,sackOK,TS val 969124366 ecr 0,nop,wscale 7], length 0
19:00:43.967267 ens3  Out IP 172.26.18.119.40173 > 192.168.26.7.9153: Flags [S], seq 3013250355, win 64240, options [mss 1460,sackOK,TS val 969126382 ecr 0,nop,wscale 7], length 0

---

19:00:51.222057 cali8120cccc73a Out IP 172.87.1.232.38979 > 192.168.26.7.9153: Flags [S], seq 2968234132, win 64860, options [mss 1410,sackOK,TS val 1477133051 ecr 0,nop,wscale 7], length 0
19:00:51.222078 cali8120cccc73a In  IP 192.168.26.7.9153 > 172.87.1.232.38979: Flags [S.], seq 3261314743, ack 2968234133, win 64308, options [mss 1410,sackOK,TS val 2135571683 ecr 1477133051,nop,wscale 7], length 0
19:00:51.222101 cali8120cccc73a Out IP 172.87.1.232.38979 > 192.168.26.7.9153: Flags [.], ack 1, win 507, options [nop,nop,TS val 1477133051 ecr 2135571683], length 0
19:00:52.247154 cali8120cccc73a Out IP 172.87.1.232.38979 > 192.168.26.7.9153: Flags [P.], seq 1:2, ack 1, win 507, options [nop,nop,TS val 1477134076 ecr 2135571683], length 1
19:00:52.247186 cali8120cccc73a In  IP 192.168.26.7.9153 > 172.87.1.232.38979: Flags [.], ack 2, win 503, options [nop,nop,TS val 2135572708 ecr 1477134076], length 0
19:00:53.009133 cali8120cccc73a Out IP 172.87.1.232.38979 > 192.168.26.7.9153: Flags [P.], seq 2:7, ack 1, win 507, options [nop,nop,TS val 1477134838 ecr 2135572708], length 5
```

Question is now: how can I make sure Calico use a single NIC for its traffic? The `nodeAddressAutodetectionV4` with the correct CIDRs appears to not be working properly.

**Comment by jonatasbaldin** [comment]
More information (!).

The BPF conntrack table shows the connection being initiated from the wrong IP address (172.26.18.119):

```
$ k -n calico-system exec calico-node-dcgc9 -- calico-node -bpf conntrack dump

Defaulted container "calico-node" out of: calico-node, flexvol-driver (init), mount-bpffs (init), install-cni (init)
TCP 192.168.26.7:41548 -> 172.87.1.232:6443  Active ago 6.649934267s ESTABLISHED
TCP 172.26.18.119:58794 -> 192.168.26.7:9153  Active ago 1.773950602s SYN-SENT
TCP 192.168.255.4:33688 -> 192.168.26.7:53  Active ago 1m56.153624612s CLOSED
TCP 192.168.26.8:34500 -> 201.23.31.146:6443  Active ago 15.579535576s ESTABLISHED
TCP 172.26.18.119:44126 -> 192.168.26.8:5443  Active ago 22.541960592s SYN-SENT
```

**Comment by jonatasbaldin** [comment]
It seems that the cali* interface is being built on top of the wrong interface:

```
$ ip route get 192.168.26.7
192.168.26.7 dev cali8120cccc73a src 172.26.18.119 uid 0 
    cache
```

Related to https://github.com/projectcalico/calico/issues/9293.

**Comment by jonatasbaldin** [comment]
More information.

I tried: `kubernetes: NodeInternalIP` and `interface: usr-proj-nic` and both still returned the same issue.

**Comment by jonatasbaldin** [comment]
Some more information.

I found two possible fixes:

### 1 Routing Table
The Node has another routing table (101) with a default gateway to the `ens3` interface:

```
root@k8s-j-calico-004-cp-71e28:/# ip route show table all
default via 172.26.18.1 dev ens3 table 101 proto static onlink 
default via 172.87.0.1 dev usr-proj-nic proto dhcp src 172.87.2.232 metric 100 
...
```

By removing the routing table, I was able to get the correct IP for the route to the Pod:
```
root@k8s-j-calico-004-cp-71e28:/# ip route get 192.168.147.2
192.168.147.2 dev cali3d00bd97446 src 172.87.2.232 uid 0 
    cache 
```

A question is: the table 101 should have less priority to the kernel than the default 100 table, right? Why is the address from the `ens3` interface being picked by the kernel? 🤔 

## 2 Using DeviceRouteSourceAddress
By having a custom `FelixConfiguration` for each Node specifying the IP address from the interface I want to use (in this case, usr-proj-nic), the traffic is forwarded correctly.

Example:
```
kind: FelixConfiguration
apiVersion: projectcalico.org/v3
metadata:
  name: node.k8s-j-calico-004-cp-71e28
spec:
  deviceRouteSourceAddress: 172.87.2.232
```

To verify:
```
root@k8s-j-calico-004-cp-71e28:/# ip route get 192.168.147.2
192.168.147.2 dev cali3d00bd97446 src 172.87.2.232 uid 0 
    cache 
```

---

On my side, I'll investigate the kernel policy table priority.

As for Calico, I'd expect that, when building routes, it should use the IP address returned by `nodeAddressAutodetectionV{4,6}` instead of the kernel priority, since it already does the job of identifying (and allowing to customize) the IP address detection.

WDYT?

**Comment by fasaxc** [comment]
> the table 101 should have less priority to the kernel than the default 100 table, right

The table number is not relevant, we need to see the PBR table, try 
```
ip rule show
```

Note that you can control the src on the cali interface routes with felix configuration, but it is awkward to do so because you have to create a felixconfig resource per node with the correct IP in it.  Better to get your overall routing set-up working correctly so that the correct source IP is chosen in the first place.

You can check the route (and hence source IP) that will be chosen with 
```
ip route get <target ip>
```

**Comment by jonatasbaldin** [comment]
Here is my PBR table:

```
root@k8s-j-calico-004-cp-ddc10:/# ip rule show

0:      from all lookup local
32765:  from 172.26.18.135 lookup 101 proto static
32766:  from all lookup main
32767:  from all lookup default
```

And the `101` table:
```
root@k8s-j-calico-004-cp-ddc10:/# ip route show table 101

default via 172.26.18.129 dev ens3 proto static onlink
```

One thing I still don't understand is why the kernel is picking the address from `ens3` to build the route. Is there a way to force it to use the address from the other NIC?

**Comment by jonatasbaldin** [comment]
It seems that the `cali*` veth interface is being pared with the `ens3` NIC (index 2); it should be paired with the `usr-proj-nic`.

```
root@k8s-j-calico-004-cp-ddc10:/# ethtool -S cali642b8b9cbab
NIC statistics:
     peer_ifindex: 2
     rx_queue_0_xdp_packets: 0
     rx_queue_0_xdp_bytes: 0
     rx_queue_0_drops: 0
     rx_queue_0_xdp_redirect: 0
     rx_queue_0_xdp_drops: 0
     rx_queue_0_xdp_tx: 0
     rx_queue_0_xdp_tx_errors: 0
     tx_queue_0_xdp_xmit: 0
     tx_queue_0_xdp_xmit_errors: 0
```

The index 2 is the `ens3`:
```
root@k8s-j-calico-004-cp-ddc10:/# ip link show ens3
2: ens3: <BROADCAST,MULTICAST,UP,LOWER_UP> mtu 1500 qdisc prio state UP mode DEFAULT group default qlen 1000
    link/ether fa:16:3e:16:a4:3c brd ff:ff:ff:ff:ff:ff
    altname enp0s3
```

Is there a way to force the veth creation paired with other NIC?

**Comment by fasaxc** [comment]
veths aren't peered with a NIC, they're peered with another veth.  The other veth will be in the network namespace of the pod so it'll have ifindex 2 in the other network namespace (not related to your ens3).

You didn't share `ip route show` for your main table, but I'm assuming that it doesn't have `src` on the cali routes.  If that's the case (no src on the routes) then source IP selection will follow Linux's standard IP selection algorithm:

* First it'll look for an IP that is "close" to the pod's IP; on the same subnet with suitable scope.  It won't find one in this case.
* Then it'll fall back to looking for any good IP; it does that by scanning interfaces in order; `lo` is preferred, then it'll go to ens3 because it has lower ifindex and choose its IP.

So, if you can assign your "main" IP to `lo`, that might be a way to solve it since it'll be the default.  There might be other tricks you could use, such as putting ens3 into a second vrf.

**Comment by tomastigera** [comment]
@jonatasbaldin seems like routing is incorrect on your CP nodes. Please, follow @fasaxc advice. I am closing this issue as it is not related to calico per-se.
