### ISSUE TITLE
Problems running calico and nm-cloud-setup

### ISSUE THREAD

**Issue by manuelbuil** [projectcalico/calico#4662]
When running calico or canal in AWS image RHEL8.4, k8s deployments don't work correctly. The reason is the tool [nm-cloud-setup](https://www.mankier.com/8/nm-cloud-setup#), that adds a ip rule table which breaks the local connectivity host<-->pod. For example, if I deploy a pod in a host, this is the main ip table:
```
[ec2-user@ip-10-0-10-5 ~]$ ip r
default via 10.0.10.1 dev eth0 proto dhcp metric 100 
10.0.10.0/28 dev eth0 proto kernel scope link src 10.0.10.5 metric 100 
192.168.94.0/26 via 10.0.10.13 dev eth0 proto 80 onlink 
192.168.165.192/26 via 10.0.10.14 dev eth0 proto 80 onlink 
192.168.234.1 dev calie56a59d32a1 scope link 
```
I should be able to ping `192.168.234.1`. However, it does not work:
```
[ec2-user@ip-10-0-10-5 ~]$ ping 192.168.234.1
PING 192.168.234.1 (192.168.234.1) 56(84) bytes of data.
^C
--- 192.168.234.1 ping statistics ---
5 packets transmitted, 0 received, 100% packet loss, time 4118ms
```
When sniffing the interface, I can see the packets:
```
14:21:16.293671 IP 10.0.10.5 > 192.168.234.1: ICMP echo request, id 25370, seq 10, length 64
14:21:16.293699 IP 192.168.234.1 > 10.0.10.5: ICMP echo reply, id 25370, seq 10, length 64
14:21:17.317188 IP 10.0.10.5 > 192.168.234.1: ICMP echo request, id 25370, seq 11, length 64
14:21:17.317216 IP 192.168.234.1 > 10.0.10.5: ICMP echo reply, id 25370, seq 11, length 64
14:21:18.341238 IP 10.0.10.5 > 192.168.234.1: ICMP echo request, id 25370, seq 12, length 64
14:21:18.341265 IP 192.168.234.1 > 10.0.10.5: ICMP echo reply, id 25370, seq 12, length 64
14:21:19.365216 IP 10.0.10.5 > 192.168.234.1: ICMP echo request, id 25370, seq 13, length 64
14:21:19.365245 IP 192.168.234.1 > 10.0.10.5: ICMP echo reply, id 25370, seq 13, length 64
```
When looking at the ip routing tables, there is one created by the nm-cloud-setup (30400):
```
[ec2-user@ip-10-0-10-5 ~]$ ip rule
0:	from all lookup local
30400:	from 10.0.10.5 lookup 30400
32766:	from all lookup main
32767:	from all lookup default
[ec2-user@ip-10-0-10-5 ~]$ ip route show table 30400
default via 10.0.10.1 dev eth0 proto static metric 10 
10.0.10.1 dev eth0 proto static scope link metric 10 
```
As soon as it gets deleted, things work as expected:
```
[ec2-user@ip-10-0-10-5 ~]$ sudo ip rule del table 30400
[ec2-user@ip-10-0-10-5 ~]$ ip rule
0:	from all lookup local
32766:	from all lookup main
32767:	from all lookup default
[ec2-user@ip-10-0-10-5 ~]$ ping 192.168.234.1
PING 192.168.234.1 (192.168.234.1) 56(84) bytes of data.
64 bytes from 192.168.234.1: icmp_seq=1 ttl=64 time=0.058 ms
64 bytes from 192.168.234.1: icmp_seq=2 ttl=64 time=0.064 ms
64 bytes from 192.168.234.1: icmp_seq=3 ttl=64 time=0.065 ms
64 bytes from 192.168.234.1: icmp_seq=4 ttl=64 time=0.064 ms
```
Things also work if nm-cloud-setup is disabled and the node is rebooted (that routing table never gets created).

I have reported this issue to NetworkManager https://gitlab.freedesktop.org/NetworkManager/NetworkManager/-/issues/740 but so far there has not been a solution

## Expected Behavior

Be able to ping local pods from host

## Current Behavior

It is not possible to ping local pods from host

## Possible Solution

Disable nm-cloud-setup and nm-cloud-setup.timer

## Steps to Reproduce (for bugs)

Explained above. Tried with rancher rke2 and calico. Tried as well with rke2 and canal

## Your Environment

* Calico version: v3.19.1
* Orchestrator version (e.g. kubernetes, mesos, rkt): Kubernetes 1.20.7
* Operating System and version: RHEL 8.4 (in my case from AWS)

**Comment by dmitry-irtegov** [comment]
How do I vote for NetworkManager issue?

**Comment by caseydavenport** [comment]
This looks like a bug on the nm side which causes all VM traffic to bypass the main routing table. Not sure there's anything meaningful we can do on the Calico side.

If possible, I'd recommend disabling nm.

**Comment by caseydavenport** [comment]
Or maybe there is a way to disable the use of the second routing table?
