### ISSUE TITLE
Random connection timeouts in ebpf mode (Error attaching tc program invalid argument iface="tunl0")

### ISSUE THREAD

**Issue by byoungb** [projectcalico/calico#6103]
Random timeouts connecting to http site when in `ebpf` mode, with or without DSR enabled. Everything worked find with normal calico with kube-proxy.

## Expected Behavior
running
`curl http://my-test.example.com/` 
should return successfully every time and quickly.

## Current Behavior
while running
`curl http://my-test.example.com/` 
randomly it will fail with
```
curl: (28) Failed to connect to my-test.example.com port 80 after 128698 ms: Connection timed out
```
Or also randomly I will get a valid response after like a minute...
`time curl http://my-test.example.com/` 
```
200 Hello World
real	1m3.985s
user	0m0.004s
sys	0m0.003s
```
But these errors only occur about every 3 or 4 requests, and the other requests are just fine.

I also noticed these errors in the calico-node logs... and maybe I should have started with this... I guess?
```
[INFO][66] felix/bpf_ep_mgr.go 1376: Need to attach program hook="egress" iface="tunl0" type="tunnel"
[INFO][66] felix/bpf_ep_mgr.go 1376: Need to attach program hook="ingress" iface="tunl0" type="tunnel"
[WARNING][66] felix/bpf_ep_mgr.go 646: Failed to apply policy to interface, will retry error=Error attaching tc program invalid argument iface="tunl0"
[INFO][66] felix/attach.go 501: Removed stale BPF map pin. id=1238 path="/sys/fs/bpf/tc/tunl0_egr/cali_jump2"
[INFO][66] felix/attach.go 501: Removed stale BPF map pin. id=1240 path="/sys/fs/bpf/tc/tunl0_igr/cali_jump2"
```

But I can confirm that both nodes have the `tunl0` interface... `ip addr show`

```
8: tunl0@NONE: <NOARP,UP,LOWER_UP> mtu 1430 qdisc noqueue state UNKNOWN group default qlen 1000
    link/ipip 0.0.0.0 brd 0.0.0.0
    inet 10.244.23.64/32 scope global tunl0
       valid_lft forever preferred_lft forever
```

## Steps to Reproduce (for bugs)
1. Install calico on Kubernetes cluster (without kube-proxy) and enable ebpf
2. Have MetalLB installed on the cluster
3. Expose an http MetalLB loadbalanced service 
4. Ctrl+F5 or run curl multiple times until it randomly hangs.

## Context
I am trying to setup a Kubernetes cluster for an eCommerce site. We need source IP preservation and we are running MetalLB as our loadbalancer, in BGP mode.

When running just the default version of calico (or flannel) with kube-proxy everything works fine, (except cannot get original source IPs). 

I am currently just testing with 2 nodes, and I can confirm that the issue does occur on both nodes by running `tcpdump` and when the issue occurs I see the following with tcpdump and this will occur on both nodes.

```
20:29:23.262291 IP 71-34-168-14.desm.qwest.net.46454 > 108.61.135.113.vultrusercontent.com.https: Flags [S], seq 786589275, win 64240, options [mss 1460,sackOK,TS val 2448501534 ecr 0,nop,wscale 7], length 0
20:29:24.274776 IP 71-34-168-14.desm.qwest.net.46454 > 108.61.135.113.vultrusercontent.com.https: Flags [S], seq 786589275, win 64240, options [mss 1460,sackOK,TS val 2448502547 ecr 0,nop,wscale 7], length 0
20:29:26.322842 IP 71-34-168-14.desm.qwest.net.46454 > 108.61.135.113.vultrusercontent.com.https: Flags [S], seq 786589275, win 64240, options [mss 1460,sackOK,TS val 2448504595 ecr 0,nop,wscale 7], length 0
20:29:30.354828 IP 71-34-168-14.desm.qwest.net.46454 > 108.61.135.113.vultrusercontent.com.https: Flags [S], seq 786589275, win 64240, options [mss 1460,sackOK,TS val 2448508627 ecr 0,nop,wscale 7], length 0
20:29:38.610865 IP 71-34-168-14.desm.qwest.net.46454 > 108.61.135.113.vultrusercontent.com.https: Flags [S], seq 786589275, win 64240, options [mss 1460,sackOK,TS val 2448516883 ecr 0,nop,wscale 7], length 0
20:29:54.994544 IP 71-34-168-14.desm.qwest.net.46454 > 108.61.135.113.vultrusercontent.com.https: Flags [S], seq 786589275, win 64240, options [mss 1460,sackOK,TS val 2448533267 ecr 0,nop,wscale 7], length 0
```

## Your Environment
* Calico version
3.23.0
* Orchestrator version (e.g. kubernetes, mesos, rkt):
kubernetes v1.24.0
* Operating System and version:
cat /etc/redhat-release
`Rocky Linux release 8.5 (Green Obsidian)`
* Linux Kernel
uname -r
`4.18.0-348.23.1.el8_5.x86_64`
* BPF Mount
mount | grep "/sys/fs/bpf"
`bpf on /sys/fs/bpf type bpf (rw,nosuid,nodev,noexec,relatime,mode=700)`
* MetalLB version
v0.12.1

**Comment by fasaxc** [comment]
Let's try to take as many variables out of the equation as possible:
* How is DNS involved (is there an intermediate load balancer or does that DN connect to the MetalLB IP)?  You said `curl http://my-test.example.com/`, what if you `curl` the IP address instead?
* What if you connect to the node port instead of MetalLB IP?

**Comment by byoungb** [comment]
Yeah sorry I probably could have predicted those requests.

> How is DNS involved (is there an intermediate load balancer or does that DN connect to the MetalLB IP)? You said curl http://my-test.example.com/, what if you curl the IP address instead?
* Same result using the IP address directly instead of using a domain name. (curl http://108.61.135.113:8080/)
> What if you connect to the node port instead of MetalLB IP?
* Node port service appears to have the exact same issue (every 3rd or 4th requests just hangs and then either returns or timesout), so MetalLB is I guess not involved in the issue.
> Where are you running curl? Is it on an external system?
* I was just running it from my desktop, but I just redid the tests from servers in the same network as the k8s cluster and they have the same issue with the node port service.
* I also connected to several other servers on various other networks (AWS and a colocation facility) and they had the same issues.

It is probably also worth mentioning that the pods that actually service the requests all get hit... so once a connection is established I can refresh over and over and it is fine (without a ctrl+f5 refresh) and I can see all the pods returned in various requests with the whoami image I am testing with.

**Comment by byoungb** [comment]
I am very willing to do some additional debugging on this issue. Any suggestions on what I should try? 

- Different OS?
- Different Network Interface?
- Different Network?

I think I will just try a single node right now to see if the issue appears even when there is no "external/outside" networking. Might be a waste of time... but easy enough for me to test.

I guess I didn't mention this in my above notes... but I do have 2 networks in this setup... an external public network, and an internal private network. I have kubernetes setup up to basically use the private network. (kublet has node-ip set to the private ip, and `kubelet-preferred-address-types: InternalIP`)

I left `BPFDataIfacePattern` to be the default regex which does match both of my interfaces.
