### ISSUE TITLE
Intermittent IPv6 LoadBalancer/externalIP TCP connection stalls with eBPF, BGP, and externalTrafficPolicy=Local

### ISSUE THREAD

**Issue by pr0ton11** [projectcalico/calico#12957]
# Intermittent IPv6 LoadBalancer/externalIP TCP connection stalls with eBPF, BGP, and externalTrafficPolicy=Local

## Summary

We are seeing intermittent TCP connection stalls and timeouts when connecting to an IPv6 Kubernetes Service external IP that is advertised via Calico BGP and handled by the Calico eBPF service dataplane.

The issue only appears when targeting the Service external/LoadBalancer IP. Directly targeting the same node's NodePort is clean.

The tcpdump evidence shows that the initial SYN reaches the selected Kubernetes node, but the node does not send a SYN-ACK until the client retransmits the SYN about 1 second later. This causes intermittent ~1s, ~2s, ~3s connection setup delays and occasional curl connect timeouts.

This looks similar to:

- https://github.com/projectcalico/calico/issues/11523
- https://github.com/projectcalico/calico/issues/4712
- https://github.com/projectcalico/calico/issues/4431

## Environment

All hostnames and IP addresses below are redacted. IPv6 examples use the documentation prefix `2001:db8::/32`.

- Calico version: `v3.32.0`
- Kubernetes distribution: `k3s`
- Kubernetes version: `v1.35.5+k3s1`
- OS: Debian GNU/Linux 13 trixie
- Kernel: `6.12.90+deb13.1-amd64`
- Dataplane: Calico eBPF enabled
- BGP enabled, node-to-node mesh enabled
- IPv6/dual-stack cluster
- Nodes:
  - `node-1.example`: `2001:db8:50::11`
  - `node-2.example`: `2001:db8:50::12`
  - `node-3.example`: `2001:db8:50::13`
- External router / BGP peer: VyOS VM, `2001:db8:50::1`
- The router and all Kubernetes nodes are on the same L2 bridge.

Relevant Felix config from logs:

```text
CalicoVersion:"v3.32.0"
BPFEnabled:true
Ipv6Support:true
BPFExternalServiceMode:"tunnel"
BPFConnectTimeLoadBalancing:"TCP"
BPFConnectTimeLoadBalancingEnabled:false
```

## Calico BGP configuration

```yaml
apiVersion: projectcalico.org/v3
kind: BGPConfiguration
metadata:
  name: default
spec:
  logSeverityScreen: Info
  nodeToNodeMeshEnabled: true
  nodeMeshMaxRestartTime: 120s
  asNumber: 65000
  serviceClusterIPs:
    - cidr: 10.0.0.0/16
    - cidr: 2001:db8:cad::/64
  serviceLoadBalancerIPs:
    - cidr: 192.0.2.0/24
    - cidr: 2001:db8:cae::/64
  serviceExternalIPs:
    - cidr: 192.0.2.0/24
    - cidr: 2001:db8:cae::/64
  listenPort: 178
  bindMode: NodeIP
```

## Service configuration

The affected Service is generated by Envoy Gateway.

```yaml
apiVersion: v1
kind: Service
metadata:
  name: envoy-redacted
  namespace: tigera-gateway
  annotations:
    projectcalico.org/loadBalancerIPs: '["192.0.2.80","2001:db8:cae::1080"]'
spec:
  type: LoadBalancer
  externalTrafficPolicy: Local
  internalTrafficPolicy: Cluster
  ipFamilyPolicy: PreferDualStack
  ipFamilies:
    - IPv6
    - IPv4
  clusterIPs:
    - 2001:db8:cad::4ad6
    - 10.0.220.174
  externalIPs:
    - 192.0.2.80
    - 2001:db8:cae::1080
  ports:
    - name: http-80
      port: 80
      nodePort: 31636
      targetPort: 10080
      protocol: TCP
    - name: https-443
      port: 443
      nodePort: 30709
      targetPort: 10443
      protocol: TCP
```

There is one ready Envoy Gateway backend pod on each node. Example IPv6 EndpointSlice:

```text
2001:db8:cab::101   # node-1
2001:db8:cab::102   # node-2
2001:db8:cab::103   # node-3
```

## BGP route on external router

The router has ECMP routes for the LoadBalancer IPv6 prefix:

```text
2001:db8:cae::/64 nhid 62 proto bgp metric 20 pref medium
        nexthop via 2001:db8:50::13 dev eth3 weight 1
        nexthop via 2001:db8:50::12 dev eth3 weight 1
        nexthop via 2001:db8:50::11 dev eth3 weight 1
```

For some tests we pinned the router route to `node-1` only:

```text
2001:db8:cae::1080 from 2001:db8:50::1
  via 2001:db8:50::11 dev eth3 src 2001:db8:50::1 metric 1 pref medium
```

The issue still reproduced when pinned to a single node.

## Reproduction

Run repeated HTTPS connects from the external router to the advertised IPv6 Service external IP:

```bash
curl \
  --silent --show-error --output /dev/null \
  --connect-timeout 5 --max-time 15 \
  --haproxy-protocol \
  --resolve 'redacted.domain:443:2001:db8:cae::1080' \
  'https://redacted.domain/'
```

The `--haproxy-protocol` flag is not believed to be related. The problem is visible in `time_connect`; the TLS handshake delay is downstream of the delayed TCP connection establishment.

Typical slow/failing rows from the test loop:

```text
ts                         rc  time_connect  time_appconnect  time_total  http_code  route
2026-06-10T20:28:18+02:00  0   1.063597      1.102053         1.106088    302        via node-1
2026-06-10T20:28:24+02:00  0   1.038703      1.076130         1.080873    302        via node-1
2026-06-10T20:28:26+02:00  0   1.018785      1.056209         1.060610    302        via node-1
2026-06-10T20:52:27+02:00  28  0.000000      0.000000         5.001647    000        timeout
2026-06-10T20:52:45+02:00  28  0.000000      0.000000         5.001156    000        timeout
```

## NodePort comparison

Directly connecting from the same external router to the same node's NodePort is clean.

Test target:

```text
[2001:db8:50::11]:30709
```

Result over at least 500 probes:

```text
checked=100 last_rc=0 last_appconnect=0.037744 last_total=0.042286
checked=200 last_rc=0 last_appconnect=0.037557 last_total=0.040764
checked=300 last_rc=0 last_appconnect=0.037193 last_total=0.041931
checked=400 last_rc=0 last_appconnect=0.037255 last_total=0.041429
checked=500 last_rc=0 last_appconnect=0.037827 last_total=0.041978
```

This suggests the basic router-to-node path, Envoy listener, pod, and NodePort path are healthy. The failure appears specific to the Calico eBPF handling of the external/LoadBalancer IP.

## Tcpdump evidence

We captured simultaneously on:

- external router interface `eth3`
- selected Kubernetes node `node-1`

For a slow connection using client source port `54250`, the first SYN reaches `node-1`, but `node-1` does not send a SYN-ACK until the retransmitted SYN about 1 second later.

On `node-1`:

```text
20:28:18.382739  external-router > node-1  2001:db8:50::1.54250 > 2001:db8:cae::1080.443: Flags [S]
20:28:19.445451  external-router > node-1  2001:db8:50::1.54250 > 2001:db8:cae::1080.443: Flags [S]
20:28:19.445879  node-1 > external-router  2001:db8:cae::1080.443 > 2001:db8:50::1.54250: Flags [S.]
```

Same pattern for source port `54444`:

```text
20:28:24.871640  external-router > node-1  2001:db8:50::1.54444 > 2001:db8:cae::1080.443: Flags [S]
20:28:25.909636  external-router > node-1  2001:db8:50::1.54444 > 2001:db8:cae::1080.443: Flags [S]
20:28:25.909960  node-1 > external-router  2001:db8:cae::1080.443 > 2001:db8:50::1.54444: Flags [S.]
```

And source port `58630`:

```text
20:28:26.171244  external-router > node-1  2001:db8:50::1.58630 > 2001:db8:cae::1080.443: Flags [S]
20:28:27.189500  external-router > node-1  2001:db8:50::1.58630 > 2001:db8:cae::1080.443: Flags [S]
20:28:27.189564  node-1 > external-router  2001:db8:cae::1080.443 > 2001:db8:50::1.58630: Flags [S.]
```

This rules out loss before the node: the first SYN is visible on the node. The delayed SYN-ACK suggests the first SYN is not being handled correctly by the node's service dataplane.

There was also one more severe failure where packets appeared to loop/duplicate between nodes for the external IP:

```text
20:28:35.702244  external-router > node-1  2001:db8:50::1.36864 > 2001:db8:cae::1080.443: Flags [S]
20:28:35.702721  node-2 > external-router  2001:db8:50::1.36864 > 2001:db8:cae::1080.443: Flags [S]
20:28:35.702746  external-router > node-1  2001:db8:50::1.36864 > 2001:db8:cae::1080.443: Flags [S]
```

In that case the same SYN was repeatedly seen from the `node-2` MAC back to the router while still addressed to the external IPv6 Service IP.

## Calico logs

After adding the external IP CIDRs to `serviceExternalIPs`, Calico no longer logs "Cannot advertise External IP - not in allow list".

However, after restarting `calico-node` on `node-1`, the issue still reproduces.

The logs repeatedly show the affected Service being received by Felix, followed by:

```text
Received *proto.ServiceUpdate update from calculation graph. msg=name:"envoy-redacted" namespace:"tigera-gateway" type:"LoadBalancer" cluster_ips:"2001:db8:cad::4ad6" cluster_ips:"10.0.220.174" external_ips:"192.0.2.80" external_ips:"2001:db8:cae::1080" ports:{Protocol:"TCP" Port:80 NodePort:31636} ports:{Protocol:"TCP" Port:443 NodePort:30709}
Unhandled update type=*proto.ServiceUpdate
```

## Expected behavior

Connections to the IPv6 Service external/LoadBalancer IP should be handled consistently. If the SYN reaches a node that has a local ready endpoint for the Service, the node should respond without waiting for a client SYN retransmission.

## Actual behavior

Some SYNs that reach the selected node are not answered until the client retransmits. This causes intermittent connection setup delays in roughly 1-second increments and occasional 5-second connect timeouts.

Direct NodePort traffic to the same node and backend is stable.

## Workaround

Pointing the upstream load balancer directly at the nodes' NodePort appears to avoid the issue:

```text
node-1 [2001:db8:50::11]:30709
node-2 [2001:db8:50::12]:30709
node-3 [2001:db8:50::13]:30709
```

## Question

Is this a known issue in the Calico eBPF service dataplane for IPv6 external/LoadBalancer IPs with BGP and `externalTrafficPolicy: Local`?

If this is expected to be fixed by a newer `v3.32.x` build or by a specific PR, I can test that. PR https://github.com/projectcalico/calico/pull/12743 looked potentially related, but I am not sure whether it applies to this failure mode.

**Comment by pr0ton11** [comment]
Is anyone looking at this? It would be very helpful to get some assistance for this issue.

**Comment by aaaaaaaalex** [comment]
Hiya, sorry for the wait. Could you provide a full log dump if it's not too much trouble and you're able to redact it?


Also, are you using `externalTrafficPolicy` for the repro?
One potential cause of this issue is that the internal Calico tunnel used for bouncing service packets between nodes isn't fully working, and you see a response when Calico picks it's own node for load balancing the packet, instead of bouncing it. You can verify if that's related by setting `externalTrafficPolicy: Local`. If it still happens then, it's something else. If it goes away, the issue is related to the inter-node tunnel.

As an example, something that could possibly break the inter-node tunnel is a badly-fitting MTU value - eBPF dataplane drops packets when they exceed the MTU, rather than fragmenting. MTU can be an issue for the inter-node tunnel because we internally use a VXLAN device for Calico-to-Calico packet handover, which adds a few bytes of overhead.

**Comment by pr0ton11** [comment]
Yes, unfortunately in the meantime we moved the company to Cilium because we needed independent LoadBalancer pools to work reliably. We can not use the workaround with the NodePort forever since it's taking a lot of effort to keep this predictable for many nodes.
But yes; I was using externalTrafficPolicy: Local on the  service instances. The nodes are connected in the same layer 2 broadcast domain within Proxmox and switches and don't use jumbo frames, MTU is therefore standard.
In Cilium no such issue exists, so an underlying networking issue is quite unlikely.

**Comment by aaaaaaaalex** [comment]
Sorry to hear, thanks for trying Calico 🙏
