### ISSUE TITLE
TCP failure

### ISSUE THREAD

**Issue by tseglevskiy** [projectcalico/calico#2141]
Good day. 

We have Kubernetes cluster with the Calico inside. We have a few symmetric nodes, with the same versions of software, with the same hardware and the same network subnet. But between two specific nodes we have problem with TCP. It looks like Calico drops big packets. I can see it by tcpdump, look at it below.

Is there any ideas, what is the reason? What instruments are available to investigate?

It is internal side, tunl0:

```
node-6 core # tcpdump -ni tunl0 host 10.2.0.1 and port 3000
dropped privs to tcpdump
tcpdump: verbose output suppressed, use -v or -vv for full protocol decode
listening on tunl0, link-type RAW (Raw IP), capture size 262144 bytes
10:40:56.384344 IP 10.2.0.1.46536 > 10.2.7.26.3000: Flags [S], seq 2470058151, win 28800, options [mss 1440,sackOK,TS val 909488305 ecr 0,nop,wscale 7], length 0
10:40:56.384570 IP 10.2.7.26.3000 > 10.2.0.1.46536: Flags [S.], seq 2473209361, ack 2470058152, win 28560, options [mss 1440,sackOK,TS val 3118059364 ecr 909488305,nop,wscale 7], length 0
10:40:56.384796 IP 10.2.0.1.46536 > 10.2.7.26.3000: Flags [.], ack 1, win 225, options [nop,nop,TS val 909488305 ecr 3118059364], length 0
10:40:56.384879 IP 10.2.0.1.46536 > 10.2.7.26.3000: Flags [P.], seq 1:181, ack 1, win 225, options [nop,nop,TS val 909488305 ecr 3118059364], length 180
10:40:56.384898 IP 10.2.7.26.3000 > 10.2.0.1.46536: Flags [.], ack 181, win 232, options [nop,nop,TS val 3118059364 ecr 909488305], length 0
10:40:56.432671 IP 10.2.7.26.3000 > 10.2.0.1.46536: Flags [.], seq 1:7141, ack 181, win 232, options [nop,nop,TS val 3118059412 ecr 909488305], length 7140
10:40:56.432760 IP 10.2.7.26.3000 > 10.2.0.1.46536: Flags [.], seq 7141:14281, ack 181, win 232, options [nop,nop,TS val 3118059412 ecr 909488305], length 7140
10:40:56.436794 IP 10.2.7.26.3000 > 10.2.0.1.46536: Flags [.], seq 14281:15709, ack 181, win 232, options [nop,nop,TS val 3118059416 ecr 909488305], length 1428
10:40:56.639794 IP 10.2.7.26.3000 > 10.2.0.1.46536: Flags [.], seq 1:1429, ack 181, win 232, options [nop,nop,TS val 3118059619 ecr 909488305], length 1428
10:40:57.047782 IP 10.2.7.26.3000 > 10.2.0.1.46536: Flags [.], seq 1:1429, ack 181, win 232, options [nop,nop,TS val 3118060027 ecr 909488305], length 1428
10:40:57.863800 IP 10.2.7.26.3000 > 10.2.0.1.46536: Flags [.], seq 1:1429, ack 181, win 232, options [nop,nop,TS val 3118060843 ecr 909488305], length 1428
10:40:59.527786 IP 10.2.7.26.3000 > 10.2.0.1.46536: Flags [.], seq 1:1429, ack 181, win 232, options [nop,nop,TS val 3118062507 ecr 909488305], length 1428
10:41:02.024784 IP 10.2.7.26.3000 > 10.2.0.1.46144: Flags [.], seq 2238366142:2238367570, ack 4005363882, win 232, options [nop,nop,TS val 3118065004 ecr 909480572], length 1428
10:41:02.791766 IP 10.2.7.26.3000 > 10.2.0.1.46536: Flags [.], seq 1:1429, ack 181, win 232, options [nop,nop,TS val 3118065771 ecr 909488305], length 1428
10:41:09.703797 IP 10.2.7.26.3000 > 10.2.0.1.46536: Flags [.], seq 1:1429, ack 181, win 232, options [nop,nop,TS val 3118072683 ecr 909488305], length 1428
10:41:18.482415 IP 10.2.0.1.46536 > 10.2.7.26.3000: Flags [F.], seq 181, ack 1, win 225, options [nop,nop,TS val 909510403 ecr 3118059364], length 0
10:41:18.522806 IP 10.2.7.26.3000 > 10.2.0.1.46536: Flags [.], ack 182, win 232, options [nop,nop,TS val 3118081502 ecr 909510403], length 0
10:41:23.015809 IP 10.2.7.26.3000 > 10.2.0.1.46536: Flags [.], seq 1:1429, ack 182, win 232, options [nop,nop,TS val 3118085995 ecr 909510403], length 1428
10:41:28.135961 IP 10.2.7.26.3000 > 10.2.0.1.46144: Flags [.], seq 0:1428, ack 1, win 232, options [nop,nop,TS val 3118091115 ecr 909480572], length 1428
^C
19 packets captured
19 packets received by filter
0 packets dropped by kernel
node-6 core # 
```

```
node-6 core # tcpdump -ni ens2f0 host 10.120.193.9 and host 10.120.193.6 | grep 3000
dropped privs to tcpdump
tcpdump: verbose output suppressed, use -v or -vv for full protocol decode
listening on ens2f0, link-type EN10MB (Ethernet), capture size 262144 bytes
10:40:56.384306 IP 10.120.193.9 > 10.120.193.6: IP 10.2.0.1.46536 > 10.2.7.26.3000: Flags [S], seq 2470058151, win 28800, options [mss 1440,sackOK,TS val 909488305 ecr 0,nop,wscale 7], length 0 (ipip-proto-4)
10:40:56.384588 IP 10.120.193.6 > 10.120.193.9: IP 10.2.7.26.3000 > 10.2.0.1.46536: Flags [S.], seq 2473209361, ack 2470058152, win 28560, options [mss 1440,sackOK,TS val 3118059364 ecr 909488305,nop,wscale 7], length 0 (ipip-proto-4)
10:40:56.384789 IP 10.120.193.9 > 10.120.193.6: IP 10.2.0.1.46536 > 10.2.7.26.3000: Flags [.], ack 1, win 225, options [nop,nop,TS val 909488305 ecr 3118059364], length 0 (ipip-proto-4)
10:40:56.384871 IP 10.120.193.9 > 10.120.193.6: IP 10.2.0.1.46536 > 10.2.7.26.3000: Flags [P.], seq 1:181, ack 1, win 225, options [nop,nop,TS val 909488305 ecr 3118059364], length 180 (ipip-proto-4)
10:40:56.384904 IP 10.120.193.6 > 10.120.193.9: IP 10.2.7.26.3000 > 10.2.0.1.46536: Flags [.], ack 181, win 232, options [nop,nop,TS val 3118059364 ecr 909488305], length 0 (ipip-proto-4)
10:41:18.482371 IP 10.120.193.9 > 10.120.193.6: IP 10.2.0.1.46536 > 10.2.7.26.3000: Flags [F.], seq 181, ack 1, win 225, options [nop,nop,TS val 909510403 ecr 3118059364], length 0 (ipip-proto-4)
10:41:18.522834 IP 10.120.193.6 > 10.120.193.9: IP 10.2.7.26.3000 > 10.2.0.1.46536: Flags [.], ack 182, win 232, options [nop,nop,TS val 3118081502 ecr 909510403], length 0 (ipip-proto-4)
^C238 packets captured
252 packets received by filter
0 packets dropped by kernel

node-6 core #
```

You can see that first big packet didn't come. 

Request to the same server from another node works fine:

```
node-6 core # tcpdump -ni tunl0 host 10.2.3.1 and port 3000
dropped privs to tcpdump
tcpdump: verbose output suppressed, use -v or -vv for full protocol decode
listening on tunl0, link-type RAW (Raw IP), capture size 262144 bytes

10:52:22.476262 IP 10.2.3.1.54732 > 10.2.7.26.3000: Flags [S], seq 2975928908, win 28800, options [mss 1440,sackOK,TS val 2860165661 ecr 0,nop,wscale 7], length 0
10:52:22.476348 IP 10.2.7.26.3000 > 10.2.3.1.54732: Flags [S.], seq 2979612277, ack 2975928909, win 28560, options [mss 1440,sackOK,TS val 1903436288 ecr 2860165661,nop,wscale 7], length 0
10:52:22.476527 IP 10.2.3.1.54732 > 10.2.7.26.3000: Flags [.], ack 1, win 225, options [nop,nop,TS val 2860165661 ecr 1903436288], length 0
10:52:22.476609 IP 10.2.3.1.54732 > 10.2.7.26.3000: Flags [P.], seq 1:181, ack 1, win 225, options [nop,nop,TS val 2860165661 ecr 1903436288], length 180
10:52:22.476631 IP 10.2.7.26.3000 > 10.2.3.1.54732: Flags [.], ack 181, win 232, options [nop,nop,TS val 1903436288 ecr 2860165661], length 0
10:52:22.588262 IP 10.2.7.26.3000 > 10.2.3.1.54732: Flags [.], seq 1:7141, ack 181, win 232, options [nop,nop,TS val 1903436400 ecr 2860165661], length 7140
10:52:22.588313 IP 10.2.7.26.3000 > 10.2.3.1.54732: Flags [.], seq 7141:14281, ack 181, win 232, options [nop,nop,TS val 1903436400 ecr 2860165661], length 7140
10:52:22.588421 IP 10.2.3.1.54732 > 10.2.7.26.3000: Flags [.], ack 1429, win 248, options [nop,nop,TS val 2860165773 ecr 1903436400], length 0
10:52:22.588613 IP 10.2.3.1.54732 > 10.2.7.26.3000: Flags [.], ack 14281, win 449, options [nop,nop,TS val 2860165773 ecr 1903436400], length 0
10:52:22.588657 IP 10.2.7.26.3000 > 10.2.3.1.54732: Flags [P.], seq 14281:28561, ack 181, win 232, options [nop,nop,TS val 1903436400 ecr 2860165773], length 14280
10:52:22.588684 IP 10.2.7.26.3000 > 10.2.3.1.54732: Flags [P.], seq 28561:42841, ack 181, win 232, options [nop,nop,TS val 1903436400 ecr 2860165773], length 14280
10:52:22.588761 IP 10.2.3.1.54732 > 10.2.7.26.3000: Flags [.], ack 15709, win 471, options [nop,nop,TS val 2860165773 ecr 1903436400], length 0
10:52:22.588810 IP 10.2.3.1.54732 > 10.2.7.26.3000: Flags [.], ack 19993, win 538, options [nop,nop,TS val 2860165773 ecr 1903436400], length 0
10:52:22.588851 IP 10.2.3.1.54732 > 10.2.7.26.3000: Flags [.], ack 22849, win 582, options [nop,nop,TS val 2860165773 ecr 1903436400], length 0
10:52:22.588858 IP 10.2.7.26.3000 > 10.2.3.1.54732: Flags [.], seq 42841:44269, ack 181, win 232, options [nop,nop,TS val 1903436401 ecr 2860165773], length 1428
10:52:22.588859 IP 10.2.3.1.54732 > 10.2.7.26.3000: Flags [.], ack 25705, win 627, options [nop,nop,TS val 2860165774 ecr 1903436400], length 0
10:52:22.588887 IP 10.2.7.26.3000 > 10.2.3.1.54732: Flags [.], seq 44269:48553, ack 181, win 232, options [nop,nop,TS val 1903436401 ecr 2860165773], length 4284
10:52:22.588917 IP 10.2.3.1.54732 > 10.2.7.26.3000: Flags [.], ack 28561, win 672, options [nop,nop,TS val 2860165774 ecr 1903436400], length 0
10:52:22.588927 IP 10.2.3.1.54732 > 10.2.7.26.3000: Flags [.], ack 31417, win 716, options [nop,nop,TS val 2860165774 ecr 1903436400], length 0
10:52:22.588931 IP 10.2.3.1.54732 > 10.2.7.26.3000: Flags [.], ack 32845, win 739, options [nop,nop,TS val 2860165774 ecr 1903436400], length 0
10:52:22.588950 IP 10.2.7.26.3000 > 10.2.3.1.54732: Flags [.], seq 48553:59977, ack 181, win 232, options [nop,nop,TS val 1903436401 ecr 2860165774], length 11424
10:52:22.588988 IP 10.2.3.1.54732 > 10.2.7.26.3000: Flags [.], ack 35701, win 783, options [nop,nop,TS val 2860165774 ecr 1903436400], length 0
10:52:22.588995 IP 10.2.3.1.54732 > 10.2.7.26.3000: Flags [.], ack 38557, win 828, options [nop,nop,TS val 2860165774 ecr 1903436400], length 0
10:52:22.589000 IP 10.2.3.1.54732 > 10.2.7.26.3000: Flags [.], ack 41413, win 873, options [nop,nop,TS val 2860165774 ecr 1903436400], length 0
10:52:22.589004 IP 10.2.3.1.54732 > 10.2.7.26.3000: Flags [.], ack 42841, win 895, options [nop,nop,TS val 2860165774 ecr 1903436400], length 0
10:52:22.589024 IP 10.2.7.26.3000 > 10.2.3.1.54732: Flags [.], seq 59977:69973, ack 181, win 232, options [nop,nop,TS val 1903436401 ecr 2860165774], length 9996
10:52:22.589049 IP 10.2.3.1.54732 > 10.2.7.26.3000: Flags [.], ack 45697, win 939, options [nop,nop,TS val 2860165774 ecr 1903436401], length 0
10:52:22.589056 IP 10.2.3.1.54732 > 10.2.7.26.3000: Flags [.], ack 48553, win 984, options [nop,nop,TS val 2860165774 ecr 1903436401], length 0
10:52:22.589077 IP 10.2.7.26.3000 > 10.2.3.1.54732: Flags [.], seq 69973:78541, ack 181, win 232, options [nop,nop,TS val 1903436401 ecr 2860165774], length 8568
10:52:22.589090 IP 10.2.3.1.54732 > 10.2.7.26.3000: Flags [.], ack 51409, win 1029, options [nop,nop,TS val 2860165774 ecr 1903436401], length 0
10:52:22.589106 IP 10.2.3.1.54732 > 10.2.7.26.3000: Flags [.], ack 54265, win 1073, options [nop,nop,TS val 2860165774 ecr 1903436401], length 0
10:52:22.589118 IP 10.2.7.26.3000 > 10.2.3.1.54732: Flags [P.], seq 78541:82825, ack 181, win 232, options [nop,nop,TS val 1903436401 ecr 2860165774], length 4284
10:52:22.589138 IP 10.2.3.1.54732 > 10.2.7.26.3000: Flags [.], ack 57121, win 1118, options [nop,nop,TS val 2860165774 ecr 1903436401], length 0
10:52:22.589144 IP 10.2.3.1.54732 > 10.2.7.26.3000: Flags [.], ack 59977, win 1163, options [nop,nop,TS val 2860165774 ecr 1903436401], length 0
10:52:22.589173 IP 10.2.7.26.3000 > 10.2.3.1.54732: Flags [.], seq 82825:89965, ack 181, win 232, options [nop,nop,TS val 1903436401 ecr 2860165774], length 7140
10:52:22.589184 IP 10.2.3.1.54732 > 10.2.7.26.3000: Flags [.], ack 64261, win 1230, options [nop,nop,TS val 2860165774 ecr 1903436401], length 0
10:52:22.589212 IP 10.2.3.1.54732 > 10.2.7.26.3000: Flags [.], ack 67117, win 1274, options [nop,nop,TS val 2860165774 ecr 1903436401], length 0
10:52:22.589219 IP 10.2.3.1.54732 > 10.2.7.26.3000: Flags [.], ack 68545, win 1296, options [nop,nop,TS val 2860165774 ecr 1903436401], length 0
10:52:22.589261 IP 10.2.3.1.54732 > 10.2.7.26.3000: Flags [.], ack 71401, win 1341, options [nop,nop,TS val 2860165774 ecr 1903436401], length 0
10:52:22.589268 IP 10.2.3.1.54732 > 10.2.7.26.3000: Flags [.], ack 74257, win 1350, options [nop,nop,TS val 2860165774 ecr 1903436401], length 0
10:52:22.589282 IP 10.2.7.26.3000 > 10.2.3.1.54732: Flags [.], seq 89965:102817, ack 181, win 232, options [nop,nop,TS val 1903436401 ecr 2860165774], length 12852
10:52:22.589304 IP 10.2.3.1.54732 > 10.2.7.26.3000: Flags [.], ack 77113, win 1333, options [nop,nop,TS val 2860165774 ecr 1903436401], length 0
10:52:22.589329 IP 10.2.3.1.54732 > 10.2.7.26.3000: Flags [.], ack 81397, win 1359, options [nop,nop,TS val 2860165774 ecr 1903436401], length 0
10:52:22.589372 IP 10.2.3.1.54732 > 10.2.7.26.3000: Flags [.], ack 82825, win 1350, options [nop,nop,TS val 2860165774 ecr 1903436401], length 0
10:52:22.589379 IP 10.2.3.1.54732 > 10.2.7.26.3000: Flags [.], ack 85681, win 1333, options [nop,nop,TS val 2860165774 ecr 1903436401], length 0
10:52:22.589412 IP 10.2.7.26.3000 > 10.2.3.1.54732: Flags [.], seq 102817:114241, ack 181, win 232, options [nop,nop,TS val 1903436401 ecr 2860165774], length 11424
10:52:22.589443 IP 10.2.3.1.54732 > 10.2.7.26.3000: Flags [.], ack 89965, win 1359, options [nop,nop,TS val 2860165774 ecr 1903436401], length 0
10:52:22.589450 IP 10.2.3.1.54732 > 10.2.7.26.3000: Flags [.], ack 91393, win 1350, options [nop,nop,TS val 2860165774 ecr 1903436401], length 0
10:52:22.589455 IP 10.2.3.1.54732 > 10.2.7.26.3000: Flags [.], ack 94249, win 1366, options [nop,nop,TS val 2860165774 ecr 1903436401], length 0
10:52:22.589471 IP 10.2.7.26.3000 > 10.2.3.1.54732: Flags [.], seq 114241:125665, ack 181, win 232, options [nop,nop,TS val 1903436401 ecr 2860165774], length 11424
10:52:22.589499 IP 10.2.3.1.54732 > 10.2.7.26.3000: Flags [.], ack 95677, win 1358, options [nop,nop,TS val 2860165774 ecr 1903436401], length 0
10:52:22.589506 IP 10.2.3.1.54732 > 10.2.7.26.3000: Flags [.], ack 98533, win 1366, options [nop,nop,TS val 2860165774 ecr 1903436401], length 0
10:52:22.589510 IP 10.2.3.1.54732 > 10.2.7.26.3000: Flags [.], ack 101389, win 1366, options [nop,nop,TS val 2860165774 ecr 1903436401], length 0
10:52:22.589659 IP 10.2.3.1.54732 > 10.2.7.26.3000: Flags [.], ack 115669, win 1372, options [nop,nop,TS val 2860165774 ecr 1903436401], length 0
10:52:22.589693 IP 10.2.7.26.3000 > 10.2.3.1.54732: Flags [.], seq 125665:141373, ack 181, win 232, options [nop,nop,TS val 1903436401 ecr 2860165774], length 15708
10:52:22.589758 IP 10.2.3.1.54732 > 10.2.7.26.3000: Flags [.], ack 125665, win 1372, options [nop,nop,TS val 2860165774 ecr 1903436401], length 0
10:52:22.589794 IP 10.2.7.26.3000 > 10.2.3.1.54732: Flags [.], seq 141373:157081, ack 181, win 232, options [nop,nop,TS val 1903436402 ecr 2860165774], length 15708
10:52:22.589813 IP 10.2.7.26.3000 > 10.2.3.1.54732: Flags [.], seq 157081:158509, ack 181, win 232, options [nop,nop,TS val 1903436402 ecr 2860165774], length 1428
10:52:22.589838 IP 10.2.3.1.54732 > 10.2.7.26.3000: Flags [.], ack 127093, win 1394, options [nop,nop,TS val 2860165774 ecr 1903436401], length 0
10:52:22.589845 IP 10.2.3.1.54732 > 10.2.7.26.3000: Flags [.], ack 129949, win 1439, options [nop,nop,TS val 2860165774 ecr 1903436401], length 0
10:52:22.589849 IP 10.2.3.1.54732 > 10.2.7.26.3000: Flags [.], ack 132805, win 1483, options [nop,nop,TS val 2860165775 ecr 1903436401], length 0
10:52:22.589864 IP 10.2.3.1.54732 > 10.2.7.26.3000: Flags [.], ack 135661, win 1528, options [nop,nop,TS val 2860165775 ecr 1903436401], length 0
10:52:22.589879 IP 10.2.7.26.3000 > 10.2.3.1.54732: Flags [.], seq 158509:169933, ack 181, win 232, options [nop,nop,TS val 1903436402 ecr 2860165775], length 11424
10:52:22.589903 IP 10.2.3.1.54732 > 10.2.7.26.3000: Flags [.], ack 138517, win 1573, options [nop,nop,TS val 2860165775 ecr 1903436401], length 0
10:52:22.589911 IP 10.2.3.1.54732 > 10.2.7.26.3000: Flags [.], ack 141373, win 1617, options [nop,nop,TS val 2860165775 ecr 1903436401], length 0
10:52:22.589938 IP 10.2.3.1.54732 > 10.2.7.26.3000: Flags [.], ack 144229, win 1662, options [nop,nop,TS val 2860165775 ecr 1903436402], length 0
10:52:22.589971 IP 10.2.3.1.54732 > 10.2.7.26.3000: Flags [.], ack 147085, win 1707, options [nop,nop,TS val 2860165775 ecr 1903436402], length 0
10:52:22.589986 IP 10.2.7.26.3000 > 10.2.3.1.54732: Flags [P.], seq 169933:176409, ack 181, win 232, options [nop,nop,TS val 1903436402 ecr 2860165775], length 6476
10:52:22.590002 IP 10.2.3.1.54732 > 10.2.7.26.3000: Flags [.], ack 149941, win 1751, options [nop,nop,TS val 2860165775 ecr 1903436402], length 0
10:52:22.590079 IP 10.2.3.1.54732 > 10.2.7.26.3000: Flags [.], ack 158509, win 1885, options [nop,nop,TS val 2860165775 ecr 1903436402], length 0
10:52:22.590118 IP 10.2.3.1.54732 > 10.2.7.26.3000: Flags [.], ack 161365, win 1930, options [nop,nop,TS val 2860165775 ecr 1903436402], length 0
10:52:22.590126 IP 10.2.3.1.54732 > 10.2.7.26.3000: Flags [.], ack 165649, win 1997, options [nop,nop,TS val 2860165775 ecr 1903436402], length 0
10:52:22.590138 IP 10.2.3.1.54732 > 10.2.7.26.3000: Flags [.], ack 167077, win 2019, options [nop,nop,TS val 2860165775 ecr 1903436402], length 0
10:52:22.590151 IP 10.2.3.1.54732 > 10.2.7.26.3000: Flags [.], ack 169933, win 2064, options [nop,nop,TS val 2860165775 ecr 1903436402], length 0
10:52:22.590175 IP 10.2.3.1.54732 > 10.2.7.26.3000: Flags [.], ack 171361, win 2086, options [nop,nop,TS val 2860165775 ecr 1903436402], length 0
10:52:22.590206 IP 10.2.3.1.54732 > 10.2.7.26.3000: Flags [.], ack 175645, win 2153, options [nop,nop,TS val 2860165775 ecr 1903436402], length 0
10:52:22.590226 IP 10.2.3.1.54732 > 10.2.7.26.3000: Flags [.], ack 176409, win 2175, options [nop,nop,TS val 2860165775 ecr 1903436402], length 0
10:52:22.590336 IP 10.2.3.1.54732 > 10.2.7.26.3000: Flags [F.], seq 181, ack 176409, win 2175, options [nop,nop,TS val 2860165775 ecr 1903436402], length 0
10:52:22.590498 IP 10.2.7.26.3000 > 10.2.3.1.54732: Flags [F.], seq 176409, ack 182, win 232, options [nop,nop,TS val 1903436402 ecr 2860165775], length 0
10:52:22.590590 IP 10.2.3.1.54732 > 10.2.7.26.3000: Flags [.], ack 176410, win 2175, options [nop,nop,TS val 2860165775 ecr 1903436402], length 0
^C
80 packets captured
80 packets received by filter
0 packets dropped by kernel
node-6 core # 
```

```
node-6 core # tcpdump -ni ens2f0 host 10.120.193.7 and host 10.120.193.6 | grep 3000
dropped privs to tcpdump
tcpdump: verbose output suppressed, use -v or -vv for full protocol decode
listening on ens2f0, link-type EN10MB (Ethernet), capture size 262144 bytes


10:52:22.476239 IP 10.120.193.7 > 10.120.193.6: IP 10.2.3.1.54732 > 10.2.7.26.3000: Flags [S], seq 2975928908, win 28800, options [mss 1440,sackOK,TS val 2860165661 ecr 0,nop,wscale 7], length 0 (ipip-proto-4)
10:52:22.476357 IP 10.120.193.6 > 10.120.193.7: IP 10.2.7.26.3000 > 10.2.3.1.54732: Flags [S.], seq 2979612277, ack 2975928909, win 28560, options [mss 1440,sackOK,TS val 1903436288 ecr 2860165661,nop,wscale 7], length 0 (ipip-proto-4)
10:52:22.476520 IP 10.120.193.7 > 10.120.193.6: IP 10.2.3.1.54732 > 10.2.7.26.3000: Flags [.], ack 1, win 225, options [nop,nop,TS val 2860165661 ecr 1903436288], length 0 (ipip-proto-4)
10:52:22.476601 IP 10.120.193.7 > 10.120.193.6: IP 10.2.3.1.54732 > 10.2.7.26.3000: Flags [P.], seq 1:181, ack 1, win 225, options [nop,nop,TS val 2860165661 ecr 1903436288], length 180 (ipip-proto-4)
10:52:22.476640 IP 10.120.193.6 > 10.120.193.7: IP 10.2.7.26.3000 > 10.2.3.1.54732: Flags [.], ack 181, win 232, options [nop,nop,TS val 1903436288 ecr 2860165661], length 0 (ipip-proto-4)
10:52:22.588290 IP 10.120.193.6 > 10.120.193.7: IP 10.2.7.26.3000 > 10.2.3.1.54732: Flags [.], seq 1:7141, ack 181, win 232, options [nop,nop,TS val 1903436400 ecr 2860165661], length 7140 (ipip-proto-4)
10:52:22.588319 IP 10.120.193.6 > 10.120.193.7: IP 10.2.7.26.3000 > 10.2.3.1.54732: Flags [.], seq 7141:14281, ack 181, win 232, options [nop,nop,TS val 1903436400 ecr 2860165661], length 7140 (ipip-proto-4)
10:52:22.588405 IP 10.120.193.7 > 10.120.193.6: IP 10.2.3.1.54732 > 10.2.7.26.3000: Flags [.], ack 1429, win 248, options [nop,nop,TS val 2860165773 ecr 1903436400], length 0 (ipip-proto-4)
10:52:22.588606 IP 10.120.193.7 > 10.120.193.6: IP 10.2.3.1.54732 > 10.2.7.26.3000: Flags [.], ack 14281, win 449, options [nop,nop,TS val 2860165773 ecr 1903436400], length 0 (ipip-proto-4)
10:52:22.588671 IP 10.120.193.6 > 10.120.193.7: IP 10.2.7.26.3000 > 10.2.3.1.54732: Flags [P.], seq 14281:28561, ack 181, win 232, options [nop,nop,TS val 1903436400 ecr 2860165773], length 14280 (ipip-proto-4)
10:52:22.588692 IP 10.120.193.6 > 10.120.193.7: IP 10.2.7.26.3000 > 10.2.3.1.54732: Flags [P.], seq 28561:42841, ack 181, win 232, options [nop,nop,TS val 1903436400 ecr 2860165773], length 14280 (ipip-proto-4)
10:52:22.588756 IP 10.120.193.7 > 10.120.193.6: IP 10.2.3.1.54732 > 10.2.7.26.3000: Flags [.], ack 15709, win 471, options [nop,nop,TS val 2860165773 ecr 1903436400], length 0 (ipip-proto-4)
10:52:22.588804 IP 10.120.193.7 > 10.120.193.6: IP 10.2.3.1.54732 > 10.2.7.26.3000: Flags [.], ack 19993, win 538, options [nop,nop,TS val 2860165773 ecr 1903436400], length 0 (ipip-proto-4)
10:52:22.588841 IP 10.120.193.7 > 10.120.193.6: IP 10.2.3.1.54732 > 10.2.7.26.3000: Flags [.], ack 22849, win 582, options [nop,nop,TS val 2860165773 ecr 1903436400], length 0 (ipip-proto-4)
10:52:22.588848 IP 10.120.193.7 > 10.120.193.6: IP 10.2.3.1.54732 > 10.2.7.26.3000: Flags [.], ack 25705, win 627, options [nop,nop,TS val 2860165774 ecr 1903436400], length 0 (ipip-proto-4)
10:52:22.588867 IP 10.120.193.6 > 10.120.193.7: IP 10.2.7.26.3000 > 10.2.3.1.54732: Flags [.], seq 42841:44269, ack 181, win 232, options [nop,nop,TS val 1903436401 ecr 2860165773], length 1428 (ipip-proto-4)
10:52:22.588891 IP 10.120.193.6 > 10.120.193.7: IP 10.2.7.26.3000 > 10.2.3.1.54732: Flags [.], seq 44269:48553, ack 181, win 232, options [nop,nop,TS val 1903436401 ecr 2860165773], length 4284 (ipip-proto-4)
10:52:22.588901 IP 10.120.193.7 > 10.120.193.6: IP 10.2.3.1.54732 > 10.2.7.26.3000: Flags [.], ack 28561, win 672, options [nop,nop,TS val 2860165774 ecr 1903436400], length 0 (ipip-proto-4)
10:52:22.588908 IP 10.120.193.7 > 10.120.193.6: IP 10.2.3.1.54732 > 10.2.7.26.3000: Flags [.], ack 31417, win 716, options [nop,nop,TS val 2860165774 ecr 1903436400], length 0 (ipip-proto-4)
10:52:22.588912 IP 10.120.193.7 > 10.120.193.6: IP 10.2.3.1.54732 > 10.2.7.26.3000: Flags [.], ack 32845, win 739, options [nop,nop,TS val 2860165774 ecr 1903436400], length 0 (ipip-proto-4)
10:52:22.588958 IP 10.120.193.6 > 10.120.193.7: IP 10.2.7.26.3000 > 10.2.3.1.54732: Flags [.], seq 48553:59977, ack 181, win 232, options [nop,nop,TS val 1903436401 ecr 2860165774], length 11424 (ipip-proto-4)
10:52:22.588968 IP 10.120.193.7 > 10.120.193.6: IP 10.2.3.1.54732 > 10.2.7.26.3000: Flags [.], ack 35701, win 783, options [nop,nop,TS val 2860165774 ecr 1903436400], length 0 (ipip-proto-4)
10:52:22.588974 IP 10.120.193.7 > 10.120.193.6: IP 10.2.3.1.54732 > 10.2.7.26.3000: Flags [.], ack 38557, win 828, options [nop,nop,TS val 2860165774 ecr 1903436400], length 0 (ipip-proto-4)
10:52:22.588979 IP 10.120.193.7 > 10.120.193.6: IP 10.2.3.1.54732 > 10.2.7.26.3000: Flags [.], ack 41413, win 873, options [nop,nop,TS val 2860165774 ecr 1903436400], length 0 (ipip-proto-4)
10:52:22.588985 IP 10.120.193.7 > 10.120.193.6: IP 10.2.3.1.54732 > 10.2.7.26.3000: Flags [.], ack 42841, win 895, options [nop,nop,TS val 2860165774 ecr 1903436400], length 0 (ipip-proto-4)
10:52:22.589031 IP 10.120.193.6 > 10.120.193.7: IP 10.2.7.26.3000 > 10.2.3.1.54732: Flags [.], seq 59977:69973, ack 181, win 232, options [nop,nop,TS val 1903436401 ecr 2860165774], length 9996 (ipip-proto-4)
10:52:22.589039 IP 10.120.193.7 > 10.120.193.6: IP 10.2.3.1.54732 > 10.2.7.26.3000: Flags [.], ack 45697, win 939, options [nop,nop,TS val 2860165774 ecr 1903436401], length 0 (ipip-proto-4)
10:52:22.589045 IP 10.120.193.7 > 10.120.193.6: IP 10.2.3.1.54732 > 10.2.7.26.3000: Flags [.], ack 48553, win 984, options [nop,nop,TS val 2860165774 ecr 1903436401], length 0 (ipip-proto-4)
10:52:22.589064 IP 10.120.193.7 > 10.120.193.6: IP 10.2.3.1.54732 > 10.2.7.26.3000: Flags [.], ack 51409, win 1029, options [nop,nop,TS val 2860165774 ecr 1903436401], length 0 (ipip-proto-4)
10:52:22.589085 IP 10.120.193.6 > 10.120.193.7: IP 10.2.7.26.3000 > 10.2.3.1.54732: Flags [.], seq 69973:78541, ack 181, win 232, options [nop,nop,TS val 1903436401 ecr 2860165774], length 8568 (ipip-proto-4)
10:52:22.589099 IP 10.120.193.7 > 10.120.193.6: IP 10.2.3.1.54732 > 10.2.7.26.3000: Flags [.], ack 54265, win 1073, options [nop,nop,TS val 2860165774 ecr 1903436401], length 0 (ipip-proto-4)
10:52:22.589123 IP 10.120.193.6 > 10.120.193.7: IP 10.2.7.26.3000 > 10.2.3.1.54732: Flags [P.], seq 78541:82825, ack 181, win 232, options [nop,nop,TS val 1903436401 ecr 2860165774], length 4284 (ipip-proto-4)
10:52:22.589129 IP 10.120.193.7 > 10.120.193.6: IP 10.2.3.1.54732 > 10.2.7.26.3000: Flags [.], ack 57121, win 1118, options [nop,nop,TS val 2860165774 ecr 1903436401], length 0 (ipip-proto-4)
10:52:22.589134 IP 10.120.193.7 > 10.120.193.6: IP 10.2.3.1.54732 > 10.2.7.26.3000: Flags [.], ack 59977, win 1163, options [nop,nop,TS val 2860165774 ecr 1903436401], length 0 (ipip-proto-4)
10:52:22.589178 IP 10.120.193.7 > 10.120.193.6: IP 10.2.3.1.54732 > 10.2.7.26.3000: Flags [.], ack 64261, win 1230, options [nop,nop,TS val 2860165774 ecr 1903436401], length 0 (ipip-proto-4)
10:52:22.589182 IP 10.120.193.6 > 10.120.193.7: IP 10.2.7.26.3000 > 10.2.3.1.54732: Flags [.], seq 82825:89965, ack 181, win 232, options [nop,nop,TS val 1903436401 ecr 2860165774], length 7140 (ipip-proto-4)
10:52:22.589202 IP 10.120.193.7 > 10.120.193.6: IP 10.2.3.1.54732 > 10.2.7.26.3000: Flags [.], ack 67117, win 1274, options [nop,nop,TS val 2860165774 ecr 1903436401], length 0 (ipip-proto-4)
10:52:22.589208 IP 10.120.193.7 > 10.120.193.6: IP 10.2.3.1.54732 > 10.2.7.26.3000: Flags [.], ack 68545, win 1296, options [nop,nop,TS val 2860165774 ecr 1903436401], length 0 (ipip-proto-4)
10:52:22.589251 IP 10.120.193.7 > 10.120.193.6: IP 10.2.3.1.54732 > 10.2.7.26.3000: Flags [.], ack 71401, win 1341, options [nop,nop,TS val 2860165774 ecr 1903436401], length 0 (ipip-proto-4)
10:52:22.589258 IP 10.120.193.7 > 10.120.193.6: IP 10.2.3.1.54732 > 10.2.7.26.3000: Flags [.], ack 74257, win 1350, options [nop,nop,TS val 2860165774 ecr 1903436401], length 0 (ipip-proto-4)
10:52:22.589291 IP 10.120.193.6 > 10.120.193.7: IP 10.2.7.26.3000 > 10.2.3.1.54732: Flags [.], seq 89965:102817, ack 181, win 232, options [nop,nop,TS val 1903436401 ecr 2860165774], length 12852 (ipip-proto-4)
10:52:22.589300 IP 10.120.193.7 > 10.120.193.6: IP 10.2.3.1.54732 > 10.2.7.26.3000: Flags [.], ack 77113, win 1333, options [nop,nop,TS val 2860165774 ecr 1903436401], length 0 (ipip-proto-4)
10:52:22.589325 IP 10.120.193.7 > 10.120.193.6: IP 10.2.3.1.54732 > 10.2.7.26.3000: Flags [.], ack 81397, win 1359, options [nop,nop,TS val 2860165774 ecr 1903436401], length 0 (ipip-proto-4)
10:52:22.589361 IP 10.120.193.7 > 10.120.193.6: IP 10.2.3.1.54732 > 10.2.7.26.3000: Flags [.], ack 82825, win 1350, options [nop,nop,TS val 2860165774 ecr 1903436401], length 0 (ipip-proto-4)
10:52:22.589368 IP 10.120.193.7 > 10.120.193.6: IP 10.2.3.1.54732 > 10.2.7.26.3000: Flags [.], ack 85681, win 1333, options [nop,nop,TS val 2860165774 ecr 1903436401], length 0 (ipip-proto-4)
10:52:22.589419 IP 10.120.193.6 > 10.120.193.7: IP 10.2.7.26.3000 > 10.2.3.1.54732: Flags [.], seq 102817:114241, ack 181, win 232, options [nop,nop,TS val 1903436401 ecr 2860165774], length 11424 (ipip-proto-4)
10:52:22.589428 IP 10.120.193.7 > 10.120.193.6: IP 10.2.3.1.54732 > 10.2.7.26.3000: Flags [.], ack 89965, win 1359, options [nop,nop,TS val 2860165774 ecr 1903436401], length 0 (ipip-proto-4)
10:52:22.589434 IP 10.120.193.7 > 10.120.193.6: IP 10.2.3.1.54732 > 10.2.7.26.3000: Flags [.], ack 91393, win 1350, options [nop,nop,TS val 2860165774 ecr 1903436401], length 0 (ipip-proto-4)
10:52:22.589440 IP 10.120.193.7 > 10.120.193.6: IP 10.2.3.1.54732 > 10.2.7.26.3000: Flags [.], ack 94249, win 1366, options [nop,nop,TS val 2860165774 ecr 1903436401], length 0 (ipip-proto-4)
10:52:22.589477 IP 10.120.193.6 > 10.120.193.7: IP 10.2.7.26.3000 > 10.2.3.1.54732: Flags [.], seq 114241:125665, ack 181, win 232, options [nop,nop,TS val 1903436401 ecr 2860165774], length 11424 (ipip-proto-4)
10:52:22.589485 IP 10.120.193.7 > 10.120.193.6: IP 10.2.3.1.54732 > 10.2.7.26.3000: Flags [.], ack 95677, win 1358, options [nop,nop,TS val 2860165774 ecr 1903436401], length 0 (ipip-proto-4)
10:52:22.589490 IP 10.120.193.7 > 10.120.193.6: IP 10.2.3.1.54732 > 10.2.7.26.3000: Flags [.], ack 98533, win 1366, options [nop,nop,TS val 2860165774 ecr 1903436401], length 0 (ipip-proto-4)
10:52:22.589495 IP 10.120.193.7 > 10.120.193.6: IP 10.2.3.1.54732 > 10.2.7.26.3000: Flags [.], ack 101389, win 1366, options [nop,nop,TS val 2860165774 ecr 1903436401], length 0 (ipip-proto-4)
10:52:22.589654 IP 10.120.193.7 > 10.120.193.6: IP 10.2.3.1.54732 > 10.2.7.26.3000: Flags [.], ack 115669, win 1372, options [nop,nop,TS val 2860165774 ecr 1903436401], length 0 (ipip-proto-4)
10:52:22.589701 IP 10.120.193.6 > 10.120.193.7: IP 10.2.7.26.3000 > 10.2.3.1.54732: Flags [.], seq 125665:141373, ack 181, win 232, options [nop,nop,TS val 1903436401 ecr 2860165774], length 15708 (ipip-proto-4)
10:52:22.589753 IP 10.120.193.7 > 10.120.193.6: IP 10.2.3.1.54732 > 10.2.7.26.3000: Flags [.], ack 125665, win 1372, options [nop,nop,TS val 2860165774 ecr 1903436401], length 0 (ipip-proto-4)
10:52:22.589802 IP 10.120.193.6 > 10.120.193.7: IP 10.2.7.26.3000 > 10.2.3.1.54732: Flags [.], seq 141373:157081, ack 181, win 232, options [nop,nop,TS val 1903436402 ecr 2860165774], length 15708 (ipip-proto-4)
10:52:22.589817 IP 10.120.193.6 > 10.120.193.7: IP 10.2.7.26.3000 > 10.2.3.1.54732: Flags [.], seq 157081:158509, ack 181, win 232, options [nop,nop,TS val 1903436402 ecr 2860165774], length 1428 (ipip-proto-4)
10:52:22.589824 IP 10.120.193.7 > 10.120.193.6: IP 10.2.3.1.54732 > 10.2.7.26.3000: Flags [.], ack 127093, win 1394, options [nop,nop,TS val 2860165774 ecr 1903436401], length 0 (ipip-proto-4)
10:52:22.589829 IP 10.120.193.7 > 10.120.193.6: IP 10.2.3.1.54732 > 10.2.7.26.3000: Flags [.], ack 129949, win 1439, options [nop,nop,TS val 2860165774 ecr 1903436401], length 0 (ipip-proto-4)
10:52:22.589833 IP 10.120.193.7 > 10.120.193.6: IP 10.2.3.1.54732 > 10.2.7.26.3000: Flags [.], ack 132805, win 1483, options [nop,nop,TS val 2860165775 ecr 1903436401], length 0 (ipip-proto-4)
10:52:22.589860 IP 10.120.193.7 > 10.120.193.6: IP 10.2.3.1.54732 > 10.2.7.26.3000: Flags [.], ack 135661, win 1528, options [nop,nop,TS val 2860165775 ecr 1903436401], length 0 (ipip-proto-4)
10:52:22.589888 IP 10.120.193.6 > 10.120.193.7: IP 10.2.7.26.3000 > 10.2.3.1.54732: Flags [.], seq 158509:169933, ack 181, win 232, options [nop,nop,TS val 1903436402 ecr 2860165775], length 11424 (ipip-proto-4)
10:52:22.589896 IP 10.120.193.7 > 10.120.193.6: IP 10.2.3.1.54732 > 10.2.7.26.3000: Flags [.], ack 138517, win 1573, options [nop,nop,TS val 2860165775 ecr 1903436401], length 0 (ipip-proto-4)
10:52:22.589900 IP 10.120.193.7 > 10.120.193.6: IP 10.2.3.1.54732 > 10.2.7.26.3000: Flags [.], ack 141373, win 1617, options [nop,nop,TS val 2860165775 ecr 1903436401], length 0 (ipip-proto-4)
10:52:22.589932 IP 10.120.193.7 > 10.120.193.6: IP 10.2.3.1.54732 > 10.2.7.26.3000: Flags [.], ack 144229, win 1662, options [nop,nop,TS val 2860165775 ecr 1903436402], length 0 (ipip-proto-4)
10:52:22.589966 IP 10.120.193.7 > 10.120.193.6: IP 10.2.3.1.54732 > 10.2.7.26.3000: Flags [.], ack 147085, win 1707, options [nop,nop,TS val 2860165775 ecr 1903436402], length 0 (ipip-proto-4)
10:52:22.589991 IP 10.120.193.6 > 10.120.193.7: IP 10.2.7.26.3000 > 10.2.3.1.54732: Flags [P.], seq 169933:176409, ack 181, win 232, options [nop,nop,TS val 1903436402 ecr 2860165775], length 6476 (ipip-proto-4)
10:52:22.589998 IP 10.120.193.7 > 10.120.193.6: IP 10.2.3.1.54732 > 10.2.7.26.3000: Flags [.], ack 149941, win 1751, options [nop,nop,TS val 2860165775 ecr 1903436402], length 0 (ipip-proto-4)
10:52:22.590074 IP 10.120.193.7 > 10.120.193.6: IP 10.2.3.1.54732 > 10.2.7.26.3000: Flags [.], ack 158509, win 1885, options [nop,nop,TS val 2860165775 ecr 1903436402], length 0 (ipip-proto-4)


10:52:22.590107 IP 10.120.193.7 > 10.120.193.6: IP 10.2.3.1.54732 > 10.2.7.26.3000: Flags [.], ack 161365, win 1930, options [nop,nop,TS val 2860165775 ecr 1903436402], length 0 (ipip-proto-4)
10:52:22.590114 IP 10.120.193.7 > 10.120.193.6: IP 10.2.3.1.54732 > 10.2.7.26.3000: Flags [.], ack 165649, win 1997, options [nop,nop,TS val 2860165775 ecr 1903436402], length 0 (ipip-proto-4)
10:52:22.590132 IP 10.120.193.7 > 10.120.193.6: IP 10.2.3.1.54732 > 10.2.7.26.3000: Flags [.], ack 167077, win 2019, options [nop,nop,TS val 2860165775 ecr 1903436402], length 0 (ipip-proto-4)
10:52:22.590147 IP 10.120.193.7 > 10.120.193.6: IP 10.2.3.1.54732 > 10.2.7.26.3000: Flags [.], ack 169933, win 2064, options [nop,nop,TS val 2860165775 ecr 1903436402], length 0 (ipip-proto-4)
10:52:22.590170 IP 10.120.193.7 > 10.120.193.6: IP 10.2.3.1.54732 > 10.2.7.26.3000: Flags [.], ack 171361, win 2086, options [nop,nop,TS val 2860165775 ecr 1903436402], length 0 (ipip-proto-4)
10:52:22.590201 IP 10.120.193.7 > 10.120.193.6: IP 10.2.3.1.54732 > 10.2.7.26.3000: Flags [.], ack 175645, win 2153, options [nop,nop,TS val 2860165775 ecr 1903436402], length 0 (ipip-proto-4)
10:52:22.590222 IP 10.120.193.7 > 10.120.193.6: IP 10.2.3.1.54732 > 10.2.7.26.3000: Flags [.], ack 176409, win 2175, options [nop,nop,TS val 2860165775 ecr 1903436402], length 0 (ipip-proto-4)
10:52:22.590331 IP 10.120.193.7 > 10.120.193.6: IP 10.2.3.1.54732 > 10.2.7.26.3000: Flags [F.], seq 181, ack 176409, win 2175, options [nop,nop,TS val 2860165775 ecr 1903436402], length 0 (ipip-proto-4)
10:52:22.590508 IP 10.120.193.6 > 10.120.193.7: IP 10.2.7.26.3000 > 10.2.3.1.54732: Flags [F.], seq 176409, ack 182, win 232, options [nop,nop,TS val 1903436402 ecr 2860165775], length 0 (ipip-proto-4)
10:52:22.590583 IP 10.120.193.7 > 10.120.193.6: IP 10.2.3.1.54732 > 10.2.7.26.3000: Flags [.], ack 176410, win 2175, options [nop,nop,TS val 2860165775 ecr 1903436402], length 0 (ipip-proto-4)
^C104 packets captured
105 packets received by filter
0 packets dropped by kernel

node-6 core # 
```

 * Calico: quay.io/calico/node:v3.1.3
 * Kubernetes: v1.11.2
 * OS: CoreOS 1800.7.0

**Comment by ozdanborne** [comment]
Sounds like you might be sending jumbo packets with a size that exceeds the MTU on the IPIP tunnel interface. This doc on MTU may be of help: https://docs.projectcalico.org/v3.2/usage/configuration/mtu

**Comment by tseglevskiy** [comment]
@ozdanborne Thanks, i'll try. Btw, it's still wandering me, why only two of ten absolutely identical nodes can not communicate?

**Comment by kellycampbell** [comment]
We're seeing something similar. We have a 4 node cluster in a single AWS AZ. The first large packet after the TLS handshake causes TCP Retransmissions and never completes. We're using NLB load balancing.

I think it's related to IP-in-IP because if I set the NLB target to only the node which the pod is running on, it works fine. When the NLB target group contains any of the other nodes, it doesn't work. 

I've tried the MTU changes and allowing IP-in-IP protocol 4 on the nodes security group. 

I've only seen this failure with linux clients. MacOS clients work fine.

* quay.io/calico/node:v2.6.7
* quay.io/calico/cni:v1.11.2
* Kubernetes: v1.11.3
* Kops: v1.10.0
* OS Image: kope.io/k8s-1.11-debian-stretch-amd64-hvm-ebs-2018-08-17
* Kernel: Linux ip-172-21-32-248 4.9.0-7-amd64 #1 SMP Debian 4.9.110-3+deb9u2 (2018-08-13) x86_64 GNU/Linux
* Instance types: t3.large

![screenshot from 2018-09-14 11-03-50](https://user-images.githubusercontent.com/625998/45558507-179cb900-b80e-11e8-8510-aa6a00a84fd7.png)

**Comment by tmjd** [comment]
@tseglevskiy Were you able to get this working?

@kellycampbell Could you try with a newer version of Calico, 2.6.x is getting a bit old now?

**Comment by regardfs** [comment]
same mistake!!!!

**Comment by caseydavenport** [comment]
Closing due to inactivity / old Calico version.

Please do open a new issue if you see the same on newer versions of Calico.
