### ISSUE TITLE
Intercommunicate pods from 2 different kubernetes clusters

### ISSUE THREAD

**Issue by felipejfc** [projectcalico/calico#908]
lets say I have 2 kubernetes clusters with the following configs:

cluster 1:
node cidr: 172.21.0.0/16
non-masquerade-cidr: 100.68.0.0/14

cluster2:
node cidr: 172.19.0.0/16
non-masquerade-cidr: 100.64.0.0/14

would it be possible (with calico) for pods in cluster 1 to communicate with pods in cluster 2? 
I wonder if a route reflector + bgp peers can help in this situation..

The two cluster are located in different aws VPC's connected by a VPN.

regards

**Comment by ozdanborne** [comment]
@felipejfc That's a pretty broad topic and there can be a lot of ways to tackle it. There are a few ways to grant network connectivity to calico networked pods across multiple clusters. However, I should warn you that NetworkPolicy definitions and pod labels are not shared across clusters. So you'll be very limited when using network policy in one cluster to permit or deny traffic from pods in another cluster.

**Comment by felipejfc** [comment]
@ozdanborne not having network policy should not be a problem in my use case, can you point me to a way for making it work?

thanks!

**Comment by caseydavenport** [comment]
@felipejfc that should essentially work - depends a bit on what your requirements are.  Like @ozdanborne, there are a few ways to go about this.

You could, for example, run a single Calico network across the two clusters and things should "just work" - this has its own caveats w.r.t splitting the control plane across multiple geographic locations, if your VPCs aren't in the same region.
 
For two separate clusters, you could probably set up BGP peering across the two VPCs so that Calico instances in VPC1 know about pod IPs in VPC2 (haven't tried this myself though)

Like @ozdanborne, the tricky bit is getting policy to work in that scenario.

**Comment by tmjd** [comment]
@felipejfc You may want to check out some conversation in the CalicoUsers slack of someone else that was doing some thing similar.  Here is a link when it was reported working https://calicousers.slack.com/archives/C0BC91S9F/p1499329726691940, scroll back a bit to see some of the stuff they did.

**Comment by ozdanborne** [comment]
@felipejfc Closing as we haven't heard from you in some time. Do reopen if you still need assistance.

**Comment by njain1121** [comment]
I am trying to find a solution for a similar situation. Does anyone has more idea about communication between pods in two different k8s clusters?

I have an ODL application on two k8s clusters, The application has its pods in each cluster and they can talk to each other within same cluster (using weave net). However I also need pod communication with pods of other cluster(having same ODL app) as I want to span one ODL cluster across two k8s clusters. Is this possible? Has anyone worked on such scenario? 

Any pointers are appreciated. Thanks.

**Comment by kerk1v** [comment]
Hello, 

It seems the slack at https://calicousers.slack.com/archives/C0BC91S9F/p1499329726691940 is restricted to @tigera.io users only. Can anyone who has access help out and post the findings in there here? 

I would like to use something similar to connect cassandra nodes on two different K8s clusters. Any ideas? 

Thanks in advance.

**Comment by tmjd** [comment]
You can get an invite to calicousers slack by going to http://slack.projectcalico.org/

**Comment by kerk1v** [comment]
@tmjd thanks, worked but it's too far in the history to retrieve from a free plan. Can anyone else help with this?

**Comment by karstensi** [comment]
I am interested in this as well

**Comment by tmjd** [comment]
To the best of my knowledge the way the user in Slack reported doing it was something like Casey suggested in https://github.com/projectcalico/calico/issues/908#issuecomment-314912831 with BGP peering the two clusters and I think additionally it was necessary to add a disabled IP Pool to each cluster for the 'other' cluster's IP Pool.

Note:  You must have different IP pool subnets because they must not conflict. Also this does not share any policy or labels between clusters meaning the traffic from the 'other' cluster will need to be handled policy wise like it is external incoming traffic.

**Comment by gyliu513** [comment]
I have same question at https://github.com/projectcalico/calico/issues/1936

After I set up two Kubernetes clusters with Router Reflector, I found that the after the first start up and connect with RR, it can work fine; Then when the second cluster come up, the info in the RR etcd will be cleared, anyone has same issue with me? Thanks.

**Comment by karstensi** [comment]
I have setup a seperate bird route reflector and configured via external orchestration.
I have not used the calico route reflector.

**Comment by gyliu513** [comment]
@karstensi any detailed steps can share with me? Would love to follow your steps for some test, thanks!

**Comment by gyliu513** [comment]
@karstensi Also what is the difference between `bird route reflector` and `calico route reflector`?

**Comment by karstensi** [comment]
sure.
source to much of the below is here.
https://docs.projectcalico.org/v3.1/usage/routereflector/bird-rr-config

First you need to have 1 or more pod networks for your cluster.
eg we have two clusters
**c0**
AS 64513
podCIDR 10.0.1.0/24
**c1** 
AS 64514
podCIDR 10.0.2.0/24
both values can be set in your calic deployment yaml

Then you need to setup your route reflector, can be any kind. I used bird as I have used it before and because calico uses bird already. 

snippet from bird.conf
for all your nodes in your kubernetes clusters you need an entry in your brid.conf
```
log syslog { debug, trace, info, remote, warning, error, auth, fatal, bug };
log stderr all;

router id <ip-of-your-route-reflector>;

filter import_kernel {
  if ( net != 0.0.0.0/0 ) then {
  accept;
  }
reject;
}

debug protocols all;

protocol device {
  scan time 2;
}

protocol bgp <node-name> {
  description "<node-ip>";
  local as 64513; <- should be your AS set on your cluster
  neighbor <node-ip> as 64513;<- should be your AS set on your cluster
  multihop;
  rr client;
  graceful restart;
  import all;
  export all;
}

protocol bgp <node-name-in-cluster-c1> {
  description "<ip-of-node>";
  local as 64514; <- should be your AS set on your cluster
  neighbor <ip-of-node> as 64514; <- should be your AS set on your cluster
  multihop;
  rr client;
  graceful restart;
  import all;
  export all;
}
```
Then on to calico.
On any node with calicoctl installed you can execute the steps below.
```
# Get the current bgpconfig settings
$ calicoctl get bgpconfig -o yaml > bgp.yaml

# Set nodeToNodeMeshEnabled to false
$ vim bgp.yaml

# Replace the current bgpconfig settings
$ calicoctl replace -f bgp.yaml
```
For each of your clusters do
```
$ cat << EOF | calicoctl create -f -
apiVersion: projectcalico.org/v3
kind: BGPPeer
metadata:
  name: bgppeer-global-1
spec:
  peerIP: <route-reflector-ip>
  asNumber: 64513 <- your cluster as
EOF
```
The last step is to make the clusters aware of the other clusters network.
in above eg we have c0 with 10.0.1.0/24 and c1 with 10.0.2.0/24
so on c0:
```
cat << EOF | calicoctl create -f -
apiVersion: projectcalico.org/v3
kind: IPPool
metadata:
  name: c1-pool
spec:
  cidr: 10.0.2.0/24
  disabled: true <- if not disabled calico will start using this scope in the cluster and you will get into problems
EOF
```
and on c1
```
cat << EOF | calicoctl create -f -
apiVersion: projectcalico.org/v3
kind: IPPool
metadata:
  name: c0-pool
spec:
  cidr: 10.0.1.0/24
  disabled: true <- if not disabled calico will start using this scope in the cluster and you will get into problems
EOF
```

hope that helps

**Comment by gyliu513** [comment]
@karstensi thank, so how many RR do you have? Are you sharing one RR between two clusters or every cluster has their own RR?

**Comment by karstensi** [comment]
Above configuration has one, if you want more as a cluster you have to define
`rr cluster id`
in your brid conf

**Comment by karstensi** [comment]
the argumentation on how many RR's you need is more a discussion about your failure-domain  you have/want to have.

**Comment by gyliu513** [comment]
Cool, thanks @karstensi , let me have a try with calico router reflector, will append detailed test steps here later if I have any issues ;-)

**Comment by gyliu513** [comment]
@karstensi I found that the kube-controller for calico always remove my calico nodes of another cluster.

I have two clusters:

Cluster1
```
9.111.255.152 gyliu-ubuntu-3
9.111.255.155 gyliu-ubuntu-2
9.111.255.77 gyliu-ubuntu-1
```

Cluster2
```
9.111.255.21 gyliu-icp-1.novalocal  gyliu-icp-1
9.111.255.46 gyliu-icp-2.novalocal  gyliu-icp-2
9.111.255.91 gyliu-icp-3.novalocal  gyliu-icp-3
```

After Cluster1 configured, successfully, RR works well.
```
root@gyliu-ubuntu-1:~/cases/calico# calicoctl get nodes
NAME
gyliu-ubuntu-1
gyliu-ubuntu-2
gyliu-ubuntu-3
```

After I add cluster2 in, the calico policy controller in Cluster2 will clean all calico nodes from Cluster1
```
root@gyliu-icp-1:~/cases/calico# calicoctl get nodes
NAME
gyliu-icp-1
gyliu-icp-2
gyliu-icp-3
```

The following is the log from calico policy controller in Cluster2, it is removing calico node of Cluster1.
```
MHostKey(host=gyliu-ubuntu-1) rev=""
2018-04-26 07:56:16.112 [INFO][1] etcdv3.go 289: Delete transaction failed due resource not existing etcdv3-etcdKey="/calico/resources/v3/projectcalico.org/bgpconfigurations/node.gyliu-ubuntu-1" model-etcdKey=BGPConfiguration(node.gyliu-ubuntu-1) rev=""
2018-04-26 07:56:16.123 [INFO][1] node_controller.go 241: Deleting node from Calico datastore. node="gyliu-ubuntu-2"
2018-04-26 07:56:16.135 [INFO][1] ipam.go 311: Releasing IP addresses: [10.1.38.4 10.1.38.3 10.1.38.5 10.1.38.6]
2018-04-26 07:56:16.136 [INFO][1] ipam_block.go 208: Deleting attributes: [2 1 3 4]
2018-04-26 07:56:16.147 [INFO][1] ipam.go 830: Decremented handle 'k8s-pod-network.6f7328d5b25662dfa28a7ed7f7b113633372d128da9db1fcce5e7007a5029224' by 1
2018-04-26 07:56:16.170 [INFO][1] ipam.go 830: Decremented handle 'k8s-pod-network.6118ecb56fb051ee7ed5b6afe6c11f78995e6d12fe2fc2863c2b6d1b656e0043' by 1
2018-04-26 07:56:16.221 [INFO][1] ipam.go 830: Decremented handle 'k8s-pod-network.ad16a1f916a886e07c5369a97e65efd126c043c4d2ca95c71b53089aa351569a' by 1
2018-04-26 07:56:16.244 [INFO][1] ipam.go 830: Decremented handle 'k8s-pod-network.d2d38e41df3fbd7942d47d920c833f1018aeec2d88aec20bec413fab536788f9' by 1
2018-04-26 07:56:16.388 [INFO][1] etcdv3.go 289: Delete transaction failed due resource not existing etcdv3-etcdKey="/calico/ipam/v2/host/gyliu-ubuntu-2" model-etcdKey=IPAMHostKey(host=gyliu-ubuntu-2) rev=""
2018-04-26 07:56:16.438 [INFO][1] etcdv3.go 289: Delete transaction failed due resource not existing etcdv3-etcdKey="/calico/resources/v3/projectcalico.org/bgpconfigurations/node.gyliu-ubuntu-2" model-etcdKey=BGPConfiguration(node.gyliu-ubuntu-2) rev=""
2018-04-26 07:56:16.444 [INFO][1] node_controller.go 241: Deleting node from Calico datastore. node="gyliu-ubuntu-3"
2018-04-26 07:56:16.449 [INFO][1] ipam.go 311: Releasing IP addresses: [10.1.33.195 10.1.33.196 10.1.33.197]
2018-04-26 07:56:16.450 [INFO][1] ipam_block.go 208: Deleting attributes: [1 2 3]
2018-04-26 07:56:16.467 [INFO][1] ipam.go 830: Decremented handle 'k8s-pod-network.2711dcf2d95859d3ff94eab50f8fdaab327ee5796358d2dd95bb5dfdebf040ef' by 1
2018-04-26 07:56:16.478 [INFO][1] ipam.go 830: Decremented handle 'k8s-pod-network.3a34112dd68189f48c0f9fa4fecd8b2a325c433dea609d9ac2d43cd95f0fd6a2'
```

@karstensi did you have any special configuration for your calico policy controller? 

This is my deploy topology 

https://user-images.githubusercontent.com/4461983/39222698-a686261e-4870-11e8-9ee1-e7db799d64fd.png

**Comment by karstensi** [comment]
Ok, but that is not the architecture that i described.
Mine looks like this.
![image](https://user-images.githubusercontent.com/31059734/39308124-f19afea0-4964-11e8-9481-ffd17252e1b3.png)

When you are using the calico route reflectors they keep state in etcd, I have not used that as I do not know what it does, also it seems from documentation that the calico route refelctor is lacking the calicoctl integration.

**Comment by gyliu513** [comment]
@karstensi did you have the calico kube controller? I think you should have based on documents here https://docs.projectcalico.org/v3.1/getting-started/kubernetes/installation/integration

![image](https://user-images.githubusercontent.com/4461983/39310539-35061e8a-499d-11e8-96cf-7605159d83c6.png)

From my part, the calico kube controller is making trouble for me, as each cluster will have a kube controller and each try to clean up cache in etcd, and this caused the etcd data keeps changing.

From below, you can see I have one calico kube controller and three calico nodes.
```
root@gyliu-ubuntu-1:~# kubectl get pods -n kube-system | grep calico
calico-kube-controllers-7cc9dfb5c7-lbckq                  1/1       Running   0          1h
calico-node-24n56                                         2/2       Running   0          1h
calico-node-6j9q6                                         2/2       Running   0          1h
calico-node-7z6z6                                         2/2       Running   0          1h
```

I think we have same topology 

![image](https://user-images.githubusercontent.com/4461983/39310445-f9599718-499c-11e8-8a7d-a4543eae34c7.png)

**Comment by gyliu513** [comment]
@karstensi how many `BGPConfiguration` do you have? As the `BGPConfiguration` also include `asNumber`, and each cluster should have a different `asNumber`, so I may need two `BGPConfiguration`, but I found that I cannot create another `BGPConfiguration` if I already have a global one.

On Cluster1
```
root@gyliu-ubuntu-1:~/cases/calico# calicoctl get bgpconfig -oyaml
apiVersion: projectcalico.org/v3
items:
- apiVersion: projectcalico.org/v3
  kind: BGPConfiguration
  metadata:
    creationTimestamp: 2018-04-27T06:36:43Z
    name: default
    resourceVersion: "16195"
    uid: 59797f00-49e5-11e8-8580-fa163e0ee8bb
  spec:
    asNumber: 4567
    nodeToNodeMeshEnabled: false
kind: BGPConfigurationList
metadata:
  resourceVersion: "16378"
```

On Cluster2, I want to set another `BGPConfiguration` for Cluster2 with different `asNumber`.
```
[root@gyliu-icp-1 calico]# cat bgpconfig.yaml
apiVersion: projectcalico.org/v3
kind: BGPConfiguration
metadata:
  name: default-istio
spec:
  nodeToNodeMeshEnabled: false
  asNumber: 4569
```
Create failed for `BGPConfiguration`.
```
[root@gyliu-icp-1 calico]# calicoctl create -f ./bgpconfig.yaml
Failed to create 'BGPConfiguration' resource: error with the following fields:
-  BGPConfiguration.Spec.NodeToNodeMeshEnabled (Cannot set nodeToNodeMeshEnabled on a non default BGP Configuration.)
-  BGPConfiguration.Spec.ASNumber (Cannot set ASNumber on a non default BGP Configuration.)
```

Any comments for this?

**Comment by tmjd** [comment]
@gyliu513 I think a big problem with the setup you are suggesting is that you have one etcd and one route reflector (I'm assuming you are using the calico route-reflector image) that you are trying to share between 2 clusters.  I don't think a setup like that is possible.  I don't think it is reasonable to share an etcd instance/cluster between 2 separate kubernetes clusters.

To do the cross cluster setup I think you would need:
- Two independent clusters (no sharing etcd) (they will need different 'active' IP Pool subnets for cross cluster communication)
- Separate manually configured route reflectors (like using Bird manually configured).
- Setup peering between the two route reflectors

**Comment by gyliu513** [comment]
@tmjd I think that we are not able to use Calico Router Reflector V3.0 configure this due to the following two issues:
- https://github.com/projectcalico/calico/issues/1839
- https://github.com/projectcalico/calico/issues/1887

Will try calico 2.6 with below topology
![image](https://user-images.githubusercontent.com/4461983/39395065-4ea8985c-4b0c-11e8-99bd-4b4f19e5664c.png)

**Comment by karstensi** [comment]
As described above in my topology I am not using the calico rr docker image but run a bird instance on a VM.

I have 1 `BGPConfiguration` per cluster.

**Comment by tmjd** [comment]
@gyliu513 Yes due to the 2 issues you linked it is not possible to use the containerized calico/routereflector.
I am suggesting to set up your own route reflector with bird.  I understand that the docs suggest checking out the containerized version but it is not required to use the containerized version.

> I did not get any document telling me how to set up peering between two RR

Yes there is not currently any documentation in the calico docs for doing that.  It is not Calico specific configuration and is only required in more advanced setups so there has not been any documentation created for that.

**Comment by tmjd** [comment]
I do not think you can do what you are trying to do with the containerized router reflector.  You are trying to do something that is a [known limitation](https://docs.projectcalico.org/v2.6/usage/routereflector/calico-routereflector#known-limitations) of that containerized RR. Basically in the setup you are trying the RR1 would be an 'edge' router for RR2 and RR1 would be an 'edge' router for RR2.  And as the linked document says there is no way to setup that type of route, the basics problem is that there is no way to setup an external peering when using the Calico containerized RR.

I think there are maybe 2 options you have here.
- Setup and configure bird manually.  Calico does not provide a RR that can do the peering necessary for 2 clusters to have BGP peering.
- I *think* that you could add each node in cluster 1 as a Global BGP Peer in cluster 2 and each node in cluster 2 as a Global BGP Peer in cluster 1.  This would effectively create a node-to-node mesh over all the clusters.  I will stress this again that I *think* this may work but have not tried and there could be something obvious that I am missing.  I would not suggest a setup like this for production but if you are just trying to do a POC it may do what you need.

**Comment by gyliu513** [comment]
Thanks @tmjd  

I followed the steps at https://docs.projectcalico.org/v3.1/usage/routereflector/bird-rr-config , and it works fine for pods in two clusters can communicate with each other.

![image](https://user-images.githubusercontent.com/4461983/39514572-21090988-4e2a-11e8-879a-0343c0808c71.png)

**Comment by gyliu513** [comment]
A more simple way is use Node-Node-Mesh and add `ip route rules` from cluster2 to cluster1 and cluster1 to cluster2, this can also make sure the pod can communicate cross clusters.

Commands like this:
```command
ip route add 30.1.44.192/26 via 9.111.255.92
ip route add 30.1.255.192/26 via 9.111.255.203
```

**Comment by tmjd** [comment]
I think since there is a workable solution here (actually 2 now I think) I'm going to close this issue.  If anyone objects please speak up and I will reopen it.

**Comment by saravanakumar-periyasamy** [comment]
does this work if the cluster nodes are in two different subnet?

**Comment by gyliu513** [comment]
@saravanakumar-periyasamy yes, as long as the two different subnet hosts can access each other via ip address.

**Comment by saravanakumar-periyasamy** [comment]
do you have to enable any `cross-subnet` specific settings in bird/calico-node? for some reason we are not able to go get it working with the above pattern - https://github.com/projectcalico/calico/issues/908#issuecomment-386496313

**Comment by gyliu513** [comment]
My VMs are not cross-subnet, can you please first test if VMs in one sub-net works before you test the cross sub-net? This can help us to identify the issue that you are having @saravanakumar-periyasamy

**Comment by saravanakumar-periyasamy** [comment]
yes, thats what we are doing now. @gyliu513.. will update our results here.

**Comment by saravanakumar-periyasamy** [comment]
@gyliu513 - do you have to disable `IPIP` in calico?

**Comment by gyliu513** [comment]
@saravanakumar-periyasamy I enabled IPIP due to I was deploying my env in OpenStack, but I think this should not impact much.

**Comment by manishrajkarnikar** [comment]
@gyliu513 how do you get around this iptable rule that felix inserts
``` -A cali-INPUT -p ipv4 -m comment --comment "cali:8U47CsIYs8dEG5nH" -m comment --comment "Drop IPIP packets from non-Calico hosts" -j DROP ```

basically for me and @saravanakumar-periyasamy we have 2 cluster setup with routing and peering  all working. We see that packet reaches its destination from one cluster to another, only to be dropped by this iptable rule

**Comment by gyliu513** [comment]
My rule is as this

```
-A cali-INPUT -p ipencap -m comment --comment "cali:JhfQUFFJ2v0jbipF" -m comment --comment "Drop IPIP packets from non-Calico hosts" -j DROP
```

**Comment by manishrajkarnikar** [comment]
@gyliu513 we were able to finally make 2 cluster talk to each other. We had to make couple of changes:

- set FELIX_CHAININSERTMODE  to append in felix config in both clusters
- insert a rule which would override the above mentioned iptable rule in both clusters 

Apparently when using ipip, calico drops all the packets which are not in calicoctl get nodes list. Above iptable rule checks against an ipset populated via this list. There is no mechanism to add to this node list.

**Comment by gyliu513** [comment]
@manishrajkarnikar I was actually using calico v3.0.4 which works fine with ipip enabled.

**Comment by Zophren** [comment]
Hello @gyliu513 , i'am really interesting about your integration. I would like to do the same thing, connect pods between K8S clusters (AWS between VPC).

On which instance you setup the Bird router reflector ? If it's great if you could provide some technical implementation details ^^.
Thanks !

**Comment by gyliu513** [comment]
@Zophren I was setting up bird router reflector on a separate node which was not in my k8s cluster, just follow the document here https://docs.projectcalico.org/v3.1/usage/routereflector/bird-rr-config

Besides, if you are using calico node node mesh, you can follow steps here https://medium.com/ibm-cloud/multi-cluster-support-for-service-mesh-with-ibm-cloud-private-d7d791f9b778 to configure, check the section `Config Pod Communication Cross IBM Cloud Private Clusters`.

**Comment by gyliu513** [comment]
@Zophren I think the dns resolution is for services, what do you mean by
```
Cluster 1 POD A < --- > Cluster 2 POD B
```

Two pods on different clusters can communicate?

**Comment by karstensi** [comment]
You can do that in different ways.

If you use coredns in your kubernetes clusters you can look at this:

https://github.com/coredns/kubernetai

**Comment by ffilippopoulos** [comment]
@karstensi @gyliu513 I can see how to use `kubernetai` to discover remote services, but how are you guys handle proxying traffic to those services. I mean that even if you know how to reach pods from another cluster and the remote clusters virtual service ips, don't you still need a way (`kube-proxy`??) to inject that information inside `ipvs` or `iptables` on the host boxes??

**Comment by gyliu513** [comment]
@ffilippopoulos  Federation V2 community now working for federated ingress which can help you case. Please refer to https://github.com/kubernetes-sigs/federation-v2/issues/96 for detail.

**Comment by redbaron** [comment]
Am I right, that solutions here are all about ensuring connectivity, but leave cross-cluster NetworkPolicy   out of the scope?

**Comment by gyliu513** [comment]
@redbaron Yes, cross-cluster NetworkPolicy is out of the scope here.

Perhaps we can get more comments from @caseydavenport @tmjd for cross-cluster NetworkPolicy

**Comment by redbaron** [comment]
Unrelated to implementation, what would be the semantic of cross cluster network policies?  Network policies gained option to reference namespaces AND pod selector maybe their semantic meaning can be extended to have same meaning regardless of exact cluster, this would require no change to NetworkPolicySpec type . It would work for cases if multiple clusters have same level of work and possibly would be relatively easy to run by running extra calico-node in policy-only mode, but looking into remote cluster APIserver

**Comment by nuriel77** [comment]
@gyliu513 maybe you can advise. I've added the route to my kube-6 workernode 10.132.0.12 on a node outside of k8s (10.132.0.21):
```sh
10.233.87.192/26 via 10.132.0.12 dev eth0
```
I can see, using traceroute, that packets are indeed routing to `132.0.12` workernode when contacting `10.233.87.193`.

In addition (having an nginx container running there) I can see packets arriving from 10.132.0.12 to my kube-6 (10.132.0.12) and to the pod at `10.233.87.193`.
I even see the pod `10.233.87.193` sending packets back to 10.132.0.21, however those never reach on 10.132.0.21 . I added 10.132.0.21 to ipset group `cali40all-hosts`, but still no luck:

```[root@kube-6 centos]# tcpdump -i eth0 -nn port 80
tcpdump: verbose output suppressed, use -v or -vv for full protocol decode
listening on eth0, link-type EN10MB (Ethernet), capture size 262144 bytes
22:06:03.482375 IP 10.132.0.21.41888 > 10.233.87.193.80: Flags [S], seq 2342722493, win 26730, options [mss 8910,sackOK,TS val 25961408 ecr 0,nop,wscale 7], length 0
22:06:03.482467 IP 10.233.87.193.80 > 10.132.0.21.41888: Flags [S.], seq 999588870, ack 2342722494, win 28960, options [mss 1460,sackOK,TS val 8174033 ecr 25954391,nop,wscale 7], length 0
22:06:07.868600 IP 10.233.87.193.80 > 10.132.0.21.41888: Flags [S.], seq 999588870, ack 2342722494, win 28960, options [mss 1460,sackOK,TS val 8178420 ecr 25954391,nop,wscale 7], length 0```

Any idea why packets going back from `10.233.87.193.80 > 10.132.0.21` never arrive?

**Comment by gyliu513** [comment]
@nuriel77 did you also add a router on `10.132.0.12` to route the network back to `10.132.0.21`?

```
x.x.x.x/26 via 10.132.0.21 dev eth0
```

**Comment by sohailanjum97** [comment]
> @felipejfc that should essentially work - depends a bit on what your requirements are. Like @ozdanborne, there are a few ways to go about this.
> 
> You could, for example, run a single Calico network across the two clusters and things should "just work" - this has its own caveats w.r.t splitting the control plane across multiple geographic locations, if your VPCs aren't in the same region.
> 
> For two separate clusters, you could probably set up BGP peering across the two VPCs so that Calico instances in VPC1 know about pod IPs in VPC2 (haven't tried this myself though)
> 
> Like @ozdanborne, the tricky bit is getting policy to work in that scenario.

You did this afterwards ??

**Comment by sohailanjum97** [comment]
Hello Everyone, I have to make a Bridge Node between Two different kubernetes Clusters. 
I need some suggestion ... 
If any one alrady did that..
