### ISSUE TITLE
POD-TO-POD connect timeout

### ISSUE THREAD

**Issue by Theodoree** [projectcalico/calico#3958]
I set up a kubemetes cluster and used calico.

## Expected Behavior
The cluster can run normally

## Current Behavior
node status:
```
NAME     STATUS   ROLES    AGE   VERSION   INTERNAL-IP   EXTERNAL-IP   OS-IMAGE                KERNEL-VERSION                CONTAINER-RUNTIME
master   Ready    master   17h   v1.18.8   172.16.0.7    <none>        CentOS Linux 7 (Core)   3.10.0-1062.18.1.el7.x86_64   docker://19.3.8
node1    Ready    <none>   17h   v1.18.8   172.20.0.10   <none>        CentOS Linux 7 (Core)   3.10.0-1062.18.1.el7.x86_64   docker://19.3.8
node2    Ready    <none>   17h   v1.18.8   172.21.0.3    <none>        CentOS Linux 7 (Core)   3.10.0-1062.18.1.el7.x86_64   docker://19.3.8
```

when i from master access worknode(pod) , The request will timeout.
If i from worknode send a requests(like ping or curl) to master, The connect will be normal. But after a period of time, it will still time out

master:
```
NAME                        READY   STATUS    RESTARTS   AGE    IP               NODE     NOMINATED NODE   READINESS GATES
web-nginx-8db845c64-5f4zb   1/1     Running   2          151m   10.100.219.66    master   <none>           <none>
web-nginx-8db845c64-g2lzr   1/1     Running   2          48m    10.100.219.68    master   <none>           <none>
web-nginx-8db845c64-hjq97   1/1     Running   2          47m    10.100.104.2     node2    <none>           <none>
web-nginx-8db845c64-zjxmc   1/1     Running   2          151m   10.100.166.130   node1    <none>           <none>
[root@master ~]# curl 10.100.104.2
```
master-tunl0:
```
15:38:44.452479 IP master.53942 > 10.100.104.2.http: Flags [S], seq 809829596, win 28000, options [mss 1400,sackOK,TS val 1834112 ecr 0,nop,wscale 7], length 0
15:39:16.516506 IP master.53942 > 10.100.104.2.http: Flags [S], seq 809829596, win 28000, options [mss 1400,sackOK,TS val 1866176 ecr 0,nop,wscale 7], length 0
15:40:14.681808 IP master.54852 > 10.100.104.2.http: Flags [S], seq 3629607781, win 28000, options [mss 1400,sackOK,TS val 1924341 ecr 0,nop,wscale 7], length 0
15:40:15.684477 IP master.54852 > 10.100.104.2.http: Flags [S], seq 3629607781, win 28000, options [mss 1400,sackOK,TS val 1925344 ecr 0,nop,wscale 7], length 0
15:40:17.688481 IP master.54852 > 10.100.104.2.http: Flags [S], seq 3629607781, win 28000, options [mss 1400,sackOK,TS val 1927348 ecr 0,nop,wscale 7], length 0
```
node2-tunl0 not get package......

If from node2 access master . Then the connect will recover.

## Your Environment
* Calico version: 3.13
* Orchestrator version kubernetes: 1.18.8
* Operating System and version: CentOS Linux release 7.7.1908 (Core)
* Link to your project (optional):
