### ISSUE TITLE
Calico in eBPF mode interacts badly with tw_reuse enabled on clients

### ISSUE THREAD

**Issue by RobinGeuze** [projectcalico/calico#4661]
These are actually two issues that stem from roughly the same base issue.

The first issue is that if you put a service in Cluster mode it is possible for a local machine when it has a lot of outgoing connections to use the same source port at the same time to two different node IP's. This then cause a source port conflict when it eventually arrives at a single target pod (since the destination IP gets rewritten to the pod ip, which means the connections have nothing to uniquely identify them).

This can be solved relatively easily by setting the service in Local mode or by using something like MetalLB to ensure that the source machine always connects to the same IP preventing the port collision.

However, these leads to the second (more rare) issue. In normal scenarios a connection is kept in time_wait for 120 seconds (on Linux by default) which is longer than the conntrack timeout on both FIN and RST connections in Calico, which works fine. However, when you enable tw_reuse (for example when you have a loadbalancer that creates lots of outbound connections) it can happen that a port is recycled much more quickly (basically within a second).

This appears to be leading to a race condition in calico, where the initial handshake packets are (partially) accepted based on the existing state, however that state is removed at that point, since conntrack state removal is not atomic, leading to the connection being stuck in limbo. Neither side gets packets from the other side, leading in most cases to a connection that "hangs" or io timeouts. Note: This is what I suspect the problem is, I'm not 100% super, but lets say 95%

It only occurs when using eBPF mode.

## Expected Behavior

It should work, but to be a bit more specific some tcpdump data for a "healthy" connection:

Calico interface:
```
14:24:35.986378 IP 10.100.99.17.29478 > 10.10.175.147.9696: Flags [S], seq 2435144605, win 64240, options [mss 1460,sackOK,TS val 1470826734 ecr 0,nop,wscale 7], length 0
14:24:35.986397 IP 10.10.175.147.9696 > 10.100.99.17.29478: Flags [S.], seq 1438863694, ack 2435144606, win 65236, options [mss 1400,sackOK,TS val 3944576311 ecr 1470826734,nop,wscale 7], length 0
14:24:35.986767 IP 10.100.99.17.29478 > 10.10.175.147.9696: Flags [.], ack 1, win 502, options [nop,nop,TS val 1470826734 ecr 3944576311], length 0
14:24:35.986887 IP 10.100.99.17.29478 > 10.10.175.147.9696: Flags [P.], seq 1:5, ack 1, win 502, options [nop,nop,TS val 1470826734 ecr 3944576311], length 4
14:24:35.986907 IP 10.10.175.147.9696 > 10.100.99.17.29478: Flags [P.], seq 1:94, ack 1, win 510, options [nop,nop,TS val 3944576311 ecr 1470826734], length 93
14:24:35.986911 IP 10.100.99.17.29478 > 10.10.175.147.9696: Flags [P.], seq 5:8, ack 1, win 502, options [nop,nop,TS val 1470826734 ecr 3944576311], length 3
14:24:35.986997 IP 10.10.175.147.9696 > 10.100.99.17.29478: Flags [.], ack 8, win 510, options [nop,nop,TS val 3944576311 ecr 1470826734], length 0
14:24:35.987092 IP 10.10.175.147.9696 > 10.100.99.17.29478: Flags [P.], seq 94:125, ack 8, win 510, options [nop,nop,TS val 3944576311 ecr 1470826734], length 31
14:24:35.987166 IP 10.100.99.17.29478 > 10.10.175.147.9696: Flags [.], ack 94, win 502, options [nop,nop,TS val 1470826734 ecr 3944576311], length 0
14:24:35.987171 IP 10.10.175.147.9696 > 10.100.99.17.29478: Flags [F.], seq 125, ack 8, win 510, options [nop,nop,TS val 3944576311 ecr 1470826734], length 0
14:24:35.987430 IP 10.100.99.17.29478 > 10.10.175.147.9696: Flags [.], ack 125, win 502, options [nop,nop,TS val 1470826735 ecr 3944576311], length 0
14:24:36.029992 IP 10.100.99.17.29478 > 10.10.175.147.9696: Flags [.], ack 126, win 502, options [nop,nop,TS val 1470826777 ecr 3944576311], length 0
14:24:39.388189 IP 10.100.99.17.29478 > 10.10.175.147.9696: Flags [F.], seq 8, ack 126, win 502, options [nop,nop,TS val 1470830135 ecr 3944576311], length 0
14:24:39.388207 IP 10.10.175.147.9696 > 10.100.99.17.29478: Flags [.], ack 9, win 510, options [nop,nop,TS val 3944579713 ecr 1470830135], length 0
```

Host interface of k8s worker:
```
14:24:35.986267 IP 10.100.99.17.29478 > 10.103.6.150.31504: Flags [S], seq 2435144605, win 64240, options [mss 1460,sackOK,TS val 1470826734 ecr 0,nop,wscale 7], length 0
14:24:35.986470 IP 10.103.6.150.31504 > 10.100.99.17.29478: Flags [S.], seq 1438863694, ack 2435144606, win 65236, options [mss 1400,sackOK,TS val 3944576311 ecr 1470826734,nop,wscale 7], length 0
14:24:35.986700 IP 10.100.99.17.29478 > 10.103.6.150.31504: Flags [.], ack 1, win 502, options [nop,nop,TS val 1470826734 ecr 3944576311], length 0
14:24:35.986797 IP 10.100.99.17.29478 > 10.103.6.150.31504: Flags [P.], seq 1:5, ack 1, win 502, options [nop,nop,TS val 1470826734 ecr 3944576311], length 4
14:24:35.986797 IP 10.100.99.17.29478 > 10.103.6.150.31504: Flags [P.], seq 5:8, ack 1, win 502, options [nop,nop,TS val 1470826734 ecr 3944576311], length 3
14:24:35.986978 IP 10.103.6.150.31504 > 10.100.99.17.29478: Flags [P.], seq 1:94, ack 1, win 510, options [nop,nop,TS val 3944576311 ecr 1470826734], length 93
14:24:35.987058 IP 10.103.6.150.31504 > 10.100.99.17.29478: Flags [.], ack 8, win 510, options [nop,nop,TS val 3944576311 ecr 1470826734], length 0
14:24:35.987108 IP 10.100.99.17.29478 > 10.103.6.150.31504: Flags [.], ack 94, win 502, options [nop,nop,TS val 1470826734 ecr 3944576311], length 0
14:24:35.987152 IP 10.103.6.150.31504 > 10.100.99.17.29478: Flags [P.], seq 94:125, ack 8, win 510, options [nop,nop,TS val 3944576311 ecr 1470826734], length 31
14:24:35.987234 IP 10.103.6.150.31504 > 10.100.99.17.29478: Flags [F.], seq 125, ack 8, win 510, options [nop,nop,TS val 3944576311 ecr 1470826734], length 0
14:24:35.987374 IP 10.100.99.17.29478 > 10.103.6.150.31504: Flags [.], ack 125, win 502, options [nop,nop,TS val 1470826735 ecr 3944576311], length 0
14:24:36.029930 IP 10.100.99.17.29478 > 10.103.6.150.31504: Flags [.], ack 126, win 502, options [nop,nop,TS val 1470826777 ecr 3944576311], length 0
14:24:39.388091 IP 10.100.99.17.29478 > 10.103.6.150.31504: Flags [F.], seq 8, ack 126, win 502, options [nop,nop,TS val 1470830135 ecr 3944576311], length 0
14:24:39.388281 IP 10.103.6.150.31504 > 10.100.99.17.29478: Flags [.], ack 9, win 510, options [nop,nop,TS val 3944579713 ecr 1470830135], length 0
```

Interface of the connection source machine:
```
14:24:35.985884 IP 10.100.99.17.29478 > 10.103.6.150.31504: Flags [S], seq 2435144605, win 64240, options [mss 1460,sackOK,TS val 1470826734 ecr 0,nop,wscale 7], length 0
14:24:35.986200 IP 10.103.6.150.31504 > 10.100.99.17.29478: Flags [S.], seq 1438863694, ack 2435144606, win 65236, options [mss 1400,sackOK,TS val 3944576311 ecr 1470826734,nop,wscale 7], length 0
14:24:35.986239 IP 10.100.99.17.29478 > 10.103.6.150.31504: Flags [.], ack 1, win 502, options [nop,nop,TS val 1470826734 ecr 3944576311], length 0
14:24:35.986392 IP 10.100.99.17.29478 > 10.103.6.150.31504: Flags [P.], seq 1:5, ack 1, win 502, options [nop,nop,TS val 1470826734 ecr 3944576311], length 4
14:24:35.986435 IP 10.100.99.17.29478 > 10.103.6.150.31504: Flags [P.], seq 5:8, ack 1, win 502, options [nop,nop,TS val 1470826734 ecr 3944576311], length 3
14:24:35.986739 IP 10.103.6.150.31504 > 10.100.99.17.29478: Flags [P.], seq 1:94, ack 1, win 510, options [nop,nop,TS val 3944576311 ecr 1470826734], length 93
14:24:35.986757 IP 10.100.99.17.29478 > 10.103.6.150.31504: Flags [.], ack 94, win 502, options [nop,nop,TS val 1470826734 ecr 3944576311], length 0
14:24:35.986768 IP 10.103.6.150.31504 > 10.100.99.17.29478: Flags [.], ack 8, win 510, options [nop,nop,TS val 3944576311 ecr 1470826734], length 0
14:24:35.986865 IP 10.103.6.150.31504 > 10.100.99.17.29478: Flags [P.], seq 94:125, ack 8, win 510, options [nop,nop,TS val 3944576311 ecr 1470826734], length 31
14:24:35.986888 IP 10.100.99.17.29478 > 10.103.6.150.31504: Flags [.], ack 125, win 502, options [nop,nop,TS val 1470826735 ecr 3944576311], length 0
14:24:35.987070 IP 10.103.6.150.31504 > 10.100.99.17.29478: Flags [F.], seq 125, ack 8, win 510, options [nop,nop,TS val 3944576311 ecr 1470826734], length 0
14:24:36.029580 IP 10.100.99.17.29478 > 10.103.6.150.31504: Flags [.], ack 126, win 502, options [nop,nop,TS val 1470826777 ecr 3944576311], length 0
14:24:39.387661 IP 10.100.99.17.29478 > 10.103.6.150.31504: Flags [F.], seq 8, ack 126, win 502, options [nop,nop,TS val 1470830135 ecr 3944576311], length 0
14:24:39.388002 IP 10.103.6.150.31504 > 10.100.99.17.29478: Flags [.], ack 9, win 510, options [nop,nop,TS val 3944579713 ecr 1470830135], length 0
```

## Current Behavior

It doesn't work, but to be a bit more specific some tcpdump data for a "bad" connection:

Calico interface:
```
14:26:27.668595 IP 10.100.99.17.29478 > 10.10.175.147.9696: Flags [S], seq 4180180169, win 64240, options [mss 1460,sackOK,TS val 1470938416 ecr 0,nop,wscale 7], length 0
14:26:27.668605 IP 10.10.175.147.9696 > 10.100.99.17.29478: Flags [S.], seq 3183898231, ack 4180180170, win 65236, options [mss 1400,sackOK,TS val 3944687993 ecr 1470938416,nop,wscale 7], length 0
14:26:27.668816 IP 10.100.99.17.29478 > 10.10.175.147.9696: Flags [.], ack 1, win 502, options [nop,nop,TS val 1470938417 ecr 3944687993], length 0
14:26:27.668945 IP 10.100.99.17.29478 > 10.10.175.147.9696: Flags [P.], seq 1:5, ack 1, win 502, options [nop,nop,TS val 1470938417 ecr 3944687993], length 4
14:26:27.668953 IP 10.10.175.147.9696 > 10.100.99.17.29478: Flags [.], ack 5, win 510, options [nop,nop,TS val 3944687993 ecr 1470938417], length 0
14:26:27.669059 IP 10.100.99.17.29478 > 10.10.175.147.9696: Flags [P.], seq 5:8, ack 1, win 502, options [nop,nop,TS val 1470938417 ecr 3944687993], length 3
14:26:27.669066 IP 10.10.175.147.9696 > 10.100.99.17.29478: Flags [.], ack 8, win 510, options [nop,nop,TS val 3944687993 ecr 1470938417], length 0
14:26:27.670038 IP 10.10.175.147.9696 > 10.100.99.17.29478: Flags [P.], seq 1:94, ack 8, win 510, options [nop,nop,TS val 3944687994 ecr 1470938417], length 93
14:26:27.670163 IP 10.10.175.147.9696 > 10.100.99.17.29478: Flags [P.], seq 94:125, ack 8, win 510, options [nop,nop,TS val 3944687994 ecr 1470938417], length 31
14:26:27.670224 IP 10.10.175.147.9696 > 10.100.99.17.29478: Flags [F.], seq 125, ack 8, win 510, options [nop,nop,TS val 3944687995 ecr 1470938417], length 0
14:26:27.687564 IP 10.10.175.147.9696 > 10.100.99.17.29478: Flags [F.], seq 125, ack 8, win 510, options [nop,nop,TS val 3944688012 ecr 1470938417], length 0
14:26:27.895537 IP 10.10.175.147.9696 > 10.100.99.17.29478: Flags [FP.], seq 1:125, ack 8, win 510, options [nop,nop,TS val 3944688220 ecr 1470938417], length 124
14:26:28.315520 IP 10.10.175.147.9696 > 10.100.99.17.29478: Flags [FP.], seq 1:125, ack 8, win 510, options [nop,nop,TS val 3944688640 ecr 1470938417], length 124
14:26:29.147569 IP 10.10.175.147.9696 > 10.100.99.17.29478: Flags [FP.], seq 1:125, ack 8, win 510, options [nop,nop,TS val 3944689472 ecr 1470938417], length 124
14:26:30.815564 IP 10.10.175.147.9696 > 10.100.99.17.29478: Flags [FP.], seq 1:125, ack 8, win 510, options [nop,nop,TS val 3944691140 ecr 1470938417], length 124
14:26:34.235571 IP 10.10.175.147.9696 > 10.100.99.17.29478: Flags [FP.], seq 1:125, ack 8, win 510, options [nop,nop,TS val 3944694560 ecr 1470938417], length 124
14:26:40.891600 IP 10.10.175.147.9696 > 10.100.99.17.29478: Flags [FP.], seq 1:125, ack 8, win 510, options [nop,nop,TS val 3944701216 ecr 1470938417], length 124
14:26:54.207546 IP 10.10.175.147.9696 > 10.100.99.17.29478: Flags [FP.], seq 1:125, ack 8, win 510, options [nop,nop,TS val 3944714532 ecr 1470938417], length 124
14:27:21.339595 IP 10.10.175.147.9696 > 10.100.99.17.29478: Flags [FP.], seq 1:125, ack 8, win 510, options [nop,nop,TS val 3944741664 ecr 1470938417], length 124
```

Host interface of k8s worker:
```
14:26:27.668505 IP 10.100.99.17.29478 > 10.103.6.150.31504: Flags [S], seq 4180180169, win 64240, options [mss 1460,sackOK,TS val 1470938416 ecr 0,nop,wscale 7], length 0
14:26:27.668660 IP 10.103.6.150.31504 > 10.100.99.17.29478: Flags [S.], seq 3183898231, ack 4180180170, win 65236, options [mss 1400,sackOK,TS val 3944687993 ecr 1470938416,nop,wscale 7], length 0
14:26:27.668762 IP 10.100.99.17.29478 > 10.103.6.150.31504: Flags [.], ack 1, win 502, options [nop,nop,TS val 1470938417 ecr 3944687993], length 0
14:26:27.668894 IP 10.100.99.17.29478 > 10.103.6.150.31504: Flags [P.], seq 1:5, ack 1, win 502, options [nop,nop,TS val 1470938417 ecr 3944687993], length 4
14:26:27.669005 IP 10.103.6.150.31504 > 10.100.99.17.29478: Flags [.], ack 5, win 510, options [nop,nop,TS val 3944687993 ecr 1470938417], length 0
14:26:27.669009 IP 10.100.99.17.29478 > 10.103.6.150.31504: Flags [P.], seq 5:8, ack 1, win 502, options [nop,nop,TS val 1470938417 ecr 3944687993], length 3
14:26:27.669117 IP 10.103.6.150.31504 > 10.100.99.17.29478: Flags [.], ack 8, win 510, options [nop,nop,TS val 3944687993 ecr 1470938417], length 0
14:26:27.670114 IP 10.10.175.147.9696 > 10.100.99.17.29478: Flags [P.], seq 3183898232:3183898325, ack 4180180177, win 510, options [nop,nop,TS val 3944687994 ecr 1470938417], length 93
14:26:27.670206 IP 10.10.175.147.9696 > 10.100.99.17.29478: Flags [P.], seq 93:124, ack 1, win 510, options [nop,nop,TS val 3944687994 ecr 1470938417], length 31
14:26:27.670271 IP 10.10.175.147.9696 > 10.100.99.17.29478: Flags [F.], seq 124, ack 1, win 510, options [nop,nop,TS val 3944687995 ecr 1470938417], length 0
14:26:27.687644 IP 10.10.175.147.9696 > 10.100.99.17.29478: Flags [F.], seq 124, ack 1, win 510, options [nop,nop,TS val 3944688012 ecr 1470938417], length 0
14:26:27.895644 IP 10.10.175.147.9696 > 10.100.99.17.29478: Flags [FP.], seq 0:124, ack 1, win 510, options [nop,nop,TS val 3944688220 ecr 1470938417], length 124
14:26:28.315594 IP 10.10.175.147.9696 > 10.100.99.17.29478: Flags [FP.], seq 0:124, ack 1, win 510, options [nop,nop,TS val 3944688640 ecr 1470938417], length 124
14:26:29.147655 IP 10.10.175.147.9696 > 10.100.99.17.29478: Flags [FP.], seq 0:124, ack 1, win 510, options [nop,nop,TS val 3944689472 ecr 1470938417], length 124
14:26:30.815647 IP 10.10.175.147.9696 > 10.100.99.17.29478: Flags [FP.], seq 0:124, ack 1, win 510, options [nop,nop,TS val 3944691140 ecr 1470938417], length 124
14:26:34.235672 IP 10.10.175.147.9696 > 10.100.99.17.29478: Flags [FP.], seq 0:124, ack 1, win 510, options [nop,nop,TS val 3944694560 ecr 1470938417], length 124
14:26:40.891736 IP 10.10.175.147.9696 > 10.100.99.17.29478: Flags [FP.], seq 0:124, ack 1, win 510, options [nop,nop,TS val 3944701216 ecr 1470938417], length 124
14:26:41.038953 IP 10.100.99.17.29478 > 10.103.6.150.31504: Flags [F.], seq 8, ack 1, win 502, options [nop,nop,TS val 1470951787 ecr 3944687993], length 0
14:26:41.245975 IP 10.100.99.17.29478 > 10.103.6.150.31504: Flags [F.], seq 8, ack 1, win 502, options [nop,nop,TS val 1470951994 ecr 3944687993], length 0
14:26:41.454102 IP 10.100.99.17.29478 > 10.103.6.150.31504: Flags [F.], seq 8, ack 1, win 502, options [nop,nop,TS val 1470952202 ecr 3944687993], length 0
14:26:41.886085 IP 10.100.99.17.29478 > 10.103.6.150.31504: Flags [F.], seq 8, ack 1, win 502, options [nop,nop,TS val 1470952634 ecr 3944687993], length 0
14:26:42.718113 IP 10.100.99.17.29478 > 10.103.6.150.31504: Flags [F.], seq 8, ack 1, win 502, options [nop,nop,TS val 1470953466 ecr 3944687993], length 0
14:26:44.382020 IP 10.100.99.17.29478 > 10.103.6.150.31504: Flags [F.], seq 8, ack 1, win 502, options [nop,nop,TS val 1470955130 ecr 3944687993], length 0
14:26:47.806014 IP 10.100.99.17.29478 > 10.103.6.150.31504: Flags [F.], seq 8, ack 1, win 502, options [nop,nop,TS val 1470958554 ecr 3944687993], length 0
14:26:54.207692 IP 10.10.175.147.9696 > 10.100.99.17.29478: Flags [FP.], seq 0:124, ack 1, win 510, options [nop,nop,TS val 3944714532 ecr 1470938417], length 124
14:26:54.462005 IP 10.100.99.17.29478 > 10.103.6.150.31504: Flags [F.], seq 8, ack 1, win 502, options [nop,nop,TS val 1470965210 ecr 3944687993], length 0
14:27:07.774077 IP 10.100.99.17.29478 > 10.103.6.150.31504: Flags [F.], seq 8, ack 1, win 502, options [nop,nop,TS val 1470978522 ecr 3944687993], length 0
14:27:21.339706 IP 10.10.175.147.9696 > 10.100.99.17.29478: Flags [FP.], seq 0:124, ack 1, win 510, options [nop,nop,TS val 3944741664 ecr 1470938417], length 124
14:27:34.142029 IP 10.100.99.17.29478 > 10.103.6.150.31504: Flags [F.], seq 8, ack 1, win 502, options [nop,nop,TS val 1471004890 ecr 3944687993], length 0
```

Interface of the connection source machine:
```
14:26:27.668156 IP 10.100.99.17.29478 > 10.103.6.150.31504: Flags [S], seq 4180180169, win 64240, options [mss 1460,sackOK,TS val 1470938416 ecr 0,nop,wscale 7], length 0
14:26:27.668387 IP 10.103.6.150.31504 > 10.100.99.17.29478: Flags [S.], seq 3183898231, ack 4180180170, win 65236, options [mss 1400,sackOK,TS val 3944687993 ecr 1470938416,nop,wscale 7], length 0
14:26:27.668413 IP 10.100.99.17.29478 > 10.103.6.150.31504: Flags [.], ack 1, win 502, options [nop,nop,TS val 1470938417 ecr 3944687993], length 0
14:26:27.668545 IP 10.100.99.17.29478 > 10.103.6.150.31504: Flags [P.], seq 1:5, ack 1, win 502, options [nop,nop,TS val 1470938417 ecr 3944687993], length 4
14:26:27.668573 IP 10.100.99.17.29478 > 10.103.6.150.31504: Flags [P.], seq 5:8, ack 1, win 502, options [nop,nop,TS val 1470938417 ecr 3944687993], length 3
14:26:27.668726 IP 10.103.6.150.31504 > 10.100.99.17.29478: Flags [.], ack 5, win 510, options [nop,nop,TS val 3944687993 ecr 1470938417], length 0
14:26:27.668837 IP 10.103.6.150.31504 > 10.100.99.17.29478: Flags [.], ack 8, win 510, options [nop,nop,TS val 3944687993 ecr 1470938417], length 0
14:26:41.038509 IP 10.100.99.17.29478 > 10.103.6.150.31504: Flags [F.], seq 8, ack 1, win 502, options [nop,nop,TS val 1470951787 ecr 3944687993], length 0
14:26:41.245572 IP 10.100.99.17.29478 > 10.103.6.150.31504: Flags [F.], seq 8, ack 1, win 502, options [nop,nop,TS val 1470951994 ecr 3944687993], length 0
14:26:41.453654 IP 10.100.99.17.29478 > 10.103.6.150.31504: Flags [F.], seq 8, ack 1, win 502, options [nop,nop,TS val 1470952202 ecr 3944687993], length 0
14:26:41.885638 IP 10.100.99.17.29478 > 10.103.6.150.31504: Flags [F.], seq 8, ack 1, win 502, options [nop,nop,TS val 1470952634 ecr 3944687993], length 0
14:26:42.717668 IP 10.100.99.17.29478 > 10.103.6.150.31504: Flags [F.], seq 8, ack 1, win 502, options [nop,nop,TS val 1470953466 ecr 3944687993], length 0
14:26:44.381627 IP 10.100.99.17.29478 > 10.103.6.150.31504: Flags [F.], seq 8, ack 1, win 502, options [nop,nop,TS val 1470955130 ecr 3944687993], length 0
14:26:47.805622 IP 10.100.99.17.29478 > 10.103.6.150.31504: Flags [F.], seq 8, ack 1, win 502, options [nop,nop,TS val 1470958554 ecr 3944687993], length 0
14:26:54.461614 IP 10.100.99.17.29478 > 10.103.6.150.31504: Flags [F.], seq 8, ack 1, win 502, options [nop,nop,TS val 1470965210 ecr 3944687993], length 0
14:27:07.773648 IP 10.100.99.17.29478 > 10.103.6.150.31504: Flags [F.], seq 8, ack 1, win 502, options [nop,nop,TS val 1470978522 ecr 3944687993], length 0
```

I also have a log gathered via tc exec bpf debug available, but its is 3.2 GB, so if you can tell me what information to look for I can probably dig it out from there.

## Possible Solution

Ideally you'd somehow make the conntracking purging atomic.

## Steps to Reproduce (for bugs)

1. Turn on tw_reuse
2. Setup a k8s cluster running calico in ebpf mode with a service in Local mode
3. I wrote a bit of test code that rapidly reuses ports in go: https://gist.github.com/RobinGeuze/d96287e9b0a73b054136be6ab3bea031 . This talks to a server talking MySQL, so the GARBAGE that I dump onto the line causes the remote end to close the connection, but I think anything that sends a small payload and causes the remote end to close the connection should work.

## Context

We are seeing MySQL connections that either hang or hit the timeout threshold in our load balancer (haproxy) when executing a very simple query that would normally take less than a second

## Your Environment

* Calico version: v3.18.3
* Orchestrator version (e.g. kubernetes, mesos, rkt): kubernetes
* Operating System and version: ubuntu 18.04

**Comment by lwr20** [comment]
@fasaxc Sounds like your area of expertise?

**Comment by fasaxc** [comment]
Ugh, that's a nasty one, thanks for the detailed writeup, sounds very plausible.

**Comment by fasaxc** [comment]
@RobinGeuze Do you have any ideas for what behaviour you'd like to see when a single client sends requests to two different nodes from the same (IP, port) and they collide at the backing pod?  One option would be to SNAT the source, but that's in opposition to one of our goals for the eBPF dataplane (which is to preserve the client source IP).  Another option would be to try to detect that case and to respond with a RST or something like that.

For the FIN race, I think we might have a bug where we're mishandling a SYN after we've got a FIN on that 5-tuple.  We _should_ be recreating the conntrack state but I think we're not doing so.

**Comment by RobinGeuze** [comment]
@fasaxc I agree that SNATing is what you don't want. One option could be to disallow the situation somehow although I don't really see how you'd do that (eg disallow different source address to the same nodeport). RST could work, but I guess you'd get a lot of connection errors, which is not ideal either.

For the FIN stuff I suspect the problem is actually in the go code. It walks over the entries in the conntrack map and deletes them if they are older than timeout value for the current connection state. It doesn't do this atomically though. So what can happen is that a SYN packet arrive between the go code reading the packet from the map and it deleting it because its older than X.  The only way to really prevent this is to somehow do this garbage collection in the actual eBPF code since there is no real way to put a shared lock on these or anything. But, its also possible that what you say is also happening.

**Comment by fasaxc** [comment]
I think you're right that there's a race on the cleanup path, but it doesn't match the scenario you outlined with a very rapid reuse of the port after 1s so that made me think we've got a 10s window instead of a 10ms window.  Need to double check but I think the BPF code has a bug here that's making things worse.

Yes, BPF doesn't support any kind of compare-and-delete sort of functionality, which is a shame.  There are other features that might help us (like BPF spinlocks) but we don't have access to those right now.

**Comment by salanki** [comment]
This smells oddly familiar to https://github.com/projectcalico/calico/issues/4431

**Comment by tomastigera** [comment]
@RobinGeuze :
>  I agree that SNATing is what you don't want. One option could be to disallow the situation somehow although I don't really see how you'd do that (eg disallow different source address to the same nodeport). RST could work, but I guess you'd get a lot of connection errors, which is not ideal either.

There is a good chance that after the RST a differnt port is selected for this path. Itis unlikely that the source ports for different destinations are picked in a lock-step. So imo RST would not result in that many connection errors.

However a solution that avoids any RST would be preferable :thinking:

**Comment by tomastigera** [comment]
> For the FIN race, I think we might have a bug where we're mishandling a SYN after we've got a FIN on that 5-tuple. We should be recreating the conntrack state but I think we're not doing so.

> I think you're right that there's a race on the cleanup path, but it doesn't match the scenario you outlined with a very rapid reuse of the port after 1s so that made me think we've got a 10s window instead of a 10ms window. Need to double check but I think the BPF code has a bug here that's making things worse.

Yeah it seems like the BPF side is making things worse by not considering the FIN. And yes, that is an inherent race in the cleaner, but likely much less of an issue.

**Comment by tomastigera** [comment]
@RobinGeuze would you be able to try out a build with a fix candidate?

**Comment by salanki** [comment]
I have confirmed that https://github.com/projectcalico/calico/issues/4431 still occurs with `net.ipv4.tcp_tw_reuse=0`, it is regretfully not the same issue.

**Comment by RobinGeuze** [comment]
@tomastigera I was on holiday for a bit, I'll see if I can set up the test case again somewhere end of this week, beginning of next week. For now we've found a workaround, we use metallb which means the source machine always connects to the same target IP, which seems to prevent the issue from occurring.

**Comment by tomastigera** [comment]
@RobinGeuze 
> For now we've found a workaround, we use metallb which means the source machine always connects to the same target IP, which seems to prevent the issue from occurring.

Yes, that would prevent this issue from happening :+1:

**Comment by tomastigera** [comment]
This was fixed by https://github.com/projectcalico/calico/commit/7280fbb06028db7b6788c03512274f14aba57e2d
