### ISSUE TITLE
POD IP cannot ping success maybe since not proper route items are added? 

### ISSUE THREAD

**Issue by sandy-lcq** [projectcalico/calico#4123]
### Issue
My k8s cluster have  one master, and 3 nodes,  and I deployed nginx pod per node,  one of the node's pod IP cannot ping success

kubectl get pods -o wide
NAME             READY   STATUS    RESTARTS   AGE     IP               NODE            NOMINATED NODE   READINESS GATES
nginx-arm64      1/1     Running   0          5h22m   172.16.33.1      bcm-2xxx-rpi4   <none>           <none>
**nginx-intel      1/1     Running   0          57m     172.16.210.201   intel-x86-64    <none>           <none>**
nginx-worker-0   1/1     Running   0          2d4h    172.16.43.1      worker-0        <none>           <none>

ping 172.16.210.201  on master node not success

## Expected Behavior
ping 172.16.210.201 on master node success

## Current Behavior
Below is some info:
 
**tcpdump -i cali89835606d4a -nn icmp**

> tcpdump: verbose output suppressed, use -v or -vv for full protocol decode
> listening on cali89835606d4a, link-type EN10MB (Ethernet), capture size 262144 bytes
> 09:44:19.845193 IP 172.16.192.64 > 172.16.210.201: ICMP echo request, id 13461, seq 1111, length 64
> 09:44:20.845379 IP 172.16.192.64 > 172.16.210.201: ICMP echo request, id 13461, seq 1112, length 64

ICMP packets have received, but no response. 

**This is route table after pod nginx-intel is deployed on intel-x86-64:**

> Kernel IP routing table:
> Destination     Gateway         Genmask         Flags Metric Ref    Use Iface
> 0.0.0.0         192.168.204.1   0.0.0.0         UG    0      0        0 eth0
> 
> **0.0.0.0         0.0.0.0         0.0.0.0         U     10233  0        0 cali89835606d4a
> 169.254.0.0     0.0.0.0         255.255.0.0     U     233    0        0 cali89835606d4a**
> 
> 172.16.33.0     192.168.206.8   255.255.255.192 UG    0      0        0 tunl0
> 172.16.43.0     192.168.206.6   255.255.255.192 UG    0      0        0 tunl0
> 172.16.166.128  192.168.206.3   255.255.255.192 UG    0      0        0 tunl0
> 172.16.192.64   192.168.206.2   255.255.255.192 UG    0      0        0 tunl0
> 172.16.210.192  0.0.0.0         255.255.255.192 U     0      0        0 *
> 172.16.210.201  0.0.0.0         255.255.255.255 UH    0      0        0 cali89835606d4a
> 172.17.0.0      0.0.0.0         255.255.0.0     U     0      0        0 docker0
> 192.168.204.0   0.0.0.0         255.255.255.0   U     0      0        0 eth0
> 192.168.206.0   0.0.0.0         255.255.255.0   U     0      0        0 eth0
> 

3  routes  items are added after pod is deployed,  and I think maybe the highlighted 2 items are not needed.
I don't know why it is added on this node.  the other 2 working nodes only add one route item.

**ip addr show cali89835606d4a**

> 33: cali89835606d4a@if5: <BROADCAST,MULTICAST,UP,LOWER_UP> mtu 1440 qdisc noqueue state UP group default 
>     link/ether ee:ee:ee:ee:ee:ee brd ff:ff:ff:ff:ff:ff link-netnsid 0
**>     inet 169.254.167.173/16 brd 169.254.255.255 scope global noprefixroute cali89835606d4a
>        valid_lft forever preferred_lft forever
>     inet6 fe80::ff87:16a7:c285:f239/64 scope link 
>        valid_lft forever preferred_lft forever
>     inet6 fe80::ecee:eeff:feee:eeee/64 scope link 
>        valid_lft forever preferred_lft forever**

I don't understand why the highlighed part is added.  the working node don't have this part.

## Your Environment
* Calico version :  v3.12.0
* Orchestrator version : k8s version:  v1.18.8-dirty
* Operating System:  Linux 

Does calico version and k8s version have  requirement to match each other? Where I can get this info? Thanks

**Comment by sandy-lcq** [comment]
I also tried nsenter -n -t $CONTAINER_PID ping 172.16.192.64, cannot ping success. 
so I add a route manully:
ip route add 169.254.1.1 dev eth0

after add this,   ping 172.16.210.201 can success. 

This is route table of container:
Destination     Gateway         Genmask         Flags Metric Ref    Use Iface
0.0.0.0         169.254.1.1     0.0.0.0         UG    0      0        0 eth0
169.254.1.1     0.0.0.0         255.255.255.255 UH    0      0        0 eth0

with the wrongly added route items,  package send to gateway which should goto eth0,  but goto cali89835606d4a again.

**Comment by matakasi** [comment]
This one is similar to the bug I just opened here #4131

**Comment by sandy-lcq** [comment]
I reinstall the system of intel-x86-64, and deploy again with same steps.  and this time,  the 2 additional  wrong route item not added,  so I can ping susscess my pod ip.

so I guess this bug cannot reproduce every time,  it should be triggered by some condition,  which maybe cause not every clean enviroment， I just guess.

**Comment by song-jiang** [comment]
@sandy-lcq What is your pod CIDR and node CIDR? It seems they are both on `172.16.0.0/16` network? Normally you would set your pod CIDR (e.g. 192.168.0.0/24) on a different network with your node CIDR.

**Comment by sandy-lcq** [comment]
@song-jiang ,   my pod CIDR is 172.16.0.0/16, and my node network is in subnet  192.168.204.0/24,  so my understanding they are in different network,  please help to check below config, thanks.

here is my config
kubectl cluster-info dump | grep cidr
                            "--allocate-node-cidrs=true",
                            "--cluster-cidr=172.16.0.0/16",
                            "--node-cidr-mask-size=24",
                            "--allocate-node-cidrs=true",
                            "--cluster-cidr=172.16.0.0/16",
                            "--node-cidr-mask-size=24",

kubeadm config view | grep Subnet
  podSubnet: 172.16.0.0/16
  serviceSubnet: 10.96.0.0/12


master node ip: 192.168.204.1
intel-x86-64 node ip : 192.168.204.5;eth0

**Comment by song-jiang** [comment]
In your issue description, you mentioned pinging from master node not working 
```
09:44:19.845193 IP 172.16.192.64 > 172.16.210.201: ICMP echo request, id 13461, seq 1111, length 64
09:44:20.845379 IP 172.16.192.64 > 172.16.210.201: ICMP echo request, id 13461, seq 1112, length 64
```
So I am assuming 172.16.192.64 is your master node ip.

**Comment by sandy-lcq** [comment]
@song-jiang  172.16.192.64 is ip of  tunl0 on master-node.  calico work in ipip mode.

**Comment by song-jiang** [comment]
@sandy-lcq I see. Yeah, two routes highlighted are very suspicious and definitely wrong. From local host, there should be one route `pod-ip to calixxxx interface` for each pod. 
```
0.0.0.0 0.0.0.0 0.0.0.0 U 10233 0 0 cali89835606d4a
169.254.0.0 0.0.0.0 255.255.0.0 U 233 0 0 cali89835606d4a
```
I wonder if there are other processes programming routes on your host.

**Comment by song-jiang** [comment]
@sandy-lcq Please reopen this issue if you have more information.

**Comment by iimrankhan98** [comment]
@song-jiang 
Recently I have setup a self managed dual stack k8s cluster with calico networking by kubeadm on Linux, but right now I am facing some issues like I am unable to ping6 from master node to pod and at the same time I am able to ping6 from pods to master node
And ipv4 pinging both side from master to pods and pods to master node,
So can you give me some suggestions where I am missing some things
