### ISSUE TITLE
can not access the pod that exists inside of node

### ISSUE THREAD

**Issue by GwiYeong** [projectcalico/calico#2426]
in my kubernetes cluster, i can not access the pod that exists inside of node, but can access the pod that exists another node.

the cluster builted up with kubespray, and using calico for cni.

because i can not access the pod inside of node, kubelet http liveness check always fail. so, coredns and kubernetes-dashboard (any other using http liveness probe) pods being infinitely restart.

i try to check packet is sending to the network interface for pod inside of node with tcpdump, i can see cksum incorrect messages
```
19:15:47.856167 IP (tos 0x0, ttl 63, id 40800, offset 0, flags [DF], proto TCP (6), length 548)
    192.168.0.1.443 > 192.168.221.3.41492: Flags [P.], cksum 0x606c (incorrect -> 0x598b), seq 1306856329:1306856825, ack 3252682161, win 241, options [nop,nop,TS val 141745710 ecr 3197441954], length 496
19:15:47.856200 IP (tos 0x0, ttl 64, id 21893, offset 0, flags [DF], proto TCP (6), length 52)
    192.168.221.3.41492 > 192.168.0.1.443: Flags [.], cksum 0x5e7c (incorrect -> 0x902e), seq 1, ack 496, win 1382, options [nop,nop,TS val 3197443805 ecr 141745710], length 0
19:15:48.012728 IP (tos 0x0, ttl 63, id 40801, offset 0, flags [DF], proto TCP (6), length 530)
    192.168.0.1.443 > 192.168.221.3.41492: Flags [P.], cksum 0x605a (incorrect -> 0xc00f), seq 496:974, ack 1, win 241, options [nop,nop,TS val 141745867 ecr 3197443805], length 478
19:15:48.012757 IP (tos 0x0, ttl 64, id 21894, offset 0, flags [DF], proto TCP (6), length 52)
    192.168.221.3.41492 > 192.168.0.1.443: Flags [.], cksum 0x5e7c (incorrect -> 0x8d16), seq 1, ack 974, win 1382, options [nop,nop,TS val 3197443962 ecr 141745867], length 0
19:15:48.178472 IP (tos 0x0, ttl 64, id 29905, offset 0, flags [DF], proto TCP (6), length 60)
    10.162.3.143.43076 > 192.168.221.3.8080: Flags [S], cksum 0xac0b (incorrect -> 0x75f7), seq 908560366, win 28280, options [mss 1414,sackOK,TS val 3810676436 ecr 0,nop,wscale 7], length 0
19:15:49.205568 IP (tos 0x0, ttl 64, id 29906, offset 0, flags [DF], proto TCP (6), length 60)
    10.162.3.143.43076 > 192.168.221.3.8080: Flags [S], cksum 0xac0b (incorrect -> 0x71f3), seq 908560366, win 28280, options [mss 1414,sackOK,TS val 3810677464 ecr 0,nop,wscale 7], length 0
19:15:49.861004 IP (tos 0x0, ttl 63, id 40802, offset 0, flags [DF], proto TCP (6), length 548)
    192.168.0.1.443 > 192.168.221.3.41492: Flags [P.], cksum 0x606c (incorrect -> 0xd3e0), seq 974:1470, ack 1, win 241, options [nop,nop,TS val 141747715 ecr 3197443962], length 496
19:15:49.861089 IP (tos 0x0, ttl 64, id 21895, offset 0, flags [DF], proto TCP (6), length 52)
    192.168.221.3.41492 > 192.168.0.1.443: Flags [.], cksum 0x5e7c (incorrect -> 0x7cb6), seq 1, ack 1470, win 1382, options [nop,nop,TS val 3197445810 ecr 141747715], length 0
```
what is wrong..? how can i fix it?

## Expected Behavior
on the node, i can access the pod's ip inside of node

## Current Behavior
i can not access the pod.
#### for example
```
2 nodes and 2 pods,
pod1 in node1 has 1.1.1.1 ip
pod2 in node2 has 2.2.2.2

on node1
 curl 1.1.1.1 -> Fail
 curl 2.2.2.2 -> Success
on node2
 curl 1.1.1.1 -> Success
 curl 2.2.2.2 -> Fail
```

## Possible Solution
i don't know
## Steps to Reproduce (for bugs)
i just install kubernetes using kubespray in my machine...

## Your Environment
calicoctl version
```
Client Version:    v3.4.0
Git commit:        a7e09d5
Cluster Version:   v3.4.0
Cluster Type:      kubespray,bgp,k8s
```
```
 OS: Ubuntu 18.04
 Kubernetes: 1.13.3
 Docker: 18.06
```

i write the issue at stackoverflow..
https://stackoverflow.com/questions/54745031/calico-can-not-access-pod-inside-node

**Comment by redbaron** [comment]
checksums are often incorrect when TCP offloading is enabled, check `ethtool -k eth0` (or whatever is your eth device on a node)

**Comment by GwiYeong** [comment]
@redbaron  is it not affect for connection issue? my main problem is that i can not access the pod inside of node

**Comment by redbaron** [comment]
yes, I dont know what your problem is, but checksums are very likely not related to it

**Comment by GwiYeong** [comment]
@redbaron my problem is `i can not access the pod exists inside of node`. i only access pod exists in another node. if you want more information, just tell me.. now i don't have any idea for debugging this problem.

#### for example
```
2 nodes and 2 pods,
pod1 in node1 has  ip 1.1.1.1
pod2 in node2 has  ip 2.2.2.2

on node1
 curl 1.1.1.1 -> Fail
 curl 2.2.2.2 -> Success
on node2
 curl 1.1.1.1 -> Success
 curl 2.2.2.2 -> Fail
```

**Comment by fasaxc** [comment]
@GwiYeong what's you underlying network, does it allow Calico's IPIP traffic (IP protocol 4)? Do you have any network policy in place?

**Comment by tmjd** [comment]
If this problem still persists please respond with additional information and we can reopen.
