### ISSUE TITLE
calico update 3.30 -> 3.31 breaks hostnetwork vxlan on unupgraded nodes

### ISSUE THREAD

**Issue by juliantaylor** [projectcalico/calico#11910]
While upgrading from calico 3.30.4 to 3.31.4 connection from hostnetwork pods via vxlan to kubernetes services break until all calico-node pods are fully updated.

The nodes running 3.31 respond seemingly correctly but the v3.30 drop the packets after vxlan decapsulations

tcpdump hostnetwork pod with calico 3.30.4 -> kubernetes service -> pod 100.65.107.133 on node with calico 3.31.4

```
# request to kubernetes service from hostnetwork pod
12:24:33.244816 eno1  Out IP node1.47053 > node2.4789: VXLAN, flags [I] (0x08), vni 4096
IP node1.43700 > 100.65.107.133.15010: Flags [S], seq 1137234856, win 64860, options [mss 1410,sackOK,TS val 189658141 ecr 0,nop,wscale 7], length 0
# response Synack, not delivered to pod
12:24:33.245120 eno1  In  IP node2.48238 > node1.4789: VXLAN, flags [I] (0x08), vni 4096
IP 100.65.107.133.15010 > node1.43700: Flags [S.], seq 558739255, ack 1137234857, win 64308, options [mss 1410,sackOK,TS val 2058776255 ecr 189658141,nop,wscale 7], length 0
# retransmit
12:24:34.276628 eno1  In  IP node2.40538 > node1.4789: VXLAN, flags [I] (0x08), vni 4096
IP 100.65.107.133.15010 > node1.43700: Flags [S.], seq 558739255, ack 1137234857, win 64308, options [mss 1410,sackOK,TS val 2058777287 ecr 189658141,nop,wscale 7], length 0
...

```

bpf trace logs look fine, same as on the working 3.31->3.31 hostnetwork<->service pods (including the fib failure)

```
          <idle>-0       [003] ..s2. 306139.765821: bpf_trace_printk: eno1------------I: New packet at ifindex=4; mark=0
          <idle>-0       [003] ..s2. 306139.765823: bpf_trace_printk: eno1------------I: IP id=48833 len=110
          <idle>-0       [003] ..s2. 306139.765825: bpf_trace_printk: eno1------------I: IP s=10.238.194.8 d=10.238.196.2
          <idle>-0       [003] ..s2. 306139.765826: bpf_trace_printk: eno1------------I: IP ihl=20 bytes
          <idle>-0       [003] ..s2. 306139.765828: bpf_trace_printk: eno1------------I: UDP; ports: s=48238 d=4789
          <idle>-0       [003] ..s2. 306139.765830: bpf_trace_printk: eno1------------I: VXLAN tunnel packet to 0.0.0.0 (host IP=10.238.196.2)
          <idle>-0       [003] ..s2. 306139.765832: bpf_trace_printk: eno1------------I: VXLAN: non-tunnel calico
          <idle>-0       [003] ..s2. 306139.765833: bpf_trace_printk: eno1------------I: VXLAN packet from known Calico host, allow.
          <idle>-0       [003] ..s2. 306139.765836: bpf_trace_printk: eno1------------I: Traffic is towards host namespace, marking with 0x1000000.
          <idle>-0       [003] ..s2. 306139.765838: bpf_trace_printk: eno1------------I: Final result=ALLOW rc -1. Program execution time: 14289ns
          <idle>-0       [003] ..s2. 306139.765867: bpf_trace_printk: No metadata is shared by XDP
          <idle>-0       [003] ..s2. 306139.765869: bpf_trace_printk: vxlan.calico----I: New packet at ifindex=13; mark=1100000
          <idle>-0       [003] ..s2. 306139.765871: bpf_trace_printk: vxlan.calico----I: IP id=0 len=60
          <idle>-0       [003] ..s2. 306139.765872: bpf_trace_printk: vxlan.calico----I: IP s=100.65.107.133 d=100.64.141.0
          <idle>-0       [003] ..s2. 306139.765873: bpf_trace_printk: vxlan.calico----I: IP ihl=20 bytes
          <idle>-0       [003] ..s2. 306139.765875: bpf_trace_printk: vxlan.calico----I: TCP; ports: s=15010 d=43700
          <idle>-0       [003] ..s2. 306139.765876: bpf_trace_printk: vxlan.calico----I: CT: lookup from 100.65.107.133:15010
          <idle>-0       [003] ..s2. 306139.765878: bpf_trace_printk: vxlan.calico----I: CT: lookup to   100.64.141.0:43700
          <idle>-0       [003] ..s2. 306139.765879: bpf_trace_printk: vxlan.calico----I: CT: tun_ip:0.0.0.0
          <idle>-0       [003] ..s2. 306139.765880: bpf_trace_printk: vxlan.calico----I: CT: Hit! NAT REV entry at ingress to connection opener: SNAT.
          <idle>-0       [003] ..s2. 306139.765882: bpf_trace_printk: vxlan.calico----I: CT: First response packet? ifindex=13
          <idle>-0       [003] ..s2. 306139.765885: bpf_trace_printk: vxlan.calico----I: Host RPF check src=100.65.107.133 skb loose if 13
          <idle>-0       [003] ..s2. 306139.765886: bpf_trace_printk: vxlan.calico----I: Host RPF check src=100.65.107.133 skb iface=13
          <idle>-0       [003] ..s2. 306139.765887: bpf_trace_printk: vxlan.calico----I: Host RPF check rc 0 result 1
          <idle>-0       [003] ..s2. 306139.765888: bpf_trace_printk: vxlan.calico----I: CT: Updating ifindex from 0 to 13
          <idle>-0       [003] ..s2. 306139.765889: bpf_trace_printk: vxlan.calico----I: CT: result: 0x2004
          <idle>-0       [003] ..s2. 306139.765890: bpf_trace_printk: vxlan.calico----I: conntrack entry flags 0x80
          <idle>-0       [003] ..s2. 306139.765891: bpf_trace_printk: vxlan.calico----I: CT Hit
          <idle>-0       [003] ..s2. 306139.765892: bpf_trace_printk: vxlan.calico----I: jump to idx 2 prog at 41
          <idle>-0       [003] ..s2. 306139.765893: bpf_trace_printk: vxlan.calico----I: Entering calico_tc_skb_accepted_entrypoint
          <idle>-0       [003] ..s2. 306139.765894: bpf_trace_printk: vxlan.calico----I: Entering calico_tc_skb_accepted
          <idle>-0       [003] ..s2. 306139.765896: bpf_trace_printk: vxlan.calico----I: src=100.65.107.133 dst=100.64.141.0
          <idle>-0       [003] ..s2. 306139.765897: bpf_trace_printk: vxlan.calico----I: post_nat=0.0.0.0:0
          <idle>-0       [003] ..s2. 306139.765898: bpf_trace_printk: vxlan.calico----I: tun_ip=0.0.0.0
          <idle>-0       [003] ..s2. 306139.765899: bpf_trace_printk: vxlan.calico----I: pol_rc=1
          <idle>-0       [003] ..s2. 306139.765899: bpf_trace_printk: vxlan.calico----I: sport=15010
          <idle>-0       [003] ..s2. 306139.765900: bpf_trace_printk: vxlan.calico----I: dport=43700
          <idle>-0       [003] ..s2. 306139.765901: bpf_trace_printk: vxlan.calico----I: flags=20
          <idle>-0       [003] ..s2. 306139.765901: bpf_trace_printk: vxlan.calico----I: ct_rc=4
          <idle>-0       [003] ..s2. 306139.765902: bpf_trace_printk: vxlan.calico----I: ct_related=0
          <idle>-0       [003] ..s2. 306139.765903: bpf_trace_printk: vxlan.calico----I: mark=0x1000000
          <idle>-0       [003] ..s2. 306139.765904: bpf_trace_printk: vxlan.calico----I: ip->ttl 64
          <idle>-0       [003] ..s2. 306139.765905: bpf_trace_printk: vxlan.calico----I: CT: SNAT from 100.72.246.133:15010
          <idle>-0       [003] ..s2. 306139.765906: bpf_trace_printk: vxlan.calico----I: Fixing TCP dest port from 43700 to 43700 
          <idle>-0       [003] ..s2. 306139.765907: bpf_trace_printk: vxlan.calico----I: SNAT L3 csum at 24 L4 csum at 50 
          <idle>-0       [003] ..s2. 306139.765909: bpf_trace_printk: vxlan.calico----I: L4 checksum update src IP from 100.65.107.133 to 100.72.246.133 
          <idle>-0       [003] ..s2. 306139.765910: bpf_trace_printk: vxlan.calico----I: bpf_l4_csum_diff(IP): 0x8b0700 
          <idle>-0       [003] ..s2. 306139.765912: bpf_trace_printk: vxlan.calico----I: L4 checksum update dst IP from 100.64.141.0 to 10.238.196.2 
          <idle>-0       [003] ..s2. 306139.765913: bpf_trace_printk: vxlan.calico----I: bpf_l4_csum_diff(IP): 0x2c2b4a6 
          <idle>-0       [003] ..s2. 306139.765914: bpf_trace_printk: vxlan.calico----I: FIB family=2 
          <idle>-0       [003] ..s2. 306139.765915: bpf_trace_printk: vxlan.calico----I: FIB ifindex=13 
          <idle>-0       [003] ..s2. 306139.765916: bpf_trace_printk: vxlan.calico----I: FIB l4_protocol=6 
          <idle>-0       [003] ..s2. 306139.765916: bpf_trace_printk: vxlan.calico----I: FIB sport=15010 
          <idle>-0       [003] ..s2. 306139.765917: bpf_trace_printk: vxlan.calico----I: FIB dport=43700 
          <idle>-0       [003] ..s2. 306139.765918: bpf_trace_printk: vxlan.calico----I: FIB ipv4_src=100.72.246.133 
          <idle>-0       [003] ..s2. 306139.765919: bpf_trace_printk: vxlan.calico----I: FIB ipv4_dst=100.64.141.0 
          <idle>-0       [003] ..s2. 306139.765920: bpf_trace_printk: vxlan.calico----I: Traffic is towards the host namespace, doing Linux FIB lookup 
          <idle>-0       [003] ..s2. 306139.765921: bpf_trace_printk: vxlan.calico----I: FIB lookup failed (FIB problem): 4. 
          <idle>-0       [003] ..s2. 306139.765923: bpf_trace_printk: vxlan.calico----I: Traffic is towards host namespace, marking with 0x1000000. 
          <idle>-0       [003] ..s2. 306139.765924: bpf_trace_printk: vxlan.calico----I: Final result=ALLOW rc -1. Program execution time: 53078ns 
```

The issue appears to be due to the vxlan tunnel key and fib being done in bpf in 3.31.

I printed the ctx->skb->pkt_type of the packet on the v3.30 node and it was PACKET_OTHERHOST=3 while the program is a towards host
The 3.31 code explicitly sets it to PACKET_HOST so I tried setting in v3.30 that via:

```patch
--- a/felix/bpf-gpl/fib_co_re.h
+++ b/felix/bpf-gpl/fib_co_re.h
@@ -6,6 +6,7 @@
 #define __CALI_FIB_CO_RE_H__
 
 #include "profiling.h"
+#include <linux/if_packet.h>
 
 static CALI_BPF_INLINE int forward_or_drop(struct cali_tc_ctx *ctx)
 {
@@ -358,8 +359,11 @@ allow:
                        CALI_INFO("Final result=DENY (%d). Program execution time: %lluns",
                                        reason, prog_end_time-state->prog_start_time);
                } else {
-                       CALI_INFO("Final result=ALLOW rc %d. Program execution time: %lluns",
-                                       rc, prog_end_time-state->prog_start_time);
+                        if (CALI_F_VXLAN && CALI_F_TO_HOST) {
+                               bpf_skb_change_type(ctx->skb, PACKET_HOST);
+                       }
+                       CALI_INFO("Final result=ALLOW rc %d. type %d",
+                                       rc, ctx->skb->pkt_type);
                }
        }

```

This fixed the problem and the cluster seems to work in a mixed 3.31+3.30 state, though I am not grasping enough what is actually wrong to say if this patch makes any sense.

**Comment by juliantaylor** [comment]
The reason for this issue is most likely that the 31 sent vxlan packets have the pods interface as destination mac (ee:ee:ee:ee:ee:ee)

```
Internet Protocol Version 4, Src: 10.238.194.6, Dst: 10.238.196.2
User Datagram Protocol, Src Port: 33544, Dst Port: 4789
Virtual eXtensible Local Area Network
Ethernet II, Src: srcmac, Dst: ee:ee:ee:ee:ee:ee (ee:ee:ee:ee:ee:ee)
    Destination: ee:ee:ee:ee:ee:ee (ee:ee:ee:ee:ee:ee)
    Source: srcmac
    Type: IPv4 (0x0800)
```

this is not considered local host by the kernel so it does not set the packet type to PACKET_HOST

vxlan packets from 3.30 hosts have the vxlan.calico mac as the destination.

**Comment by lucastigera** [comment]
Closing - this was fixed by https://github.com/projectcalico/calico/pull/12054 .
