### ISSUE TITLE
Intermittent connection timeouts with wireguard

### ISSUE THREAD

**Issue by iheng** [projectcalico/calico#9496]
hi, we're facing intermittent connection timeouts with Calico(3.28.2) when wireguard enabled.  All work nodes have this issue when wireguard enabled. we're only use wireguard feature, we don't have network policy in place.  we have set wireguardHostEncryptionEnabled: true

did tcpdump on source work node when timeout:
```
 1952 273.760089 10.101.183.71 → 10.101.105.134 TCP 76 [TCP Retransmission] 22000 → 8080 [SYN] Seq=0 Win=62307 Len=0 MSS=8901 SACK_PERM=1 TSval=3517018028 TSecr=0 WS=128
 1953 275.780198 10.101.183.71 → 10.101.105.134 TCP 76 [TCP Retransmission] 22000 → 8080 [SYN] Seq=0 Win=62307 Len=0 MSS=8901 SACK_PERM=1 TSval=3517020048 TSecr=0 WS=128
 1954 276.853040 10.101.183.71 → 10.101.105.134 TCP 76 13915 → 8080 [SYN] Seq=0 Win=62307 Len=0 MSS=8901 SACK_PERM=1 TSval=3517021121 TSecr=0 WS=128
 1955 277.860001 10.101.183.71 → 10.101.105.134 TCP 76 [TCP Retransmission] 13915 → 8080 [SYN] Seq=0 Win=62307 Len=0 MSS=8901 SACK_PERM=1 TSval=3517022128 TSecr=0 WS=128
 1956 279.872015 10.101.183.71 → 10.101.105.134 TCP 76 [TCP Retransmission] 13915 → 8080 [SYN] Seq=0 Win=62307 Len=0 MSS=8901 SACK_PERM=1 TSval=3517024140 TSecr=0 WS=128
 1957 280.970319 10.101.183.71 → 10.101.105.134 TCP 76 56769 → 8080 [SYN] Seq=0 Win=62307 Len=0 MSS=8901 SACK_PERM=1 TSval=3517025238 TSecr=0 WS=128
```

## Expected Behavior

no connection timeout when wireguard enabled 

## Current Behavior

random connection timeout  when wireguard enabled 

## Possible Solution

disable wireguard with following command solved issue
calicoctl patch felixconfiguration default --type='merge' -p '{"spec":{"wireguardEnabled":false}}'

## Steps to Reproduce (for bugs)

1.
2.
3.
4.
not sure how to reproduce it 
## Your Environment

* Calico version: 3.28.2
* Calico dataplane (iptables, windows etc.) iptables v1.8.4 (legacy)
* Orchestrator version (e.g. kubernetes, mesos, rkt): AWS EKS 1.30
* Operating System and version:  5.10.225-213.878.amzn2.x86_64
* Link to your project (optional):

**Comment by mazdakn** [comment]
@iheng can you check if you are having the same issue as this one: https://github.com/projectcalico/calico/issues/9223?

**Comment by iheng** [comment]
@mazdakn  seems not. in my case, cpu usage is low , not exceed 180kps
<img width="1007" alt="image" src="https://github.com/user-attachments/assets/509f5055-99b0-4949-8430-71599037734a">

<img width="694" alt="image" src="https://github.com/user-attachments/assets/c489fa23-3a44-4d8a-a28e-e794962291df">

**Comment by iheng** [comment]
![image](https://github.com/user-attachments/assets/46a43c07-088e-4315-a333-1051cd6ef51d)
@mazdakn  i saw udp buffer errors, not sure it's related or not

**Comment by tomastigera** [comment]
If any of the endpoints host-networked?

**Comment by tomastigera** [comment]
@iheng if you have any new information, feel free to port it here and we can reopen.
