### ISSUE TITLE
Networking issue with calico 3.1.x

### ISSUE THREAD

**Issue by valentin2105** [projectcalico/calico#1947]
Hi,

I try to deploy a dual stack Calico cluster (v4/v6) and got issue to ping a new created pod. 

I'm currently debug with Tcpdump, but can't figure it out what wrong. 

Any idea out there ?

#### Ping pod from worker : 
- worker (tcpdump) : 
```
16:50:13.919980 IP 10.88.88.101 > 192.168.5.37: ICMP echo request, id 24429, seq 94, length 64
16:50:13.920012 ARP, Request who-has 169.254.1.1 tell 192.168.5.37, length 28
16:50:14.943986 IP 10.88.88.101 > 192.168.5.37: ICMP echo request, id 24429, seq 95, length 64
16:50:14.943929 ARP, Request who-has 169.254.1.1 tell 192.168.5.37, length 28
```
- pod 
```
05:49:01.215913 ARP, Request who-has 169.254.1.1 tell toolbox-775559f8d5-kqsg2, length 28
05:49:01.216029 IP 10.88.88.101 > toolbox-775559f8d5-kqsg2: ICMP echo request, id 24429, seq 23, length 64
05:49:02.243938 ARP, Request who-has 169.254.1.1 tell toolbox-775559f8d5-kqsg2, length 28
05:49:02.244013 IP 10.88.88.101 > toolbox-775559f8d5-kqsg2: ICMP echo request, id 24429, seq 24, length 64
```

```
root@master01# kubectl get pod -o wide
NAME                       READY     STATUS    RESTARTS   AGE       IP             
toolbox-775559f8d5-kqsg2   1/1       Running   0          8m        192.168.5.37 
```
```
root@worker01:~# ping 192.168.5.37
PING 192.168.5.37 (192.168.5.37) 56(84) bytes of data.
^C
--- 192.168.5.37 ping statistics ---
260 packets transmitted, 0 received, 100% packet loss, time 265204ms

root@worker01:~# ip route
10.88.88.0/24 dev ens18 proto kernel scope link src 10.88.88.101 
blackhole 192.168.5.0/26 proto bird 
192.168.5.37 dev calif3f7e517cfe scope link 

root@worker01:~# calicoctl get node  -o wide
NAME       ASN         IPV4                               IPV6                                         
worker01   (unknown)   10.88.88.101/24         (hidden)
```

I don't understand why the pod doesn't answer ? 
Do calico has changed something ? 

My worker doesn't get any IPv4 default gateway, can this impact calico ? 

(calico node & policy controller run fine on the single node) 

## Your Environment
* Calico version v3.1.1
* Orchestrator version (e.g. kubernetes, mesos, rkt): v1.10.1
* Operating System and version: Debian 9.4

Thanks !

**Comment by caseydavenport** [comment]
> My worker doesn't get any IPv4 default gateway, can this impact calico ?

I think this is the issue here. As you can in the TCP dump output, there's no response to the pod's ARP requests.

That response is usually generated by the host via ARP proxy, which relies on _some_ route existing which matches `169.254.1.1`. 

So, typically Calico relies on the default route for this. If you don't have a default route, you'll need some other route which includes that address to trick the host into responding to the ARP.

**Comment by valentin2105** [comment]
Thanks @caseydavenport , It seem logic. Sorry for the issue.
