### ISSUE TITLE
only icmp packet can travel cross k8s node in bgp mode (full mesh/bgp reflector)

### ISSUE THREAD

**Issue by aries1998** [projectcalico/calico#6821]
4 nodes(1 master , 3 worker) k8s cluster ,  everything works fine in IPIP mode.  When change to calico bgp mode(full mesh/reflector) , only icmp packet can travel cross the nodes.

os version: ubuntu 20.04
k8s version:  1.25/1.24 both have this problem
calico version: 3.24.1

k8s nodes info
```
root@master:~# k get node -o wide
NAME     STATUS   ROLES           AGE   VERSION   INTERNAL-IP       EXTERNAL-IP   OS-IMAGE             KERNEL-VERSION      CONTAINER-RUNTIME
master   Ready    control-plane   41m   v1.24.0   192.168.122.150   <none>        Ubuntu 20.04.5 LTS   5.4.0-126-generic   containerd://1.6.8
ub1      Ready    <none>          41m   v1.24.0   192.168.122.101   <none>        Ubuntu 20.04.5 LTS   5.4.0-126-generic   containerd://1.6.8
ub2      Ready    <none>          38m   v1.24.0   192.168.122.102   <none>        Ubuntu 20.04.5 LTS   5.4.0-126-generic   containerd://1.6.8
ub3      Ready    <none>          36m   v1.24.0   192.168.122.103   <none>        Ubuntu 20.04.5 LTS   5.4.0-126-generic   containerd://1.6.8
```

route info
```
root@master:~# route -n
Kernel IP routing table
Destination     Gateway         Genmask         Flags Metric Ref    Use Iface
0.0.0.0         192.168.122.1   0.0.0.0         UG    0      0        0 eth0
10.10.4.64      192.168.122.102 255.255.255.192 UG    0      0        0 eth0
10.10.48.128    192.168.122.103 255.255.255.192 UG    0      0        0 eth0
10.10.142.192   192.168.122.101 255.255.255.192 UG    0      0        0 eth0
192.168.122.0   0.0.0.0         255.255.255.0   U     0      0        0 eth0
```

calico node info
```
root@master:~# c node status
Calico process is running.

IPv4 BGP status
+-----------------+---------------+-------+----------+-------------+
|  PEER ADDRESS   |   PEER TYPE   | STATE |  SINCE   |    INFO     |
+-----------------+---------------+-------+----------+-------------+
| 192.168.122.101 | node specific | up    | 06:50:46 | Established |
| 192.168.122.102 | node specific | up    | 06:50:46 | Established |
| 192.168.122.103 | node specific | up    | 06:50:46 | Established |
+-----------------+---------------+-------+----------+-------------+

IPv6 BGP status
No IPv6 peers found.
```

testing object serivce , In this issue is nginx on ub1 , pod ip is 10.10.142.195
```
root@master:~# k get pod -o wide
NAME                            READY   STATUS    RESTARTS   AGE   IP              NODE   NOMINATED NODE   READINESS GATES
nginx-deploy-84fbbc69b6-5rd5v   1/1     Running   0          33m   10.10.4.64      ub2    <none>           <none>
nginx-deploy-84fbbc69b6-5rn8h   1/1     Running   0          33m   10.10.142.195   ub1    <none>           <none>
nginx-deploy-84fbbc69b6-wqw4n   1/1     Running   0          33m   10.10.48.128    ub3    <none>           <none>
```

test step:

1.  icmp check --- ok 
```
ping ub1 from master 

root@master:~# ping 10.10.142.195 -c 1
PING 10.10.142.195 (10.10.142.195) 56(84) bytes of data.
64 bytes from 10.10.142.195: icmp_seq=1 ttl=63 time=0.765 ms

--- 10.10.142.195 ping statistics ---
1 packets transmitted, 1 received, 0% packet loss, time 0ms
rtt min/avg/max/mdev = 0.765/0.765/0.765/0.000 ms
```

tcpdump on master 
```
root@master:~# tcpdump -iany -n  icmp and  host 10.10.142.195
tcpdump: verbose output suppressed, use -v or -vv for full protocol decode
listening on any, link-type LINUX_SLL (Linux cooked v1), capture size 262144 bytes
15:35:16.832517 IP 192.168.122.150 > 10.10.142.195: ICMP echo request, id 10, seq 1, length 64
15:35:16.833198 IP 10.10.142.195 > 192.168.122.150: ICMP echo reply, id 10, seq 1, length 64

2 packets captured
2 packets received by filter
0 packets dropped by kernel
```

tcpdump on ub1
```
root@ub1:~# tcpdump -iany -e -n  icmp and  host 10.10.142.195               
tcpdump: verbose output suppressed, use -v or -vv for full protocol decode
listening on any, link-type LINUX_SLL (Linux cooked v1), capture size 262144 bytes
15:39:45.692075  In 52:54:00:f4:e7:40 ethertype IPv4 (0x0800), length 100: 192.168.122.150 > 10.10.142.195: ICMP echo request, id 15, seq 1, length 64
15:39:45.692154 Out ee:ee:ee:ee:ee:ee ethertype IPv4 (0x0800), length 100: 192.168.122.150 > 10.10.142.195: ICMP echo request, id 15, seq 1, length 64
15:39:45.692384  In a6:87:af:df:64:b5 ethertype IPv4 (0x0800), length 100: 10.10.142.195 > 192.168.122.150: ICMP echo reply, id 15, seq 1, length 64
15:39:45.692408 Out 52:54:00:9e:72:4e ethertype IPv4 (0x0800), length 100: 10.10.142.195 > 192.168.122.150: ICMP echo reply, id 15, seq 1, length 64
```

2. check nginx:ub1 status on ub1  -- ok
```
root@ub1:~# wget -nv -t 1 --timeout=1  http://10.10.142.195 
2022-10-06 15:49:36 URL:http://10.10.142.195/ [615/615] -> "index.html.1" [1]
```

3. check nginx:ub1 status on master -- not ok
```
root@master:~# wget -nv -t 1 --timeout=1  http://10.10.142.195
Read error (Connection timed out) in headers.
```

tcpdump on ub1 -- nothing as exepcted
```
root@ub1:~#  tcpdump  -iany -n port 80 and host 10.10.142.195
tcpdump: verbose output suppressed, use -v or -vv for full protocol decode
listening on any, link-type LINUX_SLL (Linux cooked v1), capture size 262144 bytes
```

tcpdump on master -- something is strange , there a return packet from 10.10.142.195 , how so ?
```
root@master:~# tcpdump  -iany -n port 80 and host 10.10.142.195
tcpdump: verbose output suppressed, use -v or -vv for full protocol decode
listening on any, link-type LINUX_SLL (Linux cooked v1), capture size 262144 bytes
15:53:14.727247 IP 192.168.122.150.38268 > 10.10.142.195.80: Flags [S], seq 1983387188, win 64240, options [mss 1460,sackOK,TS val 1422329954 ecr 0,nop,wscale 7], length 0
15:53:14.727650 IP 10.10.142.195.80 > 192.168.122.150.38268: Flags [S.], seq 941089999, ack 1983387189, win 43440, options [mss 1460,sackOK,TS val 161250734 ecr 1422329954,nop,wscale 11], length 0
15:53:14.727805 IP 192.168.122.150.38268 > 10.10.142.195.80: Flags [.], ack 1, win 502, options [nop,nop,TS val 1422329954 ecr 161250734], length 0
15:53:14.728046 IP 192.168.122.150.38268 > 10.10.142.195.80: Flags [P.], seq 1:141, ack 1, win 502, options [nop,nop,TS val 1422329955 ecr 161250734], length 140: HTTP: GET / HTTP/1.1
15:53:14.728453 IP 10.10.142.195.80 > 192.168.122.150.38268: Flags [.], ack 141, win 22, options [nop,nop,TS val 161250734 ecr 1422329955], length 0
15:53:15.729784 IP 192.168.122.150.38268 > 10.10.142.195.80: Flags [F.], seq 141, ack 1, win 502, options [nop,nop,TS val 1422330957 ecr 161250734], length 0
15:53:15.730267 IP 10.10.142.195.80 > 192.168.122.150.38268: Flags [F.], seq 1, ack 142, win 22, options [nop,nop,TS val 161251736 ecr 1422330957], length 0
15:53:15.730349 IP 192.168.122.150.38268 > 10.10.142.195.80: Flags [.], ack 2, win 502, options [nop,nop,TS val 1422330957 ecr 161251736], length 0
```

4.  Have tried fully clear the firewall on both master/ub1 with no luck . Since ipip mode is ok , it's not likely the problem of firewall.

**Comment by linhil** [comment]
I think it is the entries in iptables block the traffic, but when I use the calico.yaml under 50 nodes, it add too many iptable chains, and it hard to debug, do you know how to debug for this issue?
K8S also add so many ip table chains, it drive people creazy

**Comment by aries1998** [comment]
It's the problem of iptables on the  host.  These k8s node are kvm guest running on the host with different subnet than the host  , and the host also act as a policy router.  Add the 10.10.0.0/16 subnet to direct return rules  of iptables fix it.
