### ISSUE TITLE
K8s on Ubuntu 24.04, VXLAN - no traffic to pods on other nodes

### ISSUE THREAD

**Issue by bogd** [projectcalico/calico#10692]
K8s 1.33.2, installed via kubespray on Ubuntu 24.04 . Calico is installed by kubespray with the default settings (which are currently `backend: vxlan`, `ipip_mode: Never`, `vxlan_mode: Always`). 

After installation, traffic does not seem to traverse the cluster network properly:

```
root@k8s-testing-01-master:~# kubectl run --image=nginx nginx
pod/nginx created
root@k8s-testing-01-master:~# kubectl get pod -o wide
NAME    READY   STATUS    RESTARTS   AGE   IP             NODE             NOMINATED NODE   READINESS GATES
nginx   1/1     Running   0          13s   10.233.65.67   k8s-testing-05   <none>           <none>
root@k8s-testing-01-master:~# curl --connect-timeout 5 10.233.65.67
curl: (28) Failed to connect to 10.233.65.67 port 80 after 5002 ms: Timeout was reached
```

The problem also occured after a cluster upgrade, even though I cannot say for sure whether it was the k8s upgrade or the Ubuntu release upgrade (from 22.04 to 24.04) that surfaced the issue. But I was able to reproduce it by simply reinstalling from scratch in a test environment.

Changing Calico config to `backend: bird / ipip_mode: CrossSubnet` and restarting Calico pods fixes the issue. 

## Expected Behavior
Node-to-pod-on-other-node and pod-to-pod communication should be possible.

## Current Behavior
No HTTP traffic from a node to a pod running on another node. Strangely enough, ICMP traffic does seem to cross the network:

Ping from node to pod on another node:
```
root@k8s-testing-01-master:~# ping 10.233.65.67
PING 10.233.65.67 (10.233.65.67) 56(84) bytes of data.
64 bytes from 10.233.65.67: icmp_seq=1 ttl=63 time=0.651 ms
64 bytes from 10.233.65.67: icmp_seq=2 ttl=63 time=0.572 ms
64 bytes from 10.233.65.67: icmp_seq=3 ttl=63 time=0.569 ms

root@k8s-testing-05:~# tcpdump -ni calic440f455693 host 10.233.65.67
tcpdump: verbose output suppressed, use -v[v]... for full protocol decode
listening on calic440f455693, link-type EN10MB (Ethernet), snapshot length 262144 bytes
15:08:25.442334 IP 10.233.121.128 > 10.233.65.67: ICMP echo request, id 13748, seq 1, length 64
15:08:25.442376 IP 10.233.65.67 > 10.233.121.128: ICMP echo reply, id 13748, seq 1, length 64
15:08:26.490698 IP 10.233.121.128 > 10.233.65.67: ICMP echo request, id 13748, seq 2, length 64
15:08:26.490740 IP 10.233.65.67 > 10.233.121.128: ICMP echo reply, id 13748, seq 2, length 64
15:08:27.514715 IP 10.233.121.128 > 10.233.65.67: ICMP echo request, id 13748, seq 3, length 64
15:08:27.514745 IP 10.233.65.67 > 10.233.121.128: ICMP echo reply, id 13748, seq 3, length 64
```

HTTP (TCP/80) traffic from node to pod on another node:
```
root@k8s-testing-01-master:~# curl --connect-timeout 5 10.233.65.67
curl: (28) Failed to connect to 10.233.65.67 port 80 after 5002 ms: Timeout was reached

root@k8s-testing-05:~# tcpdump -ni calic440f455693 host 10.233.65.67
tcpdump: verbose output suppressed, use -v[v]... for full protocol decode
listening on calic440f455693, link-type EN10MB (Ethernet), snapshot length 262144 bytes
[ Nothing on the packet capture, the requests don't seem to make their way there ]
```

## Possible Solution
So far, I only have the workaround of switching to bird/ip-ip . I need someone more knowledgeable in the internals of VXLAN and Calico to help me troubleshoot (and hopefully tell me it is simply something that I am doing wrong).

## Steps to Reproduce (for bugs)

K8s install on Ubuntu 24.04, via kubespray. 

## Your Environment

* Calico version
Client Version:    v3.29.4
Git commit:        019fcb9c7
Cluster Version:   v3.29.4
Cluster Type:      kdd,k8s,bgp,kubeadm
* Calico dataplane (iptables, windows etc.)
 ipvs
* Orchestrator version (e.g. kubernetes, mesos, rkt):
 K8s 1.33.2
* Operating System and version:
Ubuntu 24.04 
* Link to your project (optional):

**Comment by caseydavenport** [comment]
Interesting - the fact that this is only happening for HTTP traffic and not ICMP seems to suggest that this likely isn't a pure routing issue, although I am not sure why IPIP vs VXLAN would matter then!

Since you're accessing the Pod IP, I wouldn't expect kubeproxy / IPVS interactions to be relevant here either.

The traffic will be getting dropped at one of a few places:
- On the source node - either in iptables or in the VXLAN device itself
- The network fabric between your nodes (although with VXLAN Always this seems unlikely as all traffic will be encap'd) 
- The destination node (either in the VXALN device or iptables)

A few questions to start off:
- Do you see this dropped traffic between pods (e.g., performing the curl from within a pod rather than from a host)?
- If you run your tcpdump on the destination node's VXLAN device, do you see the incoming packets?
- Are there any WARNING or ERROR level logs in calico/node on either the source or destination nodes?

**Comment by bogd** [comment]
@caseydavenport - I will do my best to answer. I created a testing environment dedicated to this issue, so if you need me to break anything on the cluster in order to investigate, that is always an option as well :)

- yes, I see the same behavior between pods. Did not mention it in the original message, to keep it short. But it is happening.
```
root@k8s-testing-01-master:~# kubectl get pod -o wide
NAME        READY   STATUS    RESTARTS      AGE   IP              NODE             NOMINATED NODE   READINESS GATES
alpine      1/1     Running   1 (15h ago)   15h   10.233.89.196   k8s-testing-04   <none>           <none>
nginx       1/1     Running   0             16h   10.233.65.67    k8s-testing-05   <none>           <none>
ubuntupod   1/1     Running   1 (9s ago)    15s   10.233.127.68   k8s-testing-07   <none>           <none>

root@k8s-testing-01-master:~# kubectl get pod -o wide
NAME        READY   STATUS    RESTARTS      AGE   IP              NODE             NOMINATED NODE   READINESS GATES
alpine      1/1     Running   1 (15h ago)   15h   10.233.89.196   k8s-testing-04   <none>           <none>
nginx       1/1     Running   0             16h   10.233.65.67    k8s-testing-05   <none>           <none>
ubuntupod   1/1     Running   1 (91s ago)   97s   10.233.127.68   k8s-testing-07   <none>           <none>
root@k8s-testing-01-master:~# kubectl exec -it alpine -- sh
/ # wget -O- --timeout=5 10.233.65.67
Connecting to 10.233.65.67 (10.233.65.67:80)
wget: download timed out
```

- The tcpdumps in the original message are taken on the destination node - on what I assume is the virtual interface corresponding to the pod (because the route to the pod IP goes to that device). Looking on the vxlan device, I see the exact same behavior (ICMP goes through, HTTP does not):

```
root@k8s-testing-05:~# ip r s 10.233.65.67
10.233.65.67 dev calic440f455693 scope link 

root@k8s-testing-05:~# tcpdump -ni vxlan.calico host 10.233.65.67
tcpdump: verbose output suppressed, use -v[v]... for full protocol decode
listening on vxlan.calico, link-type EN10MB (Ethernet), snapshot length 262144 bytes
07:20:51.795092 IP 10.233.89.196 > 10.233.65.67: ICMP echo request, id 30, seq 0, length 64
07:20:51.795354 IP 10.233.65.67 > 10.233.89.196: ICMP echo reply, id 30, seq 0, length 64
07:20:52.795475 IP 10.233.89.196 > 10.233.65.67: ICMP echo request, id 30, seq 1, length 64
07:20:52.795666 IP 10.233.65.67 > 10.233.89.196: ICMP echo reply, id 30, seq 1, length 64

root@k8s-testing-01-master:~# kubectl exec -it alpine -- sh
/ # wget -O- --timeout=5 10.233.65.67
Connecting to 10.233.65.67 (10.233.65.67:80)
wget: download timed out
/ # wget -O- --timeout=5 10.233.65.67
Connecting to 10.233.65.67 (10.233.65.67:80)
^C
/ # ping 10.233.65.67
PING 10.233.65.67 (10.233.65.67): 56 data bytes
64 bytes from 10.233.65.67: seq=0 ttl=62 time=0.792 ms
64 bytes from 10.233.65.67: seq=1 ttl=62 time=0.884 ms
^C
--- 10.233.65.67 ping statistics ---
2 packets transmitted, 2 packets received, 0% packet loss
round-trip min/avg/max = 0.792/0.838/0.884 ms
```

- looking on the source node VXLAN device, the story is different - I can see the SYNs making it to the device, but they seem to be lost before making it all the way to the destination node:

```
root@k8s-testing-01-master:~# tcpdump -ni vxlan.calico host 10.233.65.67 &
[1] 610430
root@k8s-testing-01-master:~# tcpdump: verbose output suppressed, use -v[v]... for full protocol decode
listening on vxlan.calico, link-type EN10MB (Ethernet), snapshot length 262144 bytes

root@k8s-testing-01-master:~# ping 10.233.65.67
PING 10.233.65.67 (10.233.65.67) 56(84) bytes of data.
64 bytes from 10.233.65.67: icmp_seq=1 ttl=63 time=0.784 ms
07:30:22.012036 IP 10.233.121.128 > 10.233.65.67: ICMP echo request, id 20704, seq 1, length 64
07:30:22.012767 IP 10.233.65.67 > 10.233.121.128: ICMP echo reply, id 20704, seq 1, length 64
64 bytes from 10.233.65.67: icmp_seq=2 ttl=63 time=0.592 ms
07:30:23.035331 IP 10.233.121.128 > 10.233.65.67: ICMP echo request, id 20704, seq 2, length 64
07:30:23.035876 IP 10.233.65.67 > 10.233.121.128: ICMP echo reply, id 20704, seq 2, length 64
64 bytes from 10.233.65.67: icmp_seq=3 ttl=63 time=0.703 ms
07:30:24.059274 IP 10.233.121.128 > 10.233.65.67: ICMP echo request, id 20704, seq 3, length 64
07:30:24.059933 IP 10.233.65.67 > 10.233.121.128: ICMP echo reply, id 20704, seq 3, length 64
^C
--- 10.233.65.67 ping statistics ---
3 packets transmitted, 3 received, 0% packet loss, time 2047ms
rtt min/avg/max/mdev = 0.592/0.693/0.784/0.078 ms

root@k8s-testing-01-master:~# curl --connect-timeout=5 10.233.65.67
curl: option --connect-timeout=5: is unknown
curl: try 'curl --help' or 'curl --manual' for more information
root@k8s-testing-01-master:~# curl --connect-timeout 5 10.233.65.67
07:30:57.356822 IP 10.233.121.128.40226 > 10.233.65.67.80: Flags [S], seq 639933210, win 64860, options [mss 1410,sackOK,TS val 3258564056 ecr 0,nop,wscale 7], length 0
07:30:58.363255 IP 10.233.121.128.40226 > 10.233.65.67.80: Flags [S], seq 639933210, win 64860, options [mss 1410,sackOK,TS val 3258565063 ecr 0,nop,wscale 7], length 0
07:30:59.387358 IP 10.233.121.128.40226 > 10.233.65.67.80: Flags [S], seq 639933210, win 64860, options [mss 1410,sackOK,TS val 3258566087 ecr 0,nop,wscale 7], length 0
07:31:00.411226 IP 10.233.121.128.40226 > 10.233.65.67.80: Flags [S], seq 639933210, win 64860, options [mss 1410,sackOK,TS val 3258567111 ecr 0,nop,wscale 7], length 0
07:31:01.435316 IP 10.233.121.128.40226 > 10.233.65.67.80: Flags [S], seq 639933210, win 64860, options [mss 1410,sackOK,TS val 3258568135 ecr 0,nop,wscale 7], length 0
curl: (28) Failed to connect to 10.233.65.67 port 80 after 5002 ms: Timeout was reached
```

- the logs do not seem to have any warnings or errors. Plenty of "[INFO] Received update from calculation graph", but that is about it.

```
root@k8s-testing-01-master:~# kubectl get pod -n kube-system -o wide
NAME                                            READY   STATUS    RESTARTS   AGE   IP               NODE                    NOMINATED NODE   READINESS GATES
calico-kube-controllers-85c5d47cb8-n6gv6        1/1     Running   0          18h   10.233.65.65     k8s-testing-05          <none>           <none>
calico-node-dgfpq                               1/1     Running   0          18h   10.10.0.104      k8s-testing-04          <none>           <none>
calico-node-dn4nx                               1/1     Running   0          18h   10.10.0.102      k8s-testing-02-master   <none>           <none>
calico-node-knpz6                               1/1     Running   0          18h   10.10.0.101      k8s-testing-01-master   <none>           <none>
calico-node-ldqxm                               1/1     Running   0          18h   10.10.0.106      k8s-testing-06          <none>           <none>
calico-node-tpdx2                               1/1     Running   0          18h   10.10.0.105      k8s-testing-05          <none>           <none>
calico-node-wghzv                               1/1     Running   0          18h   10.10.0.107      k8s-testing-07          <none>           <none>
calico-node-zjtmx                               1/1     Running   0          18h   10.10.0.103      k8s-testing-03-master   <none>           <none>

[ Looking at destination node, 05]
root@k8s-testing-01-master:~# kubectl logs calico-node-tpdx2 -n kube-system | grep WARN
Defaulted container "calico-node" out of: calico-node, upgrade-ipam (init), install-cni (init), mount-bpffs (init)
root@k8s-testing-01-master:~# kubectl logs calico-node-tpdx2 -n kube-system | grep ERROR
Defaulted container "calico-node" out of: calico-node, upgrade-ipam (init), install-cni (init), mount-bpffs (init)

[ Looking at source node, 01]
root@k8s-testing-01-master:~# kubectl -n kube-system logs calico-node-knpz6 | grep WARN
Defaulted container "calico-node" out of: calico-node, upgrade-ipam (init), install-cni (init), mount-bpffs (init)
2025-07-18 05:27:43.555 [WARNING][72] cni-config-monitor/winutils.go 150: Neither --kubeconfig nor --master was specified.  Using the inClusterConfig.  This might not work.
root@k8s-testing-01-master:~# kubectl -n kube-system logs calico-node-knpz6 | grep ERR
Defaulted container "calico-node" out of: calico-node, upgrade-ipam (init), install-cni (init), mount-bpffs (init)

[ Looking at source node for the pod-to-pod traffic, 04 ]
root@k8s-testing-01-master:~# kubectl -n kube-system logs calico-node-dgfpq | grep WARN
Defaulted container "calico-node" out of: calico-node, upgrade-ipam (init), install-cni (init), mount-bpffs (init)
root@k8s-testing-01-master:~# kubectl -n kube-system logs calico-node-dgfpq | grep ERR
Defaulted container "calico-node" out of: calico-node, upgrade-ipam (init), install-cni (init), mount-bpffs (init)
```

For completeness, I am adding [ipvs](https://gist.github.com/bogd/e6f6c7d316a66d02e03b300d8908eb03) and [iptables rules](https://gist.github.com/bogd/94b1c46e989a7c565edacd4ad156e95a) from the source node. Because it does indeed look like a firewall issue, but I do not see anything in the rules that might cause this (and I just double checked, the template I was starting from had empty iptables chains)

Also adding the [calico config](https://gist.github.com/bogd/3255d61f36a8b81b5adfec4fb101ba0b).

**Comment by bogd** [comment]
Some more details:
- Looking at captures on the physical interface, I see the same pattern - ICMP going through, no return TCP traffic (all TCP packets are SYNs from the local device)
(the IP addresses of the nodes are 10.10.0.10X, with 101-103 being control plane, and 104-107 being worker nodes)

```
root@k8s-testing-05:~# tcpdump -ni ens160 udp port 4789
tcpdump: verbose output suppressed, use -v[v]... for full protocol decode
listening on ens160, link-type EN10MB (Ethernet), snapshot length 262144 bytes
07:51:56.628895 IP 10.10.0.105.35736 > 10.10.0.101.4789: VXLAN, flags [I] (0x08), vni 4096
IP 10.233.65.64.65242 > 10.233.121.129.53: Flags [S], seq 3200239535, win 65495, options [mss 65495,sackOK,TS val 243283301 ecr 0,nop,wscale 7], length 0
07:51:57.119485 IP 10.10.0.105.35132 > 10.10.0.102.4789: VXLAN, flags [I] (0x08), vni 4096
IP 10.233.65.64.54265 > 10.233.65.1.53: Flags [S], seq 1648646507, win 65495, options [mss 65495,sackOK,TS val 243283792 ecr 0,nop,wscale 7], length 0
07:51:57.485342 IP 10.10.0.101.38133 > 10.10.0.105.4789: VXLAN, flags [I] (0x08), vni 4096
IP 10.233.121.128 > 10.233.65.67: ICMP echo request, id 32420, seq 1, length 1430
07:51:57.485547 IP 10.10.0.105.41109 > 10.10.0.101.4789: VXLAN, flags [I] (0x08), vni 4096
IP 10.233.65.67 > 10.233.121.128: ICMP echo reply, id 32420, seq 1, length 1430
07:51:57.586046 IP 10.10.0.105.50734 > 10.10.0.102.4789: VXLAN, flags [I] (0x08), vni 4096
IP 10.233.65.64.30117 > 10.233.65.1.53: Flags [S], seq 3046587446, win 65495, options [mss 65495,sackOK,TS val 243284258 ecr 0,nop,wscale 7], length 0
07:51:57.631582 IP 10.10.0.105.51993 > 10.10.0.101.4789: VXLAN, flags [I] (0x08), vni 4096
IP 10.233.65.64.65242 > 10.233.121.129.53: Flags [S], seq 3200239535, win 65495, options [mss 65495,sackOK,TS val 243284304 ecr 0,nop,wscale 7], length 0
07:51:58.529084 IP 10.10.0.101.38133 > 10.10.0.105.4789: VXLAN, flags [I] (0x08), vni 4096
IP 10.233.121.128 > 10.233.65.67: ICMP echo request, id 32420, seq 2, length 1430
07:51:58.529317 IP 10.10.0.105.41109 > 10.10.0.101.4789: VXLAN, flags [I] (0x08), vni 4096
IP 10.233.65.67 > 10.233.121.128: ICMP echo reply, id 32420, seq 2, length 1430
07:51:58.591528 IP 10.10.0.105.48827 > 10.10.0.102.4789: VXLAN, flags [I] (0x08), vni 4096
IP 10.233.65.64.30117 > 10.233.65.1.53: Flags [S], seq 3046587446, win 65495, options [mss 65495,sackOK,TS val 243285264 ecr 0,nop,wscale 7], length 0
07:51:58.595233 IP 10.10.0.105.56214 > 10.10.0.101.4789: VXLAN, flags [I] (0x08), vni 4096
IP 10.233.65.64.5718 > 10.233.121.129.53: Flags [S], seq 502726108, win 65495, options [mss 65495,sackOK,TS val 243285267 ecr 0,nop,wscale 7], length 0
07:51:59.130676 IP 10.10.0.105.58551 > 10.10.0.102.4789: VXLAN, flags [I] (0x08), vni 4096
IP 10.233.65.64.9253 > 10.233.65.1.53: Flags [S], seq 3127168556, win 65495, options [mss 65495,sackOK,TS val 243285803 ecr 0,nop,wscale 7], length 0
07:51:59.615498 IP 10.10.0.105.44211 > 10.10.0.101.4789: VXLAN, flags [I] (0x08), vni 4096
IP 10.233.65.64.5718 > 10.233.121.129.53: Flags [S], seq 502726108, win 65495, options [mss 65495,sackOK,TS val 243286288 ecr 0,nop,wscale 7], length 0
07:52:00.088401 IP 10.10.0.105.47173 > 10.10.0.101.4789: VXLAN, flags [I] (0x08), vni 4096
IP 10.233.65.64.10530 > 10.233.121.129.53: Flags [S], seq 1531046066, win 65495, options [mss 65495,sackOK,TS val 243286760 ecr 0,nop,wscale 7], length 0
07:52:00.191491 IP 10.10.0.105.57182 > 10.10.0.102.4789: VXLAN, flags [I] (0x08), vni 4096
IP 10.233.65.64.9253 > 10.233.65.1.53: Flags [S], seq 3127168556, win 65495, options [mss 65495,sackOK,TS val 243286864 ecr 0,nop,wscale 7], length 0
^C
30 packets captured
30 packets received by filter
0 packets dropped by kernel
```

- It does look like the underlying network is "eating" the packets, but... in that case, why are the ICMPs going through? I suspected an MTU issue, but even large ICMPs make it through (up to 1422 bytes, which looks fine for an MTU of 1450/1500)

```
root@k8s-testing-01-master:~# ping -M do -s 1422 10.233.65.67
PING 10.233.65.67 (10.233.65.67) 1422(1450) bytes of data.
1430 bytes from 10.233.65.67: icmp_seq=1 ttl=63 time=0.832 ms
07:47:41.410086 IP 10.233.121.128 > 10.233.65.67: ICMP echo request, id 30093, seq 1, length 1430
07:47:41.410849 IP 10.233.65.67 > 10.233.121.128: ICMP echo reply, id 30093, seq 1, length 1430
^C
--- 10.233.65.67 ping statistics ---
1 packets transmitted, 1 received, 0% packet loss, time 0ms
rtt min/avg/max/mdev = 0.832/0.832/0.832/0.000 ms
root@k8s-testing-01-master:~# ping -M do -s 1423 10.233.65.67
PING 10.233.65.67 (10.233.65.67) 1423(1451) bytes of data.
ping: local error: message too long, mtu=1450

--- 10.233.65.67 ping statistics ---^C
1 packets transmitted, 0 received, +1 errors, 100% packet loss, time 0ms

root@k8s-testing-01-master:~# ip a s ens160
2: ens160: <BROADCAST,MULTICAST,UP,LOWER_UP> mtu 1500 qdisc mq state UP group default qlen 1000
    link/ether 00:50:56:b4:6f:6e brd ff:ff:ff:ff:ff:ff
    altname enp3s0
    inet 10.10.0.101/24 brd 10.10.0.255 scope global ens160
       valid_lft forever preferred_lft forever
root@k8s-testing-01-master:~# ip a s vxlan.calico
4: vxlan.calico: <BROADCAST,MULTICAST,UP,LOWER_UP> mtu 1450 qdisc noqueue state UNKNOWN group default qlen 1000
    link/ether 66:19:b5:d6:ed:1b brd ff:ff:ff:ff:ff:ff
    inet 10.233.121.128/32 scope global vxlan.calico
       valid_lft forever preferred_lft forever
```

**Comment by caseydavenport** [comment]
Sorry for the delay on this - I've looked over the diags and I'm struggling to see anything that indicates the root cause!

Could this be something to do with the underlying network fabric? How are your nodes connected to each other? Is this cluster running on-prem or in a public cloud?

**Comment by bogd** [comment]
Actually, I am the one that should apologize - someone in the [related issue](https://github.com/kubernetes-sigs/kubespray/issues/12412#issuecomment-3160956422) pointed me in the right direction, but I never got around to testing it or updating this issue.

It appears that vSphere does have a nasty habit of "eating" some VXLAN packets. And I am in a vSphere environment, and the symptoms I am seeing are definitely very similar to the ones in [this issue](https://github.com/projectcalico/calico/issues/9433) - ICMP makes it through, but nothing else.

**Comment by caseydavenport** [comment]
Ahh interesting, I see. I had missed that one! Agree this sounds like the checksum offload issue.

**Comment by bogd** [comment]
I am attempting to test the solution listed in the other issue (changing the vxlan port), but after modifying the FelixConfiguration, I still see the node only listening on UDP/4789. Even after restarting the node:

```
# kubectl get felixconfigurations.crd.projectcalico.org default -o yaml
apiVersion: crd.projectcalico.org/v1
kind: FelixConfiguration
spec:
  vxlanEnabled: true
  vxlanPort: 4799
```

```
# ss -ulpa
UNCONN     0          0                    0.0.0.0:4789                0.0.0.0:*           
```

Is there anything else I need to do for Calico to pick up the new config and use the new port?

**Comment by caseydavenport** [comment]
It shouldn't need any other configuration as far as I'm aware - one thing you could do is check the calico/node logs to see if the configuration is being picked up properly. Calico logs out its initial configuration, so you should be able to see `VXLANPort` in the logs.

**Comment by bogd** [comment]
@caseydavenport - once again, thank you! For pointing me in the right direction :)

Looking at the logs, I found the source of the problem:
```
2025-09-02 17:54:44.044 [INFO][70] felix/config_params.go 731: Parsed value for VXLANPort: 4789 (from environment variable)
2025-09-02 17:54:44.044 [INFO][70] felix/config_params.go 695: Parsing value for VXLANVNI: 4096 (from environment variable)
...
2025-09-02 17:54:44.131 [INFO][70] felix/config_params.go 695: Parsing value for VXLANPort: 4799 (from datastore (global))
2025-09-02 17:54:44.131 [INFO][70] felix/config_params.go 731: Parsed value for VXLANPort: 4799 (from datastore (global))
```

Now, I could swear I looked for envvars before trying to configure from FelixConfig, but.... somehow I missed this part:
```
apiVersion: apps/v1
kind: DaemonSet
metadata:
  name: calico-node
...
spec:
  template:
    spec:
      containers:
      - env:
        - name: FELIX_VXLANVNI
          value: "4096"
        - name: FELIX_VXLANPORT
          value: "4799"
...
```

After modifying the DaemonSet as well (and restarting the calico-node pods for good measure :) ), I can confirm that the node is listening on 4799, and VXLAN communication works properly across nodes.

```
# ss -alup
State      Recv-Q     Send-Q         Local Address:Port           Peer Address:Port    Process                                                       
UNCONN     0          0                    0.0.0.0:4799                0.0.0.0:*                                                                     
```

```
# curl 10.233.65.69 ## IP of a pod running on another node ##
<!DOCTYPE html>
<html>
<head>
<title>Welcome to nginx!</title>
<style>
```

So yes, I was hitting the [VMware VXLAN issue](https://github.com/projectcalico/calico/issues/9433). I will close this issue now, since it has been resolved. Once again, thank you for your help, and please accept my apologies for taking so long to test and close the issue!

**Comment by bogd** [comment]
One more thing I need to mention here, in case anyone else stumbles upon this after hitting the same symptoms - the "checksum offload issue" might not be the correct title for that issue. If I understood it correctly, in the end the problem was vSphere "eating" the VXLAN packets on the default UDP/4789 port. 

And in my case, indeed, changing the port from the default value was enough to get everything working again. I did not change any checksum offload settings.

**Comment by tomastigera** [comment]
yes, vSphere is "eating" the vxlan packets / colliding with our vxlan on the default port.
