### ISSUE TITLE
Inter-Node Pod communication gets dropped by iptables on destination host

### ISSUE THREAD

**Issue by neilcook** [projectcalico/calico#4511]
I have a fairly simple Calico setup using a node-to-node mesh with IPIP enabled. Pods can access other pods on the same node, but not pods on remote nodes.

Doing tcpdump shows that the traffic makes it to the remote node just fine, but once there the SYN packets get dropped by the iptables INVALID rule:
```
Chain cali-tw-cali447c7ab8fe6 (1 references)
 pkts bytes target     prot opt in     out     source               destination         
    0     0 ACCEPT     all  --  any    any     anywhere             anywhere             /* cali:7arLJ1FJ984lVHE4 */ ctstate NEW,RELATED,ESTABLISHED
   25  1500 DROP       all  --  any    any     anywhere             anywhere             /* cali:ktYOHCQF-A9KGwoZ */ ctstate INVALID
    1    84 MARK       all  --  any    any     anywhere             anywhere             /* cali:ULeb8CKq5Y2aCWYM */ MARK and 0xfffeffff
    1    84 cali-pri-kns.pdns-dev  all  --  any    any     anywhere             anywhere             /* cali:tMk8DR3dhBmHJ0HP */
    1    84 RETURN     all  --  any    any     anywhere             anywhere             /* cali:7_-TiyUST5xA9M9r */ /* Return if profile accepted */ mark match 0x10000/0x10000
    0     0 cali-pri-_O7PG5EVM_0SsI30l2d  all  --  any    any     anywhere             anywhere             /* cali:cnx-Qm9FufpWZb7e */
    0     0 RETURN     all  --  any    any     anywhere             anywhere             /* cali:gatD7qrxbNHsMGP4 */ /* Return if profile accepted */ mark match 0x10000/0x10000
    0     0 DROP       all  --  any    any     anywhere             anywhere             /* cali:c4x9nbncOntDHlGS */ /* Drop if no profiles matched */
```

## Expected Behavior

Connections from one node to a Pod on another node should work, and not get dropped. 

## Current Behavior

Connections to a Pod on the local node work just fine:
```
root@dox2:~# curl http://192.168.14.13:80
<!DOCTYPE html>
<html>
<head>
<title>Welcome to nginx!</title>
<style>
    body {
        width: 35em;
        margin: 0 auto;
        font-family: Tahoma, Verdana, Arial, sans-serif;
    }
</style>
</head>
<body>
<h1>Welcome to nginx!</h1>
<p>If you see this page, the nginx web server is successfully installed and
working. Further configuration is required.</p>

<p>For online documentation and support please refer to
<a href="http://nginx.org/">nginx.org</a>.<br/>
Commercial support is available at
<a href="http://nginx.com/">nginx.com</a>.</p>

<p><em>Thank you for using nginx.</em></p>
</body>
</html>
```

I can ping pods on remote nodes:
```
root@dox2:~# ping 192.168.5.137
PING 192.168.5.137 (192.168.5.137) 56(84) bytes of data.
64 bytes from 192.168.5.137: icmp_seq=1 ttl=63 time=0.684 ms
64 bytes from 192.168.5.137: icmp_seq=2 ttl=63 time=0.480 ms
```

Connecting to the remote Pod over TCP gives the following tcpdump (firstly the IPIP traffic - dumped on the remote node):
```
tcpdump: listening on any, link-type LINUX_SLL (Linux cooked v1), capture size 262144 bytes
13:34:23.298469  In c0:d6:82:fb:09:c4 ethertype IPv4 (0x0800), length 96: (tos 0x0, ttl 61, id 52089, offset 0, flags [DF], proto IPIP (4), length 80)
    10.12.62.3 > 10.12.62.1: (tos 0x10, ttl 64, id 7948, offset 0, flags [DF], proto TCP (6), length 60)
    192.168.14.0.38812 > 192.168.5.137.80: Flags [S], cksum 0x9508 (incorrect -> 0xbb35), seq 2923427762, win 43200, options [mss 1440,sackOK,TS val 1217186007 ecr 0,nop,wscale 8], length 0
13:34:23.298469  In c0:d6:82:fb:09:c4 ethertype IPv4 (0x0800), length 96: (tos 0x0, ttl 61, id 52089, offset 0, flags [DF], proto IPIP (4), length 80)
    10.12.62.3 > 10.12.62.1: (tos 0x10, ttl 64, id 7948, offset 0, flags [DF], proto TCP (6), length 60)
    192.168.14.0.38812 > 192.168.5.137.80: Flags [S], cksum 0x9508 (incorrect -> 0xbb35), seq 2923427762, win 43200, options [mss 1440,sackOK,TS val 1217186007 ecr 0,nop,wscale 8], length 0
13:34:24.314731  In c0:d6:82:fb:09:c4 ethertype IPv4 (0x0800), length 96: (tos 0x0, ttl 61, id 52183, offset 0, flags [DF], proto IPIP (4), length 80)
    10.12.62.3 > 10.12.62.1: (tos 0x10, ttl 64, id 7949, offset 0, flags [DF], proto TCP (6), length 60)
    192.168.14.0.38812 > 192.168.5.137.80: Flags [S], cksum 0x9508 (incorrect -> 0xb73d), seq 2923427762, win 43200, options [mss 1440,sackOK,TS val 1217187023 ecr 0,nop,wscale 8], length 0
```

I'm not sure if the incorrect cksum is an issue here?

Tcpdump to the pod IP address shows the SYN packets (un-encapsulated) but no replies:
```
root@dox3:~# tcpdump -vvnneSs 0 -i any host 192.168.5.137
tcpdump: listening on any, link-type LINUX_SLL (Linux cooked v1), capture size 262144 bytes
13:35:05.487510  In ethertype IPv4 (0x0800), length 76: (tos 0x10, ttl 64, id 24931, offset 0, flags [DF], proto TCP (6), length 60)
    192.168.14.0.38846 > 192.168.5.137.80: Flags [S], cksum 0x9508 (incorrect -> 0x7b1b), seq 605363464, win 43200, options [mss 1440,sackOK,TS val 1217228196 ecr 0,nop,wscale 8], length 0
13:35:06.490704  In ethertype IPv4 (0x0800), length 76: (tos 0x10, ttl 64, id 24932, offset 0, flags [DF], proto TCP (6), length 60)
    192.168.14.0.38846 > 192.168.5.137.80: Flags [S], cksum 0x9508 (incorrect -> 0x772f), seq 605363464, win 43200, options [mss 1440,sackOK,TS val 1217229200 ecr 0,nop,wscale 8], length 0
13:35:08.510982  In ethertype IPv4 (0x0800), length 76: (tos 0x10, ttl 64, id 24933, offset 0, flags [DF], proto TCP (6), length 60)
    192.168.14.0.38846 > 192.168.5.137.80: Flags [S], cksum 0x9508 (incorrect -> 0x6f4b), seq 605363464, win 43200, options [mss 1440,sackOK,TS val 1217231220 ecr 0,nop,wscale 8], length 0
13:35:12.538929  In ethertype IPv4 (0x0800), length 76: (tos 0x10, ttl 64, id 24934, offset 0, flags [DF], proto TCP (6), length 60)
```

Again the cksum is incorrect.

The iptables rules for that pod show the traffic being dropped by the INVALID rule:
```
Chain cali-tw-cali6a1050b7e5b (1 references)
 pkts bytes target     prot opt in     out     source               destination         
    1    84 ACCEPT     all  --  any    any     anywhere             anywhere             /* cali:5cZ8cKpJVXzdmGD5 */ ctstate RELATED,ESTABLISHED
   20  1200 DROP       all  --  any    any     anywhere             anywhere             /* cali:p_bDOMcSsa0hVMVl */ ctstate INVALID
    1    84 MARK       all  --  any    any     anywhere             anywhere             /* cali:Jf4Es6GIbSl5q34X */ MARK and 0xfffeffff
    1    84 cali-pri-kns.pdns-dev  all  --  any    any     anywhere             anywhere             /* cali:l4id1_TKkZ7iwQn8 */
    1    84 RETURN     all  --  any    any     anywhere             anywhere             /* cali:9gChsbOYH9w34WA1 */ /* Return if profile accepted */ mark match 0x10000/0x10000
    0     0 cali-pri-_O7PG5EVM_0SsI30l2d  all  --  any    any     anywhere             anywhere             /* cali:ZL_3lC0b-r70ZCvf */
    0     0 RETURN     all  --  any    any     anywhere             anywhere             /* cali:1bTwyVhm2_D0-70n */ /* Return if profile accepted */ mark match 0x10000/0x10000
    0     0 DROP       all  --  any    any     anywhere             anywhere             /* cali:yfOaUNDlkRLsl_oR */ /* Drop if no profiles matched */
```

## Steps to Reproduce (for bugs)

1. Install Calico, with the default settings of node-to-node BGP mesh, with IPIP and NAT enabled
2. Create Pods on multiple nodes
3. Connect using TCP to a Pod on the local node - works fine
3. Ping the remote pod IPs, that works
4. Connect using TCP to the remote Pod IPs, that fails.

## Your Environment

* Calico version:
```
root@dox3:~# calicoctl version
Client Version:    v3.18.1
Git commit:        911f383f
Cluster Version:   v3.18.1
Cluster Type:      k8s,bgp,kubeadm,kdd
```
* Orchestrator version (e.g. kubernetes, mesos, rkt):
```
Client Version: version.Info{Major:"1", Minor:"20", GitVersion:"v1.20.5", GitCommit:"6b1d87acf3c8253c123756b9e61dac642678305f", GitTreeState:"clean", BuildDate:"2021-03-18T01:10:43Z", GoVersion:"go1.15.8", Compiler:"gc", Platform:"linux/amd64"}
Server Version: version.Info{Major:"1", Minor:"20", GitVersion:"v1.20.5", GitCommit:"6b1d87acf3c8253c123756b9e61dac642678305f", GitTreeState:"clean", BuildDate:"2021-03-18T01:02:01Z", GoVersion:"go1.15.8", Compiler:"gc", Platform:"linux/amd64"}
```
* Operating System and version: Ubuntu 20.04
* Link to your project (optional):

IP Pool configuration:
```
root@dox3:~# calicoctl get -o yaml ippool
apiVersion: projectcalico.org/v3
items:
- apiVersion: projectcalico.org/v3
  kind: IPPool
  metadata:
    creationTimestamp: "2021-03-31T17:26:31Z"
    name: default-ipv4-ippool
    resourceVersion: "673"
    uid: a6993af9-fa47-4dd0-87b5-228fb247510f
  spec:
    blockSize: 26
    cidr: 192.168.0.0/18
    ipipMode: Always
    natOutgoing: true
    nodeSelector: all()
    vxlanMode: Never
kind: IPPoolList
metadata:
  resourceVersion: "713890"
```

BGP Status:
```
root@dox3:~# kubectl calico node status
Calico process is running.

IPv4 BGP status
+--------------+-------------------+-------+----------+-------------+
| PEER ADDRESS |     PEER TYPE     | STATE |  SINCE   |    INFO     |
+--------------+-------------------+-------+----------+-------------+
| 10.12.62.5   | node-to-node mesh | up    | 11:13:06 | Established |
| 10.12.62.3   | node-to-node mesh | up    | 11:13:06 | Established |
+--------------+-------------------+-------+----------+-------------+
```

Node Config:
```
root@dox3:~# kubectl calico get -o yaml node
apiVersion: projectcalico.org/v3
items:
- apiVersion: projectcalico.org/v3
  kind: Node
  metadata:
    annotations:
      projectcalico.org/kube-labels: '{"beta.kubernetes.io/arch":"amd64","beta.kubernetes.io/os":"linux","kubernetes.io/arch":"amd64","kubernetes.io/hostname":"dox1.powerdns.org","kubernetes.io/os":"linux","node-role.kubernetes.io/control-plane":"","node-role.kubernetes.io/master":""}'
    creationTimestamp: "2021-03-31T17:25:40Z"
    labels:
      beta.kubernetes.io/arch: amd64
      beta.kubernetes.io/os: linux
      kubernetes.io/arch: amd64
      kubernetes.io/hostname: dox1.powerdns.org
      kubernetes.io/os: linux
      node-role.kubernetes.io/control-plane: ""
      node-role.kubernetes.io/master: ""
    name: dox1.powerdns.org
    resourceVersion: "713989"
    uid: ae93f5bd-082a-4804-8e5c-41f92e8f59b8
  spec:
    addresses:
    - address: 10.12.62.5/31
    - address: 10.12.62.5
    bgp:
      ipv4Address: 10.12.62.5/31
      ipv4IPIPTunnelAddr: 192.168.16.192
    orchRefs:
    - nodeName: dox1.powerdns.org
      orchestrator: k8s
  status:
    podCIDRs:
    - 192.168.0.0/24
- apiVersion: projectcalico.org/v3
  kind: Node
  metadata:
    annotations:
      projectcalico.org/kube-labels: '{"beta.kubernetes.io/arch":"amd64","beta.kubernetes.io/os":"linux","bgp-peer":"true","kubernetes.io/arch":"amd64","kubernetes.io/hostname":"dox2.powerdns.org","kubernetes.io/os":"linux","nodetype":"worker"}'
    creationTimestamp: "2021-03-31T17:26:19Z"
    labels:
      beta.kubernetes.io/arch: amd64
      beta.kubernetes.io/os: linux
      bgp-peer: "true"
      kubernetes.io/arch: amd64
      kubernetes.io/hostname: dox2.powerdns.org
      kubernetes.io/os: linux
      nodetype: worker
    name: dox2.powerdns.org
    resourceVersion: "714074"
    uid: 576ab8ab-fe1f-41a0-aaa7-15bf615ae094
  spec:
    addresses:
    - address: 10.12.62.3/31
    - address: 10.12.62.3
    bgp:
      ipv4Address: 10.12.62.3/31
      ipv4IPIPTunnelAddr: 192.168.14.0
    orchRefs:
    - nodeName: dox2.powerdns.org
      orchestrator: k8s
  status:
    podCIDRs:
    - 192.168.2.0/24
- apiVersion: projectcalico.org/v3
  kind: Node
  metadata:
    annotations:
      projectcalico.org/kube-labels: '{"beta.kubernetes.io/arch":"amd64","beta.kubernetes.io/os":"linux","bgp-peer":"true","kubernetes.io/arch":"amd64","kubernetes.io/hostname":"dox3.powerdns.org","kubernetes.io/os":"linux","nodetype":"worker"}'
    creationTimestamp: "2021-03-31T17:26:19Z"
    labels:
      beta.kubernetes.io/arch: amd64
      beta.kubernetes.io/os: linux
      bgp-peer: "true"
      kubernetes.io/arch: amd64
      kubernetes.io/hostname: dox3.powerdns.org
      kubernetes.io/os: linux
      nodetype: worker
    name: dox3.powerdns.org
    resourceVersion: "713945"
    uid: 6c1509c0-73eb-4785-aec8-2d2d6ee0e425
  spec:
    addresses:
    - address: 10.12.62.1/31
    - address: 10.12.62.1
    bgp:
      ipv4Address: 10.12.62.1/31
      ipv4IPIPTunnelAddr: 192.168.5.128
    orchRefs:
    - nodeName: dox3.powerdns.org
      orchestrator: k8s
  status:
    podCIDRs:
    - 192.168.1.0/24
kind: NodeList
metadata: {}
```

**Comment by caseydavenport** [comment]
Hm, well it sounds to be like this is most likely a result of the invalid checksum you're seeing on the TCP packets. Especially since you're seeing the INVALID counter go up, and ICMP traffic is working just fine.

I'm certainly no expert in diagnosing invalid checksums. From a quick google, I'd check a few things:
- Do you have NIC offloading for checksum calculation? 
- Faulty NIC / L3 device in your network?
- Something manipulating packets in the network?

Might be worth comparing the checksum of the packet at egress from the original node to the receiving node and see if it has changed.

@fasaxc might have more ideas than I do!

**Comment by fasaxc** [comment]
Try snooping on the egress of the IPIP tunnel device.  It's certainly suspicious if the TCP packets reach the other node with invalid checksum.  It does suggest faulty checksum offloading somewhere. `tcpdump -nli tunl0` on the remote node should show the packets I'm interested in.

**Comment by neilcook** [comment]
Here's a tcpdump on the remote node (added some more flags to capture the checksum error) 
```
root@dox3:~# tcpdump -vvlni tunl0
tcpdump: listening on tunl0, link-type RAW (Raw IP), capture size 262144 bytes
18:00:31.642365 IP (tos 0x10, ttl 64, id 1984, offset 0, flags [DF], proto TCP (6), length 60)
    192.168.14.0.51570 > 192.168.5.137.80: Flags [S], cksum 0x9508 (incorrect -> 0x02e7), seq 1626284592, win 43200, options [mss 1440,sackOK,TS val 1233154351 ecr 0,nop,wscale 8], length 0
18:00:32.487846 IP (tos 0x10, ttl 64, id 37862, offset 0, flags [DF], proto TCP (6), length 60)
    192.168.14.0.51600 > 192.168.5.137.80: Flags [S], cksum 0x9508 (incorrect -> 0x5fa8), seq 74456706, win 43200, options [mss 1440,sackOK,TS val 1233155197 ecr 0,nop,wscale 8], length 0
18:00:33.498662 IP (tos 0x10, ttl 64, id 37863, offset 0, flags [DF], proto TCP (6), length 60)
    192.168.14.0.51600 > 192.168.5.137.80: Flags [S], cksum 0x9508 (incorrect -> 0x5bb6), seq 74456706, win 43200, options [mss 1440,sackOK,TS val 1233156207 ecr 0,nop,wscale 8], length 0
18:00:35.514642 IP (tos 0x10, ttl 64, id 37864, offset 0, flags [DF], proto TCP (6), length 60)
    192.168.14.0.51600 > 192.168.5.137.80: Flags [S], cksum 0x9508 (incorrect -> 0x53d6), seq 74456706, win 43200, options [mss 1440,sackOK,TS val 1233158223 ecr 0,nop,wscale 8], length 0

```

**Comment by neilcook** [comment]
Here's some tcpdumps on the sending host.

Firstly to tunl0:
```
root@dox2:~# tcpdump -vvlni tunl0
tcpdump: listening on tunl0, link-type RAW (Raw IP), capture size 262144 bytes
18:02:46.737797 IP (tos 0x10, ttl 64, id 32531, offset 0, flags [DF], proto TCP (6), length 60)
    192.168.14.0.51708 > 192.168.5.137.80: Flags [S], cksum 0x9508 (incorrect -> 0x47d5), seq 3456917472, win 43200, options [mss 1440,sackOK,TS val 1233289447 ecr 0,nop,wscale 8], length 0
18:02:47.738431 IP (tos 0x10, ttl 64, id 32532, offset 0, flags [DF], proto TCP (6), length 60)
    192.168.14.0.51708 > 192.168.5.137.80: Flags [S], cksum 0x9508 (incorrect -> 0x43ed), seq 3456917472, win 43200, options [mss 1440,sackOK,TS val 1233290447 ecr 0,nop,wscale 8], length 0
```

Secondly, the IPIP to the remote node:
```
root@dox2:~# tcpdump -vvlni any host 10.12.62.1
tcpdump: listening on any, link-type LINUX_SLL (Linux cooked v1), capture size 262144 bytes
18:02:10.559347 IP (tos 0x0, ttl 64, id 33637, offset 0, flags [DF], proto IPIP (4), length 80)
    10.12.62.3 > 10.12.62.1: IP (tos 0x10, ttl 64, id 2217, offset 0, flags [DF], proto TCP (6), length 60)
    192.168.14.0.51678 > 192.168.5.137.80: Flags [S], cksum 0x9508 (incorrect -> 0x24e2), seq 1899457818, win 43200, options [mss 1440,sackOK,TS val 1233253268 ecr 0,nop,wscale 8], length 0
18:02:10.559368 IP (tos 0x0, ttl 64, id 33637, offset 0, flags [DF], proto IPIP (4), length 80)
    10.12.62.3 > 10.12.62.1: IP (tos 0x10, ttl 64, id 2217, offset 0, flags [DF], proto TCP (6), length 60)
    192.168.14.0.51678 > 192.168.5.137.80: Flags [S], cksum 0x9508 (incorrect -> 0x24e2), seq 1899457818, win 43200, options [mss 1440,sackOK,TS val 1233253268 ecr 0,nop,wscale 8], length 0
18:02:11.578647 IP (tos 0x0, ttl 64, id 33740, offset 0, flags [DF], proto IPIP (4), length 80)
    10.12.62.3 > 10.12.62.1: IP (tos 0x10, ttl 64, id 2218, offset 0, flags [DF], proto TCP (6), length 60)
    192.168.14.0.51678 > 192.168.5.137.80: Flags [S], cksum 0x9508 (incorrect -> 0x20e6), seq 1899457818, win 43200, options [mss 1440,sackOK,TS val 1233254288 ecr 0,nop,wscale 8], length 0
```

Checksums are all invalid

**Comment by neilcook** [comment]
Output from ethtool:
```
root@dox2:~# ethtool --show-offload bond0
Features for bond0:
rx-checksumming: off [fixed]
tx-checksumming: on
	tx-checksum-ipv4: off [fixed]
	tx-checksum-ip-generic: on
	tx-checksum-ipv6: off [fixed]
	tx-checksum-fcoe-crc: off [fixed]
	tx-checksum-sctp: off [fixed]
scatter-gather: on
	tx-scatter-gather: on
	tx-scatter-gather-fraglist: off [requested on]
tcp-segmentation-offload: on
	tx-tcp-segmentation: on
	tx-tcp-ecn-segmentation: on
	tx-tcp-mangleid-segmentation: on
	tx-tcp6-segmentation: on
generic-segmentation-offload: on
generic-receive-offload: on
large-receive-offload: off
rx-vlan-offload: on
tx-vlan-offload: on [fixed]
ntuple-filters: off [fixed]
receive-hashing: off [fixed]
highdma: on
rx-vlan-filter: on
vlan-challenged: off [fixed]
tx-lockless: on [fixed]
netns-local: on [fixed]
tx-gso-robust: off [fixed]
tx-fcoe-segmentation: off [fixed]
tx-gre-segmentation: on
tx-gre-csum-segmentation: on
tx-ipxip4-segmentation: on
tx-ipxip6-segmentation: on
tx-udp_tnl-segmentation: on
tx-udp_tnl-csum-segmentation: on
tx-gso-partial: off [fixed]
tx-sctp-segmentation: off [fixed]
tx-esp-segmentation: off [fixed]
tx-udp-segmentation: on
fcoe-mtu: off [fixed]
tx-nocache-copy: off
loopback: off [fixed]
rx-fcs: off [fixed]
rx-all: off [fixed]
tx-vlan-stag-hw-insert: on [fixed]
rx-vlan-stag-hw-parse: off [fixed]
rx-vlan-stag-filter: off [fixed]
l2-fwd-offload: off [fixed]
hw-tc-offload: off [fixed]
esp-hw-offload: off [fixed]
esp-tx-csum-hw-offload: off [fixed]
rx-udp_tunnel-port-offload: off [fixed]
tls-hw-tx-offload: off [fixed]
tls-hw-rx-offload: off [fixed]
rx-gro-hw: off [fixed]
tls-hw-record: off [fixed]
```

**Comment by neilcook** [comment]
Ok so disabling checksum offloading (ethtool -K bond0 tx off) fixed it - thanks for the help!

**Comment by cmssczy** [comment]
why can we see that the tcp packet checksum is incorrect? Is is a kernel bug?
