### ISSUE TITLE
pods scheduled on different hosts cannot access each other

### ISSUE THREAD

**Issue by xaka** [projectcalico/calico#2169]
## Your Environment

* Calico version: 3.1.3 (Canal/flannel)
* Orchestrator version: k8s / kubeadm / v1.9.1
* Operating System and version: Linux 4.1.12

## Context

I've got pods A and B. 

Network policy to enforce traffic from B to A:
```yaml
kind: NetworkPolicy
apiVersion: networking.k8s.io/v1
metadata:
  name: A
spec:
  podSelector:
    matchLabels:
      app: A
  ingress:
  - from:
    - podSelector:
        matchLabels:
          app: B
```

Pods placement:
```
# kubectl get pod -o wide
NAME                                            READY     STATUS    RESTARTS   AGE       IP            NODE
a-f569c94fd-rfbsg               1/1       Running   0          4d        10.244.2.13   node-1
b-6cdf466fd4-s897s                    1/1       Running   0          4d        10.244.2.8    node-2
```

When I do `curl -v http://a` from pod B while it's scheduled on node-2 - it hangs.
When I do `curl -v http://a` from pod B while it's scheduled on node-1 - it works.

I checked calico/flannel logs and nothing suspicious shows up. Not sure how to debug it and where to look at this point.

kubeadm parameters:
```
--service-cidr=10.96.0.0/12
--cluster-cidr=10.244.0.0/16
```

**Comment by xaka** [comment]
I've noticed that when network policy is applied, the following iptables rule is being hit constantly:
```
    2   120 DROP       all  --  *      *       0.0.0.0/0            0.0.0.0/0            /* cali:zAKjEHUg04sPHr3q */ /* Drop if no policies passed packet */ mark match 0x0/0x20000
```

**Comment by caseydavenport** [comment]
@xaka does this work if there is no networkpolicy in place? Or does cross host reachability not work even without NP?

**Comment by xaka** [comment]
@caseydavenport it does work across the nodes when I remove networkpolicy

**Comment by xaka** [comment]
BTW, I'm accessing pod A via DNS name (i.e. it's behind the k8s service), which gets resolved to 10.104.206.139

**Comment by xaka** [comment]
Here is tcpdump on node-1:
```
# tcpdump -i any -nn -- 'tcp[tcpflags] & (tcp-syn) != 0 and port 9093'
tcpdump: verbose output suppressed, use -v or -vv for full protocol decode
listening on any, link-type LINUX_SLL (Linux cooked), capture size 262144 bytes
23:08:33.771752 IP 10.244.2.0.57353 > 10.244.1.3.9093: Flags [S], seq 2971439694, win 29200, options [mss 1460,sackOK,TS val 433343726 ecr 0,nop,wscale 7], length 0
```

10.244.2.0 is assigned to flannel.1 network interface on node-2

**Comment by xaka** [comment]
tcpdump when both A and B on the same node:
```
node-1:
===
23:27:52.179384 IP 10.244.1.4.51916 > 10.104.206.139.9093: Flags [S], seq 3185777273, win 29200, options [mss 1460,sackOK,TS val 434481730 ecr 0,nop,wscale 7], length 0
23:27:52.179448 IP 100.96.17.223.51916 > 10.244.1.3.9093: Flags [S], seq 3185777273, win 29200, options [mss 1460,sackOK,TS val 434481730 ecr 0,nop,wscale 7], length 0
23:27:52.179497 IP 10.244.1.3.9093 > 100.96.17.223.51916: Flags [S.], seq 1033200814, ack 3185777274, win 28960, options [mss 1460,sackOK,TS val 434481730 ecr 434481730,nop,wscale 1], length 0
23:27:52.179517 IP 10.104.206.139.9093 > 10.244.1.4.51916: Flags [S.], seq 1033200814, ack 3185777274, win 28960, options [mss 1460,sackOK,TS val 434481730 ecr 434481730,nop,wscale 1], length 0
23:27:52.179548 IP 10.244.1.4.51916 > 10.104.206.139.9093: Flags [.], ack 1, win 229, options [nop,nop,TS val 434481730 ecr 434481730], length 0
23:27:52.179566 IP 100.96.17.223.51916 > 10.244.1.3.9093: Flags [.], ack 1, win 229, options [nop,nop,TS val 434481730 ecr 434481730], length 0
23:27:52.180600 IP 10.244.1.4.51916 > 10.104.206.139.9093: Flags [P.], seq 1:75, ack 1, win 229, options [nop,nop,TS val 434481731 ecr 434481730], length 74
23:27:52.180660 IP 100.96.17.223.51916 > 10.244.1.3.9093: Flags [P.], seq 1:75, ack 1, win 229, options [nop,nop,TS val 434481731 ecr 434481730], length 74
23:27:52.180678 IP 10.244.1.3.9093 > 100.96.17.223.51916: Flags [.], ack 75, win 14480, options [nop,nop,TS val 434481732 ecr 434481731], length 0
23:27:52.180690 IP 10.104.206.139.9093 > 10.244.1.4.51916: Flags [.], ack 75, win 14480, options [nop,nop,TS val 434481732 ecr 434481731], length 0
23:27:52.182009 IP 10.244.1.3.9093 > 100.96.17.223.51916: Flags [R.], seq 1, ack 75, win 14480, options [nop,nop,TS val 434481733 ecr 434481731], length 0
23:27:52.182041 IP 10.104.206.139.9093 > 10.244.1.4.51916: Flags [R.], seq 1, ack 75, win 14480, options [nop,nop,TS val 434481733 ecr 434481731], length 0
```

tcpdump when A and B on different nodes:
```
node-2:
===
23:26:40.557790 IP 10.244.2.8.53109 > 10.104.206.139.9093: Flags [S], seq 2981938844, win 29200, options [mss 1460,sackOK,TS val 434430512 ecr 0,nop,wscale 7], length 0
23:26:40.557845 IP 10.244.2.0.53109 > 10.244.1.3.9093: Flags [S], seq 2981938844, win 29200, options [mss 1460,sackOK,TS val 434430512 ecr 0,nop,wscale 7], length 0

node-1:
===
23:26:40.557939 IP 10.244.2.0.53109 > 10.244.1.3.9093: Flags [S], seq 2981938844, win 29200, options [mss 1460,sackOK,TS val 434430512 ecr 0,nop,wscale 7], length 0
```

The difference I see is in case 1 (works) the traffic to pod goes via primary network interface (ens3, ip 100.96.17.223. In case 2 (does not work) the traffic to pod goes via flannel.1 network interface (10.244.2.0).

Could it potentially indicate any NAT issues?

**Comment by xaka** [comment]
It worths mentioning that it works when I use the following policy:
```
kind: NetworkPolicy
apiVersion: networking.k8s.io/v1
metadata:
  name: A
spec:
  podSelector:
    matchLabels:
      app: A
  ingress:
  - {}
```
Not sure whether it's significantly different from original one in terms of iptables configuration.

**Comment by xaka** [comment]
Digging deeper...

In iptables on node-1 I found:
```
Chain cali-pi-_SPAPItagBZrqK1rN_h2 (1 references)
 pkts bytes target     prot opt in     out     source               destination
    0     0 MARK       all  --  *      *       0.0.0.0/0            0.0.0.0/0            /* cali:8k3UbjXiknM2zj5H */ match-set cali40s:rr-CW_CXPIUF1cQaJ8XmE6o src MARK or 0x10000
    0     0 RETURN     all  --  *      *       0.0.0.0/0            0.0.0.0/0            /* cali:Ot8N3B3QdsOhz4BX */ mark match 0x10000/0x10000
```

Which matches ipset:
```
Name: cali40s:rr-CW_CXPIUF1cQaJ8XmE6o
Type: hash:net
Revision: 6
Header: family inet hashsize 1024 maxelem 1048576
Size in memory: 16792
References: 3
Members:
10.244.2.8
```

But IP address isn't 10.244.2.8 (pod), but 10.244.2.0 (node-2), when traffic enters node-1.

**Comment by xaka** [comment]
I captured vxlan traffic on node-1:
```
00:53:11.258286 IP 100.96.17.224.35946 > 100.96.17.223.18472: VXLAN, flags [I] (0x08), vni 1
IP 10.244.2.0.59023 > 10.244.1.3.9093: Flags [S], seq 27275262, win 29200, options [mss 1460,sackOK,TS val 439621213 ecr 0,nop,wscale 7], length 0
```

Isn't it weird that wrapped source IP address is 10.244.2.0 (node-2, flannel.1) instead of 10.244.2.8 (pod B)? Wrapped destination IP address looks correct.

**Comment by xaka** [comment]
Finally found the root cause.  Here is the iptables for nat/POSTROUTING:
```
# iptables --list POSTROUTING -n -t nat -v
Chain POSTROUTING (policy ACCEPT 8 packets, 936 bytes)
 pkts bytes target     prot opt in     out     source               destination
3355K  307M cali-POSTROUTING  all  --  *      *       0.0.0.0/0            0.0.0.0/0            /* cali:O3lYWMrLQYEMJtB5 */
3355K  307M KUBE-POSTROUTING  all  --  *      *       0.0.0.0/0            0.0.0.0/0            /* kubernetes postrouting rules */
    0     0 MASQUERADE  all  --  *      !docker0  172.17.0.0/16        0.0.0.0/0
3325K  306M POSTROUTING_direct  all  --  *      *       0.0.0.0/0            0.0.0.0/0
3325K  306M POSTROUTING_ZONES_SOURCE  all  --  *      *       0.0.0.0/0            0.0.0.0/0
3325K  306M POSTROUTING_ZONES  all  --  *      *       0.0.0.0/0            0.0.0.0/0
   30  2612 RETURN     all  --  *      *       10.244.0.0/16        10.244.0.0/16
    6   360 MASQUERADE  all  --  *      *       10.244.0.0/16       !224.0.0.0/4
    8   480 RETURN     all  --  *      *      !10.244.0.0/16        10.244.2.0/24
    0     0 MASQUERADE  all  --  *      *      !10.244.0.0/16        10.244.0.0/16
```

All `POSTROUTING_*` chains come from firewalld and masquerade was enabled for default zone. One of chains was nothing but:
```
Chain POST_public_allow (1 references)
 pkts bytes target     prot opt in     out     source               destination
3234K  300M MASQUERADE  all  --  *      !lo     0.0.0.0/0            0.0.0.0/0
```

After running `firewall-cmd --remove-masquerade`, those chains became empty and packets started hitting next rules, and leaving the host with proper source IP inside of vxlan.

I wonder if calico/flannel should work around such situations? May be by giving its own rules higher priority or validating the environment and logging suspicious conditions.

You're welcome to close the issue at this point.

**Comment by haoyehaoye** [comment]
> it does work across the nodes when I remove networkpolicy

@xaka I am wondering why removed networkpolicy it works?

**Comment by mmack** [comment]
We have the exact same situation here...

**Comment by caseydavenport** [comment]
@xaka sorry for the long delay on this, but glad you figured it out - that was some nice iptables sleuthing!

Calico does put its own rules at a higher priority. However, in the general case Calico can't circumvent all other users of iptables, because sometimes you may want the traffic to hit other POSTROUTING rules - for example, the KUBE-POSTROUTING chain that directly follows.

For those listening in, the takeaway is that you should disable any NAT between your Kubernetes pods - that may be a result of firewalld, or some other actor.
