### ISSUE TITLE
Can not ping pod from other node on OpenStack

### ISSUE THREAD

**Issue by slene** [projectcalico/calico#2082]
We have 4 vm on OpenStack. Deploy k8s and calico. Currently has network problem. The pod can not ping each other. How to deal with this problem. Please help.

But same deploy on other vm env just work fine. (like virtualbox)

```
vm A 172.16.30.103 - Pod 1（p1）192.168.176.0
vm B 172.16.30.105 - Pod 2（p2）192.168.122.192

from A ping p2 - no response
from p2 ping A - success
from B ping p2 - success

tcpdump in A can see ICMP Req but no Reply
tcpdump in B can see ICMP Req and Reply
```

calico manifest and calicoctl result in here https://gist.github.com/slene/eba38f8095c8ca014047bf6c2b1cbbb5

k8s

```
[root@172-16-30-103 ~]# kubectl get --all-namespaces po -o wide
NAMESPACE     NAME                                       READY     STATUS    RESTARTS   AGE       IP                NODE
kube-system   calico-kube-controllers-548bb4fff4-pxhnt   1/1       Running   0          14h       172.16.30.106     172.16.30.106
kube-system   calico-node-c5n5q                          2/2       Running   0          14h       172.16.30.105     172.16.30.105
kube-system   calico-node-rbrn6                          2/2       Running   0          14h       172.16.30.103     172.16.30.103
kube-system   calico-node-scgxw                          2/2       Running   0          14h       172.16.30.104     172.16.30.104
kube-system   calico-node-tpx5q                          2/2       Running   0          14h       172.16.30.106     172.16.30.106
kube-system   coredns-54486b4cb4-f8zw4                   1/1       Running   0          14h       192.168.122.192   172.16.30.105
kube-system   coredns-54486b4cb4-qmmn8                   1/1       Running   0          14h       192.168.176.0     172.16.30.103
```

calico version

```
[root@172-16-30-103 ~]# calicoctl version
Client Version:    v3.1.1
Build date:        2018-04-19T23:45:54+0000
Git commit:        86318310
Cluster Version:   v3.1.1
Cluster Type:      k8s,bgp
```

iconfig

```
[root@172-16-30-103 ~]# ip a
1: lo: <LOOPBACK,UP,LOWER_UP> mtu 65536 qdisc noqueue state UNKNOWN group default qlen 1
    link/loopback 00:00:00:00:00:00 brd 00:00:00:00:00:00
    inet 127.0.0.1/8 scope host lo
       valid_lft forever preferred_lft forever
2: eth0: <BROADCAST,MULTICAST,UP,LOWER_UP> mtu 1280 qdisc pfifo_fast state UP group default qlen 1000
    link/ether fa:16:3e:db:ec:36 brd ff:ff:ff:ff:ff:ff
    inet 172.16.30.103/24 brd 172.16.30.255 scope global noprefixroute dynamic eth0
       valid_lft 72882sec preferred_lft 72882sec
3: docker0: <NO-CARRIER,BROADCAST,MULTICAST,UP> mtu 1500 qdisc noqueue state DOWN group default
    link/ether 02:42:3f:d2:cf:11 brd ff:ff:ff:ff:ff:ff
    inet 172.17.0.1/16 brd 172.17.255.255 scope global docker0
       valid_lft forever preferred_lft forever
4: kube-bridge: <BROADCAST,MULTICAST> mtu 1280 qdisc noqueue state DOWN group default qlen 1000
    link/ether 9a:78:91:74:d4:77 brd ff:ff:ff:ff:ff:ff
5: cali380be07e98d@if3: <BROADCAST,MULTICAST,UP,LOWER_UP> mtu 1280 qdisc noqueue state UP group default
    link/ether ee:ee:ee:ee:ee:ee brd ff:ff:ff:ff:ff:ff link-netnsid 0
    
[root@172-16-30-105 ~]# ip a
1: lo: <LOOPBACK,UP,LOWER_UP> mtu 65536 qdisc noqueue state UNKNOWN group default qlen 1
    link/loopback 00:00:00:00:00:00 brd 00:00:00:00:00:00
    inet 127.0.0.1/8 scope host lo
       valid_lft forever preferred_lft forever
2: eth0: <BROADCAST,MULTICAST,UP,LOWER_UP> mtu 1280 qdisc pfifo_fast state UP group default qlen 1000
    link/ether fa:16:3e:71:cf:c9 brd ff:ff:ff:ff:ff:ff
    inet 172.16.30.105/24 brd 172.16.30.255 scope global noprefixroute dynamic eth0
       valid_lft 70084sec preferred_lft 70084sec
3: docker0: <NO-CARRIER,BROADCAST,MULTICAST,UP> mtu 1500 qdisc noqueue state DOWN group default
    link/ether 02:42:fc:ab:a8:08 brd ff:ff:ff:ff:ff:ff
    inet 172.17.0.1/16 brd 172.17.255.255 scope global docker0
       valid_lft forever preferred_lft forever
4: kube-bridge: <BROADCAST,MULTICAST> mtu 1280 qdisc noqueue state DOWN group default qlen 1000
    link/ether b6:52:7d:02:e7:39 brd ff:ff:ff:ff:ff:ff
5: cali17537066565@if3: <BROADCAST,MULTICAST,UP,LOWER_UP> mtu 1280 qdisc noqueue state UP group default
    link/ether ee:ee:ee:ee:ee:ee brd ff:ff:ff:ff:ff:ff link-netnsid 0
```

cni config

```
[root@172-16-30-103 ~]# cat /etc/cni/net.d/10-calico.conflist
{
  "name": "k8s-pod-network",
  "cniVersion": "0.3.0",
  "plugins": [
    {
        "type": "calico",
        "etcd_endpoints": "https://172.16.30.103:2379,https://172.16.30.104:2379,https://172.16.30.105:2379",
        "etcd_key_file": "/etc/calico/ssl/calico-key.pem",
        "etcd_cert_file": "/etc/calico/ssl/calico.pem",
        "etcd_ca_cert_file": "/etc/calico/ssl/ca.pem",
        "log_level": "warning",
        "mtu": 1280,
        "ipam": {
            "type": "calico-ipam"
        },
        "policy": {
            "type": "k8s"
        },
        "kubernetes": {
            "kubeconfig": "/root/.kube/config"
        }
    },
    {
      "type": "portmap",
      "snat": true,
      "capabilities": {"portMappings": true}
    }
  ]
}

[root@172-16-30-105 ~]# cat /etc/cni/net.d/10-calico.conflist
{
  "name": "k8s-pod-network",
  "cniVersion": "0.3.0",
  "plugins": [
    {
        "type": "calico",
        "etcd_endpoints": "https://172.16.30.103:2379,https://172.16.30.104:2379,https://172.16.30.105:2379",
        "etcd_key_file": "/etc/calico/ssl/calico-key.pem",
        "etcd_cert_file": "/etc/calico/ssl/calico.pem",
        "etcd_ca_cert_file": "/etc/calico/ssl/ca.pem",
        "log_level": "warning",
        "mtu": 1280,
        "ipam": {
            "type": "calico-ipam"
        },
        "policy": {
            "type": "k8s"
        },
        "kubernetes": {
            "kubeconfig": "/root/.kube/config"
        }
    },
    {
      "type": "portmap",
      "snat": true,
      "capabilities": {"portMappings": true}
    }
  ]
}
```

route

```
[root@172-16-30-103 ~]# route -n
Kernel IP routing table
Destination     Gateway         Genmask         Flags Metric Ref    Use Iface
0.0.0.0         172.16.30.254   0.0.0.0         UG    100    0        0 eth0
169.254.169.254 172.16.30.3     255.255.255.255 UGH   100    0        0 eth0
172.16.30.0     0.0.0.0         255.255.255.0   U     100    0        0 eth0
172.17.0.0      0.0.0.0         255.255.0.0     U     0      0        0 docker0
192.168.0.0     172.16.30.106   255.255.255.0   UG    0      0        0 eth0
192.168.1.0     172.16.30.104   255.255.255.0   UG    0      0        0 eth0
192.168.2.0     172.16.30.104   255.255.255.0   UG    0      0        0 eth0
192.168.3.0     172.16.30.105   255.255.255.0   UG    0      0        0 eth0
192.168.122.192 172.16.30.105   255.255.255.192 UG    0      0        0 eth0
192.168.176.0   0.0.0.0         255.255.255.255 UH    0      0        0 cali380be07e98d
192.168.176.0   0.0.0.0         255.255.255.192 U     0      0        0 *

[root@172-16-30-105 ~]# route -n
Kernel IP routing table
Destination     Gateway         Genmask         Flags Metric Ref    Use Iface
0.0.0.0         172.16.30.254   0.0.0.0         UG    100    0        0 eth0
169.254.169.254 172.16.30.1     255.255.255.255 UGH   100    0        0 eth0
172.16.30.0     0.0.0.0         255.255.255.0   U     100    0        0 eth0
172.17.0.0      0.0.0.0         255.255.0.0     U     0      0        0 docker0
192.168.0.0     172.16.30.106   255.255.255.0   UG    0      0        0 eth0
192.168.1.0     172.16.30.103   255.255.255.0   UG    0      0        0 eth0
192.168.2.0     172.16.30.104   255.255.255.0   UG    0      0        0 eth0
192.168.3.0     172.16.30.103   255.255.255.0   UG    0      0        0 eth0
192.168.122.192 0.0.0.0         255.255.255.255 UH    0      0        0 cali17537066565
192.168.122.192 0.0.0.0         255.255.255.192 U     0      0        0 *
192.168.176.0   172.16.30.103   255.255.255.192 UG    0      0        0 eth0
```

ping & tcpdump

```
[root@172-16-30-103 ~]# ping 192.168.122.192
PING 192.168.122.192 (192.168.122.192) 56(84) bytes of data.

[root@172-16-30-103 ~]# tcpdump host 192.168.122.192
tcpdump: verbose output suppressed, use -v or -vv for full protocol decode
listening on eth0, link-type EN10MB (Ethernet), capture size 262144 bytes
21:01:17.889667 IP host-172-16-30-103.openstacklocal > 192.168.122.192: ICMP echo request, id 13478, seq 13, length 64
21:01:18.913681 IP host-172-16-30-103.openstacklocal > 192.168.122.192: ICMP echo request, id 13478, seq 14, length 64
21:01:19.937692 IP host-172-16-30-103.openstacklocal > 192.168.122.192: ICMP echo request, id 13478, seq 15, length 64

[root@172-16-30-105 ~]# tcpdump host 192.168.122.192
tcpdump: verbose output suppressed, use -v or -vv for full protocol decode
listening on eth0, link-type EN10MB (Ethernet), capture size 262144 bytes
21:01:27.756665 IP host-172-16-30-103.openstacklocal > 192.168.122.192: ICMP echo request, id 13478, seq 22, length 64
21:01:27.756707 IP 192.168.122.192 > host-172-16-30-103.openstacklocal: ICMP echo reply, id 13478, seq 22, length 64
21:01:28.780638 IP host-172-16-30-103.openstacklocal > 192.168.122.192: ICMP echo request, id 13478, seq 23, length 64
21:01:28.780680 IP 192.168.122.192 > host-172-16-30-103.openstacklocal: ICMP echo reply, id 13478, seq 23, length 64
21:01:29.804638 IP host-172-16-30-103.openstacklocal > 192.168.122.192: ICMP echo request, id 13478, seq 24, length 64
21:01:29.804669 IP 192.168.122.192 > host-172-16-30-103.openstacklocal: ICMP echo reply, id 13478, seq 24, length 64
```

iptables log

```
# for iptables log

iptables -t mangle -A PREROUTING -p icmp -j LOG --log-prefix "ICMP (mangle.PREROUTING): "
iptables -t nat -A PREROUTING -p icmp -j LOG --log-prefix "ICMP (nat.PREROUTING): "
iptables -t mangle -A INPUT -p icmp -j LOG --log-prefix "ICMP (mangle.INPUT): "
iptables -t filter -A INPUT -p icmp -j LOG --log-prefix "ICMP (filter.INPUT): "
iptables -t mangle -A FORWARD -p icmp -j LOG --log-prefix "ICMP (mangle.FORWARD): "
iptables -t filter -A FORWARD -p icmp -j LOG --log-prefix "ICMP (filter.FORWARD): "
iptables -t mangle -A OUTPUT -p icmp -j LOG --log-prefix "ICMP (mangle.OUTPUT): "
iptables -t nat -A OUTPUT -p icmp -j LOG --log-prefix "ICMP (nat.OUTPUT): "
iptables -t filter -A OUTPUT -p icmp -j LOG --log-prefix "ICMP (filter.OUTPUT): "
iptables -t mangle -A POSTROUTING -p icmp -j LOG --log-prefix "ICMP (mangle.POSTROUTING): "
iptables -t nat -A POSTROUTING -p icmp -j LOG --log-prefix "ICMP (nat.POSTROUTING): "
```

```
[root@172-16-30-103 ~]# tail -f /var/log/messages|grep kern
Jul 23 21:03:47 172-16-30-103 kernel: ICMP (mangle.OUTPUT): IN= OUT=eth0 SRC=172.16.30.103 DST=192.168.122.192 LEN=84 TOS=0x00 PREC=0x00 TTL=64 ID=26321 DF PROTO=ICMP TYPE=8 CODE=0 ID=13765 SEQ=21
Jul 23 21:03:47 172-16-30-103 kernel: ICMP (filter.OUTPUT): IN= OUT=eth0 SRC=172.16.30.103 DST=192.168.122.192 LEN=84 TOS=0x00 PREC=0x00 TTL=64 ID=26321 DF PROTO=ICMP TYPE=8 CODE=0 ID=13765 SEQ=21
Jul 23 21:03:47 172-16-30-103 kernel: ICMP (mangle.POSTROUTING): IN= OUT=eth0 SRC=172.16.30.103 DST=192.168.122.192 LEN=84 TOS=0x00 PREC=0x00 TTL=64 ID=26321 DF PROTO=ICMP TYPE=8 CODE=0 ID=13765 SEQ=21
...

[root@172-16-30-105 ~]# tail -f /var/log/messages|grep kern
Jul 23 21:03:46 172-16-30-105 kernel: ICMP (mangle.FORWARD): IN=eth0 OUT=cali17537066565 MAC=fa:16:3e:71:cf:c9:fa:16:3e:db:ec:36:08:00 SRC=172.16.30.103 DST=192.168.122.192 LEN=84 TOS=0x00 PREC=0x00 TTL=63 ID=25735 DF PROTO=ICMP TYPE=8 CODE=0 ID=13765 SEQ=19
Jul 23 21:03:46 172-16-30-105 kernel: ICMP (mangle.POSTROUTING): IN= OUT=cali17537066565 SRC=172.16.30.103 DST=192.168.122.192 LEN=84 TOS=0x00 PREC=0x00 TTL=63 ID=25735 DF PROTO=ICMP TYPE=8 CODE=0 ID=13765 SEQ=19
Jul 23 21:03:46 172-16-30-105 kernel: ICMP (mangle.FORWARD): IN=cali17537066565 OUT=eth0 MAC=ee:ee:ee:ee:ee:ee:52:80:ca:96:dc:ba:08:00 SRC=192.168.122.192 DST=172.16.30.103 LEN=84 TOS=0x00 PREC=0x00 TTL=63 ID=42062 PROTO=ICMP TYPE=0 CODE=0 ID=13765 SEQ=19 MARK=0x40000
Jul 23 21:03:46 172-16-30-105 kernel: ICMP (mangle.POSTROUTING): IN= OUT=eth0 SRC=192.168.122.192 DST=172.16.30.103 LEN=84 TOS=0x00 PREC=0x00 TTL=63 ID=42062 PROTO=ICMP TYPE=0 CODE=0 ID=13765 SEQ=19
...
```

**Comment by tmjd** [comment]
You said
>The pod can not ping each other.

but then the information you gave seemed to be traffic between hosts and pods, have you tried pod-to-pod traffic?

I'm assuming you are probably using IPIP (if you haven't changed any config then you are), have you tried using the ip address assigned to the `tunl0` devices in your ping tests.  Sometimes using the host's IP address does not work as expected when using IPIP and pinging from host to pod and back.

**Comment by tmjd** [comment]
What you are seeing may be a problem due to the OpenStack networking layer is blocking the traffic if it is doing source/destination checking of the traffic to and from the hosts.  The reason pinging from a pod to a host works is because you have NAT enabled which means the traffic will be NAT'ed and so the traffic between the hosts will have source/destination IPs of the hosts themselves.

You can try to turn off the source/destination checking but in the one setup I've done that it required steps outside of the OpenStack UI, if you're familiar with doing that feel free to go that route.  The alternate is to enable IPIP on your IP pool.
