### ISSUE TITLE
calico-vxlan ipv6, Pinging the IPv6 address of a pod across nodes is ok, but curl or telnet is not ok

### ISSUE THREAD

**Issue by dugen2020** [projectcalico/calico#7638]
## Expected Behavior

if ping6 the pods address  across nodes is ok,  curl or telnet should be ok.

## Current Behavior

Ping6 the pods address  across nodes  ok,  but curl or telnet  hung until timout .
The firewalld service of all nodes shutdowned .  The iptables service is not installed .  I also try to clear the filter rules by iptables -t filter -F , iptables -t filter -X  ,the proble still exists . So there is no related to ACL from the nodes.
```sh
[root@gxyd-iom-app61 ~]#  systemctl status firewalld
● firewalld.service - firewalld - dynamic firewall daemon
   Loaded: loaded (/usr/lib/systemd/system/firewalld.service; disabled; vendor preset: enabled)
   Active: inactive (dead)
     Docs: man:firewalld(1)
[root@gxyd-iom-app61 ~]#
[root@gxyd-iom-app61 ~]#  systemctl status iptables
Unit iptables.service could not be found.
[root@gxyd-iom-app61 ~]#  
```

## Possible Solution

Still has no idea how to do , painful for a long time... 

## Steps to Reproduce (for bugs)

1. This problem has been stable, tormenting me for a long time
2.  on Node A(for example k8s node gxyd-iom-app48)  execute ping6  IPV6 address of pod from the node B (for example gxyd-iom-app62)  ,  ping is ok 
3. on Node A  execute curl  the same pod form node B , curl is hung
for example 
I have a deploy named justcheck which include 6 pods , the pods is an simple http server which is listening on port 9000 .
```sh
###  curl -6 IPV6:port is not ok 
[root@gxyd-iom-app48 ~]#  kubectl get pods -o wide|grep justcheck
justcheck-c9c65bf7f-42l8f                           1/1     Running     0          39m     fc00::3:3aeb:51cc:4fbd:7117   gxyd-iom-app62   <none>           <none>
justcheck-c9c65bf7f-8q72x                           1/1     Running     0          39m     fc00::1:be62:c02e:8d8b:e4a    gxyd-iom-app15   <none>           <none>
justcheck-c9c65bf7f-dhfvn                           1/1     Running     0          39m     fc00::1:c265:46f7:44a2:7961   gxyd-iom-app46   <none>           <none>
justcheck-c9c65bf7f-hc2ch                           1/1     Running     0          39m     fc00::3:13b7:f724:bdb7:1f89   gxyd-iom-app61   <none>           <none>
justcheck-c9c65bf7f-k65gr                           1/1     Running     0          39m     fc00::502b:1891:83a0:3953     gxyd-iom-app45   <none>           <none>
justcheck-c9c65bf7f-kqfz4                           1/1     Running     0          39m     fc00::2:65a7:bb8f:767e:34ef   gxyd-iom-app47   <none>           <none>
[root@gxyd-iom-app48 ~]#  
[root@gxyd-iom-app48 ~]#  ping6 fc00::3:3aeb:51cc:4fbd:7117
PING fc00::3:3aeb:51cc:4fbd:7117(fc00::3:3aeb:51cc:4fbd:7117) 56 data bytes
64 bytes from fc00::3:3aeb:51cc:4fbd:7117: icmp_seq=1 ttl=63 time=0.327 ms
64 bytes from fc00::3:3aeb:51cc:4fbd:7117: icmp_seq=2 ttl=63 time=0.360 ms
^C
--- fc00::3:3aeb:51cc:4fbd:7117 ping statistics ---
2 packets transmitted, 2 received, 0% packet loss, time 1033ms
rtt min/avg/max/mdev = 0.327/0.343/0.360/0.024 ms
[root@gxyd-iom-app48 ~]#  
[root@gxyd-iom-app48 ~]#  curl -6 -g http://[fc00::3:3aeb:51cc:4fbd:7117]:9000/zcm
curl: (7) Failed to connect to fc00::3:3aeb:51cc:4fbd:7117 port 9000: Connection timed out
[root@gxyd-iom-app48 ~]#
```
 On Node A if  i curl the ipv4 address from the same pods  , it is ok 
```sh
[root@gxyd-iom-app48 ~]#  kubectl get pods -o wide |grep justcheck
justcheck-c9c65bf7f-42l8f                           1/1     Running     0          53m     fc00::3:3aeb:51cc:4fbd:7117   gxyd-iom-app62   <none>           <none>
justcheck-c9c65bf7f-8q72x                           1/1     Running     0          53m     fc00::1:be62:c02e:8d8b:e4a    gxyd-iom-app15   <none>           <none>
justcheck-c9c65bf7f-dhfvn                           1/1     Running     0          53m     fc00::1:c265:46f7:44a2:7961   gxyd-iom-app46   <none>           <none>
justcheck-c9c65bf7f-hc2ch                           1/1     Running     0          53m     fc00::3:13b7:f724:bdb7:1f89   gxyd-iom-app61   <none>           <none>
justcheck-c9c65bf7f-k65gr                           1/1     Running     0          53m     fc00::502b:1891:83a0:3953     gxyd-iom-app45   <none>           <none>
justcheck-c9c65bf7f-kqfz4                           1/1     Running     0          53m     fc00::2:65a7:bb8f:767e:34ef   gxyd-iom-app47   <none>           <none>
[root@gxyd-iom-app48 ~]#  
[root@gxyd-iom-app48 ~]#  
[root@gxyd-iom-app48 ~]#  kubectl exec -it justcheck-c9c65bf7f-42l8f  -- ifconfig
eth0: flags=4163<UP,BROADCAST,RUNNING,MULTICAST>  mtu 1380
        inet 100.80.158.29  netmask 255.255.255.255  broadcast 0.0.0.0
        inet6 fc00::3:3aeb:51cc:4fbd:7117  prefixlen 128  scopeid 0x0<global>
        inet6 fe80::7432:c7ff:fe52:404d  prefixlen 64  scopeid 0x20<link>
        ether 76:32:c7:52:40:4d  txqueuelen 0  (Ethernet)
        RX packets 27  bytes 2690 (2.6 KiB)
        RX errors 0  dropped 0  overruns 0  frame 0
        TX packets 32  bytes 2896 (2.8 KiB)
        TX errors 0  dropped 1 overruns 0  carrier 0  collisions 0

lo: flags=73<UP,LOOPBACK,RUNNING>  mtu 65536
        inet 127.0.0.1  netmask 255.0.0.0
        inet6 ::1  prefixlen 128  scopeid 0x10<host>
        loop  txqueuelen 1000  (Local Loopback)
        RX packets 0  bytes 0 (0.0 B)
        RX errors 0  dropped 0  overruns 0  frame 0
        TX packets 0  bytes 0 (0.0 B)
        TX errors 0  dropped 0 overruns 0  carrier 0  collisions 0

[root@gxyd-iom-app48 ~]#  kubectl exec -it justcheck-c9c65bf7f-42l8f  -- netstat -lntp
Active Internet connections (only servers)
Proto Recv-Q Send-Q Local Address           Foreign Address         State       PID/Program name    
tcp6       0      0 :::9000                 :::*                    LISTEN      1/httpserver        
[root@gxyd-iom-app48 ~]#  
[root@gxyd-iom-app48 ~]#  curl http://100.80.158.29:9000/zcm
Hello  2023-05-10 02:14:38.07795463 +0000 UTC m=+3283.267300684 client ip : 100.80.26.64:34942 
[root@gxyd-iom-app48 ~]# 
```
when use tcpdump to troubleshoot  on the node , i can  get the ping packet , but can not get the curl packet ,even the first syn packet can't be seen. 

 The command  tcpdump -i any host fc00::3:13b7:f724:bdb7:1f89 -nn -vv execute on node gxyd-iom-app62 .
when I execute ping6 on node gxyd-iom-app48 , on node  gxyd-iom-app62  i can get the icmp packet .
```sh
[root@gxyd-iom-app62 ~]#  tcpdump -i any host fc00::3:3aeb:51cc:4fbd:7117 -nn -vv
dropped privs to tcpdump
tcpdump: listening on any, link-type LINUX_SLL (Linux cooked v1), capture size 262144 bytes
10:51:58.320851 IP6 (flowlabel 0x9e75d, hlim 64, next-header ICMPv6 (58) payload length: 64) fc00::5cb3:7ce7:b63:8200 > fc00::3:3aeb:51cc:4fbd:7117: [icmp6 sum ok] ICMP6, echo request, seq 1
10:51:58.320944 IP6 (hlim 255, next-header ICMPv6 (58) payload length: 32) fc00::3:3aeb:51cc:4fbd:7117 > fe80::ecee:eeff:feee:eeee: [icmp6 sum ok] ICMP6, neighbor advertisement, length 32, tgt is fc00::3:3aeb:51cc:4fbd:7117, Flags [solicited, override]
          destination link-address option (2), length 8 (1): 76:32:c7:52:40:4d
            0x0000:  7632 c752 404d
10:51:58.320958 IP6 (flowlabel 0x9e75d, hlim 63, next-header ICMPv6 (58) payload length: 64) fc00::5cb3:7ce7:b63:8200 > fc00::3:3aeb:51cc:4fbd:7117: [icmp6 sum ok] ICMP6, echo request, seq 1
10:51:58.320969 IP6 (flowlabel 0xd9f8e, hlim 64, next-header ICMPv6 (58) payload length: 64) fc00::3:3aeb:51cc:4fbd:7117 > fc00::5cb3:7ce7:b63:8200: [icmp6 sum ok] ICMP6, echo reply, seq 1
10:51:58.320979 IP6 (flowlabel 0xd9f8e, hlim 63, next-header ICMPv6 (58) payload length: 64) fc00::3:3aeb:51cc:4fbd:7117 > fc00::5cb3:7ce7:b63:8200: [icmp6 sum ok] ICMP6, echo reply, seq 1
...
```
but when i execute curl -6 -g http://[fc00::3:3aeb:51cc:4fbd:7117]:9000/zcm on gxyd-iom-app48,  but on gxyd-iom-app62 can not get any packet even the first sync packet   by tcpdump.

## Your Environment

* Calico version   v3.24.5 with dual stack.
* Orchestrator version (e.g. kubernetes, mesos, rkt):  k8s 1.22.5    with dual stack 
* Operating System and version:  
```sh
[root@gxyd-iom-app48 ~]#  uname -a
Linux gxyd-iom-app48 5.10.134-12.2.el8.bclinux.x86_64 #1 SMP Fri Nov 11 10:36:24 CST 2022 x86_64 x86_64 x86_64 GNU/Linux
[root@gxyd-iom-app48 ~]#  
[root@gxyd-iom-app48 ~]#  cat  /etc/os-release 
NAME="BigCloud Enterprise Linux"
VERSION="8.6 (Core)"
ID="bclinux"
ID_LIKE="rhel fedora"
VERSION_ID="8.6"
PLATFORM_ID="platform:an8"
PRETTY_NAME="BigCloud Enterprise Linux 8.6 (Core)"
ANSI_COLOR="0;31"
CPE_NAME="cpe:/o:bclinux:bclinux:8"
HOME_URL="https://mirrors.bclinux.org/"
BUG_REPORT_URL="https://bugs.bclinux.org/"

BCLINUX_BUGZILLA_PRODUCT="BigCloud Enterprise Linux 8 (Core)"
BCLINUX_BUGZILLA_PRODUCT_VERSION=8.6
BCLINUX_SUPPORT_PRODUCT="BigCloud Enterprise Linux 8 (Core)"
BCLINUX_SUPPORT_PRODUCT_VERSION=8.6

[root@gxyd-iom-app48 ~]#  
```
* Link to your project (optional):
## other info
calico network dual stack
```sh
[root@gxyd-iom-app48 ~]#  calicoctl  get pool -o wide
NAME                  CIDR            NAT    IPIPMODE   VXLANMODE   DISABLED   DISABLEBGPEXPORT   SELECTOR   
default-ipv4-ippool   100.80.0.0/16   true   Never      Always      false      false              all()      
default-ipv6-ippool   fc00::/62       true   Never      Always      false      false              all()      

[root@gxyd-iom-app48 ~]#  
```
I absolutely make sure the simple http server is ok unerder IPV6, for example i log into the same pod and execute curl ipv6:port , it is ok.
```sh
[root@gxyd-iom-app48 ~]#   kubectl exec -it justcheck-c9c65bf7f-42l8f  -- ifconfig
eth0: flags=4163<UP,BROADCAST,RUNNING,MULTICAST>  mtu 1380
        inet 100.80.158.29  netmask 255.255.255.255  broadcast 0.0.0.0
        inet6 fc00::3:3aeb:51cc:4fbd:7117  prefixlen 128  scopeid 0x0<global>
        inet6 fe80::7432:c7ff:fe52:404d  prefixlen 64  scopeid 0x20<link>
        ether 76:32:c7:52:40:4d  txqueuelen 0  (Ethernet)
        RX packets 34  bytes 3221 (3.1 KiB)
        RX errors 0  dropped 0  overruns 0  frame 0
        TX packets 37  bytes 3423 (3.3 KiB)
        TX errors 0  dropped 1 overruns 0  carrier 0  collisions 0

lo: flags=73<UP,LOOPBACK,RUNNING>  mtu 65536
        inet 127.0.0.1  netmask 255.0.0.0
        inet6 ::1  prefixlen 128  scopeid 0x10<host>
        loop  txqueuelen 1000  (Local Loopback)
        RX packets 10  bytes 1069 (1.0 KiB)
        RX errors 0  dropped 0  overruns 0  frame 0
        TX packets 10  bytes 1069 (1.0 KiB)
        TX errors 0  dropped 0 overruns 0  carrier 0  collisions 0
[root@gxyd-iom-app48 ~]#   kubectl exec -it justcheck-c9c65bf7f-42l8f  -- curl -6 -g http://[fc00::3:3aeb:51cc:4fbd:7117]:9000/zcm
Hello  2023-05-10 02:19:37.57993561 +0000 UTC m=+3582.769281660 client ip : [fc00::3:3aeb:51cc:4fbd:7117]:34710 
[root@gxyd-iom-app48 ~]# 
``

**Comment by dugen2020** [comment]
I have tried to turn off  offload on both nodeA( node gxyd-iom-app48 ) and nodeB( node gxyd-iom-app62 )  bye execute ethtool --offload vxlan-v6.calico rx off tx off , but it still has no effect

**Comment by dugen2020** [comment]
Not all all nodes in the k8s cluster have the problem , some nodes are ok , ping6 is ok , curl or telnet is also ok . All nodes in the cluster are same os and same kernel .
for example 
```shell
[root@gxyd-iom-app48 ~]#  kubectl get pods -o wide |grep justcheck
justcheck-c9c65bf7f-42l8f                           1/1     Running     0          106m    fc00::3:3aeb:51cc:4fbd:7117   gxyd-iom-app62   <none>           <none>
justcheck-c9c65bf7f-8q72x                           1/1     Running     0          106m    fc00::1:be62:c02e:8d8b:e4a    gxyd-iom-app15   <none>           <none>
justcheck-c9c65bf7f-dhfvn                           1/1     Running     0          106m    fc00::1:c265:46f7:44a2:7961   gxyd-iom-app46   <none>           <none>
justcheck-c9c65bf7f-hc2ch                           1/1     Running     0          106m    fc00::3:13b7:f724:bdb7:1f89   gxyd-iom-app61   <none>           <none>
justcheck-c9c65bf7f-k65gr                           1/1     Running     0          106m    fc00::502b:1891:83a0:3953     gxyd-iom-app45   <none>           <none>
justcheck-c9c65bf7f-kqfz4                           1/1     Running     0          106m    fc00::2:65a7:bb8f:767e:34ef   gxyd-iom-app47   <none>           <none>
[root@gxyd-iom-app48 ~]#  
[root@gxyd-iom-app48 ~]#  curl -6 -g http://[fc00::1:be62:c02e:8d8b:e4a]:9000/zcm
Hello  2023-05-10 03:06:32.256996265 +0000 UTC m=+6397.353664442 client ip : [fc00::5cb3:7ce7:b63:8200]:42358 
[root@gxyd-iom-app48 ~]#  
[root@gxyd-iom-app48 ~]#  ping6 fc00::3:3aeb:51cc:4fbd:7117
PING fc00::3:3aeb:51cc:4fbd:7117(fc00::3:3aeb:51cc:4fbd:7117) 56 data bytes
64 bytes from fc00::3:3aeb:51cc:4fbd:7117: icmp_seq=1 ttl=63 time=0.416 ms
^C
--- fc00::3:3aeb:51cc:4fbd:7117 ping statistics ---
1 packets transmitted, 1 received, 0% packet loss, time 0ms
rtt min/avg/max/mdev = 0.416/0.416/0.416/0.000 ms
[root@gxyd-iom-app48 ~]#  curl -6 http://[fc00::3:3aeb:51cc:4fbd:7117]:9000/zcm
hung hung hung ... until timeout
```

**Comment by dugen2020** [comment]
in order to give a clear description , a draw a picture 
![image](https://github.com/projectcalico/calico/assets/74941473/d9a32cec-4104-44aa-a267-384cfdab1ed6)

**Comment by cyclinder** [comment]
I suspect that the inconsistent iptables rule on different nodes is causing this, Could you show more details by following commands?

On ok and bad nodes:

- uname -a
- ip -6 r
- ip6tables --version

**Comment by dugen2020** [comment]
@cyclinder 
on ok nodes , for example  the Node: gxyd-iom-app15
```sh
[root@gxyd-iom-app15 ~]#  uname -a
Linux gxyd-iom-app15 5.10.134-12.2.el8.bclinux.x86_64 #1 SMP Fri Nov 11 10:36:24 CST 2022 x86_64 x86_64 x86_64 GNU/Linux
[root@gxyd-iom-app15 ~]#  
[root@gxyd-iom-app15 ~]#  ip -6 r
::1 dev lo proto kernel metric 256 pref medium
2409:8050:5ac0:bbf6::22:0/112 dev eth0 proto kernel metric 103 pref medium
fc00::502b:1891:83a0:3900/120 via fc00::502b:1891:83a0:3900 dev vxlan-v6.calico metric 1024 onlink pref medium
fc00::5cb3:7ce7:b63:8200/120 via fc00::5cb3:7ce7:b63:8200 dev vxlan-v6.calico metric 1024 onlink pref medium
fc00::1:e03:538a:3136:eb00/120 via fc00::1:e03:538a:3136:eb00 dev vxlan-v6.calico metric 1024 onlink pref medium
fc00::1:8626:2df6:78aa:f00/120 via fc00::1:8626:2df6:78aa:f00 dev vxlan-v6.calico metric 1024 onlink pref medium
fc00::1:be62:c02e:8d8b:e44 dev cali7e0006961db metric 1024 pref medium
fc00::1:be62:c02e:8d8b:e45 dev cali5303040d7b7 metric 1024 pref medium
fc00::1:be62:c02e:8d8b:e4a dev cali46cdfff24bf metric 1024 pref medium
fc00::1:be62:c02e:8d8b:e4b dev cali1d5c70e43a2 metric 1024 pref medium
blackhole fc00::1:be62:c02e:8d8b:e00/120 dev lo proto 80 metric 1024 pref medium
fc00::1:c265:46f7:44a2:7900/120 via fc00::1:c265:46f7:44a2:7900 dev vxlan-v6.calico metric 1024 onlink pref medium
fc00::2:65a7:bb8f:767e:3400/120 via fc00::2:65a7:bb8f:767e:3400 dev vxlan-v6.calico metric 1024 onlink pref medium
fc00::2:a11f:f212:9b75:5600/120 via fc00::2:a11f:f212:9b75:5600 dev vxlan-v6.calico metric 1024 onlink pref medium
fc00::3:13b7:f724:bdb7:1f00/120 via fc00::3:13b7:f724:bdb7:1f00 dev vxlan-v6.calico metric 1024 onlink pref medium
fc00::3:1ac3:7ddd:174f:5800/120 via fc00::3:1ac3:7ddd:174f:5800 dev vxlan-v6.calico metric 1024 onlink pref medium
fc00::3:3aeb:51cc:4fbd:7100/120 via fc00::3:3aeb:51cc:4fbd:7100 dev vxlan-v6.calico metric 1024 onlink pref medium
fe80::/64 dev eth1 proto kernel metric 256 pref medium
fe80::/64 dev eth2 proto kernel metric 256 pref medium
fe80::/64 dev vxlan.calico proto kernel metric 256 pref medium
fe80::/64 dev cali7e0006961db proto kernel metric 256 pref medium
fe80::/64 dev cali5303040d7b7 proto kernel metric 256 pref medium
fe80::/64 dev cali46cdfff24bf proto kernel metric 256 pref medium
fe80::/64 dev cali1d5c70e43a2 proto kernel metric 256 pref medium
fe80::/64 dev eth0 proto kernel metric 1024 pref medium
default via 2409:8050:5ac0:bbf6::22:1 dev eth0 proto static metric 103 pref medium
[root@gxyd-iom-app15 ~]#   
[root@gxyd-iom-app15 ~]#  ip6tables --version
ip6tables v1.8.4 (nf_tables)
[root@gxyd-iom-app15 ~]#  
```
on bad nodes , for example  the Node: gxyd-iom-app62

```sh
[root@gxyd-iom-app62 ~]#  uname -r
5.10.134-12.2.el8.bclinux.x86_64
[root@gxyd-iom-app62 ~]#  
[root@gxyd-iom-app62 ~]#  uname -a
Linux gxyd-iom-app62 5.10.134-12.2.el8.bclinux.x86_64 #1 SMP Fri Nov 11 10:36:24 CST 2022 x86_64 x86_64 x86_64 GNU/Linux
[root@gxyd-iom-app62 ~]#  
[root@gxyd-iom-app62 ~]#  ip -6 r
::1 dev lo proto kernel metric 256 pref medium
2409:8050:5ac0:bbf6::22:0/112 dev eth0 proto kernel metric 103 pref medium
fc00::502b:1891:83a0:3900/120 via fc00::502b:1891:83a0:3900 dev vxlan-v6.calico metric 1024 onlink pref medium
fc00::5cb3:7ce7:b63:8200/120 via fc00::5cb3:7ce7:b63:8200 dev vxlan-v6.calico metric 1024 onlink pref medium
fc00::1:e03:538a:3136:eb00/120 via fc00::1:e03:538a:3136:eb00 dev vxlan-v6.calico metric 1024 onlink pref medium
fc00::1:8626:2df6:78aa:f00/120 via fc00::1:8626:2df6:78aa:f00 dev vxlan-v6.calico metric 1024 onlink pref medium
fc00::1:be62:c02e:8d8b:e00/120 via fc00::1:be62:c02e:8d8b:e00 dev vxlan-v6.calico metric 1024 onlink pref medium
fc00::1:c265:46f7:44a2:7900/120 via fc00::1:c265:46f7:44a2:7900 dev vxlan-v6.calico metric 1024 onlink pref medium
fc00::2:65a7:bb8f:767e:3400/120 via fc00::2:65a7:bb8f:767e:3400 dev vxlan-v6.calico metric 1024 onlink pref medium
fc00::2:a11f:f212:9b75:5600/120 via fc00::2:a11f:f212:9b75:5600 dev vxlan-v6.calico metric 1024 onlink pref medium
fc00::3:13b7:f724:bdb7:1f00/120 via fc00::3:13b7:f724:bdb7:1f00 dev vxlan-v6.calico metric 1024 onlink pref medium
fc00::3:1ac3:7ddd:174f:5800/120 via fc00::3:1ac3:7ddd:174f:5800 dev vxlan-v6.calico metric 1024 onlink pref medium
fc00::3:3aeb:51cc:4fbd:7117 dev cali9fee2e9a443 metric 1024 pref medium
blackhole fc00::3:3aeb:51cc:4fbd:7100/120 dev lo proto 80 metric 1024 pref medium
fe80::/64 dev eth1 proto kernel metric 256 pref medium
fe80::/64 dev eth2 proto kernel metric 256 pref medium
fe80::/64 dev vxlan.calico proto kernel metric 256 pref medium
fe80::/64 dev cali9fee2e9a443 proto kernel metric 256 pref medium
fe80::/64 dev eth0 proto kernel metric 1024 pref medium
default via 2409:8050:5ac0:bbf6::22:1 dev eth0 proto static metric 103 pref medium
[root@gxyd-iom-app62 ~]#  
[root@gxyd-iom-app62 ~]#  ip6tables  --version
ip6tables v1.8.4 (nf_tables)
[root@gxyd-iom-app62 ~]#  
```

Further more,  On the perspective of node gxyd-iom-app48 ,  we can see the ipv6 route rules are ok  compared the two destinition nodes.
![image](https://github.com/projectcalico/calico/assets/74941473/803d1919-972a-47bf-b653-dd0d9021f830)

**Comment by dugen2020** [comment]
@c

> > I suspect that the inconsistent iptables rule on different nodes is causing this
> 
> Are you able to debug ip6tables? I think some iptables rule dropped the packet

@cyclinder  I think there is no related to iptables rules .  I have clear rules of the  filter tables  more times  , but no use .

you can see , no filter rules
```
[root@gxyd-iom-app62 ~]#   ip6tables -t filter -nvL
Chain INPUT (policy ACCEPT 1684 packets, 296K bytes)
 pkts bytes target     prot opt in     out     source               destination         

Chain FORWARD (policy ACCEPT 0 packets, 0 bytes)
 pkts bytes target     prot opt in     out     source               destination         

Chain OUTPUT (policy ACCEPT 1732 packets, 250K bytes)
 pkts bytes target     prot opt in     out     source               destination         
[root@gxyd-iom-app62 ~]# 
```

**Comment by dugen2020** [comment]
and  as what i have said at he beginning of the issue , i have also tried to debug by tcpdump , there was no packet to grab on bad node gxyd-iom-app62 when execute curl on node gxyd-iom-app48.  even u can't see the syn packet (the first packet of 3-way handshake).  but u can grab ping packet on gxyd-iom-app62 when u execute ping6 on node gxyd-iom-app48.

**Comment by dugen2020** [comment]
@mazdakn   thanks for your replay. 
 I just flushed the filter tables of iptables rules  , not all the tables . I think cleaning the filter table will not affect the normal communication, just to prove that this communication problem is not caused by security rules.
There is no customized network policy, this is a new K8s cluster, all policies are default.
```sh
[root@gxyd-iom-app48 ~]#  calicoctl get networkpolicy
NAME   

[root@gxyd-iom-app48 ~]#  kubectl get networkpolicy -A
No resources found
[root@gxyd-iom-app48 ~]#  
[root@gxyd-iom-app48 ~]#  
```

i can capture the out sync from the host  where the ping6 execute , for example 
when i execute ping6 on node gxyd-iom-app48,  i can capture the syn packet 
```sh
[root@gxyd-iom-app48 ~]#  kubectl get pods -o wide |grep justcheck
justcheck-c9c65bf7f-42l8f    1/1     Running     0    6d23h   fc00::3:3aeb:51cc:4fbd:7117   gxyd-iom-app62  
justcheck-c9c65bf7f-8q72x    1/1     Running     0    6d23h   fc00::1:be62:c02e:8d8b:e4a    gxyd-iom-app15  
justcheck-c9c65bf7f-dhfvn    1/1     Running     0    6d23h   fc00::1:c265:46f7:44a2:7961   gxyd-iom-app46  
justcheck-c9c65bf7f-hc2ch    1/1     Running     0    6d23h   fc00::3:13b7:f724:bdb7:1f89   gxyd-iom-app61  
justcheck-c9c65bf7f-k65gr    1/1     Running     0    6d23h   fc00::502b:1891:83a0:3953     gxyd-iom-app45  
justcheck-c9c65bf7f-kqfz4    1/1     Running     0    6d23h   fc00::2:65a7:bb8f:767e:34ef   gxyd-iom-app47  
[root@gxyd-iom-app48 ~]# 
[root@gxyd-iom-app48 ~]#  curl -6 -g http://[fc00::3:3aeb:51cc:4fbd:7117]:9000/zcm
curl: (7) Failed to connect to fc00::3:3aeb:51cc:4fbd:7117 port 9000: Connection timed out
[root@gxyd-iom-app48 ~]#  
[root@gxyd-iom-app48 ~]#  ip route get fc00::3:3aeb:51cc:4fbd:7117
fc00::3:3aeb:51cc:4fbd:7117 from :: via fc00::3:3aeb:51cc:4fbd:7100 dev vxlan-v6.calico src fc00::5cb3:7ce7:b63:8200 metric 1024 pref medium
[root@gxyd-iom-app48 ~]#  
[root@gxyd-iom-app48 ~]#  ping6 fc00::3:3aeb:51cc:4fbd:7117
PING fc00::3:3aeb:51cc:4fbd:7117(fc00::3:3aeb:51cc:4fbd:7117) 56 data bytes
64 bytes from fc00::3:3aeb:51cc:4fbd:7117: icmp_seq=1 ttl=63 time=0.342 ms
64 bytes from fc00::3:3aeb:51cc:4fbd:7117: icmp_seq=2 ttl=63 time=0.267 ms
...
```
now we can see the out syn packet on the node gxyd-iom-app48 , but no [syn, ack] packet from node gxyd-iom-app62 . and also can get the normal icmpv6 packet when executing ping6 . 
```sh
[root@gxyd-iom-app48 ~]#  tcpdump -i any host fc00::3:3aeb:51cc:4fbd:7117 -nn 
dropped privs to tcpdump
tcpdump: verbose output suppressed, use -v or -vv for full protocol decode
listening on any, link-type LINUX_SLL (Linux cooked v1), capture size 262144 bytes
09:20:49.515539 IP6 fc00::5cb3:7ce7:b63:8200.53862 > fc00::3:3aeb:51cc:4fbd:7117.9000: Flags [S], seq 2879585410, win 64680, options [mss 1320,sackOK,TS val 2503294115 ecr 0,nop,wscale 7], length 0
09:20:50.555071 IP6 fc00::5cb3:7ce7:b63:8200.53862 > fc00::3:3aeb:51cc:4fbd:7117.9000: Flags [S], seq 2879585410, win 64680, options [mss 1320,sackOK,TS val 2503295154 ecr 0,nop,wscale 7], length 0
09:20:52.603086 IP6 fc00::5cb3:7ce7:b63:8200.53862 > fc00::3:3aeb:51cc:4fbd:7117.9000: Flags [S], seq 2879585410, win 64680, options [mss 1320,sackOK,TS val 2503297202 ecr 0,nop,wscale 7], length 0
09:20:56.635060 IP6 fc00::5cb3:7ce7:b63:8200.53862 > fc00::3:3aeb:51cc:4fbd:7117.9000: Flags [S], seq 2879585410, win 64680, options [mss 1320,sackOK,TS val 2503301234 ecr 0,nop,wscale 7], length 0
09:21:05.147075 IP6 fc00::5cb3:7ce7:b63:8200.53862 > fc00::3:3aeb:51cc:4fbd:7117.9000: Flags [S], seq 2879585410, win 64680, options [mss 1320,sackOK,TS val 2503309746 ecr 0,nop,wscale 7], length 0
09:21:21.531066 IP6 fc00::5cb3:7ce7:b63:8200.53862 > fc00::3:3aeb:51cc:4fbd:7117.9000: Flags [S], seq 2879585410, win 64680, options [mss 1320,sackOK,TS val 2503326130 ecr 0,nop,wscale 7], length 0
09:21:53.787079 IP6 fc00::5cb3:7ce7:b63:8200.53862 > fc00::3:3aeb:51cc:4fbd:7117.9000: Flags [S], seq 2879585410, win 64680, options [mss 1320,sackOK,TS val 2503358386 ecr 0,nop,wscale 7], length 0
09:23:27.370471 IP6 fc00::5cb3:7ce7:b63:8200 > fc00::3:3aeb:51cc:4fbd:7117: ICMP6, echo request, seq 1, length 64
09:23:27.370764 IP6 fc00::3:3aeb:51cc:4fbd:7117 > fc00::5cb3:7ce7:b63:8200: ICMP6, echo reply, seq 1, length 64
09:23:28.379134 IP6 fc00::5cb3:7ce7:b63:8200 > fc00::3:3aeb:51cc:4fbd:7117: ICMP6, echo request, seq 2, length 64
09:23:28.379325 IP6 fc00::3:3aeb:51cc:4fbd:7117 > fc00::5cb3:7ce7:b63:8200: ICMP6, echo reply, seq 2, length 64
...
```

**Comment by dugen2020** [comment]
@mazdakn   calico is dual stack , both ping and curl are ok for ipv4 .
<img width="1239" alt="image" src="https://github.com/projectcalico/calico/assets/74941473/78b66df2-2679-4708-bc06-62eebcf29186">

for example 

<img width="1136" alt="image" src="https://github.com/projectcalico/calico/assets/74941473/d9200e8e-19e9-4813-a6f4-20181033e427">

**Comment by mazdakn** [comment]
@dugen2020 sorry for late reply. Do you still have this issue?
