### ISSUE TITLE
eBPF proxy replacement not working under various non-standard conditions

### ISSUE THREAD

**Issue by pavels** [projectcalico/calico#5248]
Calico: `v3.17.1`
Kernel: `5.9.6-1~bpo10+1`

There is two observed cases, under which eBPF dataplane is not working in kube-proxy replacement mode:

Tagged VLAN on single physical interface

For both cases let's assume we have 3 networks - 192.168.55.0/24 and 192.168.46.0/24. The 192.168.46.0/24 (let's call it cluster network) is where kuberenets cluster runs with calico. The 192.168.55.0/24 (external) network has no kubernetes - machine with IP 192.168.46.1 on interface enp36s0f0 and 192.168.55.124 on interface enp36s0f0.10 !! that is tagged VLAN on enp36s0f0 acts as a router (and kube control plane), no masquarading, no firewall, just routing. We also have computer with 192.168.46.10 IP acting as kubernetes worker node.

Let's assume we have ClusterIP service 10.91.242.72 (10.91.0.0/16 is the cluster IP CIDR, 10.92.0.0/16 id pod CIDR).

Now we can access the cluster IP service from the router, and from the worker no problem. We can access POD ips form internal cluster network and external network (192.168.55.0/24) no problem, but it is not possible to access ClusterIP service from external network.

Here is tcpdump output - interface is enp36s0f0 - cluster facing interface
```
22:38:56.864383 IP 192.168.55.129.55746 > 10.91.242.72.http: Flags [S], seq 2098305409, win 64240, options [mss 1460,sackOK,TS val 1556438204 ecr 0,nop,wscale 7], length 0
22:38:57.866829 IP 192.168.55.129.55746 > 10.91.242.72.http: Flags [S], seq 2098305409, win 64240, options [mss 1460,sackOK,TS val 1556439207 ecr 0,nop,wscale 7], length 0
22:39:00.080814 IP 192.168.55.129.55746 > 10.91.242.72.http: Flags [S], seq 2098305409, win 64240, options [mss 1460,sackOK,TS val 1556441420 ecr 0,nop,wscale 7], length 0
22:39:04.133298 IP 192.168.55.129.55746 > 10.91.242.72.http: Flags [S], seq 2098305409, win 64240, options [mss 1460,sackOK,TS val 1556445473 ecr 0,nop,wscale 7], length 0
```

If the similar setup is done with two physical interfaces enp36s0f0 and enp36s0f1 instead of tagged VLAN interface, it works correctly.

---

Same network setup, this time there is WireGuard VPN endpoint running in the worker node - started from pod but in host network namespace. Interface wg0.

All routes are properly setup - tested with kube-proxy and all is OK. With eBPF datapath it is not possible to access ClusterIP service from other end of the WireGuard VPN - the POD IPs are OK and so is host IPs.

tcpdump output from the worker node - cluster facing enp36s0f0 interface
```
22:40:47.528718 IP 10.0.0.1.52182 > 10.91.242.72.http: Flags [S], seq 2301632043, win 27600, options [mss 1380,sackOK,TS val 3486367628 ecr 0,nop,wscale 7], length 0
22:40:48.530782 IP 10.0.0.1.52182 > 10.91.242.72.http: Flags [S], seq 2301632043, win 27600, options [mss 1380,sackOK,TS val 3486368630 ecr 0,nop,wscale 7], length 0
```
