### ISSUE TITLE
Newly created pods have delay before outbound connections are working

### ISSUE THREAD

**Issue by dannyk81** [projectcalico/calico#2471]
/cc @lwr20, following our Slack chat I've created the issue here. Let me know if more information is needed.

## Expected Behavior
New pods are created and are able to access the network within a short time of their initialisation.

## Current Behavior
New pods have delays of up to 5-6 seconds before outbound network is available (i.e. other services are available).

## Possible Solution

We are considering adding an initContainer to all pods to test network access before the actual application container is launched.

## Steps to Reproduce (for bugs)

1. Deploy a new pod with the following command spec:
```
        - command:
          - bash
          - -c
          - while sleep 1; do ping -W 1 -c 1 kubernetes.default; done
```
2. observe the pod's log, first few ping attempts timeout and then it starts working
3. replace the domain name `kubernetes.default` with the service IP (in our case, it's 10.233.0.1)
4. observe similar results

Note: using the IP usually yields shorter delays for network access (1-3 seconds), but that I believe make sense since dns resolution requires extra requests and has its own timeouts/etc.

I should also note that in some cases (relatively short percentage of overall tests), we didn't see any delay at all.

## Context

The impact of this is on a particular set of application that require outbound communication to be available as soon as they initialise, in some cases the application needs to resolve the target service name it needs to connect with, which fails and causes the application to terminate resulting in crash loops (e.g. fluentd)

Once the network is finally available, things seems to run smoothly. 

## Your Environment

* Calico version: v3.4.0
* Orchestrator version (e.g. kubernetes, mesos, rkt): K8s 1.13.2
* Operating System and version: CoreOS 1967.6.0
* additional details:
 - IPIP is disabled
 - master and worker nodes are running on VMs (VMware) on-premises
 - latency between nodes is low and consistent
```
20 packets transmitted, 20 received, 0% packet loss, time 19488ms
rtt min/avg/max/mdev = 0.192/0.283/0.642/0.090 ms
```

**Comment by redbaron** [comment]
If you ping well known IP of a pod, does it still fail? What about pinging
external IP? It might pretty much be a delay in setting up NAT rules to
access services (DNS resolution happens via service even if your ping
destination is POD)

**Comment by dannyk81** [comment]
Thanks @redbaron 

We used service clusterIPs as destination for the tests, we can try the same targeting another Pod IP.

DNS resolution in our case is done through a node local dns cache which runs on a locally attached IP, so it bypasses the standard K8s network stack.

In any case, since the same issue happens with just using an IP as destination I think this rules out DNS as the culprit in general. wdyt?

**Comment by dannyk81** [comment]
so, just a quick update on this.

following @redbaron's suggestion and also seems like one of our engineers had a similar idea :smile: 

we executed some tests pinging another POD IP (the two pods were on different nodes), majority of the tests were ok (short or no delay), but we caught one that took 40 seconds :grimacing: (took 20 pings with timeout of 1 second and a sleep of 1 second between retries)

what we've noticed is that while the ping was timing out, we saw in tcpdump the echo-requests leaving the source node and echo-replies sent back from the destination node (where the pinged pod is running), tcpdump was running on the source node.

source pod is on node green-kubw-01
destination pod is on node green-kubw-03

```
core@green-kubw-01 /var/log $ sudo tcpdump -i ens192 host 10.230.83.191
dropped privs to tcpdump
tcpdump: verbose output suppressed, use -v or -vv for full protocol decode
listening on ens192, link-type EN10MB (Ethernet), capture size 262144 bytes
16:38:51.781872 IP green-kubw-01 > green-kubw-03: ICMP echo request, id 6279, seq 0, length 64
16:38:51.782147 IP green-kubw-03 > green-kubw-01: ICMP echo reply, id 6279, seq 0, length 64
16:38:52.787665 IP green-kubw-01 > green-kubw-03: ICMP echo request, id 6280, seq 0, length 64
16:38:52.787873 IP green-kubw-03 > green-kubw-01: ICMP echo reply, id 6280, seq 0, length 64
16:38:53.791447 IP green-kubw-01 > green-kubw-03: ICMP echo request, id 6281, seq 0, length 64
16:38:53.791659 IP green-kubw-03 > green-kubw-01: ICMP echo reply, id 6281, seq 0, length 64
16:38:54.794696 IP green-kubw-01 > green-kubw-03: ICMP echo request, id 6282, seq 0, length 64
16:38:54.794937 IP green-kubw-03 > green-kubw-01: ICMP echo reply, id 6282, seq 0, length 64
16:38:55.798026 IP green-kubw-01 > green-kubw-03: ICMP echo request, id 6283, seq 0, length 64
16:38:55.798274 IP green-kubw-03 > green-kubw-01: ICMP echo reply, id 6283, seq 0, length 64
```

This cluster is basically empty, and there's nothing else running pings there.

so it looks like the reply packets could not be properly delivered to the pod?

**Comment by dannyk81** [comment]
One more piece of information, while the new pod is unable to ping the destination after initialisation, I'm getting the following when trying to ping the IP of the Pod:

1) from the same node where the pod is running:
```
core@green-kubw-01 ~ $ ping 10.233.124.13
connect: Invalid argument
```

2) from another node in the cluster, the ping just timeouts.

**Comment by dannyk81** [comment]
One more observation, during the test I ran `ip -ts monitor` on the node and observed the following:

```
[2019-03-06T19:52:37.396045] ipv4 dev calica776e3d319 forwarding on rp_filter strict mc_forwarding off proxy_neigh off ignore_routes_with_linkdown off 
[2019-03-06T19:52:37.396373] ipv6 dev calica776e3d319 forwarding off mc_forwarding off proxy_neigh off ignore_routes_with_linkdown off 
[2019-03-06T19:52:37.396531] nsid 3 
[2019-03-06T19:52:37.396565] 97: calica776e3d319@if3: <BROADCAST,MULTICAST> mtu 1500 qdisc noop state DOWN group default 
    link/ether ee:ee:ee:ee:ee:ee brd ff:ff:ff:ff:ff:ff link-netnsid 3
[2019-03-06T19:52:37.397220] ipv4 dev calica776e3d319 proxy_neigh on 
[2019-03-06T19:52:37.397410] 97: calica776e3d319@if3: <BROADCAST,MULTICAST,UP,LOWER_UP> mtu 1500 qdisc noqueue state UP group default 
    link/ether ee:ee:ee:ee:ee:ee brd ff:ff:ff:ff:ff:ff link-netnsid 3
[2019-03-06T19:52:37.397542] ff00::/8 dev calica776e3d319 table local metric 256 pref medium
[2019-03-06T19:52:37.397571] fe80::/64 dev calica776e3d319 proto kernel metric 256 pref medium
[2019-03-06T19:52:37.397591] 10.233.124.26 dev calica776e3d319 scope link 
[2019-03-06T19:52:37.399709] 97: calica776e3d319@if3: <BROADCAST,MULTICAST,UP,LOWER_UP> mtu 1500 qdisc noqueue state UP group default 
    link/ether ee:ee:ee:ee:ee:ee brd ff:ff:ff:ff:ff:ff link-netnsid 3
[2019-03-06T19:52:37.407405] Deleted 10.233.124.26 dev calica776e3d319 scope link 
[2019-03-06T19:52:37.412564] 10.233.124.26 dev calica776e3d319 lladdr 9e:a0:1a:43:2d:5c PERMANENT
[2019-03-06T19:54:01.784388] 10.233.124.26 dev calica776e3d319 scope link
```

what's strange (or maybe I misunderstand something) is that after the device was initialised and the IP was set:
`[2019-03-06T19:52:37.397591] 10.233.124.26 dev calica776e3d319 scope link`

but shortly after deleted:
`[2019-03-06T19:52:37.407405] Deleted 10.233.124.26 dev calica776e3d319 scope link`

at this point, the pod is still unable to reach the destination until this log event showed up:
`[2019-03-06T19:54:01.784388] 10.233.124.26 dev calica776e3d319 scope link`

based on tcpdump output, exactly few ms after above the pod gained networks access:
```19:54:02.630940 IP 10.233.124.26 > 10.233.107.193: ICMP echo request, id 89, seq 0, length 64
19:54:02.631060 IP 10.233.124.26 > 10.233.107.193: ICMP echo request, id 89, seq 0, length 64
19:54:02.631498 IP 10.233.107.193 > 10.233.124.26: ICMP echo reply, id 89, seq 0, length 64
19:54:02.631543 IP 10.233.107.193 > 10.233.124.26: ICMP echo reply, id 89, seq 0, length 64```

**Comment by caseydavenport** [comment]
> [2019-03-06T19:52:37.407405] Deleted 10.233.124.26 dev calica776e3d319 scope link

Awesome sleuthing! This does appear to be a really good indication of what might be happening - something seems to be deleting the route to the pod almost immediately after it is created by Calico. I'm guessing that the re-add is Felix noticing that the route has been deleted and correcting it.

Is there anything else running on the machine that might be manipulating the routing table in the root network namespace? For example, [network manager](https://docs.projectcalico.org/v3.5/usage/troubleshooting/#configure-networkmanager)? If so, it might be the culprit.

If you have the calico/node logs from that time period, it would be useful to see if there is any indication of it removing or adding the route at the times specified.

**Comment by dannyk81** [comment]
Thanks @caseydavenport!

We are using CoreOS which doesn't have NetworkManager and I can't think of anything else that could interfere here...

I went through the logs and found this:
```
2019-03-06 19:54:01.779 [INFO][59] int_dataplane.go 751: Applying dataplane updates
2019-03-06 19:54:01.779 [INFO][59] route_table.go 189: Queueing a resync of routing table. ipVersion=0x4
2019-03-06 19:54:01.784 [INFO][59] route_table.go 463: Syncing routes: adding new route. ifaceName="calica776e3d319" ipVersion=0x4 targetCIDR=10.233.124.26/32
2019-03-06 19:54:01.785 [INFO][59] int_dataplane.go 765: Finished applying updates to dataplane. msecToApply=5.32687
```
indeed, at that timestamp exactly the pod network became operational.

I captured the logs around the creation of the pod (common/dns-test-7f9bbd8779-nwm2j on IP 10.233.124.26, cali interface: calica776e3d319)

This bit looked a bit strange:
```
2019-03-06 19:52:37.398 [INFO][59] int_dataplane.go 751: Applying dataplane updates
2019-03-06 19:52:37.398 [INFO][59] route_table.go 442: Syncing routes: found unexpected route; ignoring due to grace period. dest=10.233.124.26/32 ifaceName="calica776e3d319" ipVersion=0x4
2019-03-06 19:52:37.399 [INFO][59] route_table.go 298: Interface in cleanup grace period, will retry after. ifaceName="calica776e3d319" ipVersion=0x4
2019-03-06 19:52:37.399 [INFO][59] int_dataplane.go 765: Finished applying updates to dataplane. msecToApply=0.37752800000000003
```

Not sure why it says the route is unexpected :man_shrugging: maybe I just misunderstand what it means.

I'm attaching the full log, so hope that will help.


[calico-node.log](https://github.com/projectcalico/calico/files/2939388/calico-node.log)

**Comment by redbaron** [comment]
Unexpected route? There was a [fix](https://github.com/projectcalico/confd/pull/204) to calico where it was processing BGP peers non deteministically, is there a chance to bump Calico to 3.4.2 which includes it?

**Comment by fasaxc** [comment]
@dannyk81 Unexpected route means that felix hasn't heard about the pod yet so the route for the pod isn't yet expected; it allows a grace period before cleaning it up.  In this case, looks like it hears about the pod before the end of the grace period, which is all as it should be.

The delay between detecting the route, hearing about the pod and finishing setting up the pod is about 40ms in your trace.

Then, later, Felix detects that the route was removed and re-adds it.

It does look like another process is removing the route.  Felix logs an explicit message when it removes a route and I don't see that in your trace.

Might be worth a look in the kubelet logs; maybe it's tearing down the networking for the pod for some reason.

**Comment by redbaron** [comment]
> Unexpected route means that felix hasn't heard about the pod yet so the route for the pod isn't yet expected; it allows a grace period before cleaning it up.

just for my education, what is relation between bird and felix? I was under impression, that bird manages all the routes, why felix is peeking?

**Comment by dannyk81** [comment]
Thanks @fasaxc, I'm reviewing the kubelet and system logs for that time period now, I didn't see anything suspicious when I skimmed through it yesterday though...

It would be nice of `ip monitor` (or maybe some other tool?) could show what process initiated the delete command... will keep searching.

**Comment by dannyk81** [comment]
I've gone through the system and kubelet logs from that time period and I can't see anything that may indicate what is deleting this route :disappointed: 

I've attached the logs in case you want to take a look.

[sys_and_kubelet.log](https://github.com/projectcalico/calico/files/2941899/sys_and_kubelet.log)

**Comment by dannyk81** [comment]
@fasaxc I've been reviewing Calico logs I attached above and I can't seem to figure out where exactly the route is being added for the first time.

These are the events I found regarding routes:
```
2019-03-06 19:52:37.398 [INFO][59] route_table.go 442: Syncing routes: found unexpected route; ignoring due to grace period. dest=10.233.124.26/32 ifaceName="calica776e3d319" ipVersion=0x4
2019-03-06 19:52:37.398 [INFO][59] route_table.go 298: Interface in cleanup grace period, will retry after. ifaceName="calica776e3d319" ipVersion=0x4
2019-03-06 19:52:37.398 [INFO][59] route_table.go 442: Syncing routes: found unexpected route; ignoring due to grace period. dest=10.233.124.26/32 ifaceName="calica776e3d319" ipVersion=0x4
2019-03-06 19:52:37.399 [INFO][59] route_table.go 298: Interface in cleanup grace period, will retry after. ifaceName="calica776e3d319" ipVersion=0x4
2019-03-06 19:52:37.405 [INFO][59] endpoint_mgr.go 442: Updating endpoint routes. id=proto.WorkloadEndpointID{OrchestratorId:"k8s", WorkloadId:"common/dns-test-7f9bbd8779-nwm2j", EndpointId:"eth0"}
2019-03-06 19:52:38.649 [INFO][59] route_table.go 446: Syncing routes: removing old route. dest=10.233.124.25/32 ifaceName="cali4089a6f5728" ipVersion=0x4
2019-03-06 19:54:01.779 [INFO][59] route_table.go 189: Queueing a resync of routing table. ipVersion=0x4
2019-03-06 19:54:01.784 [INFO][59] route_table.go 463: Syncing routes: adding new route. ifaceName="calica776e3d319" ipVersion=0x4 targetCIDR=10.233.124.26/32
```

But it's not clear when the route is added for the first time, I only see the route added back at `19:54:01.784`.

I'm trying to correlate things with other logs/tests I'm doing and I want to know when the initial route was configured.

**Comment by dannyk81** [comment]
I've created a small program to trace netlink similarly like `ip monitor` does but it also extracts the Port ID (PID) field and parses the first 22 bits (which should include the Process ID that initiated the netlink call).

Here's what I get when spinning a new pod (will break it down by steps):
```
2019-03-08 20:19:21 INFO  [main] [netmon.c:272] New network interface cali60759074a91, state: DOWN NOT RUNNING
2019-03-08 20:19:21 INFO  [main] [netmon.c:272] New network interface cali60759074a91, state: UP RUNNING
2019-03-08 20:19:21 INFO  [main] [netmon.c:272] New network interface cali60759074a91, state: UP RUNNING
```
^^ Interface created

```
2019-03-08 20:19:21 INFO  [main] [netmon.c:151] Routing table was changed
2019-03-08 20:19:21 INFO  [main] [netmon.c:160] └---> Route added by PID=27434
2019-03-08 20:19:21 INFO  [main] [netmon.c:181] └------> Destination: 10.233.124.47
2019-03-08 20:19:21 INFO  [main] [netmon.c:217] └------> oif: if183 (cali60759074a91)
```
^^ The route has been added, the PID here translates to 27434, using [execsnoop](https://github.com/brendangregg/perf-tools/blob/master/execsnoop) I'm able to see that this is in fact calico cni:
```
274563.403837     27434  31326 /opt/cni/bin/calico
```

now comes the sad part, as `ip monitor` showed the route is being deleted:
```
2019-03-08 20:19:22 INFO  [main] [netmon.c:151] Routing table was changed
2019-03-08 20:19:22 INFO  [main] [netmon.c:164] └---> Route deleted by PID=1
2019-03-08 20:19:22 INFO  [main] [netmon.c:181] └------> Destination: 10.233.124.47
2019-03-08 20:19:22 INFO  [main] [netmon.c:217] └------> oif: if183 (cali60759074a91)
```

^^ the PID here is `1` :scream:... I don't really understand this point... is this the kernel? systemd?

anyway, the trace continues:
```
2019-03-08 20:19:22 INFO  [main] [netmon.c:151] Routing table was changed
2019-03-08 20:19:22 INFO  [main] [netmon.c:160] └---> Route added by PID=1668673
2019-03-08 20:19:22 INFO  [main] [netmon.c:181] └------> Destination: 10.233.124.47
2019-03-08 20:19:22 INFO  [main] [netmon.c:217] └------> oif: if183 (cali60759074a91)
```
^^ looks like calico noticed the route is missing and is adding it back.

above was a "good" scenario since the reconciliation of the missing route happened very quickly, but this is quite random - other tests can have 5s, 10s and even >60s delays.

---

I realize this is not a Calico issue per-se... but posting here anyway in case anyone has any ideas, we are starting to lose hope :cry:

**Comment by redbaron** [comment]
fantastic debugging!

If it is PID1 check `networkctl status` and see if it manages cali* interfaces

**Comment by dannyk81** [comment]
Thanks @redbaron!


I'm not sure if it "manages" them, but they are listed:
```
green-kubw-01 udev # networkctl status
●        State: routable
       Address: 10.230.83.184 on ens192
                10.233.0.1 on kube-ipvs0
                10.233.0.3 on kube-ipvs0
                10.233.3.201 on kube-ipvs0
                10.233.21.13 on kube-ipvs0
                10.233.33.236 on kube-ipvs0
                10.233.44.216 on kube-ipvs0
                169.254.25.10 on nodelocaldns
                fe80::250:56ff:fe85:54d5 on ens192
                fe80::42:96ff:fe37:dfa0 on docker0
                fe80::e84d:79ff:feeb:6b00 on kube-ipvs0
                fe80::ecee:eeff:feee:eeee on cali18c97127c40
                fe80::ecee:eeff:feee:eeee on cali0625307bdba
                fe80::ecee:eeff:feee:eeee on cali19049076414
                fe80::ecee:eeff:feee:eeee on calib41deafc7f6
                fe80::ecee:eeff:feee:eeee on cali1f9aa2cfd91
                fe80::ecee:eeff:feee:eeee on calia217962bf80
                fe80::f07f:c3ff:feb5:f3d1 on nodelocaldns
                fe80::ecee:eeff:feee:eeee on calia6e0a155533
                fe80::ecee:eeff:feee:eeee on califd1609ab2b5
       Gateway: 10.230.83.254 (Hewlett Packard) on ens192
           DNS: 10.230.95.6
                10.230.95.7
           NTP: 192.168.69.21
                192.168.69.22
```

Is there maybe a way to tell it to ignore these `cali*` interfaces?

**Comment by redbaron** [comment]
sorry, try `networkctl` without status, it should show if interface is managed. 

```

**Comment by redbaron** [comment]
If they are managed, create 

```
# /etc/systemd/network/10-ignore-calico.network
[Match]
Name=cali*

[Link]
Unmanaged=yes
```

and then `systemctl restart systemd-networkd.service`

see https://www.freedesktop.org/software/systemd/man/systemd.network.html for more details

**Comment by dannyk81** [comment]
Thanks @redbaron, will try this later and report.

**Comment by dannyk81** [comment]
I added the following file:
```
green-kubw-01 ~ # cat /etc/systemd/network/20-ignore-cali.network 
#  SPDX-License-Identifier: LGPL-2.1+
#
#  This file is part of systemd.
#
#  systemd is free software; you can redistribute it and/or modify it
#  under the terms of the GNU Lesser General Public License as published by
#  the Free Software Foundation; either version 2.1 of the License, or
#  (at your option) any later version.

[Match]
Name=cali*

[Link]
Unmanaged=yes
```

and restarted the node, however the issue remains and `networkctl` shows:
```
green-kubw-01 ~ # networkctl 
IDX LINK             TYPE               OPERATIONAL SETUP     
  1 lo               loopback           carrier     configured
  2 eth0             ether              routable    configured
  3 docker0          bridge             no-carrier  configuring
  5 kube-ipvs0       ether              routable    configuring
  6 cali0625307bdba  ether              degraded    configuring
  8 cali1f9aa2cfd91  ether              degraded    configuring
  9 calia217962bf80  ether              degraded    configuring
 10 cali19049076414  ether              degraded    configuring
 11 cali18c97127c40  ether              degraded    configuring
 12 calia6e0a155533  ether              degraded    configuring
 13 calib41deafc7f6  ether              degraded    configuring
 14 nodelocaldns     ether              routable    configuring
 15 calid075e7f2977  ether              degraded    configuring

13 links listed.
```
^^ this output was the same before.

These interfaces seems to be stuck in `configuring`, also another thing which we noticed is that the `cali*` interfaces don't have any IPs when check with `ip a`, e.g.:
```
6: cali0625307bdba@if3: <BROADCAST,MULTICAST,UP,LOWER_UP> mtu 1500 qdisc noqueue state UP group default 
    link/ether ee:ee:ee:ee:ee:ee brd ff:ff:ff:ff:ff:ff link-netnsid 0
    inet6 fe80::ecee:eeff:feee:eeee/64 scope link 
       valid_lft forever preferred_lft forever
```

I always assumed that's correct, or should we see the IP here?

**Comment by redbaron** [comment]
What if you get status of one of those cali interfaces with networkctl
command? It should show which .network file was used

**Comment by dannyk81** [comment]
@redbaron bingo! we just figured it out:

```
core@blue-kubw-02 ~ $ networkctl status cali2bd9ed59e74
● 5269: cali2bd9ed59e74
       Link File: /usr/lib64/systemd/network/99-default.link
    Network File: /etc/systemd/network/10-vmware.network
            Type: ether
           State: degraded (configuring)
          Driver: veth
      HW Address: ee:ee:ee:ee:ee:ee
         Address: fe80::ecee:eeff:feee:eeee
```

it was picking up the wrong network file (10-vmware.network) because that file didn't have the proper filter:
```
[Match]
Virtualization=vmware

[Network]
DHCP=ipv4
```

We added `Driver=vmxnet3` to the Match section and now `cali*` interfaces are unmanaged and routes are no longer deleted \o/

```
green-kubw-01 ~ # networkctl 
IDX LINK             TYPE               OPERATIONAL SETUP     
  1 lo               loopback           carrier     configured
  2 eth0             ether              routable    configuring
  3 docker0          bridge             no-carrier  unmanaged 
  5 kube-ipvs0       ether              degraded    configuring
  6 cali0625307bdba  ether              degraded    unmanaged 
  8 cali1f9aa2cfd91  ether              degraded    unmanaged 
  9 calia217962bf80  ether              degraded    unmanaged 
 10 cali19049076414  ether              degraded    unmanaged 
 11 cali18c97127c40  ether              degraded    unmanaged 
 12 calia6e0a155533  ether              degraded    unmanaged 
 13 calib41deafc7f6  ether              degraded    unmanaged 
 17 nodelocaldns     ether              routable    unmanaged 
 21 cali5bfc654e95c  ether              degraded    unmanaged
```

Thanks for picking up on the clues and giving us this file push!!! :smile:

**Comment by dannyk81** [comment]
I'm closing this issue now and going to sleep with a smile :smile: 

Thanks everyone for giving us a :hand: with this! @lwr20 @redbaron @fasaxc 


This indeed was not a Calico issue, but I'm glad you were here to assist resolve this and perhaps this can help others who may stumble on a similar pitfall.

Good night and have a great weekend!

P.S. if anyone's interesting, here's the code I used for the `netmon` program that helped me trace things in netlink: https://github.com/dannyk81/netmon (credits to a lot of awesome code I "stole" from others :wink:)

**Comment by hhstu** [comment]
calico-node    logs：

``` json

2020-09-27 07:27:05.308 [INFO][57] int_dataplane.go 921: Finished applying updates to dataplane. msecToApply=0.152712
bird: Netlink: Network is down
bird: Netlink: Network is down
bird: Netlink: Network is down
bird: Netlink: Network is down
bird: Netlink: Network is down
bird: Netlink: Network is down
bird: ...
bird: Netlink: Network is down
bird: Netlink: Network is down
bird: ...
2020-09-27 07:27:11.516 [INFO][57] int_dataplane.go 907: Applying dataplane updates
2020-09-27 07:27:11.517 [INFO][57] ipsets.go 223: Asked to resync with the dataplane on next update. family="inet"
2020-09-27 07:27:11.517 [INFO][57] ipsets.go 306: Resyncing ipsets with dataplane. family="inet"
2020-09-27 07:27:11.525 [INFO][57] ipsets.go 356: Finished resync family="inet" numInconsistenciesFound=0 resyncDuration=8.50626ms
2020-09-27 07:27:11.526 [INFO][57] int_dataplane.go 921: Finished applying updates to dataplane. msecToApply=8.953452
bird: Netlink: Network is down
bird: Netlink: Network is down
bird: ...
2020-09-27 07:27:15.279 [INFO][57] ipip_mgr.go 133: Tunnel wasn't admin up, enabling it flags=0 mtu=1440 tunnelAddr=10.233.77.0
2020-09-27 07:27:15.279 [INFO][57] ipip_mgr.go 138: Set tunnel admin up mtu=1440 tunnelAddr=10.233.77.0
2020-09-27 07:27:15.280 [INFO][57] int_dataplane.go 551: Linux interface state changed. ifaceName="tunl0" state="up"
2020-09-27 07:27:15.280 [INFO][57] ipip_mgr.go 183: Address wasn't present, adding it. addr=10.233.77.0 link="tunl0"
2020-09-27 07:27:15.280 [INFO][57] int_dataplane.go 797: Received interface update msg=&intdataplane.ifaceUpdate{Name:"tunl0", State:"up"}
2020-09-27 07:27:15.280 [INFO][57] int_dataplane.go 907: Applying dataplane updates
2020-09-27 07:27:15.281 [INFO][57] int_dataplane.go 921: Finished applying updates to dataplane. msecToApply=0.10069800000000001
2020-09-27 07:27:15.281 [INFO][57] int_dataplane.go 584: Linux interface addrs changed. addrs=set.mapSet{"10.233.77.0":set.empty{}} ifaceName="tunl0"
2020-09-27 07:27:15.281 [INFO][57] iface_monitor.go 176: Netlink address update. addr="10.233.77.0" exists=true ifIndex=39
2020-09-27 07:27:15.281 [INFO][57] int_dataplane.go 812: Received interface addresses update msg=&intdataplane.ifaceAddrsUpdate{Name:"tunl0", Addrs:set.mapSet{"10.233.77.0":set.empty{}}}
2020-09-27 07:27:15.281 [INFO][57] hostip_mgr.go 84: Interface addrs changed. update=&intdataplane.ifaceAddrsUpdate{Name:"tunl0", Addrs:set.mapSet{"10.233.77.0":set.empty{}}}
2020-09-27 07:27:15.281 [INFO][57] ipsets.go 119: Queueing IP set for creation family="inet" setID="this-host" setType="hash:ip"
2020-09-27 07:27:15.281 [INFO][57] int_dataplane.go 907: Applying dataplane updates
2020-09-27 07:27:15.282 [INFO][57] ipsets.go 749: Doing full IP set rewrite family="inet" numMembersInPendingReplace=5 setID="this-host"
2020-09-27 07:27:15.283 [INFO][57] iface_monitor.go 176: Netlink address update. addr="10.233.77.0" exists=false ifIndex=39
2020-09-27 07:27:15.283 [INFO][57] int_dataplane.go 584: Linux interface addrs changed. addrs=set.mapSet{} ifaceName="tunl0"
2020-09-27 07:27:15.292 [INFO][57] int_dataplane.go 551: Linux interface state changed. ifaceName="tunl0" state="down"
2020-09-27 07:27:15.296 [INFO][57] int_dataplane.go 921: Finished applying updates to dataplane. msecToApply=14.370695
2020-09-27 07:27:15.296 [INFO][57] int_dataplane.go 812: Received interface addresses update msg=&intdataplane.ifaceAddrsUpdate{Name:"tunl0", Addrs:set.mapSet{}}
2020-09-27 07:27:15.296 [INFO][57] hostip_mgr.go 84: Interface addrs changed. update=&intdataplane.ifaceAddrsUpdate{Name:"tunl0", Addrs:set.mapSet{}}
2020-09-27 07:27:15.296 [INFO][57] ipsets.go 119: Queueing IP set for creation family="inet" setID="this-host" setType="hash:ip"
2020-09-27 07:27:15.296 [INFO][57] int_dataplane.go 907: Applying dataplane updates
2020-09-27 07:27:15.298 [INFO][57] ipsets.go 749: Doing full IP set rewrite family="inet" numMembersInPendingReplace=4 setID="this-host"
2020-09-27 07:27:15.383 [INFO][57] int_dataplane.go 921: Finished applying updates to dataplane. msecToApply=87.06132199999999
2020-09-27 07:27:15.384 [INFO][57] int_dataplane.go 797: Received interface update msg=&intdataplane.ifaceUpdate{Name:"tunl0", State:"down"}
2020-09-27 07:27:15.384 [INFO][57] int_dataplane.go 907: Applying dataplane updates
2020-09-27 07:27:15.384 [INFO][57] int_dataplane.go 921: Finished applying updates to dataplane. msecToApply=0.108008
bird: Netlink: Network is down
bird: Netlink: Network is down
bird: Netlink: Network is down
bird: Netlink: Network is down

```
