### ISSUE TITLE
natOutgoing / SNAT not working for HA single-stack ipv6 bpf cluster running on dual-stack host

### ISSUE THREAD

**Issue by brentmjohnson** [projectcalico/calico#8636]
Using tigera operator, can't seem to get SNAT working for pod egress.

## Expected Behavior
SNAT should work for egress to external services not running on cluster nodes.

## Current Behavior
SNATing is not occurring during egress with source address showing the pod ip for traffic leaving the cluster.

## Possible Solution
None identified.

## Steps to Reproduce (for bugs)
1. provision HA single-stack ipv6 kubernetes cluster (via kubeadm) on dual-stack host and one non-cluster dual-stack host for control plane endpoint load balancing (and other services) in same ipv6 local-link network/subnet
2. install tigera operator via [https://raw.githubusercontent.com/projectcalico/calico/v3.27.2/manifests/tigera-operator.yaml](https://raw.githubusercontent.com/projectcalico/calico/v3.27.2/manifests/tigera-operator.yaml)
3. install calico via the following installation manifest:
```
apiVersion: operator.tigera.io/v1
kind: Installation
metadata:
  name: default
spec:
  calicoNetwork:
    ipPools:
    - blockSize: 122
      cidr: fd00::10:244:0:0/108
      disableBGPExport: true
      encapsulation: VXLANCrossSubnet
      natOutgoing: Enabled
      nodeSelector: all()
    linuxDataplane: BPF
    nodeAddressAutodetectionV4: {}
    nodeAddressAutodetectionV6:
      kubernetes: NodeInternalIP
  typhaMetricsPort: 9093
```
4. create pod (any image that can issue icmp6): kubectl run -it -n calico-system --rm debug --image=mbentley/bind-tools --restart=Never -- sh
5. make note of assigned pod ip:
```
~ $ ip -6 a | grep 'inet6'
    inet6 ::1/128 scope host 
    inet6 fd00::10:244:c:e7c4/128 scope global 
    inet6 fe80::40a6:6eff:fe18:4ef0/64 scope link 
```
6. start icmp6 to non-cluster host: `ping -6 k8s-lb`
7. monitor icmp6 traffic on non-cluster host: `tcpdump -i any icmp6`
8. observe source address arriving on icmp6 requests:
```
22:14:19.967367 eth0  In  IP6 fd00::10:244:c:e7c4 > k8s-lb: ICMP6, echo request, id 19912, seq 20, length 64
22:14:19.967422 eth0  Out IP6 k8s-lb > fd00::10:244:c:e7c4: ICMP6, echo reply, id 19912, seq 20, length 64
```

## Context
Response traffic to requests originating from the cluster are unroutable as external services shouldn't need custom routes for pod ip cidr(s) with functioning SNAT and MASQ on the cluster node for egress traffic.

## Your Environment
* Calico Cluster Version: v3.27.2
* Calico Cluster Type: typha,kdd,k8s,operator,bgp,kubeadm
* Orchestrator version: Kubernetes v1.29.2
* Operating System and version: Ubuntu 22.04.4 LTS

## Additional Calico Installation Details
* IPPools (created by tigera operator)
```
kubectl get ippools -o yaml
apiVersion: v1
items:
- apiVersion: crd.projectcalico.org/v1
  kind: IPPool
  metadata:
    annotations:
      projectcalico.org/metadata: '{"uid":"0e80d820-cc28-498f-ae7f-735d7e9dbacf","creationTimestamp":"2024-03-20T20:19:26Z"}'
    creationTimestamp: "2024-03-20T20:19:26Z"
    generation: 1
    name: default-ipv4-ippool
    resourceVersion: "923"
    uid: 7c4a7359-0be7-48d6-ada6-33783010ea28
  spec:
    allowedUses:
    - Workload
    - Tunnel
    blockSize: 26
    cidr: 192.168.0.0/16
    ipipMode: Never
    natOutgoing: true
    nodeSelector: all()
    vxlanMode: Never
- apiVersion: crd.projectcalico.org/v1
  kind: IPPool
  metadata:
    annotations:
      projectcalico.org/metadata: '{"uid":"0649f662-66e1-45df-bf90-8ee9a8bfd988","creationTimestamp":"2024-03-20T20:19:26Z"}'
    creationTimestamp: "2024-03-20T20:19:26Z"
    generation: 1
    name: default-ipv6-ippool
    resourceVersion: "924"
    uid: 282d7d8e-a5a9-4050-bd9f-0045379442cb
  spec:
    allowedUses:
    - Workload
    - Tunnel
    blockSize: 122
    cidr: fd00::10:244:0:0/108
    disableBGPExport: true
    ipipMode: Never
    natOutgoing: true
    nodeSelector: all()
    vxlanMode: CrossSubnet
kind: List
metadata:
  resourceVersion: ""
```
* FelixConfiguration
```
apiVersion: v1
items:
- apiVersion: crd.projectcalico.org/v1
  kind: FelixConfiguration
  metadata:
    annotations:
      projectcalico.org/metadata: '{"uid":"a8003704-d53d-47ce-9c29-1937f3e5e420","generation":2,"creationTimestamp":"2024-03-20T20:19:18Z","managedFields":[{"manager":"operator","operation":"Update","apiVersion":"crd.projectcalico.org/v1","time":"2024-03-20T20:19:18Z","fieldsType":"FieldsV1","fieldsV1":{"f:spec":{".":{},"f:bpfLogLevel":{},"f:healthPort":{},"f:vxlanVNI":{}}}},{"manager":"OpenAPI-Generator","operation":"Update","apiVersion":"crd.projectcalico.org/v1","time":"2024-03-20T20:19:19Z","fieldsType":"FieldsV1","fieldsV1":{"f:spec":{"f:policySyncPathPrefix":{},"f:prometheusMetricsEnabled":{},"f:serviceLoopPrevention":{}}}}]}'
    creationTimestamp: "2024-03-20T20:19:18Z"
    generation: 3
    name: default
    resourceVersion: "926"
    uid: a8003704-d53d-47ce-9c29-1937f3e5e420
  spec:
    bpfConnectTimeLoadBalancing: TCP
    bpfHostNetworkedNATWithoutCTLB: Enabled
    bpfLogLevel: ""
    floatingIPs: Disabled
    healthPort: 9099
    logSeverityScreen: Info
    policySyncPathPrefix: /var/run/nodeagent
    prometheusMetricsEnabled: true
    reportingInterval: 0s
    serviceLoopPrevention: Disabled
    vxlanVNI: 4096
kind: List
metadata:
  resourceVersion: ""
```

## Additional Details (from node running icmp6 client pod)
* describe calico-node pod
```
Name:                 calico-node-vxmtm
Namespace:            calico-system
Priority:             2000001000
Priority Class Name:  system-node-critical
Service Account:      calico-node
Node:                 k8s-control-2/fd11::10:0:0:5
Start Time:           Wed, 20 Mar 2024 17:25:48 -0500
Labels:               app.kubernetes.io/name=calico-node
                      controller-revision-hash=558c45d59c
                      k8s-app=calico-node
                      pod-template-generation=2
Annotations:          hash.operator.tigera.io/cni-config: f2dea26b806eeb2a5867ba2b1d391bab0cc153a7
                      hash.operator.tigera.io/system: fdde45054a8ae4f629960ce37570929502e59449
                      tigera-operator.hash.operator.tigera.io/tigera-ca-private: c6784f1100cfddc78f4afeaaa3bea38d5caa9d9f
Status:               Running
IP:                   fd11::10:0:0:5
IPs:
  IP:           fd11::10:0:0:5
Controlled By:  DaemonSet/calico-node
Init Containers:
  flexvol-driver:
    Container ID:    containerd://5f0ddb8bd6efa47738e1cb19fb57168b91c029c26e0bd1e64edaec23ec708c52
    Image:           docker.io/calico/pod2daemon-flexvol:v3.27.2
    Image ID:        docker.io/calico/pod2daemon-flexvol@sha256:e9eaff6ec042d67398c25d1fc48f82511582993ec41f9541cabb03d0d59f9a6f
    Port:            <none>
    Host Port:       <none>
    SeccompProfile:  RuntimeDefault
    State:           Terminated
      Reason:        Completed
      Exit Code:     0
      Started:       Wed, 20 Mar 2024 17:25:49 -0500
      Finished:      Wed, 20 Mar 2024 17:25:49 -0500
    Ready:           True
    Restart Count:   0
    Environment:     <none>
    Mounts:
      /host/driver from flexvol-driver-host (rw)
      /var/run/secrets/kubernetes.io/serviceaccount from kube-api-access-hxnbm (ro)
  mount-bpffs:
    Container ID:    containerd://b7c2a3bda331ff279bf664369863226fdb30cc707b64742bdbb2cc095bcd614a
    Image:           docker.io/calico/node:v3.27.2
    Image ID:        docker.io/calico/node@sha256:0d00b1f4235652b370f3897803d7c8ef5a7059a081ab8d69ae02b7ca0cb0193b
    Port:            <none>
    Host Port:       <none>
    SeccompProfile:  RuntimeDefault
    Command:
      calico-node
      -init
    State:          Terminated
      Reason:       Completed
      Exit Code:    0
      Started:      Wed, 20 Mar 2024 17:25:49 -0500
      Finished:     Wed, 20 Mar 2024 17:25:49 -0500
    Ready:          True
    Restart Count:  0
    Environment:    <none>
    Mounts:
      /nodeproc from nodeproc (ro)
      /sys/fs from sys-fs (rw)
      /var/run/calico from var-run-calico (rw)
      /var/run/secrets/kubernetes.io/serviceaccount from kube-api-access-hxnbm (ro)
  install-cni:
    Container ID:    containerd://cfc8b47e7b5e33dc258ee110ea613771ef437ca4867f20eeea2386bdca5c2434
    Image:           docker.io/calico/cni:v3.27.2
    Image ID:        docker.io/calico/cni@sha256:d17e907f27956d82e978f4aee8c21f876230955f3fba51da621c7c49e71f2ece
    Port:            <none>
    Host Port:       <none>
    SeccompProfile:  RuntimeDefault
    Command:
      /opt/cni/bin/install
    State:          Terminated
      Reason:       Completed
      Exit Code:    0
      Started:      Wed, 20 Mar 2024 17:25:50 -0500
      Finished:     Wed, 20 Mar 2024 17:25:50 -0500
    Ready:          True
    Restart Count:  0
    Environment:
      CNI_CONF_NAME:            10-calico.conflist
      SLEEP:                    false
      CNI_NET_DIR:              /etc/cni/net.d
      CNI_NETWORK_CONFIG:       <set to the key 'config' of config map 'cni-config'>  Optional: false
      KUBERNETES_SERVICE_HOST:  k8s-lb
      KUBERNETES_SERVICE_PORT:  6443
    Mounts:
      /host/etc/cni/net.d from cni-net-dir (rw)
      /host/opt/cni/bin from cni-bin-dir (rw)
      /var/run/secrets/kubernetes.io/serviceaccount from kube-api-access-hxnbm (ro)
Containers:
  calico-node:
    Container ID:    containerd://634b4253af09096dcd58188f81cbe97e91d8b7e1f92426ed526cb7be20252108
    Image:           docker.io/calico/node:v3.27.2
    Image ID:        docker.io/calico/node@sha256:0d00b1f4235652b370f3897803d7c8ef5a7059a081ab8d69ae02b7ca0cb0193b
    Port:            <none>
    Host Port:       <none>
    SeccompProfile:  RuntimeDefault
    State:           Running
      Started:       Wed, 20 Mar 2024 17:25:51 -0500
    Ready:           True
    Restart Count:   0
    Liveness:        http-get http://localhost:9099/liveness delay=0s timeout=10s period=60s #success=1 #failure=3
    Readiness:       exec [/bin/calico-node -bird-ready -felix-ready] delay=0s timeout=10s period=30s #success=1 #failure=3
    Environment:
      DATASTORE_TYPE:                      kubernetes
      WAIT_FOR_DATASTORE:                  true
      CLUSTER_TYPE:                        k8s,operator,bgp
      CALICO_DISABLE_FILE_LOGGING:         false
      FELIX_DEFAULTENDPOINTTOHOSTACTION:   ACCEPT
      FELIX_HEALTHENABLED:                 true
      FELIX_HEALTHPORT:                    9099
      NODENAME:                             (v1:spec.nodeName)
      NAMESPACE:                           calico-system (v1:metadata.namespace)
      FELIX_TYPHAK8SNAMESPACE:             calico-system
      FELIX_TYPHAK8SSERVICENAME:           calico-typha
      FELIX_TYPHACAFILE:                   /etc/pki/tls/certs/tigera-ca-bundle.crt
      FELIX_TYPHACERTFILE:                 /node-certs/tls.crt
      FELIX_TYPHAKEYFILE:                  /node-certs/tls.key
      FIPS_MODE_ENABLED:                   false
      FELIX_TYPHACN:                       typha-server
      CALICO_MANAGE_CNI:                   true
      CALICO_IPV6POOL_CIDR:                fd00::10:244:0:0/108
      CALICO_IPV6POOL_VXLAN:               Never
      CALICO_IPV6POOL_BLOCK_SIZE:          122
      CALICO_IPV6POOL_NAT_OUTGOING:        true
      CALICO_IPV6POOL_NODE_SELECTOR:       all()
      CALICO_IPV6POOL_DISABLE_BGP_EXPORT:  true
      FELIX_BPFENABLED:                    true
      CALICO_NETWORKING_BACKEND:           bird
      IP:                                  none
      IP6:                                 autodetect
      IP6_AUTODETECTION_METHOD:            kubernetes-internal-ip
      FELIX_IPV6SUPPORT:                   true
      CALICO_ROUTER_ID:                    hash
      KUBERNETES_SERVICE_HOST:             k8s-lb
      KUBERNETES_SERVICE_PORT:             6443
    Mounts:
      /etc/pki/tls/cert.pem from tigera-ca-bundle (ro,path="ca-bundle.crt")
      /etc/pki/tls/certs from tigera-ca-bundle (ro)
      /host/etc/cni/net.d from cni-net-dir (rw)
      /lib/modules from lib-modules (ro)
      /node-certs from node-certs (ro)
      /run/xtables.lock from xtables-lock (rw)
      /sys/fs/bpf from bpffs (rw)
      /var/lib/calico from var-lib-calico (rw)
      /var/log/calico/cni from cni-log-dir (rw)
      /var/run/calico from var-run-calico (rw)
      /var/run/nodeagent from policysync (rw)
      /var/run/secrets/kubernetes.io/serviceaccount from kube-api-access-hxnbm (ro)
Conditions:
  Type                        Status
  PodReadyToStartContainers   True 
  Initialized                 True 
  Ready                       True 
  ContainersReady             True 
  PodScheduled                True 
Volumes:
  lib-modules:
    Type:          HostPath (bare host directory volume)
    Path:          /lib/modules
    HostPathType:  
  xtables-lock:
    Type:          HostPath (bare host directory volume)
    Path:          /run/xtables.lock
    HostPathType:  FileOrCreate
  policysync:
    Type:          HostPath (bare host directory volume)
    Path:          /var/run/nodeagent
    HostPathType:  DirectoryOrCreate
  tigera-ca-bundle:
    Type:      ConfigMap (a volume populated by a ConfigMap)
    Name:      tigera-ca-bundle
    Optional:  false
  node-certs:
    Type:        Secret (a volume populated by a Secret)
    SecretName:  node-certs
    Optional:    false
  var-run-calico:
    Type:          HostPath (bare host directory volume)
    Path:          /var/run/calico
    HostPathType:  
  var-lib-calico:
    Type:          HostPath (bare host directory volume)
    Path:          /var/lib/calico
    HostPathType:  
  sys-fs:
    Type:          HostPath (bare host directory volume)
    Path:          /sys/fs
    HostPathType:  DirectoryOrCreate
  bpffs:
    Type:          HostPath (bare host directory volume)
    Path:          /sys/fs/bpf
    HostPathType:  Directory
  nodeproc:
    Type:          HostPath (bare host directory volume)
    Path:          /proc
    HostPathType:  
  cni-bin-dir:
    Type:          HostPath (bare host directory volume)
    Path:          /opt/cni/bin
    HostPathType:  
  cni-net-dir:
    Type:          HostPath (bare host directory volume)
    Path:          /etc/cni/net.d
    HostPathType:  
  cni-log-dir:
    Type:          HostPath (bare host directory volume)
    Path:          /var/log/calico/cni
    HostPathType:  
  flexvol-driver-host:
    Type:          HostPath (bare host directory volume)
    Path:          /usr/libexec/kubernetes/kubelet-plugins/volume/exec/nodeagent~uds
    HostPathType:  DirectoryOrCreate
  kube-api-access-hxnbm:
    Type:                    Projected (a volume that contains injected data from multiple sources)
    TokenExpirationSeconds:  3607
    ConfigMapName:           kube-root-ca.crt
    ConfigMapOptional:       <nil>
    DownwardAPI:             true
QoS Class:                   BestEffort
Node-Selectors:              kubernetes.io/os=linux
Tolerations:                 :NoSchedule op=Exists
                             :NoExecute op=Exists
                             CriticalAddonsOnly op=Exists
                             node.kubernetes.io/disk-pressure:NoSchedule op=Exists
                             node.kubernetes.io/memory-pressure:NoSchedule op=Exists
                             node.kubernetes.io/network-unavailable:NoSchedule op=Exists
                             node.kubernetes.io/not-ready:NoExecute op=Exists
                             node.kubernetes.io/pid-pressure:NoSchedule op=Exists
                             node.kubernetes.io/unreachable:NoExecute op=Exists
                             node.kubernetes.io/unschedulable:NoSchedule op=Exists
Events:
  Type     Reason     Age                From               Message
  ----     ------     ----               ----               -------
  Normal   Scheduled  26m                default-scheduler  Successfully assigned calico-system/calico-node-vxmtm to k8s-control-2
  Normal   Pulled     26m                kubelet            Container image "docker.io/calico/pod2daemon-flexvol:v3.27.2" already present on machine
  Normal   Created    26m                kubelet            Created container flexvol-driver
  Normal   Started    26m                kubelet            Started container flexvol-driver
  Normal   Pulled     26m                kubelet            Container image "docker.io/calico/node:v3.27.2" already present on machine
  Normal   Created    26m                kubelet            Created container mount-bpffs
  Normal   Started    26m                kubelet            Started container mount-bpffs
  Normal   Pulled     26m                kubelet            Container image "docker.io/calico/cni:v3.27.2" already present on machine
  Normal   Created    26m                kubelet            Created container install-cni
  Normal   Started    26m                kubelet            Started container install-cni
  Normal   Pulled     26m                kubelet            Container image "docker.io/calico/node:v3.27.2" already present on machine
  Normal   Created    26m                kubelet            Created container calico-node
  Normal   Started    26m                kubelet            Started container calico-node
  Warning  Unhealthy  26m (x2 over 26m)  kubelet            Readiness probe failed: calico/node is not ready: BIRD is not ready: Error querying BIRD: unable to connect to BIRDv4 socket: dial unix /var/run/calico/bird.ctl: connect: connection refused
```

* calico-node -show-status
```
bird v4 status
+-------+-------------------+---------------+---------------------+---------------------+---------------------+
| READY |      VERSION      |    ROUTEID    |     SERVERTIME      |      LASTBOOT       |    LASTRECONFIG     |
+-------+-------------------+---------------+---------------------+---------------------+---------------------+
| true  | v0.3.3+birdv1.6.8 | 145.35.94.133 | 2024-03-20 20:41:45 | 2024-03-20 20:40:46 | 2024-03-20 20:40:46 |
+-------+-------------------+---------------+---------------------+---------------------+---------------------+

bird v4 BGP peers
+--------------+-----------+-------+-------+----------+
| PEER ADDRESS | PEER TYPE | STATE | SINCE | BGPSTATE |
+--------------+-----------+-------+-------+----------+
+--------------+-----------+-------+-------+----------+

bird v4 routes
+-------------+----------+-------+-------------+---------+
| DESTINATION | GATEWAY  | IFACE | LEARNEDFROM | PRIMARY |
+-------------+----------+-------+-------------+---------+
| 0.0.0.0/0   | 10.0.0.1 | eth0  | kernel1     | *       |
| 10.0.0.2/32 | N/A      | eth0  | kernel1     | *       |
| 10.0.0.0/24 | N/A      | eth0  | direct1     | *       |
| 10.0.0.1/32 | N/A      | eth0  | kernel1     | *       |
+-------------+----------+-------+-------------+---------+



bird v6 status
+-------+-------------------+---------------+---------------------+---------------------+---------------------+
| READY |      VERSION      |    ROUTEID    |     SERVERTIME      |      LASTBOOT       |    LASTRECONFIG     |
+-------+-------------------+---------------+---------------------+---------------------+---------------------+
| true  | v0.3.3+birdv1.6.8 | 145.35.94.133 | 2024-03-20 20:41:45 | 2024-03-20 20:40:46 | 2024-03-20 20:40:46 |
+-------+-------------------+---------------+---------------------+---------------------+---------------------+

bird v6 BGP peers
+----------------+-----------+-------+----------+-------------+
|  PEER ADDRESS  | PEER TYPE | STATE |  SINCE   |  BGPSTATE   |
+----------------+-----------+-------+----------+-------------+
| fd11::10:0:0:3 | Mesh      | up    | 20:40:48 | Established |
| fd11::10:0:0:4 | Mesh      | up    | 20:40:48 | Established |
+----------------+-----------+-------+----------+-------------+

bird v6 routes
+-------------------------+--------------------------+-----------------+-------------+---------+
|       DESTINATION       |         GATEWAY          |      IFACE      | LEARNEDFROM | PRIMARY |
+-------------------------+--------------------------+-----------------+-------------+---------+
| ::/0                    | fe80::215:5dff:fe01:8013 | eth0            | kernel1     | *       |
| fd00::10:244:c:e7c4/128 | N/A                      | cali9afddb189c7 | kernel1     | *       |
| fd00::10:244:c:e7c0/122 | N/A                      | blackhole       | static1     | *       |
| fd00::10:244:c:e7c0/122 | N/A                      | blackhole       | kernel1     |         |
| fd00::10:244:c:e7c0/128 | N/A                      | vxlan-v6.calico | direct1     | *       |
| fd00::10:244:c:e7c3/128 | N/A                      | calidbcba662e5c | kernel1     | *       |
| fd00::10:244:c:e7c2/128 | N/A                      | calid4bb1f604df | kernel1     | *       |
| fd00::10:244:2:e200/122 | fd11::10:0:0:4           | eth0            | kernel1     | *       |
| 2001:db8::1/128         | N/A                      | bpfin.cali      | kernel1     | *       |
| fd00::10:244:e:d680/122 | fd11::10:0:0:3           | eth0            | kernel1     | *       |
| fd00::10:96:0:a/128     | 2001:db8::1              | bpfin.cali      | kernel1     | *       |
| fd11::10:0:0:0/118      | N/A                      | eth0            | kernel1     | *       |
| fd11::10:0:0:5/128      | N/A                      | eth0            | direct1     | *       |
+-------------------------+--------------------------+-----------------+-------------+---------+
```
* calico-node -bpf routes -6 dump
```
fd00::10:244:0:0/108: remote in-pool nat-out
fd00::10:244:2:e200/122: remote workload in-pool nat-out same-subnet tunneled nh fd11::10:0:0:4
fd00::10:244:2:e200/128: remote host in-pool nat-out same-subnet tunneled
fd00::10:244:c:e7c0/128: local host
fd00::10:244:c:e7c2/128: local workload in-pool nat-out same-subnet idx 3
fd00::10:244:c:e7c3/128: local workload in-pool nat-out same-subnet idx 7
fd00::10:244:c:e7c4/128: local workload in-pool nat-out same-subnet idx 8
fd00::10:244:e:d680/122: remote workload in-pool nat-out same-subnet tunneled nh fd11::10:0:0:3
fd00::10:244:e:d680/128: remote host in-pool nat-out same-subnet tunneled
fd11::10:0:0:3/128: remote host
fd11::10:0:0:4/128: remote host
fd11::10:0:0:5/128: local host
```
* calico-node -bpf nat -6 dump
```
fd00::10:96:0:6fee port 5473 proto 6 id 0 count 2 local 1
        0:0      [fd11::10:0:0:5]:5473
        0:1      [fd11::10:0:0:3]:5473
fd00::10:96:0:1 port 443 proto 6 id 1 count 3 local 0
        1:0      [fd11::10:0:0:3]:6443
        1:1      [fd11::10:0:0:4]:6443
        1:2      [fd11::10:0:0:5]:6443
fd00::10:96:0:a port 53 proto 6 id 3 count 2 local 0
        3:0      [fd00::10:244:2:e206]:53
        3:1      [fd00::10:244:2:e207]:53
fd00::10:96:0:a port 53 proto 17 id 2 count 2 local 0
        2:0      [fd00::10:244:2:e206]:53
        2:1      [fd00::10:244:2:e207]:53
fd00::10:96:0:a port 9153 proto 6 id 4 count 2 local 0
        4:0      [fd00::10:244:2:e206]:9153
        4:1      [fd00::10:244:2:e207]:9153
fd00::10:96:0:4e0 port 443 proto 6 id 5 count 1 local 0
        5:0      [fd00::10:244:e:d683]:9443
fd00::10:96:0:5858 port 443 proto 6 id 6 count 2 local 1
        6:0      [fd00::10:244:c:e7c3]:5443
        6:1      [fd00::10:244:e:d684]:5443
```

Hopefully just something I am doing wrong...

**Comment by brentmjohnson** [comment]
Confirmed spec.calicoNetwork.linuxDataplane = iptables works as expected (SNAT + MASQ) with above config.  If anyone has any ideas related to potential incorrect tigera operator generated manifests / config would be happy to try that out!

**Comment by tomastigera** [comment]
Could you share `ip6tables-save -c` output from the node where your ping pod runs? What is `k8s-lb` IP?

**Comment by brentmjohnson** [comment]
> Could you share `ip6tables-save -c` output from the node where your ping pod runs? What is `k8s-lb` IP?

Sure!

k8s-lb ip addr show eth0:
```
2: eth0: <BROADCAST,MULTICAST,UP,LOWER_UP> mtu 1500 qdisc mq state UP qlen 1000
    link/ether 00:15:5d:01:80:13 brd ff:ff:ff:ff:ff:ff
    inet 10.0.0.2/24 scope global eth0
       valid_lft forever preferred_lft forever
    inet6 fd11::10:0:0:2/118 scope global
       valid_lft forever preferred_lft forever
    inet6 fe80::215:5dff:fe01:8013/64 scope link
       valid_lft forever preferred_lft forever
```

k8s-control-2 ip6tables-save -c:
```
# Generated by ip6tables-save v1.8.7 on Fri Mar 22 23:49:09 2024
*mangle
:PREROUTING ACCEPT [0:0]
:INPUT ACCEPT [0:0]
:FORWARD ACCEPT [0:0]
:OUTPUT ACCEPT [0:0]
:POSTROUTING ACCEPT [0:0]
:KUBE-IPTABLES-HINT - [0:0]
:KUBE-KUBELET-CANARY - [0:0]
COMMIT
# Completed on Fri Mar 22 23:49:09 2024
# Generated by ip6tables-save v1.8.7 on Fri Mar 22 23:49:09 2024
*raw
:PREROUTING ACCEPT [0:0]
:OUTPUT ACCEPT [0:0]
:cali-PREROUTING - [0:0]
:cali-untracked-flows - [0:0]
:cali-untracked-policy - [0:0]
[412952:143527437] -A PREROUTING -m comment --comment "cali:6gwbT8clXdHdC1b1" -j cali-PREROUTING
[0:0] -A cali-PREROUTING -m comment --comment "cali:7zj7wGmwqVLvW3HM" -m comment --comment "Jump to target for packets with Bypass mark" -g cali-untracked-policy
[410096:143112825] -A cali-PREROUTING -m comment --comment "cali:7eWd-Mfcvj2ajb5P" -m comment --comment "Mark traffic towards the host - it is TRACKed" -m addrtype --dst-type LOCAL -j MARK --set-xmark 0x1100000/0x1100000
[2856:414612] -A cali-PREROUTING -m comment --comment "cali:Ym3djp8aZ-csATbF" -m comment --comment "Check if forwarded traffic needs to be TRACKed" -m addrtype ! --dst-type LOCAL -g cali-untracked-flows
[0:0] -A cali-untracked-flows -i docker+ -m comment --comment "cali:4NvdONeom6EEzmfy" -m comment --comment "Track interface docker+" -j RETURN
[39:2440] -A cali-untracked-flows -m comment --comment "cali:VtS22xg7f6wFtQnT" -m comment --comment "MarkSeenSkipFIB Mark" -j RETURN
[0:0] -A cali-untracked-flows -m comment --comment "cali:pTuyY-99YpsSnNwE" -m comment --comment "MarkSeenFallThrough Mark" -j RETURN
[0:0] -A cali-untracked-flows -m comment --comment "cali:YQVCNgli2v3VOBUb" -m comment --comment "MarkSeenMASQ Mark" -j RETURN
[2777:408872] -A cali-untracked-flows -m comment --comment "cali:wFRbW8MsubpMXL-g" -m comment --comment "MarkSeenNATOutgoing Mark" -j RETURN
[40:3300] -A cali-untracked-flows -m comment --comment "cali:YVfeAHk7oTMmiVm5" -j NOTRACK
[0:0] -A cali-untracked-policy -m comment --comment "cali:GmTHf-cZvJXoOqUt" -j MARK --set-xmark 0x0/0x0
[0:0] -A cali-untracked-policy -m comment --comment "cali:QJsxuYT1xa6WFzwv" -j NOTRACK
COMMIT
# Completed on Fri Mar 22 23:49:09 2024
# Generated by ip6tables-save v1.8.7 on Fri Mar 22 23:49:09 2024
*filter
:INPUT ACCEPT [0:0]
:FORWARD ACCEPT [0:0]
:OUTPUT ACCEPT [0:0]
:KUBE-KUBELET-CANARY - [0:0]
[301955:122068444] -A INPUT -m comment --comment "cali:zkuE8qdwsVpH6Kd2" -m comment --comment "Accept packets from flows that pre-date BPF." -m conntrack --ctstate RELATED,ESTABLISHED -j ACCEPT
[454:61469] -A INPUT -m comment --comment "cali:XQL0mC-L6wldZdgN" -m comment --comment "Drop packets from unknown flows." -j DROP
[2153:2062810] -A INPUT -i cali+ -m comment --comment "cali:pbFdTFCLcV-MVLSS" -j ACCEPT
[2:112] -A INPUT -i cali+ -m comment --comment "cali:u_TyW7ph8QsYnThE" -j DROP
[814:120205] -A FORWARD -m comment --comment "cali:umcmOn0WnTNOKJrp" -m comment --comment "Pre-approved by BPF programs." -j ACCEPT
[0:0] -A FORWARD -i cali+ -m comment --comment "cali:NnQ109Z-tVFkJGc1" -m comment --comment "From workload without BPF seen mark" -j DROP
[0:0] -A FORWARD -p ipv6-icmp -m comment --comment "cali:G6CqIT99Qk88vQD2" -m icmp6 --icmpv6-type 130 -j DROP
[0:0] -A FORWARD -p ipv6-icmp -m comment --comment "cali:WVM3dh_ZPuc35ye0" -m icmp6 --icmpv6-type 131 -j DROP
[0:0] -A FORWARD -p ipv6-icmp -m comment --comment "cali:n5mXFwHZlaojXhdv" -m icmp6 --icmpv6-type 132 -j DROP
[0:0] -A FORWARD -p ipv6-icmp -m comment --comment "cali:cOHnzciY9U-SqSTa" -m icmp6 --icmpv6-type 133 -j DROP
[0:0] -A FORWARD -p ipv6-icmp -m comment --comment "cali:RjGqPar5i0cePsNV" -m icmp6 --icmpv6-type 135 -j DROP
[0:0] -A FORWARD -p ipv6-icmp -m comment --comment "cali:hIySpSO-wo0K4WZK" -m icmp6 --icmpv6-type 136 -j DROP
[405535:154556234] -A OUTPUT -m comment --comment "cali:CD7jZCSqPP_KjGsd" -m comment --comment "Mark pre-established flows." -m conntrack --ctstate RELATED,ESTABLISHED -j MARK --set-xmark 0x8000000/0x8000000
COMMIT
# Completed on Fri Mar 22 23:49:09 2024
# Generated by ip6tables-save v1.8.7 on Fri Mar 22 23:49:09 2024
*nat
:PREROUTING ACCEPT [0:0]
:INPUT ACCEPT [0:0]
:OUTPUT ACCEPT [0:0]
:POSTROUTING ACCEPT [0:0]
:KUBE-KUBELET-CANARY - [0:0]
:cali-POSTROUTING - [0:0]
:cali-fip-snat - [0:0]
:cali-nat-outgoing - [0:0]
[4345:351743] -A POSTROUTING -m comment --comment "cali:O3lYWMrLQYEMJtB5" -j cali-POSTROUTING
[0:0] -A cali-POSTROUTING -m comment --comment "cali:ggLCSZ9_r9uXnHIo" -m comment --comment "BPF loopback SNAT" -j MASQUERADE --random-fully
[4345:351743] -A cali-POSTROUTING -m comment --comment "cali:THrmnLhAi3cxMLBO" -j cali-fip-snat
[4345:351743] -A cali-POSTROUTING -m comment --comment "cali:ez7mOi3T8N6rtIlJ" -j cali-nat-outgoing
[0:0] -A cali-POSTROUTING -o vxlan-v6.calico -m comment --comment "cali:i9aA9QlUgUVXqa4K" -m addrtype ! --src-type LOCAL --limit-iface-out -m addrtype --src-type LOCAL -j MASQUERADE --random-fully
[281:22480] -A cali-nat-outgoing -m comment --comment "cali:k9SjE1bWVYbIZgCm" -j MASQUERADE --random-fully
COMMIT
# Completed on Fri Mar 22 23:49:09 2024
```

note - this has been redeployed (should be same config), so you'll see different pod / ipam block assignments so here's the show-status as well:
```
bird v4 status
+-------+-------------------+---------------+---------------------+---------------------+---------------------+
| READY |      VERSION      |    ROUTEID    |     SERVERTIME      |      LASTBOOT       |    LASTRECONFIG     |
+-------+-------------------+---------------+---------------------+---------------------+---------------------+
| true  | v0.3.3+birdv1.6.8 | 145.35.94.133 | 2024-03-22 23:51:08 | 2024-03-22 23:42:59 | 2024-03-22 23:42:59 |
+-------+-------------------+---------------+---------------------+---------------------+---------------------+

bird v4 BGP peers
+--------------+-----------+-------+-------+----------+
| PEER ADDRESS | PEER TYPE | STATE | SINCE | BGPSTATE |
+--------------+-----------+-------+-------+----------+
+--------------+-----------+-------+-------+----------+

bird v4 routes
+-------------+----------+-------+-------------+---------+
| DESTINATION | GATEWAY  | IFACE | LEARNEDFROM | PRIMARY |
+-------------+----------+-------+-------------+---------+
| 0.0.0.0/0   | 10.0.0.1 | eth0  | kernel1     | *       |
| 10.0.0.2/32 | N/A      | eth0  | kernel1     | *       |
| 10.0.0.0/24 | N/A      | eth0  | direct1     | *       |
| 10.0.0.1/32 | N/A      | eth0  | kernel1     | *       |
+-------------+----------+-------+-------------+---------+



bird v6 status
+-------+-------------------+---------------+---------------------+---------------------+---------------------+
| READY |      VERSION      |    ROUTEID    |     SERVERTIME      |      LASTBOOT       |    LASTRECONFIG     |
+-------+-------------------+---------------+---------------------+---------------------+---------------------+
| true  | v0.3.3+birdv1.6.8 | 145.35.94.133 | 2024-03-22 23:51:08 | 2024-03-22 23:42:59 | 2024-03-22 23:42:59 |
+-------+-------------------+---------------+---------------------+---------------------+---------------------+

bird v6 BGP peers
+----------------+-----------+-------+----------+-------------+
|  PEER ADDRESS  | PEER TYPE | STATE |  SINCE   |  BGPSTATE   |
+----------------+-----------+-------+----------+-------------+
| fd11::10:0:0:3 | Mesh      | up    | 23:44:01 | Established |
| fd11::10:0:0:4 | Mesh      | up    | 23:43:29 | Established |
+----------------+-----------+-------+----------+-------------+

bird v6 routes
+-------------------------+--------------------------+-----------------+-------------+---------+
|       DESTINATION       |         GATEWAY          |      IFACE      | LEARNEDFROM | PRIMARY |
+-------------------------+--------------------------+-----------------+-------------+---------+
| ::/0                    | fe80::215:5dff:fe01:8013 | eth0            | kernel1     | *       |
| fd00::10:244:c:e7c5/128 | N/A                      | cali9afddb189c7 | kernel1     | *       |
| fd00::10:244:c:e7c4/128 | N/A                      | cali75db6953aa7 | kernel1     | *       |
| fd00::10:244:c:e7c0/122 | N/A                      | blackhole       | static1     | *       |
| fd00::10:244:c:e7c0/122 | N/A                      | blackhole       | kernel1     |         |
| fd00::10:244:c:e7c0/128 | N/A                      | vxlan-v6.calico | direct1     | *       |
| fd00::10:244:c:e7c3/128 | N/A                      | califde329b9f1d | kernel1     | *       |
| fd00::10:244:c:e7c2/128 | N/A                      | caliced6f8125e5 | kernel1     | *       |
| fd00::10:244:2:e200/122 | fd11::10:0:0:4           | eth0            | kernel1     | *       |
| fd00::10:96:0:c119/128  | 2001:db8::1              | bpfin.cali      | kernel1     | *       |
| 2001:db8::1/128         | N/A                      | bpfin.cali      | kernel1     | *       |
| fd00::10:244:e:d680/122 | fd11::10:0:0:3           | eth0            | kernel1     | *       |
| fd00::10:96:0:812d/128  | 2001:db8::1              | bpfin.cali      | kernel1     | *       |
| fd00::10:96:0:62ce/128  | 2001:db8::1              | bpfin.cali      | kernel1     | *       |
| fd00::10:96:0:1/128     | 2001:db8::1              | bpfin.cali      | kernel1     | *       |
| fd00::10:96:0:a/128     | 2001:db8::1              | bpfin.cali      | kernel1     | *       |
| fd11::10:0:0:0/118      | N/A                      | eth0            | kernel1     | *       |
| fd11::10:0:0:5/128      | N/A                      | eth0            | direct1     | *       |
+-------------------------+--------------------------+-----------------+-------------+---------+
```

**Comment by sridhartigera** [comment]
@brentmjohnson I am able to reproduce this issue. But the issue is specific to ICMPv6. I tested tcp and it works. We will be fixing this soon. Thanks.

**Comment by brentmjohnson** [comment]
Thanks for confirming. In cluster DNS seemed to proxy as expected. I will validate for TCP / UDP. Let me know if you expect any other protocols may need specific testing.

**Comment by sridhartigera** [comment]
The issue is only with ICMPv6.

**Comment by brentmjohnson** [comment]
I did identify one other issue / behavior in the current implementation in response forwarding of SNAT'ed requests.  I observed some fragmentation of response packets from the external service.  They looked like this in tcpdump on the node performing the SNAT'ing:

```
20:39:00.462276 IP6 k8s-lb > k8s-control-2: frag (1232|158)
20:39:03.918839 IP6 k8s-lb > k8s-control-2: frag (0|1232) http > 25373: Flags [.], seq 1:1201, ack 78, win 256, options [nop,nop,TS val 2342592066 ecr 1213597580], length 1200: HTTP: HTTP/1.1 200 OK
```

These appear to be dropped / not forwarded.  Is it expected ipv6 fragment forwarding should be handled in the ipv6 eBPF SNAT implementation? This is somewhat related to ICMPv6 as well as re RFC 2460 ICMP is used to notify the upstream in certain situations of fragment reassembly errors.

**Comment by brentmjohnson** [comment]
Thanks all, I will re-test once a dev image is available. Any feedback on expected level of support for forwarding of fragmented payloads?

**Comment by tomastigera** [comment]
@brentmjohnson `calico/node:v3.27.3-3-g547edf833d4c` should carry the fix. We just missed the 3.27.3 release, but this is essentially 3.27.3 + the fix. Let us know if it works for you and if it also fixed the fragmentation. If not, lets open another issue for that only :pray:

**Comment by brentmjohnson** [comment]
confirmed SNAT / MASQ of ICMP6 from pod network CIDR to external services in the node network CIDR works as expected now in `calico/node:v3.27.3-3-g547edf833d4c`

**Comment by sridhartigera** [comment]
@brentmjohnson Thanks for confirming.
