### ISSUE TITLE
Multi aarch x86_64 master, arm64 worker pod has no network

### ISSUE THREAD

**Issue by kub3let** [projectcalico/calico#5555]
I had a testlab setup with calico working on virtual x86_x64 hardware.

Trying to replicate the setup with a raspberry pi I can't get networking to work.

The pod on the worker can not ping anything, also the master can't ping the pod.

Ingress fails with timeout.

I'm kinda at a loss and don't know what I should try next, any help much appreciated.

I added a bunch of of environment information, maybe this gives a clue.

<details>
  <summary>Environment Information <- Click Me</summary>
  
```
root@kube1:~# kubectl get nodes -A -o wide
NAME          STATUS   ROLES                  AGE   VERSION        INTERNAL-IP     EXTERNAL-IP   OS-IMAGE                         KERNEL-VERSION    CONTAINER-RUNTIME
master1 Ready    control-plane,master   80m   v1.22.6+k3s1   192.168.1.11   <none>        Debian GNU/Linux 11 (bullseye)   5.10.0-11-amd64   containerd://1.5.9-k3s1
node1   Ready    <none>                 76m   v1.22.6+k3s1   192.168.1.14   <none>        Debian GNU/Linux 11 (bullseye)   5.10.92-v8+       containerd://1.5.9-k3s1
```

### master1 192.168.1.11 (x86_64 debian 11)

```
root@master1:~# uname -a
Linux master1 5.10.0-11-amd64 #1 SMP Debian 5.10.92-1 (2022-01-18) x86_64 GNU/Linux
```

```
root@master1:~# calicoctl get ippools -o wide
NAME                  CIDR           NAT    IPIPMODE   VXLANMODE   DISABLED   DISABLEBGPEXPORT   SELECTOR   
default-ipv4-ippool   10.42.0.0/16   true   Always     Never       false      false              all()      
default-ipv6-ippool   fd42::/48      true   Never      Never       false      false              all()    
```

```
root@master1:~# calicoctl node status
Calico process is running.

IPv4 BGP status
+---------------+-------------------+-------+----------+-------------+
| PEER ADDRESS  |     PEER TYPE     | STATE |  SINCE   |    INFO     |
+---------------+-------------------+-------+----------+-------------+
| 192.168.1.14  | node-to-node mesh | up    | 21:39:52 | Established |
+---------------+-------------------+-------+----------+-------------+

IPv6 BGP status
No IPv6 peers found.
```

```
root@master1:~# kubectl get pods -A -o wide
NAMESPACE        NAME                                       READY   STATUS    RESTARTS      AGE   IP              NODE          NOMINATED NODE   READINESS GATES
csi-nfs-system   csi-nfs-node-8ktq8                         3/3     Running   0             46m   192.168.1.11    master1         <none>           <none>
csi-nfs-system   csi-nfs-controller-b96969cc5-xlchf         3/3     Running   0             46m   192.168.1.11    master1         <none>           <none>
kube-system      coredns-96cc4f57d-xbqf7                    1/1     Running   0             47m   10.42.18.1      master1         <none>           <none>
kube-system      local-path-provisioner-84bb864455-2zrcs    1/1     Running   0             47m   10.42.18.6      master1         <none>           <none>
kube-system      calico-kube-controllers-6b9fbfff44-rshx8   1/1     Running   0             46m   10.42.18.4      master1         <none>           <none>
metallb-system   metallb-controller-7cb7dd579d-9lfw9        1/1     Running   0             46m   10.42.18.3      master1         <none>           <none>
metallb-system   metallb-speaker-pt4rr                      1/1     Running   0             45m   192.168.1.11    master1         <none>           <none>
kube-system      metrics-server-ff9dbcb6c-kldbr             1/1     Running   0             47m   10.42.18.5      master1         <none>           <none>
ingress-nginx    ingress-nginx-controller-fjn84             1/1     Running   0             45m   10.42.18.7      master1         <none>           <none>
flux-system      helm-controller-7fcd47658b-65lh9           1/1     Running   0             45m   10.42.18.9      master1         <none>           <none>
flux-system      kustomize-controller-6fdbd74654-mcbtx      1/1     Running   0             45m   10.42.18.10     master1         <none>           <none>
flux-system      notification-controller-d45f49bb5-hxfbk    1/1     Running   0             45m   10.42.18.11     master1         <none>           <none>
flux-system      source-controller-5f88b8664d-sbvng         1/1     Running   0             45m   10.42.18.12     master1         <none>           <none>
csi-nfs-system   csi-nfs-node-qg5h8                         3/3     Running   3 (13m ago)   43m   192.168.1.14    node1   <none>           <none>
pyload           pyload-857964bf6-jwmnn                     1/1     Running   1 (13m ago)   44m   10.42.246.2     node1   <none>           <none>
metallb-system   metallb-speaker-xpw58                      1/1     Running   1 (13m ago)   43m   192.168.1.14    node1   <none>           <none>
kube-system      calico-node-7nkjc                          1/1     Running   1 (13m ago)   43m   192.168.1.14    node1   <none>           <none>
kube-system      calico-node-4zn5q                          1/1     Running   0             46m   192.168.1.11    master1         <none>           <none>
```

```
root@master1:~# ip a
1: lo: <LOOPBACK,UP,LOWER_UP> mtu 65536 qdisc noqueue state UNKNOWN group default qlen 1000
    link/loopback 00:00:00:00:00:00 brd 00:00:00:00:00:00
    inet 127.0.0.1/8 scope host lo
       valid_lft forever preferred_lft forever
    inet6 ::1/128 scope host 
       valid_lft forever preferred_lft forever
2: eth0: <BROADCAST,MULTICAST,UP,LOWER_UP> mtu 1500 qdisc fq state UP group default qlen 1000
    link/ether da:3c:81:13:63:0e brd ff:ff:ff:ff:ff:ff
    altname enp6s18
    inet 192.168.1.11/24 brd 192.168.1.255 scope global eth0
       valid_lft forever preferred_lft forever
    inet6 xxxx:xxxx:xxxx:xxxx::11/64 scope global 
       valid_lft forever preferred_lft forever
    inet6 fe80::d83c:81ff:fe13:630e/64 scope link 
       valid_lft forever preferred_lft forever
3: kube-ipvs0: <BROADCAST,NOARP> mtu 1500 qdisc noop state DOWN group default 
    link/ether da:03:7b:08:55:78 brd ff:ff:ff:ff:ff:ff
    inet 10.43.178.133/32 scope global kube-ipvs0
       valid_lft forever preferred_lft forever
    inet 10.43.0.1/32 scope global kube-ipvs0
       valid_lft forever preferred_lft forever
    inet 10.43.0.10/32 scope global kube-ipvs0
       valid_lft forever preferred_lft forever
    inet 10.43.80.141/32 scope global kube-ipvs0
       valid_lft forever preferred_lft forever
    inet 10.43.214.156/32 scope global kube-ipvs0
       valid_lft forever preferred_lft forever
    inet 10.43.221.95/32 scope global kube-ipvs0
       valid_lft forever preferred_lft forever
    inet 10.43.52.21/32 scope global kube-ipvs0
       valid_lft forever preferred_lft forever
    inet 10.43.80.44/32 scope global kube-ipvs0
       valid_lft forever preferred_lft forever
    inet 10.43.221.166/32 scope global kube-ipvs0
       valid_lft forever preferred_lft forever
    inet 10.43.94.71/32 scope global kube-ipvs0
       valid_lft forever preferred_lft forever
    inet 192.168.1.137/32 scope global kube-ipvs0
       valid_lft forever preferred_lft forever
    inet6 fd43::ff28/128 scope global 
       valid_lft forever preferred_lft forever
4: tunl0@NONE: <NOARP,UP,LOWER_UP> mtu 1480 qdisc noqueue state UNKNOWN group default qlen 1000
    link/ipip 0.0.0.0 brd 0.0.0.0
    inet 10.42.18.0/32 scope global tunl0
       valid_lft forever preferred_lft forever
7: cali96e3c09e26b@if4: <BROADCAST,MULTICAST,UP,LOWER_UP> mtu 1480 qdisc noqueue state UP group default 
    link/ether ee:ee:ee:ee:ee:ee brd ff:ff:ff:ff:ff:ff link-netns cni-2251f959-9f0e-43a1-c6fe-b4296f647c0c
    inet6 fe80::ecee:eeff:feee:eeee/64 scope link 
       valid_lft forever preferred_lft forever
9: cali13de94f4d6a@if4: <BROADCAST,MULTICAST,UP,LOWER_UP> mtu 1480 qdisc noqueue state UP group default 
    link/ether ee:ee:ee:ee:ee:ee brd ff:ff:ff:ff:ff:ff link-netns cni-0fee7ee8-a579-2042-a9ee-22c7719d0208
    inet6 fe80::ecee:eeff:feee:eeee/64 scope link 
       valid_lft forever preferred_lft forever
10: cali02683cf6c05@if4: <BROADCAST,MULTICAST,UP,LOWER_UP> mtu 1480 qdisc noqueue state UP group default 
    link/ether ee:ee:ee:ee:ee:ee brd ff:ff:ff:ff:ff:ff link-netns cni-12aace70-2f08-4680-ce96-2007ea6fddc8
    inet6 fe80::ecee:eeff:feee:eeee/64 scope link 
       valid_lft forever preferred_lft forever
11: calid08b863baea@if4: <BROADCAST,MULTICAST,UP,LOWER_UP> mtu 1480 qdisc noqueue state UP group default 
    link/ether ee:ee:ee:ee:ee:ee brd ff:ff:ff:ff:ff:ff link-netns cni-21e1b7da-facb-273c-302d-f9061efba5d7
    inet6 fe80::ecee:eeff:feee:eeee/64 scope link 
       valid_lft forever preferred_lft forever
12: cali728f8b8ce1d@if4: <BROADCAST,MULTICAST,UP,LOWER_UP> mtu 1480 qdisc noqueue state UP group default 
    link/ether ee:ee:ee:ee:ee:ee brd ff:ff:ff:ff:ff:ff link-netns cni-57162527-a782-3dcb-2581-0cc6bf1ffcc3
    inet6 fe80::ecee:eeff:feee:eeee/64 scope link 
       valid_lft forever preferred_lft forever
13: cali16ae4d07900@if4: <BROADCAST,MULTICAST,UP,LOWER_UP> mtu 1480 qdisc noqueue state UP group default 
    link/ether ee:ee:ee:ee:ee:ee brd ff:ff:ff:ff:ff:ff link-netns cni-b5d15097-2726-0930-2235-f611c4b07c37
    inet6 fe80::ecee:eeff:feee:eeee/64 scope link 
       valid_lft forever preferred_lft forever
15: cali46a65cf9e1b@if4: <BROADCAST,MULTICAST,UP,LOWER_UP> mtu 1480 qdisc noqueue state UP group default 
    link/ether ee:ee:ee:ee:ee:ee brd ff:ff:ff:ff:ff:ff link-netns cni-adb4c7d0-6465-5eea-44d9-638d49c7dabb
    inet6 fe80::ecee:eeff:feee:eeee/64 scope link 
       valid_lft forever preferred_lft forever
16: cali9ea92723730@if4: <BROADCAST,MULTICAST,UP,LOWER_UP> mtu 1480 qdisc noqueue state UP group default 
    link/ether ee:ee:ee:ee:ee:ee brd ff:ff:ff:ff:ff:ff link-netns cni-df25a7ed-ab10-ae34-ca2d-1d378cad1f23
    inet6 fe80::ecee:eeff:feee:eeee/64 scope link 
       valid_lft forever preferred_lft forever
17: calie84b44316af@if4: <BROADCAST,MULTICAST,UP,LOWER_UP> mtu 1480 qdisc noqueue state UP group default 
    link/ether ee:ee:ee:ee:ee:ee brd ff:ff:ff:ff:ff:ff link-netns cni-98a67ab4-823d-d4cb-674c-13f62d825750
    inet6 fe80::ecee:eeff:feee:eeee/64 scope link 
       valid_lft forever preferred_lft forever
18: cali8cfba654903@if4: <BROADCAST,MULTICAST,UP,LOWER_UP> mtu 1480 qdisc noqueue state UP group default 
    link/ether ee:ee:ee:ee:ee:ee brd ff:ff:ff:ff:ff:ff link-netns cni-7b6fa4d4-38f0-2c99-972c-401a3f145fe3
    inet6 fe80::ecee:eeff:feee:eeee/64 scope link 
       valid_lft forever preferred_lft forever
```

```
root@master1:~# ip route
default via 192.168.1.1 dev eth0 onlink 
blackhole 10.42.18.0/26 proto bird 
10.42.18.1 dev cali96e3c09e26b scope link 
10.42.18.3 dev cali13de94f4d6a scope link 
10.42.18.4 dev cali02683cf6c05 scope link 
10.42.18.5 dev calid08b863baea scope link 
10.42.18.6 dev cali728f8b8ce1d scope link 
10.42.18.7 dev cali16ae4d07900 scope link 
10.42.18.9 dev cali46a65cf9e1b scope link 
10.42.18.10 dev cali9ea92723730 scope link 
10.42.18.11 dev calie84b44316af scope link 
10.42.18.12 dev cali8cfba654903 scope link 
10.42.246.0/26 via 192.168.1.14 dev tunl0 proto bird onlink 
192.168.1.0/24 dev eth0 proto kernel scope link src 192.168.1.11 
```

### node1 192.168.1.14 (arm64 raspberry pi os)
```
root@node1:~# uname -a
Linux node1 5.10.92-v8+ #1514 SMP PREEMPT Mon Jan 17 17:39:38 GMT 2022 aarch64 GNU/Linux
```

```
root@node1:~# crictl ps
CONTAINER           IMAGE               CREATED             STATE               NAME                    ATTEMPT             POD ID
11bddc9e0e69b       0b20ac5a431a0       15 minutes ago      Running             pyload                  1                   69dca329e73df
8c3ba65936d29       c70f0a6232023       15 minutes ago      Running             calico-node             1                   6bdceb11015a4
c6b2ef2f0f773       d14e66740d041       16 minutes ago      Running             nfs                     1                   1d2a357b297ec
6735d95827c00       5e4d0a64d3dbe       16 minutes ago      Running             node-driver-registrar   1                   1d2a357b297ec
9a3dc5953ce62       ad231eed51cf3       16 minutes ago      Running             speaker                 1                   605521f4b2935
3fa36384906eb       1220587e7f8b9       16 minutes ago      Running             liveness-probe          1                   1d2a357b297ec
```

```
root@node1:~# ip a
1: lo: <LOOPBACK,UP,LOWER_UP> mtu 65536 qdisc noqueue state UNKNOWN group default qlen 1000
    link/loopback 00:00:00:00:00:00 brd 00:00:00:00:00:00
    inet 127.0.0.1/8 scope host lo
       valid_lft forever preferred_lft forever
    inet6 ::1/128 scope host
       valid_lft forever preferred_lft forever
2: eth0: <BROADCAST,MULTICAST,UP,LOWER_UP> mtu 1500 qdisc mq state UP group default qlen 1000
    link/ether dc:a6:32:32:36:fc brd ff:ff:ff:ff:ff:ff
    inet 192.168.1.14/24 brd 192.168.1.255 scope global dynamic noprefixroute eth0
       valid_lft 6186sec preferred_lft 5286sec
    inet6 xxxx:xxxx:xxxx:xxxx:51f:ba84:e60b:7d49/128 scope global dynamic noprefixroute
       valid_lft 6183sec preferred_lft 3483sec
    inet6 xxxx:xxxx:xxxx:xxxx:33e9:7c75:9f69:e800/64 scope global dynamic mngtmpaddr noprefixroute
       valid_lft 86337sec preferred_lft 14337sec
    inet6 fe80::e640:61e8:18f8:fa2b/64 scope link
       valid_lft forever preferred_lft forever
3: wlan0: <BROADCAST,MULTICAST> mtu 1500 qdisc noop state DOWN group default qlen 1000
    link/ether dc:a6:32:32:36:fd brd ff:ff:ff:ff:ff:ff
4: calid834561dd21@if3: <BROADCAST,MULTICAST,UP,LOWER_UP> mtu 1480 qdisc noqueue state UP group default
    link/ether ee:ee:ee:ee:ee:ee brd ff:ff:ff:ff:ff:ff link-netns cni-838652d4-0826-8070-0968-ef5b9a67075b
    inet 169.254.167.173/16 brd 169.254.255.255 scope global noprefixroute calid834561dd21
       valid_lft forever preferred_lft forever
    inet6 fe80::9f73:dd9c:7016:6857/64 scope link
       valid_lft forever preferred_lft forever
    inet6 fe80::ecee:eeff:feee:eeee/64 scope link
       valid_lft forever preferred_lft forever
5: tunl0@NONE: <NOARP,UP,LOWER_UP> mtu 1480 qdisc noqueue state UNKNOWN group default qlen 1000
    link/ipip 0.0.0.0 brd 0.0.0.0
    inet 10.42.246.1/32 scope global tunl0
       valid_lft forever preferred_lft forever
```

```
root@node1:~# ip route
default via 192.168.1.1 dev eth0 proto dhcp src 192.168.1.14 metric 202
10.42.18.0/26 via 192.168.1.11 dev tunl0 proto bird onlink
blackhole 10.42.246.0/26 proto bird
10.42.246.2 dev calid834561dd21 scope link
169.254.0.0/16 dev calid834561dd21 scope link src 169.254.167.173 metric 204
192.168.1.0/24 dev eth0 proto dhcp scope link src 192.168.1.14 metric 202
```

### pyload pod 10.42.246.2
```
root@node1:~# crictl exec -it 11b sh

root@pyload-857964bf6-jwmnn:/# ip a
1: lo: <LOOPBACK,UP,LOWER_UP> mtu 65536 qdisc noqueue state UNKNOWN qlen 1000
    link/loopback 00:00:00:00:00:00 brd 00:00:00:00:00:00
    inet 127.0.0.1/8 scope host lo
       valid_lft forever preferred_lft forever
    inet6 ::1/128 scope host
       valid_lft forever preferred_lft forever
3: eth0@tunl0: <BROADCAST,MULTICAST,UP,LOWER_UP,M-DOWN> mtu 1480 qdisc noqueue state UP
    link/ether 1e:65:3a:a8:81:53 brd ff:ff:ff:ff:ff:ff
    inet 10.42.246.2/32 scope global eth0
       valid_lft forever preferred_lft forever
    inet6 fd42::89f6:f2db:534b:e5c:2580/128 scope global
       valid_lft forever preferred_lft forever
    inet6 fe80::1c65:3aff:fea8:8153/64 scope link
       valid_lft forever preferred_lft forever
4: tunl0@NONE: <NOARP> mtu 1480 qdisc noop state DOWN qlen 1000
    link/ipip 0.0.0.0 brd 0.0.0.0

root@pyload-857964bf6-jwmnn:/# ip route
default via 169.254.1.1 dev eth0
169.254.1.1 dev eth0 scope link

root@pyload-857964bf6-jwmnn:/# ping 1.1.1.1
PING 1.1.1.1 (1.1.1.1): 56 data bytes
^C
--- 1.1.1.1 ping statistics ---
3 packets transmitted, 0 packets received, 100% packet loss
```
</details>

## Expected Behavior
ping from pod on worker node should work

## Current Behavior
networking in pods on worker node (raspberry pi) is not working

## Your Environment
* Calico version v3.22.0
* Orchestrator version (e.g. kubernetes, mesos, rkt): k3s v1.23.3+k3s1
* Operating System and version: debian bullseye x86_64 / raspberry pi os bullseye aarch64

## Updates
**update1:**
Tried flannel instead to see if there is a general problem but flannel works out of box.

There is no firewall or anything between nodes and all modules (br_netfilter etc.) are loaded.

IPv4 & IPv6 Forwarding is enabled on all nodes.

Upgraded k3s to latest v1.23.3+k3s1 and calico to v3.22.0

**update2:**
tried to change mtu from 1480 to 1440 and 1500 no difference

tried to disable ipipmode (set to Never) no difference

run tcpdump, ping arrives at node1 but the cali interface does not answer

the gateway of the tun interface answers

```
root@node1:# tcpdump -i any icmp
tcpdump: data link type LINUX_SLL2
tcpdump: verbose output suppressed, use -v[v]... for full protocol decode
listening on any, link-type LINUX_SLL2 (Linux cooked v2), snapshot length 262144 bytes
20:04:09.839958 tunl0 In  IP 10.42.18.0 > 10.42.246.2: ICMP echo request, id 25316, seq 4, length 64
20:04:09.840022 calid834561dd21 Out IP 10.42.18.0 > 10.42.246.2: ICMP echo request, id 25316, seq 4, length 64
20:04:10.863667 tunl0 In  IP 10.42.18.0 > 10.42.246.2: ICMP echo request, id 25316, seq 5, length 64
20:04:10.863789 calid834561dd21 Out IP 10.42.18.0 > 10.42.246.2: ICMP echo request, id 25316, seq 5, length 64
20:04:11.887644 tunl0 In  IP 10.42.18.0 > 10.42.246.2: ICMP echo request, id 25316, seq 6, length 64
20:04:11.887707 calid834561dd21 Out IP 10.42.18.0 > 10.42.246.2: ICMP echo request, id 25316, seq 6, length 64
20:04:54.353536 tunl0 In  IP 10.42.18.0 > 10.42.246.1: ICMP echo request, id 3017, seq 1, length 64
20:04:54.353785 tunl0 Out IP 10.42.246.1 > 10.42.18.0: ICMP echo reply, id 3017, seq 1, length 64
20:04:55.354718 tunl0 In  IP 10.42.18.0 > 10.42.246.1: ICMP echo request, id 3017, seq 2, length 64
20:04:55.354902 tunl0 Out IP 10.42.246.1 > 10.42.18.0: ICMP echo reply, id 3017, seq 2, length 64
```

This must be something related to the virtual cali interface on the aarch64 raspberry pi os ?!

**update3:**
created allow all ingress/egress network policy no difference

Still at a loss on what to do.

**Comment by kub3let** [comment]
On master1 calico-node pod fails with 

```
root@master1:~# kubectl describe pod -n kube-system calico-node-4zn5q
Events:
  Type     Reason     Age   From     Message
  ----     ------     ----  ----     -------
  Warning  Unhealthy  52m   kubelet  Readiness probe failed: 2022-01-31 21:37:31.045 [INFO][6346] confd/health.go 180: Number of node(s) with BGP peering established = 0
calico/node is not ready: BIRD is not ready: BGP not established with 192.168.1.14
  Warning  Unhealthy  51m  kubelet  Readiness probe failed: 2022-01-31 21:37:41.067 [INFO][6378] confd/health.go 180: Number of node(s) with BGP peering established = 0
calico/node is not ready: BIRD is not ready: BGP not established with 192.168.1.14
  Warning  Unhealthy  51m  kubelet  Readiness probe failed: 2022-01-31 21:37:51.076 [INFO][6403] confd/health.go 180: Number of node(s) with BGP peering established = 0
calico/node is not ready: BIRD is not ready: BGP not established with 192.168.1.14
  Warning  Unhealthy  51m  kubelet  Readiness probe failed: 2022-01-31 21:37:51.214 [INFO][6419] confd/health.go 180: Number of node(s) with BGP peering established = 0
calico/node is not ready: BIRD is not ready: BGP not established with 192.168.1.14
  Warning  Unhealthy  51m  kubelet  Readiness probe failed: 2022-01-31 21:38:01.046 [INFO][6447] confd/health.go 180: Number of node(s) with BGP peering established = 0
calico/node is not ready: BIRD is not ready: BGP not established with 192.168.1.14
  Warning  Unhealthy  51m  kubelet  Readiness probe failed: 2022-01-31 21:38:11.088 [INFO][6476] confd/health.go 180: Number of node(s) with BGP peering established = 0
calico/node is not ready: BIRD is not ready: BGP not established with 192.168.1.14
  Warning  Unhealthy  51m  kubelet  Readiness probe failed: 2022-01-31 21:38:21.069 [INFO][6511] confd/health.go 180: Number of node(s) with BGP peering established = 0
calico/node is not ready: BIRD is not ready: BGP not established with 192.168.1.14
  Warning  Unhealthy  51m  kubelet  Readiness probe failed: 2022-01-31 21:38:31.096 [INFO][6552] confd/health.go 180: Number of node(s) with BGP peering established = 0
calico/node is not ready: BIRD is not ready: BGP not established with 192.168.1.14
  Warning  Unhealthy  50m  kubelet  Readiness probe failed: 2022-01-31 21:38:41.126 [INFO][6583] confd/health.go 180: Number of node(s) with BGP peering established = 0
calico/node is not ready: BIRD is not ready: BGP not established with 192.168.1.14
  Warning  Unhealthy  50m (x4 over 50m)  kubelet  (combined from similar events): Readiness probe failed: 2022-01-31 21:39:11.102 [INFO][6705] confd/health.go 180: Number of node(s) with BGP peering established = 0
calico/node is not ready: BIRD is not ready: BGP not established with 192.168.1.14
```

Log spams the following over and over:
```
root@master1:~# kubectl logs -n kube-system calico-node-4zn5q
2022-01-31 22:34:18.196 [INFO][55] felix/watchercache.go 97: Watch channel closed by remote - recreate watcher ListRoot="/calico/resources/v3/projectcalico.org/bgpconfigurations"
2022-01-31 22:34:45.362 [INFO][55] felix/summary.go 100: Summarising 10 dataplane reconciliation loops over 1m2.8s: avg=21ms longest=52ms ()
2022-01-31 22:34:51.540 [INFO][58] monitor-addresses/startup.go 713: Using autodetected IPv4 address on interface eth0: 192.168.1.11/24
```

**Comment by kub3let** [comment]
Tried flannel instead to see if there is a general problem but flannel works out of box.

There is no firewall or anything between nodes and all modules (br_netfilter etc.) are loaded.

IPv4 & IPv6 Forwarding is enabled on all nodes.

**Comment by caseydavenport** [comment]
I'd start by verifying basic networking functionality and health:

- Can your nodes talk to each other?
- Can a node talk to pods that are running on that node (using pod IP)?
- Can a node talk to a pod running on another node (using pod IP)?
- What does `ip route` show on one of your nodes?
- Are there any error logs in the calico/node log output? 


> run tcpdump, ping arrives at node1 but the cali interface does not answer

Is this from a pod -> pod or node -> pod? This suggests that perhaps iptables is dropping the packet on the remote end, or perhaps that routing isn't properly configured for the remote node.

you can check those like so:

** Check for iptables DROP rules being hit **

```
sudo iptables-save -C | grep DROP
```

** On remote node, look for a /32 route with the destination pod's IP and a /26 route for the source host **

```
ip route
```

**Comment by kub3let** [comment]
Thanks for your reply @caseydavenport 

There is a ton of Information in the Spoiler (Environment Information), maybe you missed that ? It includes things like ip route etc.



> * Can your nodes talk to each other?
yes

> * Can a node talk to pods that are running on that node (using pod IP)?
no

> * Can a node talk to a pod running on another node (using pod IP)?
no

> * What does `ip route` show on one of your nodes?
```
root@node1:~# ip route
default via 192.168.1.1 dev eth0 proto dhcp src 192.168.1.134 metric 202
10.42.2.64/26 via 192.168.1.132 dev eth0 proto bird
10.42.9.128/26 via 192.168.1.133 dev eth0 proto bird
10.42.18.0/26 via 192.168.1.131 dev eth0 proto bird
10.42.246.0 dev cali9c00b2d1d25 scope link
blackhole 10.42.246.0/26 proto bird
169.254.0.0/16 dev cali9c00b2d1d25 scope link src 169.254.167.173 metric 206
192.168.1.0/24 dev eth0 proto dhcp scope link src 192.168.1.134 metric 202
```

> * Are there any error logs in the calico/node log output?
Not sure if these are errors
```
2022-02-04 19:21:38.981 [INFO][86] felix/endpoint_mgr.go 1182: Applying /proc/sys configuration to interface. ifaceName="cali9c00b2d1d25"
2022-02-04 19:21:38.982 [INFO][86] felix/endpoint_mgr.go 477: Re-evaluated workload endpoint status adminUp=true failed=false known=true operUp=true status="up" workloadEndpointID=proto.WorkloadEndpointID{OrchestratorId:"k8s", WorkloadId:"pyload/pyload-59fb94ffbb-pw7bs", EndpointId:"eth0"}
2022-02-04 19:21:38.982 [INFO][86] felix/status_combiner.go 58: Storing endpoint status update ipVersion=0x4 status="up" workload=proto.WorkloadEndpointID{OrchestratorId:"k8s", WorkloadId:"pyload/pyload-59fb94ffbb-pw7bs", EndpointId:"eth0"}
2022-02-04 19:21:38.983 [INFO][86] felix/endpoint_mgr.go 584: Updating per-endpoint chains. id=proto.WorkloadEndpointID{OrchestratorId:"k8s", WorkloadId:"pyload/pyload-59fb94ffbb-pw7bs", EndpointId:"eth0"}
2022-02-04 19:21:38.983 [INFO][86] felix/table.go 506: Queueing update of chain. chainName="cali-tw-cali9c00b2d1d25" ipVersion=0x6 table="filter"
2022-02-04 19:21:38.983 [INFO][86] felix/table.go 506: Queueing update of chain. chainName="cali-fw-cali9c00b2d1d25" ipVersion=0x6 table="filter"
2022-02-04 19:21:38.983 [INFO][86] felix/endpoint_mgr.go 615: Updating endpoint routes. id=proto.WorkloadEndpointID{OrchestratorId:"k8s", WorkloadId:"pyload/pyload-59fb94ffbb-pw7bs", EndpointId:"eth0"}
2022-02-04 19:21:38.984 [INFO][86] felix/endpoint_mgr.go 1182: Applying /proc/sys configuration to interface. ifaceName="cali9c00b2d1d25"
2022-02-04 19:21:38.984 [INFO][86] felix/endpoint_mgr.go 477: Re-evaluated workload endpoint status adminUp=true failed=false known=true operUp=true status="up" workloadEndpointID=proto.WorkloadEndpointID{OrchestratorId:"k8s", WorkloadId:"pyload/pyload-59fb94ffbb-pw7bs", EndpointId:"eth0"}
2022-02-04 19:21:38.985 [INFO][86] felix/status_combiner.go 58: Storing endpoint status update ipVersion=0x6 status="up" workload=proto.WorkloadEndpointID{OrchestratorId:"k8s", WorkloadId:"pyload/pyload-59fb94ffbb-pw7bs", EndpointId:"eth0"}
2022-02-04 19:21:39.031 [INFO][86] felix/status_combiner.go 81: Endpoint up for at least one IP version id=proto.WorkloadEndpointID{OrchestratorId:"k8s", WorkloadId:"pyload/pyload-59fb94ffbb-pw7bs", EndpointId:"eth0"} ipVersion=0x4 status="up"
2022-02-04 19:21:39.031 [INFO][86] felix/status_combiner.go 98: Reporting combined status. id=proto.WorkloadEndpointID{OrchestratorId:"k8s", WorkloadId:"pyload/pyload-59fb94ffbb-pw7bs", EndpointId:"eth0"} status="up"
2022-02-04 19:22:05.967 [INFO][86] felix/calc_graph.go 446: Local endpoint updated id=WorkloadEndpoint(node=node1, orchestrator=k8s, workload=pyload/pyload-59fb94ffbb-pw7bs, name=eth0)
2022-02-04 19:22:05.967 [INFO][86] felix/int_dataplane.go 1520: Received *proto.WorkloadEndpointUpdate update from calculation graph msg=id:<orchestrator_id:"k8s" workload_id:"pyload/pyload-59fb94ffbb-pw7bs" endpoint_id:"eth0" > endpoint:<state:"active" name:"cali9c00b2d1d25" profile_ids:"kns.pyload" profile_ids:"ksa.pyload.default" ipv4_nets:"10.42.246.0/32" ipv6_nets:"fd42::89f6:f2db:534b:e5c:2580/128" tiers:<name:"default" ingress_policies:"pyload/knp.default.allow-inbound-ingress" ingress_policies:"pyload/knp.default.deny-all" egress_policies:"pyload/knp.default.allow-cluster-dns" egress_policies:"pyload/knp.default.deny-all" > > 
2022-02-04 19:22:05.968 [INFO][86] felix/endpoint_mgr.go 584: Updating per-endpoint chains. id=proto.WorkloadEndpointID{OrchestratorId:"k8s", WorkloadId:"pyload/pyload-59fb94ffbb-pw7bs", EndpointId:"eth0"}
2022-02-04 19:22:05.968 [INFO][86] felix/table.go 506: Queueing update of chain. chainName="cali-tw-cali9c00b2d1d25" ipVersion=0x4 table="filter"
2022-02-04 19:22:05.968 [INFO][86] felix/table.go 506: Queueing update of chain. chainName="cali-fw-cali9c00b2d1d25" ipVersion=0x4 table="filter"
2022-02-04 19:22:05.968 [INFO][86] felix/endpoint_mgr.go 615: Updating endpoint routes. id=proto.WorkloadEndpointID{OrchestratorId:"k8s", WorkloadId:"pyload/pyload-59fb94ffbb-pw7bs", EndpointId:"eth0"}
2022-02-04 19:22:05.969 [INFO][86] felix/endpoint_mgr.go 1182: Applying /proc/sys configuration to interface. ifaceName="cali9c00b2d1d25"
2022-02-04 19:22:05.969 [INFO][86] felix/endpoint_mgr.go 477: Re-evaluated workload endpoint status adminUp=true failed=false known=true operUp=true status="up" workloadEndpointID=proto.WorkloadEndpointID{OrchestratorId:"k8s", WorkloadId:"pyload/pyload-59fb94ffbb-pw7bs", EndpointId:"eth0"}
2022-02-04 19:22:05.969 [INFO][86] felix/status_combiner.go 58: Storing endpoint status update ipVersion=0x4 status="up" workload=proto.WorkloadEndpointID{OrchestratorId:"k8s", WorkloadId:"pyload/pyload-59fb94ffbb-pw7bs", EndpointId:"eth0"}
2022-02-04 19:22:05.970 [INFO][86] felix/endpoint_mgr.go 584: Updating per-endpoint chains. id=proto.WorkloadEndpointID{OrchestratorId:"k8s", WorkloadId:"pyload/pyload-59fb94ffbb-pw7bs", EndpointId:"eth0"}
2022-02-04 19:22:05.970 [INFO][86] felix/table.go 506: Queueing update of chain. chainName="cali-tw-cali9c00b2d1d25" ipVersion=0x6 table="filter"
2022-02-04 19:22:05.970 [INFO][86] felix/table.go 506: Queueing update of chain. chainName="cali-fw-cali9c00b2d1d25" ipVersion=0x6 table="filter"
2022-02-04 19:22:05.970 [INFO][86] felix/endpoint_mgr.go 615: Updating endpoint routes. id=proto.WorkloadEndpointID{OrchestratorId:"k8s", WorkloadId:"pyload/pyload-59fb94ffbb-pw7bs", EndpointId:"eth0"}
2022-02-04 19:22:05.971 [INFO][86] felix/endpoint_mgr.go 1182: Applying /proc/sys configuration to interface. ifaceName="cali9c00b2d1d25"
2022-02-04 19:22:05.971 [INFO][86] felix/endpoint_mgr.go 477: Re-evaluated workload endpoint status adminUp=true failed=false known=true operUp=true status="up" workloadEndpointID=proto.WorkloadEndpointID{OrchestratorId:"k8s", WorkloadId:"pyload/pyload-59fb94ffbb-pw7bs", EndpointId:"eth0"}
2022-02-04 19:22:05.971 [INFO][86] felix/status_combiner.go 58: Storing endpoint status update ipVersion=0x6 status="up" workload=proto.WorkloadEndpointID{OrchestratorId:"k8s", WorkloadId:"pyload/pyload-59fb94ffbb-pw7bs", EndpointId:"eth0"}
2022-02-04 19:22:06.007 [INFO][86] felix/status_combiner.go 81: Endpoint up for at least one IP version id=proto.WorkloadEndpointID{OrchestratorId:"k8s", WorkloadId:"pyload/pyload-59fb94ffbb-pw7bs", EndpointId:"eth0"} ipVersion=0x6 status="up"
2022-02-04 19:22:06.008 [INFO][86] felix/status_combiner.go 98: Reporting combined status. id=proto.WorkloadEndpointID{OrchestratorId:"k8s", WorkloadId:"pyload/pyload-59fb94ffbb-pw7bs", EndpointId:"eth0"} status="up"
2022-02-04 19:22:06.369 [INFO][83] monitor-addresses/autodetection_methods.go 103: Using autodetected IPv4 address on interface eth0: 192.168.1.134/24
2022-02-04 19:22:08.420 [INFO][86] felix/calc_graph.go 446: Local endpoint updated id=WorkloadEndpoint(node=node1, orchestrator=k8s, workload=pyload/pyload-59fb94ffbb-pw7bs, name=eth0)
2022-02-04 19:22:08.420 [INFO][86] felix/int_dataplane.go 1520: Received *proto.WorkloadEndpointUpdate update from calculation graph msg=id:<orchestrator_id:"k8s" workload_id:"pyload/pyload-59fb94ffbb-pw7bs" endpoint_id:"eth0" > endpoint:<state:"active" name:"cali9c00b2d1d25" profile_ids:"kns.pyload" profile_ids:"ksa.pyload.default" ipv4_nets:"10.42.246.0/32" ipv6_nets:"fd42::89f6:f2db:534b:e5c:2580/128" tiers:<name:"default" ingress_policies:"pyload/knp.default.allow-inbound-ingress" ingress_policies:"pyload/knp.default.deny-all" egress_policies:"pyload/knp.default.allow-cluster-dns" egress_policies:"pyload/knp.default.deny-all" > > 
2022-02-04 19:22:08.426 [INFO][86] felix/endpoint_mgr.go 584: Updating per-endpoint chains. id=proto.WorkloadEndpointID{OrchestratorId:"k8s", WorkloadId:"pyload/pyload-59fb94ffbb-pw7bs", EndpointId:"eth0"}
2022-02-04 19:22:08.426 [INFO][86] felix/table.go 506: Queueing update of chain. chainName="cali-tw-cali9c00b2d1d25" ipVersion=0x4 table="filter"
2022-02-04 19:22:08.427 [INFO][86] felix/table.go 506: Queueing update of chain. chainName="cali-fw-cali9c00b2d1d25" ipVersion=0x4 table="filter"
2022-02-04 19:22:08.427 [INFO][86] felix/endpoint_mgr.go 615: Updating endpoint routes. id=proto.WorkloadEndpointID{OrchestratorId:"k8s", WorkloadId:"pyload/pyload-59fb94ffbb-pw7bs", EndpointId:"eth0"}
2022-02-04 19:22:08.427 [INFO][86] felix/endpoint_mgr.go 1182: Applying /proc/sys configuration to interface. ifaceName="cali9c00b2d1d25"
2022-02-04 19:22:08.427 [INFO][86] felix/endpoint_mgr.go 477: Re-evaluated workload endpoint status adminUp=true failed=false known=true operUp=true status="up" workloadEndpointID=proto.WorkloadEndpointID{OrchestratorId:"k8s", WorkloadId:"pyload/pyload-59fb94ffbb-pw7bs", EndpointId:"eth0"}
2022-02-04 19:22:08.428 [INFO][86] felix/status_combiner.go 58: Storing endpoint status update ipVersion=0x4 status="up" workload=proto.WorkloadEndpointID{OrchestratorId:"k8s", WorkloadId:"pyload/pyload-59fb94ffbb-pw7bs", EndpointId:"eth0"}
2022-02-04 19:22:08.428 [INFO][86] felix/endpoint_mgr.go 584: Updating per-endpoint chains. id=proto.WorkloadEndpointID{OrchestratorId:"k8s", WorkloadId:"pyload/pyload-59fb94ffbb-pw7bs", EndpointId:"eth0"}
2022-02-04 19:22:08.428 [INFO][86] felix/table.go 506: Queueing update of chain. chainName="cali-tw-cali9c00b2d1d25" ipVersion=0x6 table="filter"
2022-02-04 19:22:08.428 [INFO][86] felix/table.go 506: Queueing update of chain. chainName="cali-fw-cali9c00b2d1d25" ipVersion=0x6 table="filter"
2022-02-04 19:22:08.428 [INFO][86] felix/endpoint_mgr.go 615: Updating endpoint routes. id=proto.WorkloadEndpointID{OrchestratorId:"k8s", WorkloadId:"pyload/pyload-59fb94ffbb-pw7bs", EndpointId:"eth0"}
2022-02-04 19:22:08.429 [INFO][86] felix/endpoint_mgr.go 1182: Applying /proc/sys configuration to interface. ifaceName="cali9c00b2d1d25"
2022-02-04 19:22:08.429 [INFO][86] felix/endpoint_mgr.go 477: Re-evaluated workload endpoint status adminUp=true failed=false known=true operUp=true status="up" workloadEndpointID=proto.WorkloadEndpointID{OrchestratorId:"k8s", WorkloadId:"pyload/pyload-59fb94ffbb-pw7bs", EndpointId:"eth0"}
2022-02-04 19:22:08.429 [INFO][86] felix/status_combiner.go 58: Storing endpoint status update ipVersion=0x6 status="up" workload=proto.WorkloadEndpointID{OrchestratorId:"k8s", WorkloadId:"pyload/pyload-59fb94ffbb-pw7bs", EndpointId:"eth0"}
2022-02-04 19:22:08.460 [INFO][86] felix/status_combiner.go 81: Endpoint up for at least one IP version id=proto.WorkloadEndpointID{OrchestratorId:"k8s", WorkloadId:"pyload/pyload-59fb94ffbb-pw7bs", EndpointId:"eth0"} ipVersion=0x4 status="up"
2022-02-04 19:22:08.460 [INFO][86] felix/status_combiner.go 98: Reporting combined status. id=proto.WorkloadEndpointID{OrchestratorId:"k8s", WorkloadId:"pyload/pyload-59fb94ffbb-pw7bs", EndpointId:"eth0"} status="up"
2022-02-04 19:22:18.983 [INFO][86] felix/summary.go 100: Summarising 13 dataplane reconciliation loops over 1m5s: avg=21ms longest=51ms (resync-filter-v4,resync-filter-v6)
2022-02-04 19:22:38.517 [INFO][86] felix/route_table.go 896: Remove old route dest=169.254.0.0/16 ifaceName="cali9c00b2d1d25" ifaceRegex="^cali.*" ipVersion=0x4 routeProblems=[]string{"unexpected route", "incorrect source address"} tableIndex=0
2022-02-04 19:22:38.519 [INFO][86] felix/conntrack.go 90: Removing conntrack flows ip=169.254.0.0
```


> ** Check for iptables DROP rules being hit **
```
root@node1:~# sudo iptables-save -c | grep DROP
[0:0] -A cali-PREROUTING -m comment --comment "cali:mPIOOWmbH3iO0R90" -m mark --mark 0x40000/0x40000 -m rpfilter --validmark --invert -j DROP
[0:0] -A KUBE-FIREWALL -m comment --comment "kubernetes firewall for dropping marked packets" -m mark --mark 0x8000/0x8000 -j DROP
[0:0] -A KUBE-FIREWALL ! -s 127.0.0.0/8 -d 127.0.0.0/8 -m comment --comment "block incoming localnet connections" -m conntrack ! --ctstate RELATED,ESTABLISHED,DNAT -j DROP
[0:0] -A KUBE-FORWARD -m conntrack --ctstate INVALID -j DROP
[0:0] -A cali-from-wl-dispatch -m comment --comment "cali:97zNNld2edZ1SsPg" -m comment --comment "Unknown interface" -j DROP
[0:0] -A cali-fw-cali9c00b2d1d25 -m comment --comment "cali:5tslPpUEDRC-aWIE" -m conntrack --ctstate INVALID -j DROP
[0:0] -A cali-fw-cali9c00b2d1d25 -p udp -m comment --comment "cali:w3_-xO3Np1Dvz9e9" -m comment --comment "Drop VXLAN encapped packets originating in workloads" -m multiport --dports 4789 -j DROP
[0:0] -A cali-fw-cali9c00b2d1d25 -p ipencap -m comment --comment "cali:E6QagEW1p9ff0xAU" -m comment --comment "Drop IPinIP encapped packets originating in workloads" -j DROP
[6:1866] -A cali-fw-cali9c00b2d1d25 -m comment --comment "cali:As_EzdCkx3AmJipg" -m comment --comment "Drop if no policies passed packet" -m mark --mark 0x0/0x20000 -j DROP
[0:0] -A cali-fw-cali9c00b2d1d25 -m comment --comment "cali:dmbw9vjOek1XXsOy" -m comment --comment "Drop if no profiles matched" -j DROP
[0:0] -A cali-to-wl-dispatch -m comment --comment "cali:BDhUxE4_M_ZVmjiT" -m comment --comment "Unknown interface" -j DROP
[0:0] -A cali-tw-cali9c00b2d1d25 -m comment --comment "cali:P2fZHzqZPuBG1-WI" -m conntrack --ctstate INVALID -j DROP
[0:0] -A cali-tw-cali9c00b2d1d25 -m comment --comment "cali:KDlYTk0NKHakpIGV" -m comment --comment "Drop if no policies passed packet" -m mark --mark 0x0/0x20000 -j DROP
[0:0] -A cali-tw-cali9c00b2d1d25 -m comment --comment "cali:i8ennEq1palwnUEY" -m comment --comment "Drop if no profiles matched" -j DROP
:KUBE-MARK-DROP - [0:0]
[0:0] -A KUBE-FW-NJBCC6VRJBU2OULR -m comment --comment "flux-system/receiver loadbalancer IP" -j KUBE-MARK-DROP
[0:0] -A KUBE-MARK-DROP -j MARK --set-xmark 0x8000/0x8000
```


Note that if I use x86_64 hardware with the same setup everything works, this must be somehow related to raspberry pi os 64bit and I assume it has something to do with the virtual cali interface or some configuration of the os, or like as you already proposed iptables dropping them but I haven't setup any network policy rules yet.

Routes all look fine to me.

**Comment by caseydavenport** [comment]
> There is a ton of Information in the Spoiler (Environment Information), maybe you missed that ? It includes things like ip route etc.

Yep, I totally missed that because it was hidden :grin: 

From that output, looks like interface addressing, routing, etc are set up correctly. 

> [6:1866] -A cali-fw-cali9c00b2d1d25 -m comment --comment "cali:As_EzdCkx3AmJipg" -m comment --comment "Drop if no policies passed packet" -m mark --mark 0x0/0x20000 -j DROP

This rule seems to be getting hit, which suggests that iptables is dropping the packets locally (on egress from the source pod) at least for some packets. What do the full contents of the `cali-fw-cali9c00b2d1d25` chain look like on that node? Do you see any other rules getting hit? 

I'm guessing that ^ is a red herring, because your traceroute output suggests packets _are_ making it to the remote node, so wouldn't be dropped on egress, but worth double checking.

> Can a node talk to pods that are running on that node (using pod IP)?

This is pretty suspicious, and generally means that something is very wrong. If a node can't talk to its local pods, that's usually a pretty fundamental issue with the node, so figuring out what is causing this particular traffic path would be my suggestion on where to start.

Maybe check which iptables version is being used on each node? If one is using NFT and the other legacy, that might be part of it.

**Comment by kub3let** [comment]
@caseydavenport i also tried switching to iptables legacy, all nodes are using nft but that made no difference.

Somehow I got it working, I'm trying to reproduce this now.

I installed a master setup on the raspberry pi node first with the same settings as the x86_64 (this was to test whether calico does not work at all on the pi, or maybe something related to my config but in fact this way it worked just fine), after that I run k3s-uninstall.sh and followed normal with the node worker install and suddenly everything worked, the pyload container was deployed and networking worked as well.

The routes and interfaces also look different with it working.

Like the pyload container is using the interface eth0@if18 instead of eth0@tunl0

<details>
  <summary>IP & Routes (Working)</summary>
  
**master (192.168.1.11)**
```
root@master1:# ip a
1: lo: <LOOPBACK,UP,LOWER_UP> mtu 65536 qdisc noqueue state UNKNOWN group default qlen 1000
    link/loopback 00:00:00:00:00:00 brd 00:00:00:00:00:00
    inet 127.0.0.1/8 scope host lo
       valid_lft forever preferred_lft forever
    inet6 ::1/128 scope host 
       valid_lft forever preferred_lft forever
2: eth0: <BROADCAST,MULTICAST,UP,LOWER_UP> mtu 1500 qdisc fq state UP group default qlen 1000
    link/ether 76:40:bf:44:c5:80 brd ff:ff:ff:ff:ff:ff
    altname enp6s18
    inet 192.168.1.11/24 brd 192.168.1.255 scope global eth0
       valid_lft forever preferred_lft forever
    inet6 XXXX:XXXX:XXXX:XXXX/64 scope global 
       valid_lft forever preferred_lft forever
    inet6 fe80::7440:bfff:fe44:c580/64 scope link 
       valid_lft forever preferred_lft forever
3: kube-ipvs0: <BROADCAST,NOARP> mtu 1500 qdisc noop state DOWN group default 
    link/ether 22:6c:e0:63:eb:1b brd ff:ff:ff:ff:ff:ff
    inet 10.43.94.141/32 scope global kube-ipvs0
       valid_lft forever preferred_lft forever
    inet 10.43.255.83/32 scope global kube-ipvs0
       valid_lft forever preferred_lft forever
    inet 192.168.1.137/32 scope global kube-ipvs0
       valid_lft forever preferred_lft forever
    inet 10.43.77.183/32 scope global kube-ipvs0
       valid_lft forever preferred_lft forever
    inet 10.43.129.224/32 scope global kube-ipvs0
       valid_lft forever preferred_lft forever
    inet 10.43.0.10/32 scope global kube-ipvs0
       valid_lft forever preferred_lft forever
    inet 10.43.99.71/32 scope global kube-ipvs0
       valid_lft forever preferred_lft forever
    inet 10.43.178.174/32 scope global kube-ipvs0
       valid_lft forever preferred_lft forever
    inet 10.43.0.1/32 scope global kube-ipvs0
       valid_lft forever preferred_lft forever
    inet 10.43.170.182/32 scope global kube-ipvs0
       valid_lft forever preferred_lft forever
    inet 10.43.56.78/32 scope global kube-ipvs0
       valid_lft forever preferred_lft forever
    inet6 fd43::176d/128 scope global 
       valid_lft forever preferred_lft forever
4: cali0295737f7c5@if3: <BROADCAST,MULTICAST,UP,LOWER_UP> mtu 1500 qdisc noqueue state UP group default 
    link/ether ee:ee:ee:ee:ee:ee brd ff:ff:ff:ff:ff:ff link-netns cni-afe56f4b-3bf4-8adc-e60f-36469fe9471f
    inet6 fe80::ecee:eeff:feee:eeee/64 scope link 
       valid_lft forever preferred_lft forever
5: cali76fcdd072b4@if3: <BROADCAST,MULTICAST,UP,LOWER_UP> mtu 1500 qdisc noqueue state UP group default 
    link/ether ee:ee:ee:ee:ee:ee brd ff:ff:ff:ff:ff:ff link-netns cni-ed3648ec-31ca-76fb-aff1-2dd09355d418
    inet6 fe80::ecee:eeff:feee:eeee/64 scope link 
       valid_lft forever preferred_lft forever
6: cali4743c3acba7@if3: <BROADCAST,MULTICAST,UP,LOWER_UP> mtu 1500 qdisc noqueue state UP group default 
    link/ether ee:ee:ee:ee:ee:ee brd ff:ff:ff:ff:ff:ff link-netns cni-08a16ad0-8252-b7b9-bbf1-de7f43f70c59
    inet6 fe80::ecee:eeff:feee:eeee/64 scope link 
       valid_lft forever preferred_lft forever
7: cali410446358c0@if3: <BROADCAST,MULTICAST,UP,LOWER_UP> mtu 1500 qdisc noqueue state UP group default 
    link/ether ee:ee:ee:ee:ee:ee brd ff:ff:ff:ff:ff:ff link-netns cni-b61f2c01-9179-2953-47dc-585f2842d411
    inet6 fe80::ecee:eeff:feee:eeee/64 scope link 
       valid_lft forever preferred_lft forever
8: cali3e3d146d424@if3: <BROADCAST,MULTICAST,UP,LOWER_UP> mtu 1500 qdisc noqueue state UP group default 
    link/ether ee:ee:ee:ee:ee:ee brd ff:ff:ff:ff:ff:ff link-netns cni-4d7a672c-4741-0cb5-5f55-266a9517cc3e
    inet6 fe80::ecee:eeff:feee:eeee/64 scope link 
       valid_lft forever preferred_lft forever
```

```
root@master1:# ip route
default via 192.168.1.1 dev eth0 onlink 
10.42.2.64/26 via 192.168.1.12 dev eth0 proto bird 
10.42.9.128/26 via 192.168.1.13 dev eth0 proto bird 
blackhole 10.42.18.0/26 proto bird 
10.42.18.20 dev cali0295737f7c5 scope link 
10.42.18.21 dev cali76fcdd072b4 scope link 
10.42.18.22 dev cali4743c3acba7 scope link 
10.42.18.23 dev cali410446358c0 scope link 
10.42.18.24 dev cali3e3d146d424 scope link 
10.42.246.0/26 via 192.168.1.14 dev eth0 proto bird 
192.168.1.0/24 dev eth0 proto kernel scope link src 192.168.1.11 
```

**node1 (192.168.1.14)**
```
root@node1:/home/pi# ip a
1: lo: <LOOPBACK,UP,LOWER_UP> mtu 65536 qdisc noqueue state UNKNOWN group default qlen 1000
    link/loopback 00:00:00:00:00:00 brd 00:00:00:00:00:00
    inet 127.0.0.1/8 scope host lo
       valid_lft forever preferred_lft forever
    inet6 ::1/128 scope host
       valid_lft forever preferred_lft forever
2: eth0: <BROADCAST,MULTICAST,UP,LOWER_UP> mtu 1500 qdisc mq state UP group default qlen 1000
    link/ether dc:a6:32:32:36:fc brd ff:ff:ff:ff:ff:ff
    inet 192.168.1.14/24 brd 192.168.1.255 scope global dynamic noprefixroute eth0
       valid_lft 6893sec preferred_lft 5993sec
    inet6 XXXX:XXXX:XXXX:XXXX/64 scope global dynamic mngtmpaddr noprefixroute
       valid_lft 86345sec preferred_lft 14345sec
    inet6 fe80::70e9:9725:822b:cd58/64 scope link
       valid_lft forever preferred_lft forever
3: wlan0: <BROADCAST,MULTICAST> mtu 1500 qdisc noop state DOWN group default qlen 1000
    link/ether dc:a6:32:32:36:fd brd ff:ff:ff:ff:ff:ff
4: kube-ipvs0: <BROADCAST,NOARP,UP,LOWER_UP> mtu 1500 qdisc noqueue state UNKNOWN group default
    link/ether f2:34:89:90:fa:36 brd ff:ff:ff:ff:ff:ff
    inet 10.43.0.1/32 scope global kube-ipvs0
       valid_lft forever preferred_lft forever
    inet 10.43.0.10/32 scope global kube-ipvs0
       valid_lft forever preferred_lft forever
    inet 10.43.173.120/32 scope global kube-ipvs0
       valid_lft forever preferred_lft forever
    inet 169.254.131.192/16 brd 169.254.255.255 scope global noprefixroute kube-ipvs0
       valid_lft forever preferred_lft forever
    inet 10.43.76.12/32 scope global kube-ipvs0
       valid_lft forever preferred_lft forever
    inet6 fe80::68f6:f84c:22e0:1e64/64 scope link
       valid_lft forever preferred_lft forever
6: tunl0@NONE: <NOARP,UP,LOWER_UP> mtu 1480 qdisc noqueue state UNKNOWN group default qlen 1000
    link/ipip 0.0.0.0 brd 0.0.0.0
18: cali7dae20eea29@if4: <BROADCAST,MULTICAST,UP,LOWER_UP> mtu 1500 qdisc noqueue state UP group default
    link/ether ee:ee:ee:ee:ee:ee brd ff:ff:ff:ff:ff:ff link-netns cni-dc623151-eb8b-fd16-3fb4-da67d2f52f5b
    inet 169.254.167.173/16 brd 169.254.255.255 scope global noprefixroute cali7dae20eea29
       valid_lft forever preferred_lft forever
    inet6 fe80::e8ba:b91b:27b0:8b19/64 scope link
       valid_lft forever preferred_lft forever
    inet6 fe80::ecee:eeff:feee:eeee/64 scope link
       valid_lft forever preferred_lft forever
```

```
root@node1:/home/pi# ip route
default via 192.168.1.1 dev eth0 proto dhcp src 192.168.1.14 metric 202
10.42.2.64/26 via 192.168.1.12 dev eth0 proto bird
10.42.9.128/26 via 192.168.1.13 dev eth0 proto bird
10.42.18.0/26 via 192.168.1.11 dev eth0 proto bird
blackhole 10.42.246.0/26 proto bird
10.42.246.1 dev cali7dae20eea29 scope link
169.254.0.0/16 dev kube-ipvs0 scope link src 169.254.131.192 metric 204
169.254.0.0/16 dev cali7dae20eea29 scope link src 169.254.167.173 metric 218
192.168.1.0/24 dev eth0 proto dhcp scope link src 192.168.1.14 metric 202
```

**pyload container**
```
root@node1:/home/pi# crictl exec -it ce7 sh

root@pyload-86759d89f6-25lfv:/# ip a
1: lo: <LOOPBACK,UP,LOWER_UP> mtu 65536 qdisc noqueue state UNKNOWN qlen 1000
    link/loopback 00:00:00:00:00:00 brd 00:00:00:00:00:00
    inet 127.0.0.1/8 scope host lo
       valid_lft forever preferred_lft forever
    inet6 ::1/128 scope host
       valid_lft forever preferred_lft forever
2: tunl0@NONE: <NOARP> mtu 1480 qdisc noop state DOWN qlen 1000
    link/ipip 0.0.0.0 brd 0.0.0.0
4: eth0@if18: <BROADCAST,MULTICAST,UP,LOWER_UP,M-DOWN> mtu 1500 qdisc noqueue state UP
    link/ether 2a:a2:2a:01:05:c6 brd ff:ff:ff:ff:ff:ff
    inet 10.42.246.1/32 scope global eth0
       valid_lft forever preferred_lft forever
    inet6 fd42::89f6:f2db:534b:e5c:2580/128 scope global
       valid_lft forever preferred_lft forever
    inet6 fe80::28a2:2aff:fe01:5c6/64 scope link
       valid_lft forever preferred_lft forever
```

```
root@pyload-86759d89f6-25lfv:/# ip route
default via 169.254.1.1 dev eth0
169.254.1.1 dev eth0 scope link
```

```
root@pyload-86759d89f6-25lfv:/# ping 1.1.1.1
PING 1.1.1.1 (1.1.1.1): 56 data bytes
64 bytes from 1.1.1.1: seq=0 ttl=54 time=25.399 ms
64 bytes from 1.1.1.1: seq=1 ttl=54 time=22.769 ms
64 bytes from 1.1.1.1: seq=2 ttl=54 time=21.602 ms
^C
--- 1.1.1.1 ping statistics ---
3 packets transmitted, 3 packets received, 0% packet loss
round-trip min/avg/max = 21.602/23.256/25.399 ms
```
</details>

**Comment by kub3let** [comment]
Well that actually is it.... I first have to install a master instance on the pi then uninstall it followed by agent install and it works.

```
wiped ssd, installed raspberry pi os x64

installed worker

does not work
```

```
wiped ssd, installed raspberry pi os x64

installed master, uninstalled master

installed worker

works
```

```
wiped ssd, installed raspberry pi os x64

installed worker

does not work

uninstalled worker, installed master, uninstalled master, installed worker

works
```

master installed using:
```
curl -sfL https://get.k3s.io | INSTALL_K3S_VERSION="v1.23.3+k3s1" INSTALL_K3S_EXEC="--disable servicelb --disable traefik --disable-network-policy --flannel-backend=none --kube-proxy-arg proxy-mode=ipvs --cluster-cidr=10.42.0.0/16,fd42::/48 --service-cidr=10.43.0.0/16,fd43::/112" sh -

kubectl apply -f calico.yaml
watch kubectl get pods -A
```

master uninstalled via
```
/usr/local/bin/k3s-uninstall.sh
```

worker installed via 
```
curl -sfL https://get.k3s.io | INSTALL_K3S_VERSION="v1.23.3+k3s1" K3S_URL=https://192.168.1.11:6443 K3S_TOKEN="XXXXXXXXXXXXXXXXXXXXXXXXXXXXXXXXXXXXXXXXXXXXXXXXXXXXX" sh -
```

**Comment by kub3let** [comment]
It is not enough to simply install the k3s master you also need to apply the calico yaml.

If I do not apply the calico yaml the worker node does not work so it seems to be still related to calico and not k3s itself.

**Comment by caseydavenport** [comment]
> If I do not apply the calico yaml the worker node does not work so it seems to be still related to calico and not k3s itself.

I don't think I'm following exactly what you did, but you definitely need to install Calico in order for Calico to work :grin:

**Comment by kub3let** [comment]
> > If I do not apply the calico yaml the worker node does not work so it seems to be still related to calico and not k3s itself.
> 
> I don't think I'm following exactly what you did, but you definitely need to install Calico in order for Calico to work grin

No I have to install a master instance on the raspberry pi and apply the calico yaml which runs calico-kube-controllers on it, then remove everything and install it as worker. This way it calico works for some reason.

Either way I have no idea what it is but after switching from raspberry pi os ARM64 to ubuntu server 21.10 ARM64, everything works now as expected.

I will try vanilla debian next since I'm not a fan of ubuntu, hopefully that works as well.
