### ISSUE TITLE
MTU for openstack tap interfaces not set

### ISSUE THREAD

**Issue by jocado** [projectcalico/calico#2257]
## Expected Behavior
MTU of the tap interfaces should reflect openstack related options to enable instances to use the specified MTUs.

## Current Behavior
MTU of the tap interface is the default 1500

## Possible Solution
The ml2 plugin should consume the related MTU option values, and make them available for Felix to consume and set on the tap interfaces when created.

## Steps to Reproduce (for bugs)
Set the following:
```
neutron.conf: global_physnet_mtu = 9000
ml2 conf: path_mtu = 9000
```
Restart neutron-server, and create an instance.

## Context
Instance interface MTUs that reflect the underlay can be configured, and all the correct openstack config is in place, but traffic is fragmented when it passes the tap interface.  Changing the relevant tap interface MTU manually to the required value prevents further packet fragmentation.

Default MTU:

```
# ip l show tapb1d13698-13
37: tapb1d13698-13: <BROADCAST,MULTICAST,UP,LOWER_UP> mtu 1500 qdisc pfifo_fast state UP mode DEFAULT group default qlen 1000
    link/ether 00:61:fe:ed:ca:fe brd ff:ff:ff:ff:ff:ff

# tcpdump -i tapb1d13698-13 icmp -n
tcpdump: verbose output suppressed, use -v or -vv for full protocol decode
listening on tapb1d13698-13, link-type EN10MB (Ethernet), capture size 262144 bytes
18:39:22.615684 IP 10.64.144.170 > 10.64.134.2: ICMP echo request, id 1418, seq 1, length 8908
18:39:22.616299 IP 10.64.134.2 > 10.64.144.170: ICMP echo reply, id 1418, seq 1, length 1480
18:39:22.616307 IP 10.64.134.2 > 10.64.144.170: ip-proto-1
18:39:22.616310 IP 10.64.134.2 > 10.64.144.170: ip-proto-1
18:39:22.616312 IP 10.64.134.2 > 10.64.144.170: ip-proto-1
18:39:22.616314 IP 10.64.134.2 > 10.64.144.170: ip-proto-1
18:39:22.616317 IP 10.64.134.2 > 10.64.144.170: ip-proto-1
18:39:22.616319 IP 10.64.134.2 > 10.64.144.170: ip-proto-1
18:39:23.617092 IP 10.64.144.170 > 10.64.134.2: ICMP echo request, id 1418, seq 2, length 8908
18:39:23.617763 IP 10.64.134.2 > 10.64.144.170: ICMP echo reply, id 1418, seq 2, length 1480
18:39:23.617781 IP 10.64.134.2 > 10.64.144.170: ip-proto-1
18:39:23.617784 IP 10.64.134.2 > 10.64.144.170: ip-proto-1
18:39:23.617786 IP 10.64.134.2 > 10.64.144.170: ip-proto-1
18:39:23.617788 IP 10.64.134.2 > 10.64.144.170: ip-proto-1
18:39:23.617790 IP 10.64.134.2 > 10.64.144.170: ip-proto-1
18:39:23.617792 IP 10.64.134.2 > 10.64.144.170: ip-proto-1
```

Increaed MTU:
```
# ip link set tapb1d13698-13 mtu 9000

# tcpdump -i tapb1d13698-13 icmp -n
tcpdump: verbose output suppressed, use -v or -vv for full protocol decode
listening on tapb1d13698-13, link-type EN10MB (Ethernet), capture size 262144 bytes
18:40:44.845442 IP 10.64.144.170 > 10.64.134.2: ICMP echo request, id 1423, seq 1, length 8908
18:40:44.846135 IP 10.64.134.2 > 10.64.144.170: ICMP echo reply, id 1423, seq 1, length 8908
18:40:45.847037 IP 10.64.144.170 > 10.64.134.2: ICMP echo request, id 1423, seq 2, length 8908
18:40:45.847782 IP 10.64.134.2 > 10.64.144.170: ICMP echo reply, id 1423, seq 2, length 8908
```

## Your Environment

* Calico version - 3.2.1
* Orchestrator version - Openstack Mitaka
* Operating System and version: Ubuntu Xenial

**Comment by caseydavenport** [comment]
@neiljerram presumably this is a relatively straightforward tweak in `networking-calico`?

**Comment by neiljerram** [comment]
@caseydavenport @jocado No, I think it might need a Nova patch, and that more debugging is needed to understand why this is not already working.

Nova code (as of 17.0.5, which happens to be the tag I currently have checked out) has this, which looks good to me:
```
    def plug_tap(self, instance, vif):
        """Plug a VIF_TYPE_TAP virtual interface."""
        dev = self.get_vif_devname(vif)
        mac = vif['details'].get(network_model.VIF_DETAILS_TAP_MAC_ADDRESS)
        linux_net.create_tap_dev(dev, mac)
        network = vif.get('network')
        mtu = network.get_meta('mtu') if network else None
        linux_net._set_device_mtu(dev, mtu)
```

**Comment by neiljerram** [comment]
That code was exactly the same as of 13.0.0, which is the Mitaka release version.
