### ISSUE TITLE
calico use ipipMode，some node access pod ip，occur snat,  when the tcp_tw_recycle is enable some time can't access pod by pod ip

### ISSUE THREAD

**Issue by huangjiasingle** [projectcalico/calico#6439]
## Expected Behavior

the pod network ns normal show another node tunl0‘s ip

## Current Behavior

when the tcp_tw_recycle is enable  can normal access nginx pod by pod ip, no occur snat.

## Possible Solution

disable tcp_tw_recycle, can access nginx pod by pod ip, but the pod network namesapce always occur snat

## Steps to Reproduce (for bugs)

1.  
client node info: 
```
eth0: flags=4163<UP,BROADCAST,RUNNING,MULTICAST>  mtu 1500
        inet 10.161.17.183  netmask 255.255.254.0  broadcast 10.161.17.255
        inet6 fe80::222:c1ff:fef0:f830  prefixlen 64  scopeid 0x20<link>
        ether 00:22:c1:f0:f8:30  txqueuelen 1000  (Ethernet)
        RX packets 18574893291  bytes 10105228428878 (9.1 TiB)
        RX errors 0  dropped 0  overruns 0  frame 0
        TX packets 14774106877  bytes 23158760015927 (21.0 TiB)
        TX errors 0  dropped 0 overruns 0  carrier 0  collisions 0
tunl0: flags=193<UP,RUNNING,NOARP>  mtu 1480
        inet 172.17.200.64  netmask 255.255.255.255
        tunnel   txqueuelen 1000  (IPIP Tunnel)
        RX packets 1110735426  bytes 1040483469466 (969.0 GiB)
        RX errors 0  dropped 0  overruns 0  frame 0
        TX packets 1174938489  bytes 499201811330 (464.9 GiB)
        TX errors 0  dropped 9 overruns 0  carrier 0  collisions 0
```
dst pod node info:
```
eth0: flags=4163<UP,BROADCAST,RUNNING,MULTICAST>  mtu 1500
        inet 10.161.233.247  netmask 255.255.252.0  broadcast 10.161.235.255
        inet6 fe80::222:9aff:febe:442d  prefixlen 64  scopeid 0x20<link>
        ether 00:22:9a:be:44:2d  txqueuelen 1000  (Ethernet)
        RX packets 2027996787  bytes 9334499483612 (8.4 TiB)
        RX errors 0  dropped 0  overruns 0  frame 0
        TX packets 1897018777  bytes 1893196253177 (1.7 TiB)
        TX errors 0  dropped 0 overruns 0  carrier 0  collisions 0
tunl0: flags=193<UP,RUNNING,NOARP>  mtu 1480
        inet 172.16.206.192  netmask 255.255.255.255
        tunnel   txqueuelen 1000  (IPIP Tunnel)
        RX packets 192412298  bytes 49642198979 (46.2 GiB)
        RX errors 0  dropped 0  overruns 0  frame 0
        TX packets 129788239  bytes 205709166204 (191.5 GiB)
        TX errors 0  dropped 1 overruns 0  carrier 0  collisions 0
```
dst pod ip:
```
172.17.200.64
```
2.  on the client node, use curl to access 172.17.200.64, 
```
curl 172.17.200.64

!DOCTYPE html>
<html>
<head>
<title>Welcome to nginx!</title>
<style>
    body {
        width: 35em;
        margin: 0 auto;
        font-family: Tahoma, Verdana, Arial, sans-serif;
    }
</style>
</head>
<body>
<h1>Welcome to nginx!</h1>
<p>If you see this page, the nginx web server is successfully installed and
working. Further configuration is required.</p>

<p>For online documentation and support please refer to
<a href="http://nginx.org/">nginx.org</a>.<br/>
Commercial support is available at
<a href="http://nginx.com/">nginx.com</a>.</p>

<p><em>Thank you for using nginx.</em></p>
</body>
</html>
```
3. on the pod node and pod network namespace use tcpdump dump pkg

tunl0:  tcpdump -ttt -i tunl0  host 172.16.206.246  -nn
```
00:01:03.106843 IP 172.17.200.64.42464 > 172.16.206.246.80: Flags [S], seq 3081195122, win 28800, options [mss 1440,sackOK,TS val 4093462735 ecr 0,nop,wscale 7], length 0
 00:00:00.000156 IP 172.16.206.246.80 > 172.17.200.64.42464: Flags [S.], seq 3919217550, ack 3081195123, win 28560, options [mss 1440,sackOK,TS val 1240520009 ecr 4093462735,nop,wscale 9], length 0
 00:00:00.000273 IP 172.17.200.64.42464 > 172.16.206.246.80: Flags [.], ack 1, win 225, options [nop,nop,TS val 4093462735 ecr 1240520009], length 0
 00:00:00.000105 IP 172.17.200.64.42464 > 172.16.206.246.80: Flags [P.], seq 1:79, ack 1, win 225, options [nop,nop,TS val 4093462735 ecr 1240520009], length 78: HTTP: GET / HTTP/1.1
 00:00:00.000104 IP 172.16.206.246.80 > 172.17.200.64.42464: Flags [.], ack 79, win 56, options [nop,nop,TS val 1240520009 ecr 4093462735], length 0
 00:00:00.000232 IP 172.16.206.246.80 > 172.17.200.64.42464: Flags [P.], seq 1:239, ack 79, win 56, options [nop,nop,TS val 1240520010 ecr 4093462735], length 238: HTTP: HTTP/1.1 200 OK
 00:00:00.000146 IP 172.16.206.246.80 > 172.17.200.64.42464: Flags [P.], seq 239:851, ack 79, win 56, options [nop,nop,TS val 1240520010 ecr 4093462735], length 612: HTTP
 00:00:00.000078 IP 172.17.200.64.42464 > 172.16.206.246.80: Flags [.], ack 239, win 234, options [nop,nop,TS val 4093462736 ecr 1240520010], length 0
 00:00:00.000096 IP 172.17.200.64.42464 > 172.16.206.246.80: Flags [.], ack 851, win 243, options [nop,nop,TS val 4093462736 ecr 1240520010], length 0
 00:00:00.000138 IP 172.17.200.64.42464 > 172.16.206.246.80: Flags [F.], seq 79, ack 851, win 243, options [nop,nop,TS val 4093462736 ecr 1240520010], length 0
 00:00:00.000152 IP 172.16.206.246.80 > 172.17.200.64.42464: Flags [F.], seq 851, ack 80, win 56, options [nop,nop,TS val 1240520010 ecr 4093462736], length 0
 00:00:00.000227 IP 172.17.200.64.42464 > 172.16.206.246.80: Flags [.], ack 852, win 243, options [nop,nop,TS val 4093462736 ecr 1240520010], length 0
```
pod network namesapce:  docker inspect contaienrId | grep Pid , nsenter -t pid -n 
```
pod networknamespace info:

eth0: flags=4163<UP,BROADCAST,RUNNING,MULTICAST>  mtu 1480
        inet 172.16.206.246  netmask 255.255.255.255  broadcast 0.0.0.0
        ether 76:92:4d:2f:18:a8  txqueuelen 0  (Ethernet)
        RX packets 804  bytes 60612 (59.1 KiB)
        RX errors 0  dropped 0  overruns 0  frame 0
        TX packets 720  bytes 131402 (128.3 KiB)
        TX errors 0  dropped 0 overruns 0  carrier 0  collisions 0

lo: flags=73<UP,LOOPBACK,RUNNING>  mtu 65536
        inet 127.0.0.1  netmask 255.0.0.0
        loop  txqueuelen 1000  (Local Loopback)
        RX packets 0  bytes 0 (0.0 B)
        RX errors 0  dropped 0  overruns 0  frame 0
        TX packets 0  bytes 0 (0.0 B)
        TX errors 0  dropped 0 overruns 0  carrier 0  collisions 0
```
```
tcpdump -ttt host 172.17.200.64  -nn

 00:00:00.000000 IP 10.161.233.247.42464 > 172.16.206.246.80: Flags [S], seq 3081195122, win 28800, options [mss 1440,sackOK,TS val 4093462735 ecr 0,nop,wscale 7], length 0
 00:00:00.000056 IP 172.16.206.246.80 > 10.161.233.247.42464: Flags [S.], seq 3919217550, ack 3081195123, win 28560, options [mss 1440,sackOK,TS val 1240520009 ecr 4093462735,nop,wscale 9], length 0
 00:00:00.000336 IP 10.161.233.247.42464 > 172.16.206.246.80: Flags [.], ack 1, win 225, options [nop,nop,TS val 4093462735 ecr 1240520009], length 0
 00:00:00.000108 IP 10.161.233.247.42464 > 172.16.206.246.80: Flags [P.], seq 1:79, ack 1, win 225, options [nop,nop,TS val 4093462735 ecr 1240520009], length 78: HTTP: GET / HTTP/1.1
 00:00:00.000043 IP 172.16.206.246.80 > 10.161.233.247.42464: Flags [.], ack 79, win 56, options [nop,nop,TS val 1240520009 ecr 4093462735], length 0
 00:00:00.000200 IP 172.16.206.246.80 > 10.161.233.247.42464: Flags [P.], seq 1:239, ack 79, win 56, options [nop,nop,TS val 1240520010 ecr 4093462735], length 238: HTTP: HTTP/1.1 200 OK
 00:00:00.000175 IP 172.16.206.246.80 > 10.161.233.247.42464: Flags [P.], seq 239:851, ack 79, win 56, options [nop,nop,TS val 1240520010 ecr 4093462735], length 612: HTTP
 00:00:00.000124 IP 10.161.233.247.42464 > 172.16.206.246.80: Flags [.], ack 239, win 234, options [nop,nop,TS val 4093462736 ecr 1240520010], length 0
 00:00:00.000100 IP 10.161.233.247.42464 > 172.16.206.246.80: Flags [.], ack 851, win 243, options [nop,nop,TS val 4093462736 ecr 1240520010], length 0
 00:00:00.000146 IP 10.161.233.247.42464 > 172.16.206.246.80: Flags [F.], seq 79, ack 851, win 243, options [nop,nop,TS val 4093462736 ecr 1240520010], length 0
 00:00:00.000102 IP 172.16.206.246.80 > 10.161.233.247.42464: Flags [F.], seq 851, ack 80, win 56, options [nop,nop,TS val 1240520010 ecr 4093462736], length 0
 00:00:00.000272 IP 10.161.233.247.42464 > 172.16.206.246.80: Flags [.], ack 852, win 243, options [nop,nop,TS val 4093462736 ecr 1240520010], length 0

```

4. on the client node tcmdump tunl0 
```
tcpdump -ttt -i tunl0  host 172.16.206.246 and port 80   -nn

 00:01:03.107352 IP 172.17.200.64.42464 > 172.16.206.246.80: Flags [S], seq 3081195122, win 28800, options [mss 1440,sackOK,TS val 4093462735 ecr 0,nop,wscale 7], length 0
 00:00:00.000452 IP 172.16.206.246.80 > 172.17.200.64.42464: Flags [S.], seq 3919217550, ack 3081195123, win 28560, options [mss 1440,sackOK,TS val 1240520009 ecr 4093462735,nop,wscale 9], length 0
 00:00:00.000033 IP 172.17.200.64.42464 > 172.16.206.246.80: Flags [.], ack 1, win 225, options [nop,nop,TS val 4093462735 ecr 1240520009], length 0
 00:00:00.000051 IP 172.17.200.64.42464 > 172.16.206.246.80: Flags [P.], seq 1:79, ack 1, win 225, options [nop,nop,TS val 4093462735 ecr 1240520009], length 78: HTTP: GET / HTTP/1.1
 00:00:00.000357 IP 172.16.206.246.80 > 172.17.200.64.42464: Flags [.], ack 79, win 56, options [nop,nop,TS val 1240520009 ecr 4093462735], length 0
 00:00:00.000261 IP 172.16.206.246.80 > 172.17.200.64.42464: Flags [P.], seq 1:239, ack 79, win 56, options [nop,nop,TS val 1240520010 ecr 4093462735], length 238: HTTP: HTTP/1.1 200 OK
 00:00:00.000022 IP 172.17.200.64.42464 > 172.16.206.246.80: Flags [.], ack 239, win 234, options [nop,nop,TS val 4093462736 ecr 1240520010], length 0
 00:00:00.000086 IP 172.16.206.246.80 > 172.17.200.64.42464: Flags [P.], seq 239:851, ack 79, win 56, options [nop,nop,TS val 1240520010 ecr 4093462735], length 612: HTTP
 00:00:00.000022 IP 172.17.200.64.42464 > 172.16.206.246.80: Flags [.], ack 851, win 243, options [nop,nop,TS val 4093462736 ecr 1240520010], length 0
 00:00:00.000117 IP 172.17.200.64.42464 > 172.16.206.246.80: Flags [F.], seq 79, ack 851, win 243, options [nop,nop,TS val 4093462736 ecr 1240520010], length 0
 00:00:00.000371 IP 172.16.206.246.80 > 172.17.200.64.42464: Flags [F.], seq 851, ack 80, win 56, options [nop,nop,TS val 1240520010 ecr 4093462736], length 0
 00:00:00.000015 IP 172.17.200.64.42464 > 172.16.206.246.80: Flags [.], ack 852, win 243, options [nop,nop,TS val 4093462736 ecr 1240520010], length 0

```
## Context

in prod env, some pod can't access succeeded.

## Your Environment

* Calico version
* v3.22.1
* Orchestrator version (e.g. kubernetes, mesos, rkt):
* kubernetes
* Operating System and version:
* 3.10.0-1160.59.1.el7.x86_64
* Link to your project (optional):

**Comment by huangjiasingle** [comment]
@caseydavenport I need your help

**Comment by huangjiasingle** [comment]
in the pod network namespace, the arp record is not correct
```
ip -s -s neigh
10.161.233.247 dev eth0 lladdr ee:ee:ee:ee:ee:ee used 18/78/18 probes 0 STALE
169.254.1.1 dev eth0 lladdr ee:ee:ee:ee:ee:ee ref 1 used 45/0/45 probes 4 REACHABLE
```
the tcpdump for arp 
```
04:13:11.319422 ARP, Request who-has idc-k8s-cal-node-23 tell idc-k8s-cal-node-23.cloud.onecloud.io, length 28
04:13:11.319457 ARP, Reply idc-k8s-cal-node-23 is-at 92:84:23:63:fb:94 (oui Unknown), length 28
04:13:41.335429 ARP, Request who-has idc-k8s-cal-node-23 tell idc-k8s-cal-node-23.cloud.onecloud.io, length 28
04:13:41.335447 ARP, Reply idc-k8s-cal-node-23 is-at 92:84:23:63:fb:94 (oui Unknown), length 28
04:14:11.335415 ARP, Request who-has idc-k8s-cal-node-23 tell idc-k8s-cal-node-23.cloud.onecloud.io, length 28
04:14:11.335446 ARP, Reply idc-k8s-cal-node-23 is-at 92:84:23:63:fb:94 (oui Unknown), length 28
04:14:41.383442 ARP, Request who-has idc-k8s-cal-node-23 tell idc-k8s-cal-node-23.cloud.onecloud.io, length 28
04:14:41.383486 ARP, Reply idc-k8s-cal-node-23 is-at 92:84:23:63:fb:94 (oui Unknown), length 28
04:15:11.527418 ARP, Request who-has idc-k8s-cal-node-23 tell idc-k8s-cal-node-23.cloud.onecloud.io, length 28
04:15:11.527441 ARP, Reply idc-k8s-cal-node-23 is-at 92:84:23:63:fb:94 (oui Unknown), length 28
04:15:41.527439 ARP, Request who-has idc-k8s-cal-node-23 tell idc-k8s-cal-node-23.cloud.onecloud.io, length 28
04:15:41.527462 ARP, Reply idc-k8s-cal-node-23 is-at 92:84:23:63:fb:94 (oui Unknown), length 28
```
l flush the arp cache in pod network namespace, but  later, it's call arp request interval.

**Comment by caseydavenport** [comment]
> 169.254.1.1 dev eth0 lladdr ee:ee:ee:ee:ee:ee ref 1 used 45/0/45 probes 4 REACHABLE

This is expected - Calico uses proxy-arp from the host and each pod is connected via its own L3 link to the host, with not other devices.

**Comment by caseydavenport** [comment]
It's not clear to me from the post what the symptoms you're experiencing are - what packet path are you experiencing SNAT on that you believe shouldn't have SNAT?

**Comment by huangjiasingle** [comment]
> It's not clear to me from the post what the symptoms you're experiencing are - what packet path are you experiencing SNAT on that you believe shouldn't have SNAT?

in the pod, the client source ip should‘t the server pod's node ip,  if the source ip is the server pod ip, when node set tcp_tw_recycle=1, some time, can't access the server pod.

**Comment by caseydavenport** [comment]
You should look at the iptables rules on the sending node to see why the SNAT is occurring. There is likely a rule with SNAT or MASQ present. 

Calico shouldn't be performing this NAT, so if I had to guess I would say it's kube-proxy or another rule on the host.
