### ISSUE TITLE
Pod connect externel mysql error 

### ISSUE THREAD

**Issue by Rogary** [projectcalico/calico#2291]
Hello ,I want to use service in pod to connect   Externel Mysql but  not use

in kubernetes  i want to use service and endpoint  to connect a externel mysql like this 
```yml
kind: Endpoints
apiVersion: v1
metadata:
  name: mysql-endpoint
  namespace: default
subsets:
  - addresses:
      - ip: 10.111.121.2 # this is externel mysql ip address
    ports:
      - port: 3306
---------
apiVersion: v1
kind: Service
metadata:
  name: mysql-endpoint
  namespace: default
spec:
  ports:
    - port: 3306
```

now i have a Service like this 
```
Name:              mysql-endpoint
Namespace:         default
Labels:            <none>
Annotations:       kubectl.kubernetes.io/last-applied-configuration:
                     {"apiVersion":"v1","kind":"Service","metadata":{"annotations":{},"name":"mysql-endpoint","namespace":"default","selfLink":"/api/v1/namespa...
Selector:          <none>
Type:              ClusterIP
IP:                10.99.53.23
Port:              <unset>  3306/TCP
TargetPort:        3306/TCP
Endpoints:         10.111.121.2:3306
Session Affinity:  None
```

## Expected Behavior 
In hope that i can use clusterIp + port to connect Externel mysql  in pod 

## Current Behavior 
in  cluster  node  i can telnet  clusterIp port  this Service ,
```
# telnet 10.99.53.23 3306
Trying 10.99.53.23...
Connected to 10.99.53.23.
Escape character is '^]'.
```
but in pod i can't  ,
```
# nc -vzw 10 10.99.53.23 3306
nc: 10.99.53.23 (10.99.53.23:3306): Operation timed out
```
## Possible Solution
i try to modify NetworkPolicy  allow-all 
```
kubectl apply -f - <<EOF
apiVersion: networking.k8s.io/v1
kind: NetworkPolicy
metadata:
  name: allow-all
spec:
  podSelector: {}
  egress:
  - {}
  policyTypes:
  - Egress
EOF
------------------
kubectl create -f - <<EOF
apiVersion: networking.k8s.io/v1
kind: NetworkPolicy
metadata:
  name: allow-all-1
spec:
  podSelector: {}
  ingress:
  - {}
EOF
```
but not use 
then 
i use tcpdump  in mysql node  i got this 
```
15:59:33.043557 IP 192.1.1.24.36009 > nsxjapptst01.cs1cloud.internal.mysql: Flags [S], seq 2624077831, win 28000, options [mss 1400,sackOK,TS val 1060556222 ecr 0,nop,wscale 7], length 0
15:59:33.043614 IP nsxjapptst01.cs1cloud.internal.mysql > 192.1.1.24.36009: Flags [S.], seq 195091831, ack 2624077832, win 28960, options [mss 1460,sackOK,TS val 1061852098 ecr 1060556222,nop,wscale 7], length 0
```
and tcpdump in pod node 
```
16:35:13.452727 IP 192.1.1.24.42053 > nsxjapptst01.cs1cloud.internal.mysql: Flags [S], seq 2971838493, win 28000, options [mss 1400,sackOK,TS val 1062696641 ecr 0,nop,wscale 7], length 0
16:35:14.455413 IP 192.1.1.24.42053 > nsxjapptst01.cs1cloud.internal.mysql: Flags [S], seq 2971838493, win 28000, options [mss 1400,sackOK,TS val 1062697644 ecr 0,nop,wscale 7], length 0
```
**Package has Already arrived to mysql node ,but   NO Package Return** 

192.1.1.24  this is my pod IP but mysql node has no route to 192.1.0.0/16  so package can't return 

so i configed calico ip pool 
like this 
https://docs.projectcalico.org/master/usage/external-connectivity
```
cat << EOF | calicoctl apply -f -
- apiVersion: projectcalico.org/v3
  kind: IPPool
  metadata:
    name: default-ipv4-ippool
  spec:
    cidr: 192.168.0.0/16
    ipipMode: Always
    natOutgoing: true
EOF
```
but it still not work  
in mysql node tcpdump not change

How can i Connect mysql in pod?

**Comment by caseydavenport** [comment]
@Rogary I'd expect the traffic to go through an SNAT, because you set `natOutgoing: true`. You're still seeing the traffic reach the SQL node with a source address of the pod?

Could you show the output of this command? `calicoctl get ippool -o yaml`

**Comment by caseydavenport** [comment]
The SQL node doesn't need to support BGP, but it needs to be able to route back to the sending pod.

That could be done in a few ways:
- Default route which includes the pod range and directs it to an appropriate router
- Enabling `natOutgoing: true` on your IP pool so that traffic leaves the host with the host's address.
- Or, running BGP on the SQL node itself.

I suspect in your scenario, you want option 2 - enabling outgoing NAT - since I'm assuming the SQL node can route to the Kubernetes hosts. 

I see in the second half of your post that you did try that, but it still didn't work - I'd first check if the packets are actually being masqueraded, and if so then try to identify whether or not the SQL node actually has network access to the Kubernetes nodes.

i.e., can you access the SQL node from your k8s hosts?
