### ISSUE TITLE
V6 vxlanCrossSubNet does not create routes over vxlan in purely ipv6 env

### ISSUE THREAD

**Issue by tomastigera** [projectcalico/calico#9403]
We ran into a similar issue when we tested Calico. Only difference in our setup is that we run IPv6 Single-Stack.
DNS was not working, but the underlying issue was deeper and general pod-to-pod traffic was not working between pods on different nodes.

Config looked as follows:
```
apiVersion: operator.tigera.io/v1
kind: Installation
metadata:
  annotations:
    meta.helm.sh/release-name: calico
    meta.helm.sh/release-namespace: tigera-operator
  creationTimestamp: "2024-10-18T07:58:09Z"
  finalizers:
  - operator.tigera.io/installation-controller
  - tigera.io/operator-cleanup
  - operator.tigera.io/apiserver-controller
  generation: 3
  labels:
    app.kubernetes.io/managed-by: Helm
    helm.toolkit.fluxcd.io/name: test-cluster-addons-calico
    helm.toolkit.fluxcd.io/namespace: provider
  name: default
  resourceVersion: "2351712"
  uid: 93644abd-7176-43ea-9c86-ee3b103b86b3
spec:
  calicoNetwork:
    bgp: Disabled
    hostPorts: Enabled
    ipPools:
    - allowedUses:
      - Workload
      - Tunnel
      blockSize: 122
      cidr: fd80:cafe::/104
      disableBGPExport: true
      encapsulation: VXLANCrossSubnet
      name: default-ipv6-ippool
      natOutgoing: Enabled
      nodeSelector: all()
    linuxDataplane: BPF
    multiInterfaceMode: None
    nodeAddressAutodetectionV4: {}
    nodeAddressAutodetectionV6:
      kubernetes: NodeInternalIP
    windowsDataplane: Disabled
  cni:
    ipam:
      type: Calico
    type: Calico
  controlPlaneReplicas: 2
  flexVolumePath: /usr/libexec/kubernetes/kubelet-plugins/volume/exec/
  imagePullSecrets: []
  kubeletVolumePluginPath: /var/lib/kubelet
  kubernetesProvider: ""
  logging:
    cni:
      logFileMaxAgeDays: 30
      logFileMaxCount: 10
      logFileMaxSize: 100Mi
      logSeverity: Debug
  nodeUpdateStrategy:
    rollingUpdate:
      maxUnavailable: 1
    type: RollingUpdate
  nonPrivileged: Disabled
  variant: Calico
---
apiVersion: projectcalico.org/v3
kind: FelixConfiguration
metadata:
  annotations:
    operator.tigera.io/bpfEnabled: "true"
  creationTimestamp: "2024-10-18T07:58:14Z"
  generation: 1
  name: default
  resourceVersion: "2351439"
  uid: 7d7bcc1d-ec32-4f17-9099-8b55d64a4dd2
spec:
  bpfConnectTimeLoadBalancing: TCP
  bpfEnabled: true
  bpfHostNetworkedNATWithoutCTLB: Enabled
  bpfLogLevel: ""
  floatingIPs: Disabled
  healthPort: 9099
  logSeverityScreen: Info
  reportingInterval: 0s
  vxlanVNI: 4096
```

The root cause in our setup seems to be that the VXLAN device is not used as routes are incorrectly set by Calico:
```
# ip -6 r
2001:db8::1 dev bpfin.cali metric 1024 pref medium
fd01:cafe::/64 dev eth0 proto ra metric 1024 mtu 65520 hoplimit 255 pref medium
fd80:cafe::5f:4281 dev cali3b862d89810 metric 1024 pref medium
fd80:cafe::5f:4282 dev cali9d386f561d2 metric 1024 pref medium
fd80:cafe::5f:4283 dev cali856dc622126 metric 1024 pref medium
blackhole fd80:cafe::5f:4280/122 dev lo proto 80 metric 1024 pref medium
fd80:cafe::a8:4d00/122 via fd01:cafe::f14c:9fa1:8496:5550 dev eth0 proto 80 metric 1024 onlink pref medium
fd85:cafe::a via 2001:db8::1 dev bpfin.cali src fd01:cafe::4aab:d761:d808:996 metric 1024 pref medium
fe80::/64 dev eth0 proto kernel metric 256 pref medium
fe80::/64 dev cali3b862d89810 proto kernel metric 256 pref medium
fe80::/64 dev cali9d386f561d2 proto kernel metric 256 pref medium
fe80::/64 dev bpfout.cali proto kernel metric 256 pref medium
fe80::/64 dev bpfin.cali proto kernel metric 256 pref medium
fe80::/64 dev cali856dc622126 proto kernel metric 256 pref medium
default dev eth0 proto static metric 1000 pref medium
default via fe80::ecee:eeff:feee:eeee dev eth0 proto ra metric 1024 expires 65136sec mtu 65520 hoplimit 255 pref medium
```

We were expecting `fd80:cafe::a8:4d00/122 via fd01:cafe::f14c:9fa1:8496:5550 dev eth0 proto 80 metric 1024 onlink pref medium` to go through the vxlan interface and not be directly routed to the second node (`fd01...`).

@matthewdupre Hopefully that helps. We are currently working around this issue by using flannel, but would prefer calico.

_Originally posted by @trevex in https://github.com/projectcalico/calico/issues/8811#issuecomment-2421779071_

**Comment by tomastigera** [comment]
@nitrocb @trevex `thruby/node:3-28-vxlan6-fix-1` is animage based on 3.28 with this change https://github.com/projectcalico/calico/pull/9420 Could you try it out if it solves the problem for you?

**Comment by nitrocb** [comment]
Hi @tomastigera,

sorry for the delay, I was now able to test the newest calico version (3.29.1).
Unfortunately the connectivity from a node to a pod on another node still does not work.

Here are some things to keep in mind:

- we are using kubevirt VMs as cluster-nodes
- we are running on IPv6 single stack
- when using Flannel as CNI, this is all working fine
- this has been tested with eBPF dataplane and iptables mode

Here is what I tested:

I have built a new Talos cluster on Kubevirt VMs:

```
$ k get no -owide
NAME            STATUS   ROLES           AGE   VERSION   INTERNAL-IP                      EXTERNAL-IP   OS-IMAGE         KERNEL-VERSION   CONTAINER-RUNTIME
talos-e7u-vo4   Ready    control-plane   65m   v1.30.1   fd01:cafe::f14c:9fa1:8496:5574   <none>        Talos (v1.8.2)   6.6.58-talos     containerd://2.0.0-rc.6
talos-jes-u3j   Ready    control-plane   66m   v1.30.1   fd01:cafe::4e6b:47a6:a647:d26b   <none>        Talos (v1.8.2)   6.6.58-talos     containerd://2.0.0-rc.6
talos-tjg-f18   Ready    control-plane   66m   v1.30.1   fd01:cafe::9aa9:bd8d:90ee:a315   <none>        Talos (v1.8.2)   6.6.58-talos     containerd://2.0.0-rc.6
```

The nodes are able to reach each other:

```
root@talos-tjg-f18:/# ping -c3  fd01:cafe::4e6b:47a6:a647:d26b
PING fd01:cafe::4e6b:47a6:a647:d26b (fd01:cafe::4e6b:47a6:a647:d26b) 56 data bytes
64 bytes from fd01:cafe::4e6b:47a6:a647:d26b: icmp_seq=1 ttl=255 time=0.509 ms
64 bytes from fd01:cafe::4e6b:47a6:a647:d26b: icmp_seq=2 ttl=255 time=0.543 ms
64 bytes from fd01:cafe::4e6b:47a6:a647:d26b: icmp_seq=3 ttl=255 time=0.698 ms

--- fd01:cafe::4e6b:47a6:a647:d26b ping statistics ---
3 packets transmitted, 3 received, 0% packet loss, time 2031ms
rtt min/avg/max/mdev = 0.509/0.583/0.698/0.082 ms
```

When I check the routes on the nodes, I also see routes to the other nodeCIDRs going through the vxlan interface now, which was not the case before:

```
root@talos-tjg-f18:/# ip -6 r |grep vxlan
fd80:cafe::29:a8c0/122 via fd80:cafe::29:a8c0 dev vxlan-v6.calico metric 1024 onlink pref medium
fd80:cafe::78:fb00/122 via fd80:cafe::78:fb00 dev vxlan-v6.calico metric 1024 onlink pref medium
```

But when I try to reach a pod on another node, like the coreDNS pod for example, it does not work:

```
$ k -n kube-system get po coredns-cc8bf9fd8-ndfhw -owide
NAME                      READY   STATUS    RESTARTS   AGE   IP                   NODE            NOMINATED NODE   READINESS GATES
coredns-cc8bf9fd8-ndfhw   1/1     Running   0          39m   fd80:cafe::29:a8c3   talos-jes-u3j   <none>           <none>

root@talos-tjg-f18:/# nc -vzw 5 fd80:cafe::29:a8c3 53
nc: connect to fd80:cafe::29:a8c3 port 53 (tcp) timed out: Operation now in progress
```

While on the node where the coreDNS pod is running, this connection works fine:

```
root@talos-jes-u3j:/# nc -vzw 5 fd80:cafe::29:a8c3 53
Connection to fd80:cafe::29:a8c3 53 port [tcp/*] succeeded!
```

What we also noticed is, that in iptables dataplane mode there seems to be no bridge, where the calico pod-interfaces are connected to:

```
root@talos-jes-u3j:/# ip a s calieb2ccbd263f
18: calieb2ccbd263f@if5: <BROADCAST,MULTICAST,UP,LOWER_UP> mtu 1430 qdisc noqueue state UP group default qlen 1000
    link/ether ee:ee:ee:ee:ee:ee brd ff:ff:ff:ff:ff:ff link-netnsid 5
    inet6 fe80::ecee:eeff:feee:eeee/64 scope link
       valid_lft forever preferred_lft forever
root@talos-jes-u3j:/# bridge link show
root@talos-jes-u3j:/#
```

This interface is not connected to any master and no bridge exists. We are not sure, if this is intended behaviour.

Thank you very much for your thoughts on this!

**Comment by tomastigera** [comment]
> When I check the routes on the nodes, I also see routes to the other nodeCIDRs going through the vxlan interface now, which was not the case before:

Thanks for testing and verifying this.

> But when I try to reach a pod on another node, like the coreDNS pod for example, it does not work:

Did you do any tcpdump on the node `talos-tjg-f18` where the client is to see where the packet went? Any tcpdump from the vxlan device to see if the packet reached it or from the main iface if you could see the vxlan packet there?

**Comment by nitrocb** [comment]
Hi @tomastigera,

I can see that the source node tries to send the packet over the vxlan interface:

```
root@talos-tjg-f18:/# tcpdump -n -i vxlan-v6.calico host fd80:cafe::29:a8c3
tcpdump: verbose output suppressed, use -v[v]... for full protocol decode
listening on vxlan-v6.calico, link-type EN10MB (Ethernet), snapshot length 262144 bytes
08:24:27.488353 IP6 fd80:cafe::63:5bc0.37190 > fd80:cafe::29:a8c3.53: Flags [S], seq 1880556868, win 64390, options [mss 1370,sackOK,TS val 106898775 ecr 0,nop,wscale 7], length 0
08:24:28.491135 IP6 fd80:cafe::63:5bc0.37190 > fd80:cafe::29:a8c3.53: Flags [S], seq 1880556868, win 64390, options [mss 1370,sackOK,TS val 106899778 ecr 0,nop,wscale 7], length 0
08:24:29.515122 IP6 fd80:cafe::63:5bc0.37190 > fd80:cafe::29:a8c3.53: Flags [S], seq 1880556868, win 64390, options [mss 1370,sackOK,TS val 106900802 ecr 0,nop,wscale 7], length 0
08:24:30.539135 IP6 fd80:cafe::63:5bc0.37190 > fd80:cafe::29:a8c3.53: Flags [S], seq 1880556868, win 64390, options [mss 1370,sackOK,TS val 106901826 ecr 0,nop,wscale 7], length 0
08:24:31.563123 IP6 fd80:cafe::63:5bc0.37190 > fd80:cafe::29:a8c3.53: Flags [S], seq 1880556868, win 64390, options [mss 1370,sackOK,TS val 106902850 ecr 0,nop,wscale 7], length 0
08:24:32.587136 IP6 fd80:cafe::63:5bc0.37190 > fd80:cafe::29:a8c3.53: Flags [S], seq 1880556868, win 64390, options [mss 1370,sackOK,TS val 106903874 ecr 0,nop,wscale 7], length 0
08:24:34.603129 IP6 fd80:cafe::63:5bc0.37190 > fd80:cafe::29:a8c3.53: Flags [S], seq 1880556868, win 64390, options [mss 1370,sackOK,TS val 106905890 ecr 0,nop,wscale 7], length 0
08:24:38.699120 IP6 fd80:cafe::63:5bc0.37190 > fd80:cafe::29:a8c3.53: Flags [S], seq 1880556868, win 64390, options [mss 1370,sackOK,TS val 106909986 ecr 0,nop,wscale 7], length 0
```

But on the destination node I do not get any packet from the source node:

```
root@talos-jes-u3j:/# tcpdump -n -i vxlan-v6.calico host fd80:cafe::63:5bc0
tcpdump: verbose output suppressed, use -v[v]... for full protocol decode
listening on vxlan-v6.calico, link-type EN10MB (Ethernet), snapshot length 262144 bytes
```

So the packet is being sent over the vxlan interface, which is correct, but it never reaches the destination node.
I also am not able to ping the vxlan interface IP address of the destionation node either:

```
root@talos-jes-u3j:/# ip a s vxlan-v6.calico
10: vxlan-v6.calico: <BROADCAST,MULTICAST,UP,LOWER_UP> mtu 1430 qdisc noqueue state UNKNOWN group default qlen 1000
    link/ether 66:1d:a1:26:de:0f brd ff:ff:ff:ff:ff:ff
    inet6 fd80:cafe::29:a8c0/128 scope global
       valid_lft forever preferred_lft forever

root@talos-tjg-f18:/# ping -c3 fd80:cafe::29:a8c0
PING fd80:cafe::29:a8c0 (fd80:cafe::29:a8c0) 56 data bytes

--- fd80:cafe::29:a8c0 ping statistics ---
3 packets transmitted, 0 received, 100% packet loss, time 2047ms
```

**Comment by tomastigera** [comment]
> root@talos-jes-u3j:/# tcpdump -n -i vxlan-v6.calico host fd80:cafe::63:5bc0

Would you see the VXLAN packets leaving the first node and entering the second node? They should be UDP port 4789 from/to the nodes main IPs.

**Comment by nitrocb** [comment]
The packets are leaving the first node through the eth0 interface:

```
root@talos-tjg-f18:/# tcpdump -ni eth0 port 4789 |grep -B1 "\.53:"
tcpdump: verbose output suppressed, use -v[v]... for full protocol decode
listening on eth0, link-type EN10MB (Ethernet), snapshot length 262144 bytes
12:36:34.219136 IP6 fd01:cafe::9aa9:bd8d:90ee:a315.42813 > fd01:cafe::4e6b:47a6:a647:d26b.4789: VXLAN, flags [I] (0x08), vni 4096
IP6 fd80:cafe::63:5bc0.49298 > fd80:cafe::29:a8c3.53: Flags [S], seq 95917388, win 64390, options [mss 1370,sackOK,TS val 208425506 ecr 0,nop,wscale 7], length 0
--
12:36:35.805935 IP6 fd01:cafe::9aa9:bd8d:90ee:a315.46930 > fd01:cafe::4e6b:47a6:a647:d26b.4789: VXLAN, flags [I] (0x08), vni 4096
IP6 fd80:cafe::63:5bc0.32930 > fd80:cafe::29:a8c3.53: Flags [S], seq 2312745495, win 64390, options [mss 1370,sackOK,TS val 208427092 ecr 0,nop,wscale 7], length 0
--
12:36:36.811159 IP6 fd01:cafe::9aa9:bd8d:90ee:a315.34147 > fd01:cafe::4e6b:47a6:a647:d26b.4789: VXLAN, flags [I] (0x08), vni 4096
IP6 fd80:cafe::63:5bc0.32930 > fd80:cafe::29:a8c3.53: Flags [S], seq 2312745495, win 64390, options [mss 1370,sackOK,TS val 208428098 ecr 0,nop,wscale 7], length 0
--
12:36:37.835164 IP6 fd01:cafe::9aa9:bd8d:90ee:a315.38252 > fd01:cafe::4e6b:47a6:a647:d26b.4789: VXLAN, flags [I] (0x08), vni 4096
IP6 fd80:cafe::63:5bc0.32930 > fd80:cafe::29:a8c3.53: Flags [S], seq 2312745495, win 64390, options [mss 1370,sackOK,TS val 208429122 ecr 0,nop,wscale 7], length 0
```

When I check on the second node, the packets do not arrive there at all for port 4789:

```
root@talos-jes-u3j:/# tcpdump -ni eth0 port 4789
tcpdump: verbose output suppressed, use -v[v]... for full protocol decode
listening on eth0, link-type EN10MB (Ethernet), snapshot length 262144 bytes
```

But the connectivity between the nodes in general is not a problem, other connections from node to node directly are working perfectly fine.

**Comment by nitrocb** [comment]
What I noticed in addition is the following:

Only port 4789 does not seem to go through:

```
root@talos-tjg-f18:/# nc -vzu fd01:cafe::4e6b:47a6:a647:d26b 4789
Connection to fd01:cafe::4e6b:47a6:a647:d26b 4789 port [udp/*] succeeded!   #succeeded because of UDP
```
```
root@talos-jes-u3j:/# tcpdump -ni eth0 port 4789
tcpdump: verbose output suppressed, use -v[v]... for full protocol decode
listening on eth0, link-type EN10MB (Ethernet), snapshot length 262144 bytes
```

While other random ports succeed:

```
root@talos-tjg-f18:/# nc -vzu fd01:cafe::4e6b:47a6:a647:d26b 10123
Connection to fd01:cafe::4e6b:47a6:a647:d26b 10123 port [udp/*] succeeded!
```
```
tcpdump: verbose output suppressed, use -v[v]... for full protocol decode
listening on eth0, link-type EN10MB (Ethernet), snapshot length 262144 bytes
14:02:31.580905 IP6 fd01:cafe::9aa9:bd8d:90ee:a315.58280 > fd01:cafe::4e6b:47a6:a647:d26b.10123: UDP, length 1
14:02:31.580906 IP6 fd01:cafe::9aa9:bd8d:90ee:a315.58280 > fd01:cafe::4e6b:47a6:a647:d26b.10123: UDP, length 1
14:02:32.580575 IP6 fd01:cafe::9aa9:bd8d:90ee:a315.58280 > fd01:cafe::4e6b:47a6:a647:d26b.10123: UDP, length 1
14:02:33.580876 IP6 fd01:cafe::9aa9:bd8d:90ee:a315.58280 > fd01:cafe::4e6b:47a6:a647:d26b.10123: UDP, length 1
14:02:34.581036 IP6 fd01:cafe::9aa9:bd8d:90ee:a315.58280 > fd01:cafe::4e6b:47a6:a647:d26b.10123: UDP, length 1
```

Could it be, that there is a problem with the iptables configuration here?

**Comment by tomastigera** [comment]
> Only port 4789 does not seem to go through:

Hmmm that is interesting. So either something blocks that port or our ebpf program on the other host drops it.

If the first one is the case, you can move the overlay to a different port, but if you tried and it works in iptables, it is unlikely the problem.

You can use `calico-node -bpf counters dump --iface=eth0` on the destination node to see if we are dropping and why. 

Then you may enabled bpf debug logs and see what it going on in there. you may use bpfLogFilters to look for udp port 4789 only.

**Comment by nitrocb** [comment]
I got to the root of the problem:

As we are using kubevirt to run those nodes and the host cluster also uses calico, the default vxlan port is blocked by the underlying calico instance. After changing to a custom vxlan port on the for the virtual clusters, the connections are now working fine:

```
$ k get felixconfigurations default -oyaml |yq .spec.vxlanPort
4790

$ k -n kube-system get po coredns-cc8bf9fd8-ndfhw -owide
NAME                      READY   STATUS    RESTARTS   AGE    IP                   NODE            NOMINATED NODE   READINESS GATES
coredns-cc8bf9fd8-ndfhw   1/1     Running   0          7d1h   fd80:cafe::29:a8c3   talos-jes-u3j   <none>           <none>
```

```
root@talos-tjg-f18:/# telnet fd80:cafe::29:a8c3 53
Trying fd80:cafe::29:a8c3...
Connected to fd80:cafe::29:a8c3.
Escape character is '^]'.
Connection closed by foreign host.
```

So I guess this can then re considered resolved 👌

**Comment by tomastigera** [comment]
Hey @nitrocb , there is an option `AllowVXLANPacketsFromWorkloads` which defaults to `false` that was brought to my attention by @coutinhop . So I think you have to set that one in your underlying cluster. With that, I will close the issue. Thanks for reporting back that you resolved the issue :raised_hands: 

https://docs.tigera.io/calico/latest/reference/resources/felixconfig#allowVXLANPacketsFromWorkloads
