### ISSUE TITLE
Pod-to-External DNS queries timing out when eBPF on

### ISSUE THREAD

**Issue by l8bloom** [projectcalico/calico#11623]
Hello,

I have issues with pods traffic targeting external endpoints, (eg. _google.com_) being timed out due to DNS not being resolved properly.
More specifically it seems SNAT is not in place, hence my pods never get the response back.

## Expected Behavior
Pods external traffic is being SNAT-ed.

## Current Behavior

Pods can't send traffic to public IP endpoints.

## Steps to Reproduce (for bugs)

1. Running a home lab cluster with eBPF enabled, calico installed with the default:
CALICO_VERSION="3.31.3"
https://raw.githubusercontent.com/projectcalico/calico/v$CALICO_VERSION/manifests/operator-crds.yaml
https://raw.githubusercontent.com/projectcalico/calico/v$CALICO_VERSION/manifests/tigera-operator.yaml
https://raw.githubusercontent.com/projectcalico/calico/v$CALICO_VERSION/manifests/custom-resources-bpf.yaml

2. `custom-resources-bpf.yaml` updated with `ipPools.cidr` to `10.244.0.0/16` to match kubeadm init's `--pod-network-cidr`.
3. Deploy test nginx, crictl exec -it to it  and try `curl -L google.com`, fails with

```
root@nginx-deployment-54bb44699-48ts9:/# curl -L google.com
curl: (6) Could not resolve host: google.com
```

## Context

Pods don't have essentially access to external/public Internet.

Tigera operator reports all resources as ready ✔️ 

```kubectl get tigerastatuses.operator.tigera.io 
NAME                AVAILABLE   PROGRESSING   DEGRADED   SINCE
apiserver           True        False         False      103m
calico              True        False         False      39m
goldmane            True        False         False      28m
ippools             True        False         False      107m
kubeproxy-monitor   True        False         False      107m
whisker             True        False         False      102m
```

CoreDNS up and running ✔️ 

```
kubectl get pods -n kube-system -l k8s-app=kube-dns
NAME                       READY   STATUS    RESTARTS      AGE
coredns-587b887f6f-n9zsz   1/1     Running   1 (30m ago)   57m
coredns-587b887f6f-vmn9r   1/1     Running   1 (30m ago)   57m
```

Node to pod, pod to pod and service to pod all work ✔️ 

```
kubectl get svc
NAME            TYPE        CLUSTER-IP       EXTERNAL-IP   PORT(S)   AGE
kubernetes      ClusterIP   10.96.0.1        <none>        443/TCP   118m
nginx-service   ClusterIP   10.104.200.193   <none>        80/TCP    107m
```

```
curl 10.104.200.193
<!DOCTYPE html>
<html>
<head>
<title>Welcome to nginx!</title>
<style>
html { color-scheme: light dark; }
body { width: 35em; margin: 0 auto;
font-family: Tahoma, Verdana, Arial, sans-serif; }
</style>
</head>
<body>
<h1>Welcome to nginx!</h1>
...
```

curl -L google.com works in global/system shell and docker based containers ✔️ 

CoreDNS reports errors ❌ 

```
kubectl logs -n kube-system deploy/coredns
Found 2 pods, using pod/coredns-587b887f6f-n9zsz
maxprocs: Leaving GOMAXPROCS=16: CPU quota undefined
.:53
[INFO] plugin/reload: Running configuration SHA512 = 1b226df79860026c6a52e67daa10d7f0d57ec5b023288ec00c5e05f93523c894564e15b91770d3a07ae1cfbe861d15b37d4a0027e69c546ab112970993a3b03b
CoreDNS-1.13.1
linux/amd64, go1.25.2, 1db4568
[ERROR] plugin/errors: 2 1458823090375742670.8608639235073720918. HINFO: read udp 10.244.206.152:53973->195.29.247.161:53: i/o timeout
[ERROR] plugin/errors: 2 1458823090375742670.8608639235073720918. HINFO: read udp 10.244.206.152:58302->195.29.247.162:53: i/o timeout
[ERROR] plugin/errors: 2 1458823090375742670.8608639235073720918. HINFO: read udp 10.244.206.152:45678->195.29.247.162:53: i/o timeout
[ERROR] plugin/errors: 2 1458823090375742670.8608639235073720918. HINFO: read udp 10.244.206.152:43656->195.29.247.162:53: i/o timeout
[ERROR] plugin/errors: 2 1458823090375742670.8608639235073720918. HINFO: read udp 10.244.206.152:40956->195.29.247.162:53: i/o timeout
...
```

ISP's DNS server `195.29.247.161.53` can't answer to 10.x.x.x, no SNAT ❌ 

```
sudo tcpdump -i any udp port 53 -n
tcpdump: data link type LINUX_SLL2
tcpdump: verbose output suppressed, use -v[v]... for full protocol decode
listening on any, link-type LINUX_SLL2 (Linux cooked v2), snapshot length 262144 bytes
13:25:14.439619 cali50d19c830a9 In  IP 10.244.206.152.57987 > 195.29.247.161.53: 49524+ NS? . (17)
13:25:14.471654 calib39cd32d877 In  IP 10.244.206.153.37939 > 195.29.247.162.53: 36685+ NS? . (17)
13:25:14.834065 cali50d19c830a9 In  IP 10.244.206.152.47250 > 195.29.247.162.53: 24035+ NS? . (17)
13:25:14.878193 calib39cd32d877 In  IP 10.244.206.153.35148 > 195.29.247.161.53: 53973+ NS? . (17)
13:25:15.941229 cali50d19c830a9 In  IP 10.244.206.152.44558 > 195.29.247.161.53: 40457+ NS? . (17)
```
As shown in the tcpdump log, outbound UDP 53 packets retain the Pod IP 10.244.206.152 when egressing the node. This indicates that the Calico eBPF data plane is failing to perform SNAT (Masquerade) despite natOutgoing: true being set in the IPPool.
I have tried to replace `forward . /etc/resolv.conf` in coredns with eg. `1.1.1.1` but the outcome is same.

```
kubectl get felixconfiguration default -o yaml
apiVersion: projectcalico.org/v3
kind: FelixConfiguration
metadata:
  annotations:
    operator.tigera.io/bpfEnabled: "true"
  creationTimestamp: "2026-01-06T10:24:39Z"
  generation: 1
  name: default
  resourceVersion: "6026"
  uid: 46711f8c-f919-48b2-a02e-d90cc26c578c
spec:
  bpfConnectTimeLoadBalancing: TCP
  bpfEnabled: true
  bpfExternalServiceMode: Tunnel
  bpfHostNetworkedNATWithoutCTLB: Enabled
  bpfLogLevel: ""
  floatingIPs: Disabled
  healthPort: 9099
  logSeverityScreen: Info
  nftablesMode: Enabled
  reportingInterval: 0s
  vxlanPort: 4789
  vxlanVNI: 4096
```

```
kubectl get ippools default-ipv4-ippool -o yaml
apiVersion: projectcalico.org/v3
kind: IPPool
metadata:
  creationTimestamp: "2026-01-06T10:24:37Z"
  generation: 1
  labels:
    app.kubernetes.io/managed-by: tigera-operator
  name: default-ipv4-ippool
  resourceVersion: "8945"
  uid: ba9a2550-5ad1-4fbd-9f4d-a1b6969df1d3
spec:
  allowedUses:
  - Workload
  - Tunnel
  assignmentMode: Automatic
  blockSize: 26
  cidr: 10.244.0.0/16
  ipipMode: Never
  natOutgoing: true
  nodeSelector: all()
  vxlanMode: Always
```

## Your Environment

* Calico version: 3.31.3
* Calico dataplane: bpf
* Orchestrator version: kubernetes 1.35.0
* Operating System and version: Linux 6.14.0-37-generic, Ubuntu 24.04.3 LTS

Happy to provide more, thank you in advance.

**Comment by sridhartigera** [comment]
@l8bloom `195.29.247.161` is the nameserver in your node's /etc/resolv.conf? Is `10.244.206.152` the coredns pod IP?

**Comment by sridhartigera** [comment]
With `natOutgoing` set to `true`, I expect the DNS requests to external server to be SNATed.

**Comment by tomastigera** [comment]
Given that your tcpdump listens on all devices, it is weird that you do not see any port 53 packet on another device.

```
tcpdump: verbose output suppressed, use -v[v]... for full protocol decode
listening on any, link-type LINUX_SLL2 (Linux cooked v2), snapshot length 262144 bytes
13:25:14.439619 cali50d19c830a9 In  IP 10.244.206.152.57987 > 195.29.247.161.53: 49524+ NS? . (17)
13:25:14.471654 calib39cd32d877 In  IP 10.244.206.153.37939 > 195.29.247.162.53: 36685+ NS? . (17)
```

> More specifically it seems SNAT is not in place, hence my pods never get the response back.

Do you see the packets actually leaving the node? How is your routing on the node? Would you see any iptables rules that drop? (SNAT for NATOutgoing is done by iptables even in eBPF dataplane)

**Comment by Hamedmt** [comment]
Hi @tomastigera
I have seen similar behavior in my three nodes cluster using RKE2 too. The RKE2 version is `v1.33.5+rke2r1` and Calico version is `v3.30.3` using the images provided by rancher repo. The CNI is using iptables/kube-proxy (No eBPF) and wireguard is enabled for node-2-node encryption. Also, the `Tx` and `Rx` `checksum` are off for the wireguard and vxlan interface on the node to avoid checksum issue that has been reported on some NICs.

The problem is that UDP packets are escaping the iptables `NAT` table and are routed to the external network/GW via the routing table on the OS, which is not supposed to happen. However, TCP sessions are fine. As an example, `dig @10.43.0.10 <SVC>` gets a timeout but enforcing `TCP` by `dig @10.43.0.10 <SVC> +tcp` works fine. The `tcpdump` confirms this too. TCP packets are handled by wireguard (for intra-cluster) or pods interfaces, while UDP packets are going out via the physical interfaces.

After many investigations on the iptables to see what tables, chains, and rules are involved in handling the UDP packets, I noticed the followings.
The `output` chain in `raw` table has the following rule, and UDP packets hit this one.
```
Chain OUTPUT (policy ACCEPT 0 packets, 0 bytes)
 pkts bytes target     prot opt in     out     source               destination
7371K 4699M cali-OUTPUT  all  --  *      *       0.0.0.0/0            0.0.0.0/0            /* cali:tVnHkvAo15HuiPy0 */
```
The `cali-OUTPUT` chain has the following rules.
```
  32M   21G MARK       all  --  *      *       0.0.0.0/0            0.0.0.0/0            /* cali:clI8WObfCl4yhr60 */ MARK and 0xffe4ffff
  32M   21G cali-to-host-endpoint  all  --  *      *       0.0.0.0/0            0.0.0.0/0            /* cali:ZbkN6P8OdRcBRPpU */
5567K 3804M CT         udp  --  *      *       0.0.0.0/0            0.0.0.0/0            /* cali:ry5_UEpt1OaPPCxO */ NOTRACK
  32M   21G ACCEPT     all  --  *      *       0.0.0.0/0            0.0.0.0/0            /* cali:MGhICIksKDnYMIkW */
```

As far as I understand, the cluster traffic should not hit rule 3 and 4. Specifically talking about UDP packets, when they are hit by rule 3 (which is `NOTRACK`) they miss the NAT table and then kernel handles them with the routing table and send them to the default GW.
Is there any known workaround for this? Have I misconfigured the CNI somehow?

Thanks

**Comment by Hamedmt** [comment]
It was an iptables issue. Flushing the iptables rules on all worker nodes and then restarting kube-proxy solved it.
