### ISSUE TITLE
pod bandwidth reduced significant when calico kubernetes over openstack network!

### ISSUE THREAD

**Issue by ReyRen** [projectcalico/calico#4563]
The cluster environment is kubernetes over openstack, and using iperf3 as bandwidth measurement tool. 
This is from host to host (openstack vm):
```
root@generalai-v100s-4:~# iperf3 -c 182.18.29.16
Connecting to host 182.18.29.16, port 5201
[  4] local 182.18.29.17 port 46506 connected to 182.18.29.16 port 5201
[ ID] Interval           Transfer     Bandwidth       Retr  Cwnd
[  4]   0.00-1.00   sec  1.93 GBytes  16.6 Gbits/sec  354    974 KBytes       
[  4]   1.00-2.00   sec  1.67 GBytes  14.4 Gbits/sec   49    720 KBytes       
[  4]   2.00-3.00   sec  1.71 GBytes  14.7 Gbits/sec    0    744 KBytes       
[  4]   3.00-4.00   sec  1.81 GBytes  15.5 Gbits/sec  362    843 KBytes       
[  4]   4.00-5.00   sec  1.64 GBytes  14.1 Gbits/sec  627    858 KBytes       
[  4]   5.00-6.00   sec  1.72 GBytes  14.7 Gbits/sec  431    899 KBytes       
[  4]   6.00-7.00   sec  2.09 GBytes  17.9 Gbits/sec  294    675 KBytes       
[  4]   7.00-8.00   sec  2.10 GBytes  18.1 Gbits/sec  287    814 KBytes       
[  4]   8.00-9.00   sec  1.71 GBytes  14.7 Gbits/sec    0    884 KBytes       
[  4]   9.00-10.00  sec  1.39 GBytes  11.9 Gbits/sec  668    711 KBytes       
- - - - - - - - - - - - - - - - - - - - - - - - -
[ ID] Interval           Transfer     Bandwidth       Retr
[  4]   0.00-10.00  sec  17.8 GBytes  15.3 Gbits/sec  3072             sender
[  4]   0.00-10.00  sec  17.8 GBytes  15.2 Gbits/sec                  receiver
```
This is from pod to pod (k8s):
```
Connecting to host 10.200.152.5, port 5201
[  5] local 10.200.158.147 port 34256 connected to 10.200.152.5 port 5201
[ ID] Interval           Transfer     Bitrate         Retr  Cwnd
[  5]   0.00-1.00   sec  6.99 MBytes  58.6 Mbits/sec  584   4.07 KBytes
[  5]   1.00-2.00   sec  9.25 MBytes  77.6 Mbits/sec  834   2.71 KBytes
[  5]   2.00-3.00   sec  8.01 MBytes  67.2 Mbits/sec  568   4.07 KBytes       
[  5]   3.00-4.00   sec  7.31 MBytes  61.2 Mbits/sec  753   2.71 KBytes       
[  5]   4.00-5.00   sec  9.66 MBytes  81.2 Mbits/sec  547   2.71 KBytes       
[  5]   5.00-6.00   sec  13.0 MBytes   109 Mbits/sec  936   2.71 KBytes       
[  5]   6.00-7.00   sec  7.89 MBytes  66.2 Mbits/sec  457   5.42 KBytes       
[  5]   7.00-8.00   sec  8.75 MBytes  73.4 Mbits/sec  796   4.07 KBytes       
[  5]   8.00-9.00   sec  11.3 MBytes  95.1 Mbits/sec  1299   5.42 KBytes       
[  5]   9.00-10.00  sec  16.5 MBytes   138 Mbits/sec  1873   2.71 KBytes       
- - - - - - - - - - - - - - - - - - - - - - - - -
[ ID] Interval           Transfer     Bitrate         Retr
[  5]   0.00-10.00  sec  98.7 MBytes  82.8 Mbits/sec  8647             sender
[  5]   0.00-10.04  sec  98.6 MBytes  82.4 Mbits/sec                  receiver

iperf Done.
```
Does there any limited in?

## Expected Behavior
The bandwidth  same with host to host  almostly.

## Possible Solution
openstack+k8s confused veth?

## Steps to Reproduce (for bugs)

1. openstack
2. kubernetes with calico cni setup in openstack
3. create pod on different host
4. iperf3 to test

## Your Environment

```
root@generalai-cpu-0:~# kubectl describe pod calico-node-gnnff -n kube-system                                                                                               
Name:                 calico-node-gnnff                                                                                                                                     
Namespace:            kube-system                                                                                                                                           
Priority:             2000001000                                                                                                                                            
Priority Class Name:  system-node-critical                                                                                                                                  
Node:                 generalai-v100s-2/182.18.29.15                                                                                                                        
Start Time:           Tue, 20 Apr 2021 15:34:12 +0800                                                                                                                       
Labels:               controller-revision-hash=676dcb5d54                                                                                                                   
                      k8s-app=calico-node                                                                                                                                   
                      pod-template-generation=2                                                                                                                             
Annotations:          kubectl.kubernetes.io/restartedAt: 2021-04-20T15:33:08+08:00                                                                                          
Status:               Running                                                                                                                                               
IP:                   182.18.29.15                                                                                                                                          
IPs:                                                                                                                                                                        
  IP:           182.18.29.15                                                                                                                                                
Controlled By:  DaemonSet/calico-node                                                                                                                                       
Init Containers:                                                                                                                                                            
  upgrade-ipam:                                                                                                                                                             
    Container ID:  docker://b62679c97c603e5e896ec3ef379546fab71be1766cb90e043a336a1af89a4e7f                                                                                
    Image:         172.18.29.81:8080/generalai/calico/cni:v3.16.6                                                                                                           
    Image ID:      docker-pullable://172.18.29.81:8080/generalai/calico/cni@sha256:b2b627ca83d71c9f21d398d7fe3a8d071d054ab3a4a25c86eadb4d447351ad07                         
    Port:          <none>                                                                                                                                                   
    Host Port:     <none>                                                                                                                                                   
    Command:                                                                                                                                                                
      /opt/cni/bin/calico-ipam                                                                                                                                              
      -upgrade                                                                                                                                                              
    State:          Terminated                                                                                                                                              
      Reason:       Completed                                                                                                                                               
      Exit Code:    0                                                                                                                                                       
      Started:      Tue, 20 Apr 2021 15:34:13 +0800                                                                                                                         
      Finished:     Tue, 20 Apr 2021 15:34:13 +0800                                                                                                                         
    Ready:          True                                                                                                                                                    
    Restart Count:  0                                                 
Environment:                                                                                                                                                            
      KUBERNETES_NODE_NAME:        (v1:spec.nodeName)                                                                                                                       
      CALICO_NETWORKING_BACKEND:  <set to the key 'calico_backend' of config map 'calico-config'>  Optional: false
    Mounts:
      /host/opt/cni/bin from cni-bin-dir (rw)
      /var/lib/cni/networks from host-local-net-dir (rw)
      /var/run/secrets/kubernetes.io/serviceaccount from calico-node-token-wfll7 (ro)
  install-cni:
    Container ID:  docker://4db7caaa254e95c1e1ef2817605cf24e8e397509b4db743c83d526c4247f4081
    Image:         172.18.29.81:8080/generalai/calico/cni:v3.16.6
    Image ID:      docker-pullable://172.18.29.81:8080/generalai/calico/cni@sha256:b2b627ca83d71c9f21d398d7fe3a8d071d054ab3a4a25c86eadb4d447351ad07
    Port:          <none>
    Host Port:     <none>
    Command:
      /opt/cni/bin/install
    State:          Terminated
      Reason:       Completed
      Exit Code:    0
      Started:      Tue, 20 Apr 2021 15:34:14 +0800
      Finished:     Tue, 20 Apr 2021 15:34:15 +0800
    Ready:          True
    Restart Count:  0
    Environment:
      CNI_CONF_NAME:            10-calico.conflist
      UPDATE_CNI_BINARIES:      true
      CNI_NETWORK_CONFIG_FILE:  /host/etc/cni/net.d/calico.conflist.template
      SLEEP:                    false
      KUBERNETES_NODE_NAME:      (v1:spec.nodeName)
    Mounts:
      /host/etc/cni/net.d from cni-net-dir (rw)
      /host/opt/cni/bin from cni-bin-dir (rw)
      /var/run/secrets/kubernetes.io/serviceaccount from calico-node-token-wfll7 (ro)
Containers:
  calico-node:
    Container ID:   docker://d19d24e712ad2a907788e61959021e41b33a204174683f3a19cca150ddbbb317
    Image:          172.18.29.81:8080/generalai/calico/node:v3.16.6
    Image ID:       docker-pullable://172.18.29.81:8080/generalai/calico/node@sha256:0dcb1261dc62cca59c697aadaa7c39fbf972861c03647661c862a4c3d1a10574
    Port:           <none>
    Host Port:      <none>
    State:          Running
Started:      Tue, 20 Apr 2021 15:34:16 +0800                                                                                                                         
    Ready:          True                                                                                                                                                    
    Restart Count:  0                                                                                                                                                       
    Limits:                                                                                                                                                                 
      cpu:     300m                                                                                                                                                         
      memory:  500M                                                                                                                                                         
    Requests:                                                                                                                                                               
      cpu:      150m                                                                                                                                                        
      memory:   64M                                                                                                                                                         
    Liveness:   exec [/bin/calico-node -felix-live -bird-live] delay=5s timeout=1s period=10s #success=1 #failure=6                                                         
    Readiness:  exec [/bin/calico-node -bird-ready -felix-ready] delay=0s timeout=1s period=10s #success=1 #failure=6                                                       
    Environment:                                                                                                                                                            
      DATASTORE_TYPE:                         kubernetes                                                                                                                    
      WAIT_FOR_DATASTORE:                     true                                                                                                                          
      CALICO_NETWORKING_BACKEND:              <set to the key 'calico_backend' of config map 'calico-config'>  Optional: false                                              
      CLUSTER_TYPE:                           <set to the key 'cluster_type' of config map 'calico-config'>    Optional: false                                              
      CALICO_K8S_NODE_REF:                     (v1:spec.nodeName)                                                                                                           
      CALICO_DISABLE_FILE_LOGGING:            true                                                                                                                          
      FELIX_DEFAULTENDPOINTTOHOSTACTION:      RETURN                                                                                                                        
      FELIX_HEALTHHOST:                       localhost                                                                                                                     
      FELIX_IPTABLESBACKEND:                  Legacy                                                                                                                        
      FELIX_IPTABLESLOCKTIMEOUTSECS:          10                                                                                                                            
      CALICO_IPV4POOL_IPIP:                   Off                                                                                                                           
      FELIX_IPV6SUPPORT:                      False                                                                                                                         
      FELIX_LOGSEVERITYSCREEN:                info                                                                                                                          
      FELIX_USAGEREPORTINGENABLED:            False                                                                                                                         
      FELIX_CHAININSERTMODE:                  Insert                                                                                                                        
      FELIX_PROMETHEUSMETRICSENABLED:         False                                                                                                                         
      FELIX_PROMETHEUSMETRICSPORT:            9091                                                                                                                          
      FELIX_PROMETHEUSGOMETRICSENABLED:       True                                                                                                                          
      FELIX_PROMETHEUSPROCESSMETRICSENABLED:  True   
NODEIP:                                  (v1:status.hostIP)
      IP_AUTODETECTION_METHOD:                can-reach=$(NODEIP)
      IP:                                     autodetect
      NODENAME:                                (v1:spec.nodeName)
      FELIX_HEALTHENABLED:                    true
      FELIX_IGNORELOOSERPF:                   False
    Mounts:
      /lib/modules from lib-modules (ro)
      /run/xtables.lock from xtables-lock (rw)
      /var/lib/calico from var-lib-calico (rw)
      /var/run/calico from var-run-calico (rw)
      /var/run/secrets/kubernetes.io/serviceaccount from calico-node-token-wfll7 (ro)
Conditions:
  Type              Status
  Initialized       True
  Ready             True
  ContainersReady   True
  PodScheduled      True
Volumes:
  lib-modules:
    Type:          HostPath (bare host directory volume)
    Path:          /lib/modules
    HostPathType:
  var-run-calico:
    Type:          HostPath (bare host directory volume)
    Path:          /var/run/calico
    HostPathType:
  var-lib-calico:
var-lib-calico:
    Type:          HostPath (bare host directory volume)
    Path:          /var/lib/calico
    HostPathType:
  cni-net-dir:
    Type:          HostPath (bare host directory volume)
    Path:          /etc/cni/net.d
    HostPathType:
  cni-bin-dir:
    Type:          HostPath (bare host directory volume)
    Path:          /opt/cni/bin
    HostPathType:
  xtables-lock:
    Type:          HostPath (bare host directory volume)
    Path:          /run/xtables.lock
    HostPathType:  FileOrCreate
  host-local-net-dir:
    Type:          HostPath (bare host directory volume)
    Path:          /var/lib/cni/networks
    HostPathType:
  calico-node-token-wfll7:
    Type:        Secret (a volume populated by a Secret)
    SecretName:  calico-node-token-wfll7
    Optional:    false
QoS Class:       Burstable
Node-Selectors:  <none>
Tolerations:     op=Exists
                 node.kubernetes.io/disk-pressure:NoSchedule op=Exists
                 node.kubernetes.io/memory-pressure:NoSchedule op=Exists
                 node.kubernetes.io/network-unavailable:NoSchedule op=Exists
                 node.kubernetes.io/not-ready:NoExecute op=Exists
                 node.kubernetes.io/pid-pressure:NoSchedule op=Exists
                 node.kubernetes.io/unreachable:NoExecute op=Exists
                 node.kubernetes.io/unschedulable:NoSchedule op=Exists
```
and host network is:
```
root@generalai-v100s-3:~# ip link
1: lo: <LOOPBACK,UP,LOWER_UP> mtu 65536 qdisc noqueue state UNKNOWN mode DEFAULT group default qlen 1000
    link/loopback 00:00:00:00:00:00 brd 00:00:00:00:00:00
2: ens3: <BROADCAST,MULTICAST,UP,LOWER_UP> mtu 9000 qdisc fq_codel state UP mode DEFAULT group default qlen 1000
    link/ether fa:16:3e:33:83:5d brd ff:ff:ff:ff:ff:ff
3: cali6a7779a2e5b@if4: <BROADCAST,MULTICAST,UP,LOWER_UP> mtu 1500 qdisc noqueue state UP mode DEFAULT group default 
    link/ether ee:ee:ee:ee:ee:ee brd ff:ff:ff:ff:ff:ff link-netnsid 0
4: ens15: <BROADCAST,MULTICAST,UP,LOWER_UP> mtu 1500 qdisc mq state UP mode DEFAULT group default qlen 1000
    link/ether 3e:26:a3:40:36:2d brd ff:ff:ff:ff:ff:ff
5: ib0: <BROADCAST,MULTICAST,UP,LOWER_UP> mtu 2044 qdisc mq state UP mode DEFAULT group default qlen 256
    link/infiniband 00:00:05:47:fe:80:00:00:00:00:00:00:00:04:00:00:00:00:00:01 brd 00:ff:ff:ff:ff:12:40:1b:ff:ff:00:00:00:00:00:00:ff:ff:ff:ff
6: docker0: <NO-CARRIER,BROADCAST,MULTICAST,UP> mtu 1500 qdisc noqueue state DOWN mode DEFAULT group default 
    link/ether 02:42:a2:5a:0a:58 brd ff:ff:ff:ff:ff:ff
10: tunl0@NONE: <NOARP,UP,LOWER_UP> mtu 1440 qdisc noqueue state UNKNOWN mode DEFAULT group default qlen 1000
    link/ipip 0.0.0.0 brd 0.0.0.0
40: kube-ipvs0: <BROADCAST,NOARP> mtu 1500 qdisc noop state DOWN mode DEFAULT group default 
    link/ether 26:05:61:38:b9:27 brd ff:ff:ff:ff:ff:ff
51: califfca96d8508@if4: <BROADCAST,MULTICAST,UP,LOWER_UP> mtu 1500 qdisc noqueue state UP mode DEFAULT group default 
    link/ether ee:ee:ee:ee:ee:ee brd ff:ff:ff:ff:ff:ff link-netnsid 1
52: cali567991e8b41@if4: <BROADCAST,MULTICAST,UP,LOWER_UP> mtu 1500 qdisc noqueue state UP mode DEFAULT group default 
    link/ether ee:ee:ee:ee:ee:ee brd ff:ff:ff:ff:ff:ff link-netnsid 2
53: cali08e9e800a8e@if4: <BROADCAST,MULTICAST,UP,LOWER_UP> mtu 1500 qdisc noqueue state UP mode DEFAULT group default 
    link/ether ee:ee:ee:ee:ee:ee brd ff:ff:ff:ff:ff:ff link-netnsid 3
54: cali28016f07eab@if4: <BROADCAST,MULTICAST,UP,LOWER_UP> mtu 1500 qdisc noqueue state UP mode DEFAULT group default 
    link/ether ee:ee:ee:ee:ee:ee brd ff:ff:ff:ff:ff:ff link-netnsid 4
55: calie8288802bca@if4: <BROADCAST,MULTICAST,UP,LOWER_UP> mtu 1500 qdisc noqueue state UP mode DEFAULT group default 
    link/ether ee:ee:ee:ee:ee:ee brd ff:ff:ff:ff:ff:ff link-netnsid 5
56: cali97f917bed1c@if4: <BROADCAST,MULTICAST,UP,LOWER_UP> mtu 1500 qdisc noqueue state UP mode DEFAULT group default 
    link/ether ee:ee:ee:ee:ee:ee brd ff:ff:ff:ff:ff:ff link-netnsid 6
57: cali49d6ff6a4e2@if4: <BROADCAST,MULTICAST,UP,LOWER_UP> mtu 1500 qdisc noqueue state UP mode DEFAULT group default 
    link/ether ee:ee:ee:ee:ee:ee brd ff:ff:ff:ff:ff:ff link-netnsid 7
58: cali2917fbda182@if4: <BROADCAST,MULTICAST,UP,LOWER_UP> mtu 1500 qdisc noqueue state UP mode DEFAULT group default 
    link/ether ee:ee:ee:ee:ee:ee brd ff:ff:ff:ff:ff:ff link-netnsid 8
63: cali7017b1e7b96@if4: <BROADCAST,MULTICAST,UP,LOWER_UP> mtu 1500 qdisc noqueue state UP mode DEFAULT group default 
    link/ether ee:ee:ee:ee:ee:ee brd ff:ff:ff:ff:ff:ff link-netnsid 9
76: calic38d4dd2977@if4: <BROADCAST,MULTICAST,UP,LOWER_UP> mtu 1500 qdisc noqueue state UP mode DEFAULT group default 
    link/ether ee:ee:ee:ee:ee:ee brd ff:ff:ff:ff:ff:ff link-netnsid 10
```
host route is :
```
root@generalai-v100s-3:~# route -n
Kernel IP routing table
Destination     Gateway         Genmask         Flags Metric Ref    Use Iface
0.0.0.0         172.18.29.254   0.0.0.0         UG    100    0        0 ens3
10.200.152.0    182.18.29.17    255.255.255.128 UG    0      0        0 tunl0
10.200.158.128  0.0.0.0         255.255.255.128 U     0      0        0 *
10.200.158.138  0.0.0.0         255.255.255.255 UH    0      0        0 cali6a7779a2e5b
10.200.158.139  0.0.0.0         255.255.255.255 UH    0      0        0 califfca96d8508
10.200.158.140  0.0.0.0         255.255.255.255 UH    0      0        0 cali567991e8b41
10.200.158.141  0.0.0.0         255.255.255.255 UH    0      0        0 cali08e9e800a8e
10.200.158.142  0.0.0.0         255.255.255.255 UH    0      0        0 cali28016f07eab
10.200.158.143  0.0.0.0         255.255.255.255 UH    0      0        0 calie8288802bca
10.200.158.144  0.0.0.0         255.255.255.255 UH    0      0        0 cali97f917bed1c
10.200.158.145  0.0.0.0         255.255.255.255 UH    0      0        0 cali49d6ff6a4e2
10.200.158.146  0.0.0.0         255.255.255.255 UH    0      0        0 cali2917fbda182
10.200.158.147  0.0.0.0         255.255.255.255 UH    0      0        0 cali7017b1e7b96
10.200.158.160  0.0.0.0         255.255.255.255 UH    0      0        0 calic38d4dd2977
10.200.212.128  182.18.29.18    255.255.255.128 UG    0      0        0 tunl0
10.202.95.0     182.18.29.13    255.255.255.128 UG    0      0        0 tunl0
10.204.44.0     182.18.29.61    255.255.255.128 UG    0      0        0 tunl0
10.205.141.128  182.18.29.60    255.255.255.128 UG    0      0        0 tunl0
10.206.206.0    182.18.29.62    255.255.255.128 UG    0      0        0 tunl0
10.207.23.0     182.18.29.14    255.255.255.128 UG    0      0        0 tunl0
10.207.108.128  182.18.29.15    255.255.255.128 UG    0      0        0 tunl0
169.254.169.254 172.18.29.11    255.255.255.255 UGH   100    0        0 ens3
172.17.0.0      0.0.0.0         255.255.0.0     U     0      0        0 docker0
172.18.29.0     0.0.0.0         255.255.255.0   U     0      0        0 ens3
182.18.29.0     0.0.0.0         255.255.255.0   U     0      0        0 ens15
192.18.29.0     0.0.0.0         255.255.255.0   U     0      0        0 ib0
```
when using tcpdump(host to host):
```
15:56:35.620697 IP (tos 0x0, ttl 64, id 386, offset 0, flags [DF], proto TCP (6), length 52)
    generalai-v100s-4.cluster.local.5201 > generalai-v100s-3.cluster.local.8522: Flags [.], cksum 0x5000 (correct), seq 2, ack 42, win 509, options [nop,nop,TS val 2457339136 ecr 2150003724], length 0
15:56:35.620801 IP (tos 0x0, ttl 63, id 53372, offset 0, flags [DF], proto TCP (6), length 153)
    generalai-v100s-3.cluster.local.8522 > generalai-v100s-4.cluster.local.5201: Flags [P.], cksum 0xa6d1 (incorrect -> 0xa0fb), seq 42:143, ack 2, win 502, options [nop,nop,TS val 2150003765 ecr 2457339136], length 101
15:56:35.620850 IP (tos 0x0, ttl 64, id 387, offset 0, flags [DF], proto TCP (6), length 52)
    generalai-v100s-4.cluster.local.5201 > generalai-v100s-3.cluster.local.8522: Flags [.], cksum 0x4f72 (correct), seq 2, ack 143, win 509, options [nop,nop,TS val 2457339136 ecr 2150003765], length 0

```
when using tcpdump(pod to pod):
```
15:57:08.426993 IP (tos 0x0, ttl 63, id 44263, offset 0, flags [DF], proto IPIP (4), length 72)
    generalai-v100s-3.cluster.local > generalai-v100s-4.cluster.local: IP (tos 0x0, ttl 63, id 58075, offset 0, flags [DF], proto TCP (6), length 52)
    10.200.158.147.48740 > 10.200.152.5.5201: Flags [.], cksum 0x4c4f (incorrect -> 0xe4d4), seq 1, ack 1, win 502, options [nop,nop,TS val 3726393773 ecr 3058478758], length 0
15:57:08.427001 IP (tos 0x0, ttl 63, id 44264, offset 0, flags [DF], proto IPIP (4), length 109)
    generalai-v100s-3.cluster.local > generalai-v100s-4.cluster.local: IP (tos 0x0, ttl 63, id 58076, offset 0, flags [DF], proto TCP (6), length 89)
    10.200.158.147.48740 > 10.200.152.5.5201: Flags [P.], cksum 0x4c74 (incorrect -> 0x3d94), seq 1:38, ack 1, win 502, options [nop,nop,TS val 3726393773 ecr 3058478758], length 37
```
using ethtool see interface(host):
```
root@generalai-v100s-3:~# ethtool ens15                                                                                                                                     
Settings for ens15:                                                                                                                                                         
        Supported ports: [ FIBRE ]                                                                                                                                          
        Supported link modes:   1000baseT/Full                                                                                                                              
                                1000baseKX/Full                                                                                                                             
                                10000baseT/Full                                                                                                                             
                                10000baseKR/Full                                                                                                                            
                                40000baseKR4/Full                                                                                                                           
                                40000baseCR4/Full                                                                                                                           
                                40000baseSR4/Full                                                                                                                           
                                40000baseLR4/Full                                                                                                                           
                                25000baseCR/Full                                                                                                                            
                                25000baseKR/Full                                                                                                                            
                                25000baseSR/Full                                                                                                                            
                                50000baseCR2/Full                                                                                                                           
                                50000baseKR2/Full                                                                                                                           
                                100000baseKR4/Full                                                                                                                          
                                100000baseSR4/Full                                                                                                                          
                                100000baseCR4/Full                                                                                                                          
                                100000baseLR4_ER4/Full                                                                                                                      
                                50000baseSR2/Full                                                                                                                           
                                1000baseX/Full                                                                                                                              
                                10000baseCR/Full                                                                                                                            
                                10000baseSR/Full                                                                                                                            
                                10000baseLR/Full                                                                                                                            
                                10000baseER/Full
        Supported pause frame use: Symmetric
        Supports auto-negotiation: Yes
        Supported FEC modes: Not reported
        Advertised link modes:  1000baseT/Full
                                1000baseKX/Full
10000baseT/Full
                                10000baseKR/Full
                                40000baseKR4/Full
                                40000baseCR4/Full
                                40000baseSR4/Full
                                40000baseLR4/Full
                                25000baseCR/Full
                                25000baseKR/Full
                                25000baseSR/Full
                                50000baseCR2/Full
                                50000baseKR2/Full
                                100000baseKR4/Full
                                100000baseSR4/Full
                                100000baseCR4/Full
                                100000baseLR4_ER4/Full
                                50000baseSR2/Full
                                1000baseX/Full
                                10000baseCR/Full
                                10000baseSR/Full
                                10000baseLR/Full
                                10000baseER/Full
        Advertised pause frame use: No
        Advertised auto-negotiation: Yes
        Advertised FEC modes: None
        Speed: 100000Mb/s
        Duplex: Full
        Port: FIBRE
        PHYAD: 0
        Transceiver: internal
        Auto-negotiation: on
        Supports Wake-on: d
        Wake-on: d
        Current message level: 0x00000004 (4)
                               link
        Link detected: yes
```
using ethtool see interface(pos):
```
root@gpt-1:/workspace# ethtool eth0
Settings for eth0:
        Supported ports: [ ]
        Supported link modes:   Not reported
        Supported pause frame use: No
        Supports auto-negotiation: No
        Supported FEC modes: Not reported
        Advertised link modes:  Not reported
        Advertised pause frame use: No
        Advertised auto-negotiation: No
        Advertised FEC modes: Not reported
        Speed: 10000Mb/s
        Duplex: Full
        Port: Twisted Pair
        PHYAD: 0
        Transceiver: internal
        Auto-negotiation: off
        MDI-X: Unknown
Cannot get wake-on-lan settings: Operation not permitted
        Link detected: yes
```

Very appreciate get any help from you. 

Thanks,
Yuan

**Comment by caseydavenport** [comment]
@ReyRen looks like your host network supports jumbo frames of MTU 9000, but you have configured the Calico network with an MTU of 1500 - that's likely why you're seeing a performance difference.

You can adjust Calico's MTU setting to match the host network (minus any enabled encap) or enable auto-MTU detection (if you're using a modern version of Calico that supports it). 

https://docs.projectcalico.org/networking/mtu

**Comment by ReyRen** [comment]
@caseydavenport Thanks, close this
