### ISSUE TITLE
Calico eBPF 3.30 doesn't reassemble UDP fragmets when UDP reply exceeds ethernet frame size

### ISSUE THREAD

**Issue by Yoda317** [projectcalico/calico#10737]
After upgrading calico-ebpf from 3.29.2 to 3.30.2 calico began to discard fragments of UDP packets in UDP replies.
This  only happens in UDP replies.

## Expected Behavior
Packets  exceeding ethernet frame size are reassembled well (tcpdump on cali interface )
```
08:19:39.367961 IP 10.245.60.145.59403 > dsw2.z481.net.xx.xx.snmp:  GetBulk(98)  N=0 M=10 .iso.0.8802.1.1.2.1.4.1.1.9 .iso.0.8802.1.1.2.1.4.1.1.10 .iso.0.8802.1.1.2.1.4.1.1.7 .iso.0.8802.1.1.2.1.4.1.1.8 .iso.0.8802.1.1.2.1.4.1.1.6
08:19:39.439874 IP dsw2.z481.net.xx.xx > 10.245.60.145: udp
08:19:39.439881 IP dsw2.z481.net.xx.xx > 10.245.60.145: udp

```

## Current Behavior
Only first packet received
cmd from pod
```
snmpbulkget -v 2c -c test1234 -Cn0 -Cr55 -r 0 10.25.192.220 .iso.0.8802.1.1.2.1.4.1.1.10
Timeout: No Response from 10.25.192.220

```

tcpdump on cali interface
```
10:05:46.222937 IP 10.246.136.129.36420 > 10.25.192.220.161:   GetBulk(31)  N=0 M=55 .1.0.8802.1.1.2.1.4.1.1.10
10:05:46.267199 IP 10.25.192.220.161 > 10.246.136.129.36420:  [len1468<asnlen1517]

```
ebpf debug  log
```
     snmpbulkget-358688  [019] d.s3. 8895012.390146: bpf_trace_printk: cali77a00953dad-E: New packet at ifindex=260180; mark=0
     snmpbulkget-358688  [019] d.s3. 8895012.390151: bpf_trace_printk: cali77a00953dad-E: IP id=38055 len=76
     snmpbulkget-358688  [019] d.s3. 8895012.390153: bpf_trace_printk: cali77a00953dad-E: IP s=10.246.136.129 d=10.25.192.220
     snmpbulkget-358688  [019] d.s3. 8895012.390154: bpf_trace_printk: cali77a00953dad-E: IP ihl=20 bytes
     snmpbulkget-358688  [019] d.s3. 8895012.390156: bpf_trace_printk: cali77a00953dad-E: UDP; ports: s=42071 d=161
     snmpbulkget-358688  [019] d.s3. 8895012.390157: bpf_trace_printk: cali77a00953dad-E: CT: lookup from 10.246.136.129:42071
     snmpbulkget-358688  [019] d.s3. 8895012.390158: bpf_trace_printk: cali77a00953dad-E: CT: lookup to   10.25.192.220:161
     snmpbulkget-358688  [019] d.s3. 8895012.390159: bpf_trace_printk: cali77a00953dad-E: CT: Miss.
     snmpbulkget-358688  [019] d.s3. 8895012.390163: bpf_trace_printk: cali77a00953dad-E: CT: result: NEW.
     snmpbulkget-358688  [019] d.s3. 8895012.390165: bpf_trace_printk: cali77a00953dad-E: conntrack entry flags 0x0
     snmpbulkget-358688  [019] d.s3. 8895012.390166: bpf_trace_printk: cali77a00953dad-E: NAT: 1st level lookup addr=10.25.192.220 port=161 udp
     snmpbulkget-358688  [019] d.s3. 8895012.390167: bpf_trace_printk: cali77a00953dad-E: NAT: Miss.
     snmpbulkget-358688  [019] d.s3. 8895012.390168: bpf_trace_printk: cali77a00953dad-E: NAT: route miss
     snmpbulkget-358688  [019] d.s3. 8895012.390173: bpf_trace_printk: cali77a00953dad-E: Workload RPF check src=10.246.136.129 skb iface=260180.
     snmpbulkget-358688  [019] d.s3. 8895012.390175: bpf_trace_printk: cali77a00953dad-E: Socket cookie: 65bbf0c3
     snmpbulkget-358688  [019] d.s3. 8895012.390177: bpf_trace_printk: cali77a00953dad-E: No route for post DNAT dest 10.25.192.220
     snmpbulkget-358688  [019] d.s3. 8895012.390178: bpf_trace_printk: cali77a00953dad-E: About to jump to policy program.
     snmpbulkget-358688  [019] d.s3. 8895012.390178: bpf_trace_printk: cali77a00953dad-E: policy allow prog at 67
     snmpbulkget-358688  [019] d.s3. 8895012.390179: bpf_trace_printk: cali77a00953dad-E: policy deny prog at 69
     snmpbulkget-358688  [019] d.s3. 8895012.390180: bpf_trace_printk: cali77a00953dad-E: jump to policy prog at 86
     snmpbulkget-358688  [019] d.s3. 8895012.390181: bpf_trace_printk: cali77a00953dad-E: Entering calico_tc_skb_accepted_entrypoint
     snmpbulkget-358688  [019] d.s3. 8895012.390183: bpf_trace_printk: cali77a00953dad-E: Entering calico_tc_skb_accepted
     snmpbulkget-358688  [019] d.s3. 8895012.390184: bpf_trace_printk: cali77a00953dad-E: src=10.246.136.129 dst=10.25.192.220
     snmpbulkget-358688  [019] d.s3. 8895012.390185: bpf_trace_printk: cali77a00953dad-E: post_nat=10.25.192.220:161
     snmpbulkget-358688  [019] d.s3. 8895012.390186: bpf_trace_printk: cali77a00953dad-E: tun_ip=0.0.0.0
     snmpbulkget-358688  [019] d.s3. 8895012.390186: bpf_trace_printk: cali77a00953dad-E: pol_rc=1
     snmpbulkget-358688  [019] d.s3. 8895012.390187: bpf_trace_printk: cali77a00953dad-E: sport=42071
     snmpbulkget-358688  [019] d.s3. 8895012.390187: bpf_trace_printk: cali77a00953dad-E: dport=161
     snmpbulkget-358688  [019] d.s3. 8895012.390188: bpf_trace_printk: cali77a00953dad-E: flags=0
     snmpbulkget-358688  [019] d.s3. 8895012.390188: bpf_trace_printk: cali77a00953dad-E: ct_rc=0
     snmpbulkget-358688  [019] d.s3. 8895012.390189: bpf_trace_printk: cali77a00953dad-E: ct_related=0
     snmpbulkget-358688  [019] d.s3. 8895012.390189: bpf_trace_printk: cali77a00953dad-E: mark=0x1000000
     snmpbulkget-358688  [019] d.s3. 8895012.390190: bpf_trace_printk: cali77a00953dad-E: ip->ttl 64
     snmpbulkget-358688  [019] d.s3. 8895012.390191: bpf_trace_printk: cali77a00953dad-E: jump to idx 7 prog at 71
     snmpbulkget-358688  [019] d.s3. 8895012.390192: bpf_trace_printk: cali77a00953dad-E: Entering calico_tc_skb_new_flow
     snmpbulkget-358688  [019] d.s3. 8895012.390193: bpf_trace_printk: cali77a00953dad-E: Allowed by policy: ACCEPT
     snmpbulkget-358688  [019] d.s3. 8895012.390194: bpf_trace_printk: cali77a00953dad-E: CT-ALL packet mark is: 0x0
     snmpbulkget-358688  [019] d.s3. 8895012.390195: bpf_trace_printk: cali77a00953dad-E: CT-ALL Creating tracking entry type 0 at 8895123300804679.
     snmpbulkget-358688  [019] d.s3. 8895012.390195: bpf_trace_printk: cali77a00953dad-E: CT-ALL tracking entry flags 0x0
     snmpbulkget-358688  [019] d.s3. 8895012.390196: bpf_trace_printk: cali77a00953dad-E: CT-ALL SNAT orig 0.0.0.0:0
     snmpbulkget-358688  [019] d.s3. 8895012.390197: bpf_trace_printk: cali77a00953dad-E: NEW src_to_dst->ifindex 260180
     snmpbulkget-358688  [019] d.s3. 8895012.390200: bpf_trace_printk: cali77a00953dad-E: FIB family=2
     snmpbulkget-358688  [019] d.s3. 8895012.390200: bpf_trace_printk: cali77a00953dad-E: FIB ifindex=260180
     snmpbulkget-358688  [019] d.s3. 8895012.390201: bpf_trace_printk: cali77a00953dad-E: FIB l4_protocol=17
     snmpbulkget-358688  [019] d.s3. 8895012.390201: bpf_trace_printk: cali77a00953dad-E: FIB sport=42071
     snmpbulkget-358688  [019] d.s3. 8895012.390202: bpf_trace_printk: cali77a00953dad-E: FIB dport=161
     snmpbulkget-358688  [019] d.s3. 8895012.390203: bpf_trace_printk: cali77a00953dad-E: FIB ipv4_src=af68881
     snmpbulkget-358688  [019] d.s3. 8895012.390203: bpf_trace_printk: cali77a00953dad-E: FIB ipv4_dst=a19c0dc
     snmpbulkget-358688  [019] d.s3. 8895012.390204: bpf_trace_printk: cali77a00953dad-E: Traffic is towards the host namespace, doing Linux FIB lookup
     snmpbulkget-358688  [019] d.s3. 8895012.390205: bpf_trace_printk: cali77a00953dad-E: FIB lookup failed (bad input): -22.
     snmpbulkget-358688  [019] d.s3. 8895012.390206: bpf_trace_printk: cali77a00953dad-E: Traffic is towards host namespace, marking with 0x1000000.
     snmpbulkget-358688  [019] d.s3. 8895012.390208: bpf_trace_printk: cali77a00953dad-E: Final result=ALLOW rc -1. Program execution time: 56758ns
     snmpbulkget-358688  [019] D.s3. 8895012.390233: bpf_trace_printk: eth0.422--------E: New packet at ifindex=10; mark=1000000
     snmpbulkget-358688  [019] D.s3. 8895012.390235: bpf_trace_printk: eth0.422--------E: IP id=38055 len=76
     snmpbulkget-358688  [019] D.s3. 8895012.390236: bpf_trace_printk: eth0.422--------E: IP s=10.246.136.129 d=10.25.192.220
     snmpbulkget-358688  [019] D.s3. 8895012.390236: bpf_trace_printk: eth0.422--------E: IP ihl=20 bytes
     snmpbulkget-358688  [019] D.s3. 8895012.390238: bpf_trace_printk: eth0.422--------E: UDP; ports: s=42071 d=161
     snmpbulkget-358688  [019] D.s3. 8895012.390239: bpf_trace_printk: eth0.422--------E: CT: lookup from 10.246.136.129:42071
     snmpbulkget-358688  [019] D.s3. 8895012.390240: bpf_trace_printk: eth0.422--------E: CT: lookup to   10.25.192.220:161
     snmpbulkget-358688  [019] D.s3. 8895012.390242: bpf_trace_printk: eth0.422--------E: CT: Hit! NORMAL entry.
     snmpbulkget-358688  [019] D.s3. 8895012.390243: bpf_trace_printk: eth0.422--------E: CT: Packet not allowed by ingress/egress approval flags (FH).
     snmpbulkget-358688  [019] D.s3. 8895012.390245: bpf_trace_printk: eth0.422--------E: CT: result: 0x0
     snmpbulkget-358688  [019] D.s3. 8895012.390246: bpf_trace_printk: eth0.422--------E: conntrack entry flags 0x0
     snmpbulkget-358688  [019] D.s3. 8895012.390248: bpf_trace_printk: eth0.422--------E: No route for post DNAT dest 10.25.192.220
     snmpbulkget-358688  [019] D.s3. 8895012.390248: bpf_trace_printk: eth0.422--------E: About to jump to policy program.
     snmpbulkget-358688  [019] D.s3. 8895012.390249: bpf_trace_printk: eth0.422--------E: policy allow prog at 1
     snmpbulkget-358688  [019] D.s3. 8895012.390250: bpf_trace_printk: eth0.422--------E: policy deny prog at 3
     snmpbulkget-358688  [019] D.s3. 8895012.390251: bpf_trace_printk: eth0.422--------E: jump to policy prog at 1
     snmpbulkget-358688  [019] D.s3. 8895012.390252: bpf_trace_printk: eth0.422--------E: HEP with no policy, allow.
     snmpbulkget-358688  [019] D.s3. 8895012.390252: bpf_trace_printk: eth0.422--------E: jump to idx 2 prog at 1
     snmpbulkget-358688  [019] D.s3. 8895012.390253: bpf_trace_printk: eth0.422--------E: Entering calico_tc_skb_accepted_entrypoint
     snmpbulkget-358688  [019] D.s3. 8895012.390255: bpf_trace_printk: eth0.422--------E: Entering calico_tc_skb_accepted
     snmpbulkget-358688  [019] D.s3. 8895012.390256: bpf_trace_printk: eth0.422--------E: src=10.246.136.129 dst=10.25.192.220
     snmpbulkget-358688  [019] D.s3. 8895012.390258: bpf_trace_printk: eth0.422--------E: post_nat=10.25.192.220:161
     snmpbulkget-358688  [019] D.s3. 8895012.390259: bpf_trace_printk: eth0.422--------E: tun_ip=0.0.0.0
     snmpbulkget-358688  [019] D.s3. 8895012.390259: bpf_trace_printk: eth0.422--------E: pol_rc=1
     snmpbulkget-358688  [019] D.s3. 8895012.390259: bpf_trace_printk: eth0.422--------E: sport=42071
     snmpbulkget-358688  [019] D.s3. 8895012.390260: bpf_trace_printk: eth0.422--------E: dport=161
     snmpbulkget-358688  [019] D.s3. 8895012.390260: bpf_trace_printk: eth0.422--------E: flags=20
     snmpbulkget-358688  [019] D.s3. 8895012.390261: bpf_trace_printk: eth0.422--------E: ct_rc=0
     snmpbulkget-358688  [019] D.s3. 8895012.390262: bpf_trace_printk: eth0.422--------E: ct_related=0
     snmpbulkget-358688  [019] D.s3. 8895012.390263: bpf_trace_printk: eth0.422--------E: mark=0x1000000
     snmpbulkget-358688  [019] D.s3. 8895012.390264: bpf_trace_printk: eth0.422--------E: ip->ttl 63
     snmpbulkget-358688  [019] D.s3. 8895012.390265: bpf_trace_printk: eth0.422--------E: jump to idx 7 prog at 6
     snmpbulkget-358688  [019] D.s3. 8895012.390266: bpf_trace_printk: eth0.422--------E: Entering calico_tc_skb_new_flow
     snmpbulkget-358688  [019] D.s3. 8895012.390266: bpf_trace_printk: eth0.422--------E: Allowed by policy: ACCEPT
     snmpbulkget-358688  [019] D.s3. 8895012.390267: bpf_trace_printk: eth0.422--------E: CT-ALL packet mark is: 0x1000000
     snmpbulkget-358688  [019] D.s3. 8895012.390268: bpf_trace_printk: eth0.422--------E: CT-ALL update src_to_dst A->B
     snmpbulkget-358688  [019] D.s3. 8895012.390271: bpf_trace_printk: eth0.422--------E: Final result=ALLOW rc -1. Program execution time: 35775ns
  napi/eth0-8647-2183    [043] D..2. 8895012.419883: bpf_trace_printk: cali77a00953dad-I: New packet at ifindex=260180; mark=3000000
  napi/eth0-8647-2183    [043] D..2. 8895012.419887: bpf_trace_printk: cali77a00953dad-I: IP id=33617 len=1500
  napi/eth0-8647-2183    [043] D..2. 8895012.419890: bpf_trace_printk: cali77a00953dad-I: IP s=10.25.192.220 d=10.246.136.129
  napi/eth0-8647-2183    [043] D..2. 8895012.419891: bpf_trace_printk: cali77a00953dad-I: Final result=ALLOW (3). Bypass mark set.

```

## Steps to Reproduce (for bugs)
1. Upgrade  kuberbetes 1.29 and calico 3.29.3 to kubernetes 1.31 and calico 3.30.2
 calico settings 
```
  bpfDataIfacePattern: ^((en|wl|ww|sl|ib)[Popsx].*|(wlan|wwan).*|tunl0$|vxlan.calico$|vxlan-v6.calico$|wireguard.cali$|wg-v6.cali$|egress.calico$|(eth|bond)[0-9]+.[0-9]+$)
  bpfEnabled: true
  bpfKubeProxyEndpointSlicesEnabled: true
  bpfKubeProxyIptablesCleanupEnabled: false
  bpfLogLevel: ""
  bpfMapSizeConntrack: 6144000
  bpfMapSizeNATBackend: 1048576
  floatingIPs: Disabled
  logSeverityScreen: Warning
  prometheusGoMetricsEnabled: false
  prometheusProcessMetricsEnabled: false
  reportingInterval: 0s
  usageReportingEnabled: false
  vxlanPort: 4790
  xdpEnabled: false

```

## Your Environment

* Calico version 3.30.2
* Calico dataplane (bpf, nftables, iptables, windows etc.) ebpf
* Orchestrator version (e.g. kubernetes, openshift, etc.): kubernetes 1.31
* Operating System and version: ubuntu 22.04

**Comment by sridhartigera** [comment]
@Yoda317 Support handling fragmented packets will be available in 3.31.

**Comment by tomastigera** [comment]
duplicates https://github.com/projectcalico/calico/issues/8821

@Yoda317 you may try to test with https://github.com/projectcalico/calico/issues/8821#issuecomment-2997226438 your help would be much appreciated.
