### ISSUE TITLE
Not able to ping outside within container 

### ISSUE THREAD

**Issue by dachulin** [projectcalico/calico#1093]
Hi,

We are using calico with k8s. We have a requirement of be able to scale down to run the k8s cluster in single host (master and minion roles in single host) and scale up as well.

When we deploy k8s cluster with master and minion in different hosts, all works as expected. We added --nat-outgoing so that our containers able to reach outside. 

However, with single host k8s cluster, our containers were not able to ping outside. 

Doing a tcpdump in host's interface found that the container's packet didn't get SNATed in single host k8s deployment:

tcpdump: verbose output suppressed, use -v or -vv for full protocol decode
listening on ens160, link-type EN10MB (Ethernet), capture size 262144 bytes
10:14:45.975762 IP 192.168.0.9 > 172.19.216.1: ICMP echo request, id 3328, seq 91, length 64
10:14:46.975965 IP 192.168.0.9 > 172.19.216.1: ICMP echo request, id 3328, seq 92, length 64
10:14:47.976153 IP 192.168.0.9 > 172.19.216.1: ICMP echo request, id 3328, seq 93, length 64

I then compare the working cluster (multiple host) vs the non-working single host cluster. Everything is identical except in single host cluster, this iptable rules is missing:

POSTROUTING --match set --match-set felix-masq-ipam-pools src --match set ! --match-set felix-all-ipam-pools dst --jump MASQUERADE

Looking at the calico/felix log and seems like it is deleted:
```
calico/felix/@4000000057c85fdc1b97b2a4.u:2016-09-01 17:05:12,637 [INFO][66/5] calico.felix.fiptables 308: Removing rule 'POSTROUTING --match set --match-set felix-masq-ipam-pools src --match set ! --match-set felix-all-ipam-pools dst --jump MASQUERADE'
calico/felix/@4000000057c85fdc1b97b2a4.u:2016-09-01 17:05:12,637 [INFO][66/5] calico.felix.fiptables 323: Ensuring rule is not present 'POSTROUTING --match set --match-set felix-masq-ipam-pools src --match set ! --match-set felix-all-ipam-pools dst --jump MASQUERADE'
calico/felix/@4000000057c85fdc1b97b2a4.u:2016-09-01 17:05:12,645 [INFO][66/5] calico.felix.fiptables 345: Removal of rule 'POSTROUTING --match set --match-set felix-masq-ipam-pools src --match set ! --match-set felix-all-ipam-pools dst --jump MASQUERADE' failed due to missing pre-requisite; rule must not be present.
calico/felix/@4000000057c85fdc1b97b2a4.u:2016-09-01 17:05:12,938 [INFO][66/5] calico.felix.fiptables 254: Inserting rule 'POSTROUTING --match set --match-set felix-masq-ipam-pools src --match set ! --match-set felix-all-ipam-pools dst --jump MASQUERADE'
calico/felix/@4000000057c85fdc1b97b2a4.u:2016-09-01 17:05:12,938 [INFO][66/5] calico.felix.fiptables 275: Attempting to move any existing instance of rule 'POSTROUTING --match set --match-set felix-masq-ipam-pools src --match set ! --match-set felix-all-ipam-pools dst --jump MASQUERADE' to top of chain.
calico/felix/@4000000057c85fdc1b97b2a4.u:2016-09-01 17:05:12,940 [INFO][66/5] calico.felix.fiptables 284: Didn't find any existing instance of rule 'POSTROUTING --match set --match-set felix-masq-ipam-pools src --match set ! --match-set felix-all-ipam-pools dst --jump MASQUERADE', inserting it instead.
calico/felix/current:2016-09-01 17:05:23,246 [INFO][65/5] calico.felix.fiptables 308: Removing rule 'POSTROUTING --match set --match-set felix-masq-ipam-pools src --match set ! --match-set felix-all-ipam-pools dst --jump MASQUERADE'
calico/felix/current:2016-09-01 17:05:23,246 [INFO][65/5] calico.felix.fiptables 323: Ensuring rule is not present 'POSTROUTING --match set --match-set felix-masq-ipam-pools src --match set ! --match-set felix-all-ipam-pools dst --jump MASQUERADE'
calico/felix/current:2016-09-01 17:05:23,259 [INFO][65/5] calico.felix.fiptables 352: 1 instances of rule 'POSTROUTING --match set --match-set felix-masq-ipam-pools src --match set ! --match-set felix-all-ipam-pools dst --jump MASQUERADE' removed
```
Wondering why it get removed? Any way I can run a single host k8s cluster with calico? 

Thanks.

**Comment by caseydavenport** [comment]
@dachulin - You should certainly be able to run a single host k8s cluster with Calico.  It shouldn't really behave any differently.

Just to be safe, ean you verify that your single host cluster also has `--nat-outgoing` configured on your pool?
```
calicoctl pool show
```

Interestingly, those logs look like the rules is removed, then inserted, then removed again.

**Comment by dachulin** [comment]
root@maglev-kube:~# calicoctl pool show
+----------------+--------------+
|   IPv4 CIDR    |   Options    |
+----------------+--------------+
| 192.168.0.0/16 | nat-outgoing |
+----------------+--------------+
+--------------------------+---------+
|        IPv6 CIDR         | Options |
+--------------------------+---------+
| fd80:24e2:f998:72d6::/64 |         |
+--------------------------+---------+

**Comment by caseydavenport** [comment]
@fasaxc am I interpreting those logs correctly, in that the MASQUERADE rules seem to be added / removed repeatedly?  Any idea why that might happen?

**Comment by fasaxc** [comment]
Hmm, there's something odd going on in the log there.  The PID of the process changes from 66 to 65 when moving from the @4000000057c85fdc1b97b2a4 to current log.  Did Felix restart?

@dachulin Do you see any logs from `calico.felix.masq`?  Those should tell us why felix is concluding that it does/does not need the rule.

One other thought: a k8s master often runs an etcd for k8s itself.  Are you running a separate etcd for calico?  If so, it's easy to get cross-talk with k8s when everything is running on one host; could be writing to one etcd and reading from the other.  Worth checking what ports felix and the CNI plugin are talking to if you are running multiple etcds.  An easy way to check would be to look for a /calico directory in each of your etcds with `etcdctl ls`

**Comment by dachulin** [comment]
We were running separate etcd for calico when the problem occurs. Few days ago, we changed calico to use the same etcd instance as k8s. Just check today and seems like the problem went away. So it seems like separate etcd instances is the cause of the problem. 

Not sure if you like to further investigate it? if not, feel free to close this.

Thanks.

**Comment by fasaxc** [comment]
OK, thanks, I'll close for now.  Please feel free to file a new issue if you reproduce it.
