### ISSUE TITLE
Newly created Pod doesn't get ARP response for 169.254.1.1 for 1 minute then succeeds

### ISSUE THREAD

**Issue by lubronzhan** [projectcalico/calico#8689]
## Expected Behavior

Curling k8s internal service succeeds immediately after creating a new pod
## Current Behavior

Before creating more nodes in the cluster, it was fine, but then

Curling the k8s internal service doesn't succeed inside a new pod, it only succeed until 1 minutes later. 

Start a dev pod 
```
apiVersion: v1
kind: Pod
metadata:
  labels:
    run: network-tools-4
  name: network-tools-4
spec:
  containers:
  - name: network-tools-4
    image: <image>/network-tools
    resources: {}
    command: ["/bin/bash", "-c", "sleep 2000000000000"]
  dnsPolicy: ClusterFirst
  restartPolicy: Always
  nodeSelector:
    kubernetes.io/hostname: <node name>
```
Keep running curl on it, only succeeded after a minute.
```
[ ~ ]$ date
Tue Apr  2 08:27:25 UTC 2024
[ ~ ]$ kubectl exec -it network-tools-4 -- curl -Ik https://100.64.0.1
curl: (7) Failed to connect to 100.64.0.1 port 443 after 3077 ms: Host is unreachable
command terminated with exit code 7
[ ~ ]$ date
Tue Apr  2 08:27:31 UTC 2024
[ ~ ]$ kubectl exec -it network-tools-4 -- curl -Ik https://100.64.0.1
curl: (7) Failed to connect to 100.64.0.1 port 443 after 3062 ms: Host is unreachable
command terminated with exit code 7
[ ~ ]$ date
Tue Apr  2 08:27:38 UTC 2024
[ ~ ]$ kubectl exec -it network-tools-4 -- curl -Ik https://100.64.0.1
curl: (7) Failed to connect to 100.64.0.1 port 443 after 3066 ms: Host is unreachable
command terminated with exit code 7
[ ~ ]$ date
Tue Apr  2 08:27:45 UTC 2024
[ ~ ]$ kubectl exec -it network-tools-4 -- curl -Ik https://100.64.0.1
curl: (7) Failed to connect to 100.64.0.1 port 443 after 3061 ms: Host is unreachable
command terminated with exit code 7
[ ~ ]$ date
Tue Apr  2 08:27:52 UTC 2024
[ ~ ]$ kubectl exec -it network-tools-4 -- curl -Ik https://100.64.0.1
curl: (7) Failed to connect to 100.64.0.1 port 443 after 3082 ms: Host is unreachable
command terminated with exit code 7
[ ~ ]$ date && kubectl exec -it network-tools-4 -- curl -Ik https://100.64.0.1
Tue Apr  2 08:28:01 UTC 2024
HTTP/2 403
audit-id: 0cdd0692-98fa-4ebe-8f59-70b4aa2359f2
cache-control: no-cache, private
content-type: application/json
x-content-type-options: nosniff
x-kubernetes-pf-flowschema-uid: d6ef7519-6937-4431-a367-d3b2750fbbf9
x-kubernetes-pf-prioritylevel-uid: 1de44c2a-9574-4629-965f-ff5f8fd47e39
content-length: 234
date: Tue, 02 Apr 2024 08:28:03 GMT
```

TCPdump on the pod interface from the node, there is a lot of request sent, after 1 minute, the ARP succeeded and got address for `169.254.1.1 `
```
[ ~ ]$ ip link |grep ^75
75: caliccf47853546@if4: <BROADCAST,MULTICAST,UP,LOWER_UP> mtu 1480 qdisc noqueue state UP mode DEFAULT group default
[ ~ ]$ sudo tcpdump -vv -i caliccf47853546
tcpdump: listening on caliccf47853546, link-type EN10MB (Ethernet), capture size 262144 bytes
08:27:05.167010 ARP, Ethernet (len 6), IPv4 (len 4), Request who-has 169.254.1.1 tell 100.122.5.198, length 28
08:27:06.186084 ARP, Ethernet (len 6), IPv4 (len 4), Request who-has 169.254.1.1 tell 100.122.5.198, length 28
...
08:27:14.826143 ARP, Ethernet (len 6), IPv4 (len 4), Request who-has 169.254.1.1 tell 100.122.5.198, length 28
08:27:14.922086 IP6 (hlim 255, next-header ICMPv6 (58) payload length: 16) fe80::dca6:b5ff:fe09:4685 > ff02::2: [icmp6 sum ok] ICMP6, router solicitation, length 16
          source link-address option (1), length 8 (1): de:a6:b5:09:46:85
            0x0000:  dea6 b509 4685
08:27:18.840072 ARP, Ethernet (len 6), IPv4 (len 4), Request who-has 169.254.1.1 tell 100.122.5.198, length 28
08:27:19.850080 ARP, Ethernet (len 6), IPv4 (len 4), Request who-has 169.254.1.1 tell 100.122.5.198, length 28
...
08:28:02.474109 ARP, Ethernet (len 6), IPv4 (len 4), Request who-has 169.254.1.1 tell 100.122.5.198, length 28
08:28:03.498077 ARP, Ethernet (len 6), IPv4 (len 4), Request who-has 169.254.1.1 tell 100.122.5.198, length 28
08:28:03.498106 ARP, Ethernet (len 6), IPv4 (len 4), Reply 169.254.1.1 is-at ee:ee:ee:ee:ee:ee (oui Unknown), length 28 <---------- finally succeeds
08:28:03.498110 IP (tos 0x0, ttl 64, id 41947, offset 0, flags [DF], proto TCP (6), length 60)
    100.122.5.198.35496 > 100.64.0.1.https: Flags [S], cksum 0xceaf (incorrect -> 0xf855), seq 1881565354, win 64800, options [mss 1440,sackOK,TS val 975299781 ecr 0,nop,wscale 8], length 0
```

I assume it's because of the failing ARP that causing this. But then where should I look next to debug this, can someone help give some hints?

## Context

Similar to this one https://github.com/projectcalico/calico/issues/4186 and https://github.com/projectcalico/calico/issues/4123.
But in our env, we don't have to manually add the route to 169.254.1.1, it just takes about 1 minute to get the correct mac address of .169.254.1.1

## Your Environment

* Calico version: 3.19.1, 3.24
* Orchestrator version (e.g. kubernetes, mesos, rkt): 1.22.9, 1.24.10 kubernetes
* Operating System and version: Photon 3
* Link to your project (optional):

**Comment by fasaxc** [comment]
* How big is your cluster?
* How many pods?
* How many network policies do you have?
* What CNI plugin are you using; is this Calico CNI + Calico Policy, or Canal (flannel + Calico Policy), or some other combination?

**Comment by lubronzhan** [comment]
Hi @fasaxc 
1. The cluster has 35 nodes
2. It has 639 pods
3. no network policies are available on the cluster
4. Just Calico CNI installed by the manifest [here](https://github.com/projectcalico/calico/blob/4b416f31b5db73ef3860ccc82aeaf745fb96642a/manifests/calico.yaml) 



The output of calico daemonset if you are interested
```
#capv@itbo2-nokia-ccs-cl-001-master-control-plane-ptxcm [ ~ ]$ kubectl get ds calico-node -n kube-system -oyaml
apiVersion: apps/v1
kind: DaemonSet
metadata:
  generation: 1
  labels:
    k8s-app: calico-node
  name: calico-node
  namespace: kube-system
spec:
  revisionHistoryLimit: 10
  selector:
    matchLabels:
      k8s-app: calico-node
  template:
    metadata:
      creationTimestamp: null
      labels:
        k8s-app: calico-node
    spec:
      containers:
      - env:
        - name: DATASTORE_TYPE
          value: kubernetes
        - name: WAIT_FOR_DATASTORE
          value: "true"
        - name: NODENAME
          valueFrom:
            fieldRef:
              apiVersion: v1
              fieldPath: spec.nodeName
        - name: CALICO_NETWORKING_BACKEND
          valueFrom:
            configMapKeyRef:
              key: calico_backend
              name: calico-config
        - name: CLUSTER_TYPE
          value: k8s,bgp
        - name: IP
          value: autodetect
        - name: CALICO_IPV4POOL_IPIP
          value: Always
        - name: CALICO_IPV4POOL_VXLAN
          value: Never
        - name: FELIX_IPINIPMTU
          valueFrom:
            configMapKeyRef:
              key: veth_mtu
              name: calico-config
        - name: FELIX_VXLANMTU
          valueFrom:
            configMapKeyRef:
              key: veth_mtu
              name: calico-config
        - name: FELIX_WIREGUARDMTU
          valueFrom:
            configMapKeyRef:
              key: veth_mtu
              name: calico-config
        - name: CALICO_DISABLE_FILE_LOGGING
          value: "true"
        - name: FELIX_DEFAULTENDPOINTTOHOSTACTION
          value: ACCEPT
        - name: FELIX_IPV6SUPPORT
          value: "false"
        - name: FELIX_HEALTHENABLED
          value: "true"
        - name: CALICO_IPV4POOL_CIDR
          value: 100.96.0.0/11
        envFrom:
        - configMapRef:
            name: kubernetes-services-endpoint
            optional: true
        image: <calico-image>
        imagePullPolicy: IfNotPresent
        livenessProbe:
          exec:
            command:
            - /bin/calico-node
            - -felix-live
            - -bird-live
          failureThreshold: 6
          initialDelaySeconds: 10
          periodSeconds: 10
          successThreshold: 1
          timeoutSeconds: 1
        name: calico-node
        readinessProbe:
          exec:
            command:
            - /bin/calico-node
            - -felix-ready
            - -bird-ready
          failureThreshold: 3
          periodSeconds: 10
          successThreshold: 1
          timeoutSeconds: 1
        resources:
          requests:
            cpu: 250m
        securityContext:
          privileged: true
        terminationMessagePath: /dev/termination-log
        terminationMessagePolicy: File
        volumeMounts:
        - mountPath: /lib/modules
          name: lib-modules
          readOnly: true
        - mountPath: /run/xtables.lock
          name: xtables-lock
        - mountPath: /var/run/calico
          name: var-run-calico
        - mountPath: /var/lib/calico
          name: var-lib-calico
        - mountPath: /var/run/nodeagent
          name: policysync
        - mountPath: /sys/fs/
          mountPropagation: Bidirectional
          name: sysfs
        - mountPath: /var/log/calico/cni
          name: cni-log-dir
          readOnly: true
      dnsPolicy: ClusterFirst
      hostNetwork: true
      initContainers:
      - command:
        - /opt/cni/bin/calico-ipam
        - -upgrade
        env:
        - name: KUBERNETES_NODE_NAME
          valueFrom:
            fieldRef:
              apiVersion: v1
              fieldPath: spec.nodeName
        - name: CALICO_NETWORKING_BACKEND
          valueFrom:
            configMapKeyRef:
              key: calico_backend
              name: calico-config
        envFrom:
        - configMapRef:
            name: kubernetes-services-endpoint
            optional: true
        image: <calico-image>
        imagePullPolicy: IfNotPresent
        name: upgrade-ipam
        resources: {}
        securityContext:
          privileged: true
        terminationMessagePath: /dev/termination-log
        terminationMessagePolicy: File
        volumeMounts:
        - mountPath: /var/lib/cni/networks
          name: host-local-net-dir
        - mountPath: /host/opt/cni/bin
          name: cni-bin-dir
      - command:
        - /opt/cni/bin/install
        env:
        - name: CNI_CONF_NAME
          value: 10-calico.conflist
        - name: CNI_NETWORK_CONFIG
          valueFrom:
            configMapKeyRef:
              key: cni_network_config
              name: calico-config
        - name: KUBERNETES_NODE_NAME
          valueFrom:
            fieldRef:
              apiVersion: v1
              fieldPath: spec.nodeName
        - name: CNI_MTU
          valueFrom:
            configMapKeyRef:
              key: veth_mtu
              name: calico-config
        - name: SLEEP
          value: "false"
        envFrom:
        - configMapRef:
            name: kubernetes-services-endpoint
            optional: true
        image: <calico-image>
        imagePullPolicy: IfNotPresent
        name: install-cni
        resources: {}
        securityContext:
          privileged: true
        terminationMessagePath: /dev/termination-log
        terminationMessagePolicy: File
        volumeMounts:
        - mountPath: /host/opt/cni/bin
          name: cni-bin-dir
        - mountPath: /host/etc/cni/net.d
          name: cni-net-dir
      - image: <calico-image>
        imagePullPolicy: IfNotPresent
        name: flexvol-driver
        resources: {}
        securityContext:
          privileged: true
        terminationMessagePath: /dev/termination-log
        terminationMessagePolicy: File
        volumeMounts:
        - mountPath: /host/driver
          name: flexvol-driver-host
      nodeSelector:
        kubernetes.io/os: linux
      priorityClassName: system-node-critical
      restartPolicy: Always
      schedulerName: default-scheduler
      securityContext: {}
      serviceAccount: calico-node
      serviceAccountName: calico-node
      terminationGracePeriodSeconds: 0
      tolerations:
      - effect: NoSchedule
        operator: Exists
      - key: CriticalAddonsOnly
        operator: Exists
      - effect: NoExecute
        operator: Exists
      volumes:
      - hostPath:
          path: /lib/modules
          type: ""
        name: lib-modules
      - hostPath:
          path: /var/run/calico
          type: ""
        name: var-run-calico
      - hostPath:
          path: /var/lib/calico
          type: ""
        name: var-lib-calico
      - hostPath:
          path: /run/xtables.lock
          type: FileOrCreate
        name: xtables-lock
      - hostPath:
          path: /sys/fs/
          type: DirectoryOrCreate
        name: sysfs
      - hostPath:
          path: /opt/cni/bin
          type: ""
        name: cni-bin-dir
      - hostPath:
          path: /etc/cni/net.d
          type: ""
        name: cni-net-dir
      - hostPath:
          path: /var/log/calico/cni
          type: ""
        name: cni-log-dir
      - hostPath:
          path: /var/lib/cni/networks
          type: ""
        name: host-local-net-dir
      - hostPath:
          path: /var/run/nodeagent
          type: DirectoryOrCreate
        name: policysync
      - hostPath:
          path: /usr/libexec/kubernetes/kubelet-plugins/volume/exec/nodeagent~uds
          type: DirectoryOrCreate
        name: flexvol-driver-host
  updateStrategy:
    rollingUpdate:
      maxSurge: 0
      maxUnavailable: 1
    type: RollingUpdate
status:
  currentNumberScheduled: 38
  desiredNumberScheduled: 38
  numberAvailable: 38
  numberMisscheduled: 0
  numberReady: 38
  observedGeneration: 1
  updatedNumberScheduled: 38
```

And ip r did show correct answers at the beginning, but ip neigh shows the mac address after a minute because of the ARP delay

**Comment by lubronzhan** [comment]
Any guidance would be appreciated. Thanks

**Comment by fasaxc** [comment]
Do you have a lot of interfaces and/or routes on your nodes in general?  I.e. how many do you see with 
```
ip route
```
and
```
ip link
```
If so, please try Calico v3.27, it has big performance fixes to deal with lots of routes/links.

**Comment by fasaxc** [comment]
Also, worth checking the proxy_delay setting sysctls.  Calico usesproxy ark just for the gateway address:
```
sudo sysctl -a | grep proxy_delay
```
The delay is in jiffies so, on a typical system a value of 80 means 0.8s.

Calico is supposed to set that to 0 for our caliXXX interfaces, IIRC but perhaps you have something else overriding it.

**Comment by lubronzhan** [comment]
Thanks.

Due to our constraint, we can only upgrade to 3.24 in short term

Below is the number of ip route
```
[ ~ ]$ for i in `cat $HOME/nodes`; do
>     echo "Collecting data on node $i"
>     ssh -q capv@$i 'ip route | wc -l'
> done;
Collecting data on node 10.216.29.106
44
Collecting data on node 10.216.29.56
44
Collecting data on node 10.216.29.105
45
Collecting data on node 10.216.29.78
48
Collecting data on node 10.216.29.72
49
Collecting data on node 10.216.29.41
49
Collecting data on node 10.216.29.74
52
Collecting data on node 10.216.29.116
51
Collecting data on node 10.216.29.73
48
Collecting data on node 10.216.29.77
52
Collecting data on node 10.216.29.62
50
Collecting data on node 10.216.29.42
47
Collecting data on node 10.216.29.24
48
Collecting data on node 10.216.29.76
51
Collecting data on node 10.216.29.40
54
Collecting data on node 10.216.29.39
49
Collecting data on node 10.216.29.115
48
Collecting data on node 10.216.29.20
51
Collecting data on node 10.216.29.75
47
Collecting data on node 10.216.29.63
48
Collecting data on node 10.216.29.15
57
Collecting data on node 10.216.29.111
49
Collecting data on node 10.216.29.113
48
Collecting data on node 10.216.29.35
47
Collecting data on node 10.216.29.21
51
Collecting data on node 10.216.29.36
50
Collecting data on node 10.216.29.33
48
Collecting data on node 10.216.29.114
48
Collecting data on node 10.216.29.61
49
Collecting data on node 10.216.29.64
48
Collecting data on node 10.216.29.23
54
Collecting data on node 10.216.29.110
49
Collecting data on node 10.216.29.60
48
Collecting data on node 10.216.29.34
49
Collecting data on node 10.216.29.112
50
Collecting data on node 10.216.29.11
61
Collecting data on node 10.216.29.65
50
Collecting data on node 10.216.29.59
47
```

And number of ip links
```
[ ~ ]$ for i in `cat $HOME/nodes`; do     echo "Collecting data on node $i";     ssh -q capv@$i 'ip link | wc -l' ; done;
Collecting data on node 10.216.29.106
12
Collecting data on node 10.216.29.56
12
Collecting data on node 10.216.29.105
14
Collecting data on node 10.216.29.78
28
Collecting data on node 10.216.29.72
30
Collecting data on node 10.216.29.41
30
Collecting data on node 10.216.29.74
36
Collecting data on node 10.216.29.116
34
Collecting data on node 10.216.29.73
28
Collecting data on node 10.216.29.77
36
Collecting data on node 10.216.29.62
32
Collecting data on node 10.216.29.42
26
Collecting data on node 10.216.29.24
28
Collecting data on node 10.216.29.76
34
Collecting data on node 10.216.29.40
40
Collecting data on node 10.216.29.39
30
Collecting data on node 10.216.29.115
28
Collecting data on node 10.216.29.20
34
Collecting data on node 10.216.29.75
26
Collecting data on node 10.216.29.63
28
Collecting data on node 10.216.29.15
46
Collecting data on node 10.216.29.111
30
Collecting data on node 10.216.29.113
28
Collecting data on node 10.216.29.35
26
Collecting data on node 10.216.29.21
34
Collecting data on node 10.216.29.36
32
Collecting data on node 10.216.29.33
28
Collecting data on node 10.216.29.114
28
Collecting data on node 10.216.29.61
30
Collecting data on node 10.216.29.64
28
Collecting data on node 10.216.29.23
40
Collecting data on node 10.216.29.110
30
Collecting data on node 10.216.29.60
28
Collecting data on node 10.216.29.34
30
Collecting data on node 10.216.29.112
32
Collecting data on node 10.216.29.11
54
Collecting data on node 10.216.29.65
32
Collecting data on node 10.216.29.59
26

```
Example proxy_arp config, it's set to 0 correctly
```
 [ ~ ]$ for i in `cat $HOME/nodes`; do     echo "-------------------------Collecting data on node $i";     ssh -q capv@$i 'sudo sysctl -a | grep proxy_delay' ; done;
-------------------------Collecting data on node 10.216.29.106
net.ipv4.neigh.cali26f4260c658.proxy_delay = 0
net.ipv4.neigh.cali31b0d168a79.proxy_delay = 0
net.ipv4.neigh.calif0620e7d9b1.proxy_delay = 0
net.ipv4.neigh.default.proxy_delay = 80
net.ipv4.neigh.eth0.proxy_delay = 80
net.ipv4.neigh.lo.proxy_delay = 80
net.ipv4.neigh.tunl0.proxy_delay = 80
net.ipv6.neigh.cali26f4260c658.proxy_delay = 80
net.ipv6.neigh.cali31b0d168a79.proxy_delay = 80
net.ipv6.neigh.calif0620e7d9b1.proxy_delay = 80
net.ipv6.neigh.default.proxy_delay = 80
net.ipv6.neigh.eth0.proxy_delay = 80
net.ipv6.neigh.lo.proxy_delay = 80
net.ipv6.neigh.tunl0.proxy_delay = 80
-------------------------Collecting data on node 10.216.29.56
net.ipv4.neigh.cali37a623f5e8c.proxy_delay = 0
net.ipv4.neigh.cali38c7f24c56e.proxy_delay = 0
net.ipv4.neigh.cali9416a4942af.proxy_delay = 0
net.ipv4.neigh.default.proxy_delay = 80
net.ipv4.neigh.eth0.proxy_delay = 80
net.ipv4.neigh.lo.proxy_delay = 80
net.ipv4.neigh.tunl0.proxy_delay = 80
net.ipv6.neigh.cali37a623f5e8c.proxy_delay = 80
net.ipv6.neigh.cali38c7f24c56e.proxy_delay = 80
net.ipv6.neigh.cali9416a4942af.proxy_delay = 80
net.ipv6.neigh.default.proxy_delay = 80
net.ipv6.neigh.eth0.proxy_delay = 80
net.ipv6.neigh.lo.proxy_delay = 80
net.ipv6.neigh.tunl0.proxy_delay = 80
```
Only weird thing that is we have so many links but only few calixxxx interface has proxy_delay config.

But ` 0.8s` shouldn't cause 1 minute delay I assume?

**Comment by lubronzhan** [comment]
One observation is that there are more than 10 ip link on each of the node, but `sudo sysctl -a | grep proxy_delay` only shows very few net.ipv4.neigh.califxxx.proxy_delay, will check whether those are added correctly on each node

**Comment by lubronzhan** [comment]
Turns out it might be related to wrong way of running `udevadm trigger` inside udev rule causing this. Even booting VM is delayed. Will close this once it's confirmed

**Comment by lubronzhan** [comment]
Yeah removing that invalid udev rule solves the issue.

But we also observe this error inside `systemd-udevd`
```
Apr 17 22:34:57 wl-calico-md-0-fxxkr-bc86f696cxbfhsn-799w4 systemd-udevd[1903]: Could not generate persistent MAC address for calico_tmp_B: No such file or directory
Apr 17 22:34:57 wl-calico-md-0-fxxkr-bc86f696cxbfhsn-799w4 systemd-udevd[1904]: link_config: autonegotiation is unset or enabled, the speed and duplex are not writable.
Apr 17 22:34:57 wl-calico-md-0-fxxkr-bc86f696cxbfhsn-799w4 systemd-udevd[1904]: Could not generate persistent MAC address for calico_tmp_A: No such file or directory
```

According to here, persistent MAC can't be set virtual devices since they don't have `ID_NET_NAME_` systemd netword probably shouldn't set that MAC since it's calico it's managing it https://github.com/systemd/systemd/issues/3374#issuecomment-223753264

But does it impact ARP proxy case?

**Comment by lubronzhan** [comment]
Another observation we found in containerd and kubelet log is that, when previous pod was deleted, there was log that showing it was triggering `RemoveContainer`, `StopPodSandbox`. and sandbox was removed successfully. `cb056e7f2b83ae62bf255b1d711fa5ba6196e2c1abe77924c699ba1dbbac4241` is the sandbox id for container `5c8ab0970a6474c643a57237b18b0d29fafe930524198a3fbb26898b7a4e5d6f`
```
Apr 18 11:03:22 test-cluster-001-np6-7c447c7f4-p6n5j containerd[656]: time="2024-04-18T11:03:22.245392111Z" level=info msg="StopContainer for \"5c8ab0970a6474c643a57237b18b0d29fafe930524198a3fbb26898b7a4e5d6f\" with timeout 30 (s)"
Apr 18 11:03:22 test-cluster-001-np6-7c447c7f4-p6n5j containerd[656]: time="2024-04-18T11:03:22.245725886Z" level=info msg="Stop container \"5c8ab0970a6474c643a57237b18b0d29fafe930524198a3fbb26898b7a4e5d6f\" with signal terminated"
Apr 18 11:03:53 test-cluster-001-np6-7c447c7f4-p6n5j kubelet[2848]: I0418 11:03:53.456364    2848 scope.go:110] "RemoveContainer" containerID="5c8ab0970a6474c643a57237b18b0d29fafe930524198a3fbb26898b7a4e5d6f"
Apr 18 11:03:53 test-cluster-001-np6-7c447c7f4-p6n5j containerd[656]: time="2024-04-18T11:03:53.457329493Z" level=info msg="RemoveContainer for \"5c8ab0970a6474c643a57237b18b0d29fafe930524198a3fbb26898b7a4e5d6f\""
Apr 18 11:03:53 test-cluster-001-np6-7c447c7f4-p6n5j containerd[656]: time="2024-04-18T11:03:53.459937385Z" level=info msg="RemoveContainer for \"5c8ab0970a6474c643a57237b18b0d29fafe930524198a3fbb26898b7a4e5d6f\" returns successfully"
Apr 18 11:03:52 test-cluster-001-np6-7c447c7f4-p6n5j containerd[656]: 2024-04-18 11:03:52.550 [INFO][7900] k8s.go 576: Cleaning up netns ContainerID="cb056e7f2b83ae62bf255b1d711fa5ba6196e2c1abe77924c699ba1dbbac4241"
Apr 18 11:03:52 test-cluster-001-np6-7c447c7f4-p6n5j containerd[656]: 2024-04-18 11:03:52.550 [INFO][7900] dataplane_linux.go 524: Deleting workload's device in netns. ContainerID="cb056e7f2b83ae62bf255b1d711fa5ba6196e2c1abe77924c699ba1dbbac4241" iface="eth0" netns="/var/run/netns/cni-11dac01e-0ed9-5318-5e9d-9512c6450abb"
Apr 18 11:03:52 test-cluster-001-np6-7c447c7f4-p6n5j containerd[656]: 2024-04-18 11:03:52.550 [INFO][7900] dataplane_linux.go 535: Entered netns, deleting veth. ContainerID="cb056e7f2b83ae62bf255b1d711fa5ba6196e2c1abe77924c699ba1dbbac4241" iface="eth0" netns="/var/run/netns/cni-11dac01e-0ed9-5318-5e9d-9512c6450abb"
Apr 18 11:03:52 test-cluster-001-np6-7c447c7f4-p6n5j containerd[656]: 2024-04-18 11:03:52.586 [INFO][7900] dataplane_linux.go 569: Deleted device in netns. ContainerID="cb056e7f2b83ae62bf255b1d711fa5ba6196e2c1abe77924c699ba1dbbac4241" after=35.612377ms iface="eth0" netns="/var/run/netns/cni-11dac01e-0ed9-5318-5e9d-9512c6450abb"
Apr 18 11:03:52 test-cluster-001-np6-7c447c7f4-p6n5j containerd[656]: 2024-04-18 11:03:52.586 [INFO][7900] k8s.go 583: Releasing IP address(es) ContainerID="cb056e7f2b83ae62bf255b1d711fa5ba6196e2c1abe77924c699ba1dbbac4241"
Apr 18 11:03:52 test-cluster-001-np6-7c447c7f4-p6n5j containerd[656]: 2024-04-18 11:03:52.586 [INFO][7900] utils.go 196: Calico CNI releasing IP address ContainerID="cb056e7f2b83ae62bf255b1d711fa5ba6196e2c1abe77924c699ba1dbbac4241"
Apr 18 11:03:52 test-cluster-001-np6-7c447c7f4-p6n5j containerd[656]: 2024-04-18 11:03:52.606 [INFO][7935] ipam_plugin.go 416: Releasing address using handleID ContainerID="cb056e7f2b83ae62bf255b1d711fa5ba6196e2c1abe77924c699ba1dbbac4241" HandleID="k8s-pod-network.cb056e7f2b83ae62bf255b1d711fa5ba6196e2c1abe77924c699ba1dbbac4241" Workload="test--cluster--001--np6--7c447c7f4--p6n5j-k8s-netshoot--06-eth0"
Apr 18 11:03:52 test-cluster-001-np6-7c447c7f4-p6n5j containerd[656]: time="2024-04-18T11:03:52Z" level=info msg="About to acquire host-wide IPAM lock." source="ipam_plugin.go:357"
Apr 18 11:03:52 test-cluster-001-np6-7c447c7f4-p6n5j containerd[656]: time="2024-04-18T11:03:52Z" level=info msg="Acquired host-wide IPAM lock." source="ipam_plugin.go:372"
Apr 18 11:03:52 test-cluster-001-np6-7c447c7f4-p6n5j containerd[656]: 2024-04-18 11:03:52.632 [INFO][7935] ipam_plugin.go 435: Released address using handleID ContainerID="cb056e7f2b83ae62bf255b1d711fa5ba6196e2c1abe77924c699ba1dbbac4241" HandleID="k8s-pod-network.cb056e7f2b83ae62bf255b1d711fa5ba6196e2c1abe77924c699ba1dbbac4241" Workload="test--cluster--001--np6--7c447c7f4--p6n5j-k8s-netshoot--06-eth0"
Apr 18 11:03:52 test-cluster-001-np6-7c447c7f4-p6n5j containerd[656]: 2024-04-18 11:03:52.632 [INFO][7935] ipam_plugin.go 444: Releasing address using workloadID ContainerID="cb056e7f2b83ae62bf255b1d711fa5ba6196e2c1abe77924c699ba1dbbac4241" HandleID="k8s-pod-network.cb056e7f2b83ae62bf255b1d711fa5ba6196e2c1abe77924c699ba1dbbac4241" Workload="test--cluster--001--np6--7c447c7f4--p6n5j-k8s-netshoot--06-eth0"
Apr 18 11:03:52 test-cluster-001-np6-7c447c7f4-p6n5j containerd[656]: time="2024-04-18T11:03:52Z" level=info msg="Released host-wide IPAM lock." source="ipam_plugin.go:378"
Apr 18 11:03:52 test-cluster-001-np6-7c447c7f4-p6n5j containerd[656]: 2024-04-18 11:03:52.634 [INFO][7900] k8s.go 589: Teardown processing complete. ContainerID="cb056e7f2b83ae62bf255b1d711fa5ba6196e2c1abe77924c699ba1dbbac4241"
Apr 18 11:03:52 test-cluster-001-np6-7c447c7f4-p6n5j containerd[656]: time="2024-04-18T11:03:52.662234037Z" level=info msg="TearDown network for sandbox \"cb056e7f2b83ae62bf255b1d711fa5ba6196e2c1abe77924c699ba1dbbac4241\" successfully"
Apr 18 11:03:52 test-cluster-001-np6-7c447c7f4-p6n5j containerd[656]: time="2024-04-18T11:03:52.662273576Z" level=info msg="StopPodSandbox for \"cb056e7f2b83ae62bf255b1d711fa5ba6196e2c1abe77924c699ba1dbbac4241\" returns successfully"
Apr 18 11:03:52 test-cluster-001-np6-7c447c7f4-p6n5j kubelet[2848]: I0418 11:03:52.862434    2848 reconciler.go:211] "operationExecutor.UnmountVolume started for volume \"kube-api-access-wfpms\" (UniqueName: \"kubernetes.io/projected/59398874-6783-46fb-99c3-cb09fc7bbfb8-kube-api-access-wfpms\") pod \"59398874-6783-46fb-99c3-cb09fc7bbfb8\" (UID: \"59398874-6783-46fb-99c3-cb09fc7bbfb8\") "
Apr 18 11:03:52 test-cluster-001-np6-7c447c7f4-p6n5j kubelet[2848]: I0418 11:03:52.886469    2848 operation_generator.go:863] UnmountVolume.TearDown succeeded for volume "kubernetes.io/projected/59398874-6783-46fb-99c3-cb09fc7bbfb8-kube-api-access-wfpms" (OuterVolumeSpecName: "kube-api-access-wfpms") pod "59398874-6783-46fb-99c3-cb09fc7bbfb8" (UID: "59398874-6783-46fb-99c3-cb09fc7bbfb8"). InnerVolumeSpecName "kube-api-access-wfpms". PluginName "kubernetes.io/projected", VolumeGidValue ""
Apr 18 11:03:52 test-cluster-001-np6-7c447c7f4-p6n5j kubelet[2848]: I0418 11:03:52.962801    2848 reconciler.go:394] "Volume detached for volume \"kube-api-access-wfpms\" (UniqueName: \"kubernetes.io/projected/59398874-6783-46fb-99c3-cb09fc7bbfb8-kube-api-access-wfpms\") on node \"test-cluster-001-np6-7c447c7f4-p6n5j\" DevicePath \"\""
Apr 18 11:03:53 test-cluster-001-np6-7c447c7f4-p6n5j kubelet[2848]: I0418 11:03:53.456364    2848 scope.go:110] "RemoveContainer" containerID="5c8ab0970a6474c643a57237b18b0d29fafe930524198a3fbb26898b7a4e5d6f"
Apr 18 11:03:53 test-cluster-001-np6-7c447c7f4-p6n5j containerd[656]: time="2024-04-18T11:03:53.457329493Z" level=info msg="RemoveContainer for \"5c8ab0970a6474c643a57237b18b0d29fafe930524198a3fbb26898b7a4e5d6f\""
Apr 18 11:03:53 test-cluster-001-np6-7c447c7f4-p6n5j containerd[656]: time="2024-04-18T11:03:53.459937385Z" level=info msg="RemoveContainer for \"5c8ab0970a6474c643a57237b18b0d29fafe930524198a3fbb26898b7a4e5d6f\" returns successfully"
Apr 18 11:03:53 test-cluster-001-np6-7c447c7f4-p6n5j systemd[1]: Removed slice libcontainer container kubepods-besteffort-pod59398874_6783_46fb_99c3_cb09fc7bbfb8.slice.
Apr 18 11:03:53 test-cluster-001-np6-7c447c7f4-p6n5j systemd[1]: kubepods-besteffort-pod59398874_6783_46fb_99c3_cb09fc7bbfb8.slice: Consumed 292ms CPU time
Apr 18 11:03:54 test-cluster-001-np6-7c447c7f4-p6n5j containerd[656]: time="2024-04-18T11:03:54.069154717Z" level=info msg="StopContainer for \"5c8ab0970a6474c643a57237b18b0d29fafe930524198a3fbb26898b7a4e5d6f\" with timeout 1 (s)"
Apr 18 11:03:54 test-cluster-001-np6-7c447c7f4-p6n5j containerd[656]: time="2024-04-18T11:03:54.069194301Z" level=error msg="StopContainer for \"5c8ab0970a6474c643a57237b18b0d29fafe930524198a3fbb26898b7a4e5d6f\" failed" error="rpc error: code = NotFound desc = an error occurred when try to find container \"5c8ab0970a6474c643a57237b18b0d29fafe930524198a3fbb26898b7a4e5d6f\": not found"
Apr 18 11:03:54 test-cluster-001-np6-7c447c7f4-p6n5j kubelet[2848]: E0418 11:03:54.069371    2848 remote_runtime.go:484] "StopContainer from runtime service failed" err="rpc error: code = NotFound desc = an error occurred when try to find container \"5c8ab0970a6474c643a57237b18b0d29fafe930524198a3fbb26898b7a4e5d6f\": not found" containerID="5c8ab0970a6474c643a57237b18b0d29fafe930524198a3fbb26898b7a4e5d6f"
Apr 18 11:03:54 test-cluster-001-np6-7c447c7f4-p6n5j containerd[656]: time="2024-04-18T11:03:54.069535960Z" level=info msg="StopPodSandbox for \"cb056e7f2b83ae62bf255b1d711fa5ba6196e2c1abe77924c699ba1dbbac4241\""
Apr 18 11:03:54 test-cluster-001-np6-7c447c7f4-p6n5j kubelet[2848]: I0418 11:03:54.070041    2848 kubelet_volumes.go:160] "Cleaned up orphaned pod volumes dir" podUID=59398874-6783-46fb-99c3-cb09fc7bbfb8 path="/var/lib/kubelet/pods/59398874-6783-46fb-99c3-cb09fc7bbfb8/volumes"
Apr 18 11:03:54 test-cluster-001-np6-7c447c7f4-p6n5j containerd[656]: time="2024-04-18T11:03:54.094846515Z" level=info msg="TearDown network for sandbox \"cb056e7f2b83ae62bf255b1d711fa5ba6196e2c1abe77924c699ba1dbbac4241\" successfully"
Apr 18 11:03:54 test-cluster-001-np6-7c447c7f4-p6n5j containerd[656]: time="2024-04-18T11:03:54.094878686Z" level=info msg="StopPodSandbox for \"cb056e7f2b83ae62bf255b1d711fa5ba6196e2c1abe77924c699ba1dbbac4241\" returns successfully"


```

Then when I create a new pod with same name, it shows it found existing endpoint 
```
Apr 18 11:04:13 test-cluster-001-np6-7c447c7f4-p6n5j containerd[656]: 2024-04-18 11:04:13.837 [INFO][8142] plugin.go 327: Calico CNI found existing endpoint: &{{WorkloadEndpoint projectcalico.org/v3} {test--cluster--001--np6--7c447c7f4--p6n5j-k8s-netshoot--06-eth0  default  4e0e2d79-2f93-4263-b4d2-633b2e36f4b6 614643 0 2024-04-18 11:04:13 +0000 UTC <nil> <nil> map[projectcalico.org/namespace:default projectcalico.org/orchestrator:k8s projectcalico.org/serviceaccount:default run:netshoot-06] map[] [] []  []} {k8s  test-cluster-001-np6-7c447c7f4-p6n5j  netshoot-06 eth0 default [] []   [kns.default ksa.default.default] calic1f9e343a5a  [] []}} ContainerID="3386597aa676152e3dc47660808f199dbeb7c91c012f349e0ba98421f5a0c040" Namespace="default" Pod="netshoot-06" WorkloadEndpoint="test--cluster--001--np6--7c447c7f4--p6n5j-k8s-netshoot--06-"
Apr 18 11:04:13 test-cluster-001-np6-7c447c7f4-p6n5j containerd[656]: 2024-04-18 11:04:13.837 [INFO][8142] k8s.go 74: Extracted identifiers for CmdAddK8s ContainerID="3386597aa676152e3dc47660808f199dbeb7c91c012f349e0ba98421f5a0c040" Namespace="default" Pod="netshoot-06" WorkloadEndpoint="test--cluster--001--np6--7c447c7f4--p6n5j-k8s-netshoot--06-eth0"
Apr 18 11:04:13 test-cluster-001-np6-7c447c7f4-p6n5j containerd[656]: 2024-04-18 11:04:13.862 [INFO][8154] ipam_plugin.go 229: Calico CNI IPAM request count IPv4=1 IPv6=0 ContainerID="3386597aa676152e3dc47660808f199dbeb7c91c012f349e0ba98421f5a0c040" HandleID="k8s-pod-network.3386597aa676152e3dc47660808f199dbeb7c91c012f349e0ba98421f5a0c040" Workload="test--cluster--001--np6--7c447c7f4--p6n5j-k8s-netshoot--06-eth0"
```
After allocating the ip for the new pod, which is different iP from previous pod, it starts to delete the podSandbox again. Not sure what's the reason behind it.

```
Apr 18 11:04:14 test-cluster-001-np6-7c447c7f4-p6n5j containerd[656]: time="2024-04-18T11:04:14.590360141Z" level=info msg="StartContainer for \"20f68333fefad6ca19ed2c48e24f231d62cc9bddc9c00efa86baa494b3a8be7d\" returns successfully"
Apr 18 11:04:15 test-cluster-001-np6-7c447c7f4-p6n5j systemd-networkd[640]: calic1f9e343a5a: Gained IPv6LL
Apr 18 11:04:15 test-cluster-001-np6-7c447c7f4-p6n5j systemd-networkd[640]: calic1f9e343a5a: Configured
Apr 18 11:04:34 test-cluster-001-np6-7c447c7f4-p6n5j containerd[656]: time="2024-04-18T11:04:34.237573828Z" level=info msg="StopPodSandbox for \"cb056e7f2b83ae62bf255b1d711fa5ba6196e2c1abe77924c699ba1dbbac4241\""
Apr 18 11:04:34 test-cluster-001-np6-7c447c7f4-p6n5j containerd[656]: 2024-04-18 11:04:34.294 [WARNING][8507] k8s.go 540: CNI_CONTAINERID does not match WorkloadEndpoint ConainerID, don't delete WEP. ContainerID="cb056e7f2b83ae62bf255b1d711fa5ba6196e2c1abe77924c699ba1dbbac4241" WorkloadEndpoint=&v3.WorkloadEndpoint{TypeMeta:v1.TypeMeta{Kind:"WorkloadEndpoint", APIVersion:"projectcalico.org/v3"}, ObjectMeta:v1.ObjectMeta{Name:"test--cluster--001--np6--7c447c7f4--p6n5j-k8s-netshoot--06-eth0", GenerateName:"", Namespace:"default", SelfLink:"", UID:"4e0e2d79-2f93-4263-b4d2-633b2e36f4b6", ResourceVersion:"614658", Generation:0, CreationTimestamp:time.Date(2024, time.April, 18, 11, 4, 13, 0, time.Local), DeletionTimestamp:<nil>, DeletionGracePeriodSeconds:(*int64)(nil), Labels:map[string]string{"projectcalico.org/namespace":"default", "projectcalico.org/orchestrator":"k8s", "projectcalico.org/serviceaccount":"default", "run":"netshoot-06"}, Annotations:map[string]string(nil), OwnerReferences:[]v1.OwnerReference(nil), Finalizers:[]string(nil), ZZZ_DeprecatedClusterName:"", ManagedFields:[]v1.ManagedFieldsEntry(nil)}, Spec:v3.WorkloadEndpointSpec{Orchestrator:"k8s", Workload:"", Node:"test-cluster-001-np6-7c447c7f4-p6n5j", ContainerID:"3386597aa676152e3dc47660808f199dbeb7c91c012f349e0ba98421f5a0c040", Pod:"netshoot-06", Endpoint:"eth0", ServiceAccountName:"default", IPNetworks:[]string{"100.126.129.200/32"}, IPNATs:[]v3.IPNAT(nil), IPv4Gateway:"", IPv6Gateway:"", Profiles:[]string{"kns.default", "ksa.default.default"}, InterfaceName:"calic1f9e343a5a", MAC:"", Ports:[]v3.WorkloadEndpointPort(nil), AllowSpoofedSourcePrefixes:[]string(nil)}}
Apr 18 11:04:34 test-cluster-001-np6-7c447c7f4-p6n5j containerd[656]: 2024-04-18 11:04:34.295 [INFO][8507] k8s.go 576: Cleaning up netns ContainerID="cb056e7f2b83ae62bf255b1d711fa5ba6196e2c1abe77924c699ba1dbbac4241"
Apr 18 11:04:34 test-cluster-001-np6-7c447c7f4-p6n5j containerd[656]: 2024-04-18 11:04:34.295 [INFO][8507] dataplane_linux.go 520: CleanUpNamespace called with no netns name, ignoring. ContainerID="cb056e7f2b83ae62bf255b1d711fa5ba6196e2c1abe77924c699ba1dbbac4241" iface="eth0" netns=""
Apr 18 11:04:34 test-cluster-001-np6-7c447c7f4-p6n5j containerd[656]: 2024-04-18 11:04:34.295 [INFO][8507] k8s.go 583: Releasing IP address(es) ContainerID="cb056e7f2b83ae62bf255b1d711fa5ba6196e2c1abe77924c699ba1dbbac4241"
Apr 18 11:04:34 test-cluster-001-np6-7c447c7f4-p6n5j containerd[656]: 2024-04-18 11:04:34.295 [INFO][8507] utils.go 196: Calico CNI releasing IP address ContainerID="cb056e7f2b83ae62bf255b1d711fa5ba6196e2c1abe77924c699ba1dbbac4241"
Apr 18 11:04:34 test-cluster-001-np6-7c447c7f4-p6n5j containerd[656]: 2024-04-18 11:04:34.314 [INFO][8518] ipam_plugin.go 416: Releasing address using handleID ContainerID="cb056e7f2b83ae62bf255b1d711fa5ba6196e2c1abe77924c699ba1dbbac4241" HandleID="k8s-pod-network.cb056e7f2b83ae62bf255b1d711fa5ba6196e2c1abe77924c699ba1dbbac4241" Workload="test--cluster--001--np6--7c447c7f4--p6n5j-k8s-netshoot--06-eth0"
Apr 18 11:04:34 test-cluster-001-np6-7c447c7f4-p6n5j containerd[656]: time="2024-04-18T11:04:34Z" level=info msg="About to acquire host-wide IPAM lock." source="ipam_plugin.go:357"
Apr 18 11:04:34 test-cluster-001-np6-7c447c7f4-p6n5j containerd[656]: time="2024-04-18T11:04:34Z" level=info msg="Acquired host-wide IPAM lock." source="ipam_plugin.go:372"
Apr 18 11:04:34 test-cluster-001-np6-7c447c7f4-p6n5j containerd[656]: 2024-04-18 11:04:34.320 [WARNING][8518] ipam_plugin.go 433: Asked to release address but it doesn't exist. Ignoring ContainerID="cb056e7f2b83ae62bf255b1d711fa5ba6196e2c1abe77924c699ba1dbbac4241" HandleID="k8s-pod-network.cb056e7f2b83ae62bf255b1d711fa5ba6196e2c1abe77924c699ba1dbbac4241" Workload="test--cluster--001--np6--7c447c7f4--p6n5j-k8s-netshoot--06-eth0"
Apr 18 11:04:34 test-cluster-001-np6-7c447c7f4-p6n5j containerd[656]: 2024-04-18 11:04:34.320 [INFO][8518] ipam_plugin.go 444: Releasing address using workloadID ContainerID="cb056e7f2b83ae62bf255b1d711fa5ba6196e2c1abe77924c699ba1dbbac4241" HandleID="k8s-pod-network.cb056e7f2b83ae62bf255b1d711fa5ba6196e2c1abe77924c699ba1dbbac4241" Workload="test--cluster--001--np6--7c447c7f4--p6n5j-k8s-netshoot--06-eth0"
Apr 18 11:04:34 test-cluster-001-np6-7c447c7f4-p6n5j containerd[656]: time="2024-04-18T11:04:34Z" level=info msg="Released host-wide IPAM lock." source="ipam_plugin.go:378"
Apr 18 11:04:34 test-cluster-001-np6-7c447c7f4-p6n5j containerd[656]: 2024-04-18 11:04:34.322 [INFO][8507] k8s.go 589: Teardown processing complete. ContainerID="cb056e7f2b83ae62bf255b1d711fa5ba6196e2c1abe77924c699ba1dbbac4241"
Apr 18 11:04:34 test-cluster-001-np6-7c447c7f4-p6n5j containerd[656]: time="2024-04-18T11:04:34.324562793Z" level=info msg="TearDown network for sandbox \"cb056e7f2b83ae62bf255b1d711fa5ba6196e2c1abe77924c699ba1dbbac4241\" successfully"
Apr 18 11:04:34 test-cluster-001-np6-7c447c7f4-p6n5j containerd[656]: time="2024-04-18T11:04:34.324595711Z" level=info msg="StopPodSandbox for \"cb056e7f2b83ae62bf255b1d711fa5ba6196e2c1abe77924c699ba1dbbac4241\" returns successfully"
Apr 18 11:04:34 test-cluster-001-np6-7c447c7f4-p6n5j containerd[656]: time="2024-04-18T11:04:34.325083016Z" level=info msg="RemovePodSandbox for \"cb056e7f2b83ae62bf255b1d711fa5ba6196e2c1abe77924c699ba1dbbac4241\""
Apr 18 11:04:34 test-cluster-001-np6-7c447c7f4-p6n5j containerd[656]: time="2024-04-18T11:04:34.325118816Z" level=info msg="Forcibly stopping sandbox \"cb056e7f2b83ae62bf255b1d711fa5ba6196e2c1abe77924c699ba1dbbac4241\""
Apr 18 11:04:34 test-cluster-001-np6-7c447c7f4-p6n5j containerd[656]: 2024-04-18 11:04:34.377 [WARNING][8552] k8s.go 540: CNI_CONTAINERID does not match WorkloadEndpoint ConainerID, don't delete WEP. ContainerID="cb056e7f2b83ae62bf255b1d711fa5ba6196e2c1abe77924c699ba1dbbac4241" WorkloadEndpoint=&v3.WorkloadEndpoint{TypeMeta:v1.TypeMeta{Kind:"WorkloadEndpoint", APIVersion:"projectcalico.org/v3"}, ObjectMeta:v1.ObjectMeta{Name:"test--cluster--001--np6--7c447c7f4--p6n5j-k8s-netshoot--06-eth0", GenerateName:"", Namespace:"default", SelfLink:"", UID:"4e0e2d79-2f93-4263-b4d2-633b2e36f4b6", ResourceVersion:"614658", Generation:0, CreationTimestamp:time.Date(2024, time.April, 18, 11, 4, 13, 0, time.Local), DeletionTimestamp:<nil>, DeletionGracePeriodSeconds:(*int64)(nil), Labels:map[string]string{"projectcalico.org/namespace":"default", "projectcalico.org/orchestrator":"k8s", "projectcalico.org/serviceaccount":"default", "run":"netshoot-06"}, Annotations:map[string]string(nil), OwnerReferences:[]v1.OwnerReference(nil), Finalizers:[]string(nil), ZZZ_DeprecatedClusterName:"", ManagedFields:[]v1.ManagedFieldsEntry(nil)}, Spec:v3.WorkloadEndpointSpec{Orchestrator:"k8s", Workload:"", Node:"test-cluster-001-np6-7c447c7f4-p6n5j", ContainerID:"3386597aa676152e3dc47660808f199dbeb7c91c012f349e0ba98421f5a0c040", Pod:"netshoot-06", Endpoint:"eth0", ServiceAccountName:"default", IPNetworks:[]string{"100.126.129.200/32"}, IPNATs:[]v3.IPNAT(nil), IPv4Gateway:"", IPv6Gateway:"", Profiles:[]string{"kns.default", "ksa.default.default"}, InterfaceName:"calic1f9e343a5a", MAC:"", Ports:[]v3.WorkloadEndpointPort(nil), AllowSpoofedSourcePrefixes:[]string(nil)}}
Apr 18 11:04:34 test-cluster-001-np6-7c447c7f4-p6n5j containerd[656]: 2024-04-18 11:04:34.378 [INFO][8552] k8s.go 576: Cleaning up netns ContainerID="cb056e7f2b83ae62bf255b1d711fa5ba6196e2c1abe77924c699ba1dbbac4241"
Apr 18 11:04:34 test-cluster-001-np6-7c447c7f4-p6n5j containerd[656]: 2024-04-18 11:04:34.378 [INFO][8552] dataplane_linux.go 520: CleanUpNamespace called with no netns name, ignoring. ContainerID="cb056e7f2b83ae62bf255b1d711fa5ba6196e2c1abe77924c699ba1dbbac4241" iface="eth0" netns=""
Apr 18 11:04:34 test-cluster-001-np6-7c447c7f4-p6n5j containerd[656]: 2024-04-18 11:04:34.378 [INFO][8552] k8s.go 583: Releasing IP address(es) ContainerID="cb056e7f2b83ae62bf255b1d711fa5ba6196e2c1abe77924c699ba1dbbac4241"
Apr 18 11:04:34 test-cluster-001-np6-7c447c7f4-p6n5j containerd[656]: 2024-04-18 11:04:34.378 [INFO][8552] utils.go 196: Calico CNI releasing IP address ContainerID="cb056e7f2b83ae62bf255b1d711fa5ba6196e2c1abe77924c699ba1dbbac4241"
Apr 18 11:04:34 test-cluster-001-np6-7c447c7f4-p6n5j containerd[656]: 2024-04-18 11:04:34.397 [INFO][8562] ipam_plugin.go 416: Releasing address using handleID ContainerID="cb056e7f2b83ae62bf255b1d711fa5ba6196e2c1abe77924c699ba1dbbac4241" HandleID="k8s-pod-network.cb056e7f2b83ae62bf255b1d711fa5ba6196e2c1abe77924c699ba1dbbac4241" Workload="test--cluster--001--np6--7c447c7f4--p6n5j-k8s-netshoot--06-eth0"
Apr 18 11:04:34 test-cluster-001-np6-7c447c7f4-p6n5j containerd[656]: time="2024-04-18T11:04:34Z" level=info msg="About to acquire host-wide IPAM lock." source="ipam_plugin.go:357"
Apr 18 11:04:34 test-cluster-001-np6-7c447c7f4-p6n5j containerd[656]: time="2024-04-18T11:04:34Z" level=info msg="Acquired host-wide IPAM lock." source="ipam_plugin.go:372"
Apr 18 11:04:34 test-cluster-001-np6-7c447c7f4-p6n5j containerd[656]: 2024-04-18 11:04:34.403 [WARNING][8562] ipam_plugin.go 433: Asked to release address but it doesn't exist. Ignoring ContainerID="cb056e7f2b83ae62bf255b1d711fa5ba6196e2c1abe77924c699ba1dbbac4241" HandleID="k8s-pod-network.cb056e7f2b83ae62bf255b1d711fa5ba6196e2c1abe77924c699ba1dbbac4241" Workload="test--cluster--001--np6--7c447c7f4--p6n5j-k8s-netshoot--06-eth0"
Apr 18 11:04:34 test-cluster-001-np6-7c447c7f4-p6n5j containerd[656]: 2024-04-18 11:04:34.403 [INFO][8562] ipam_plugin.go 444: Releasing address using workloadID ContainerID="cb056e7f2b83ae62bf255b1d711fa5ba6196e2c1abe77924c699ba1dbbac4241" HandleID="k8s-pod-network.cb056e7f2b83ae62bf255b1d711fa5ba6196e2c1abe77924c699ba1dbbac4241" Workload="test--cluster--001--np6--7c447c7f4--p6n5j-k8s-netshoot--06-eth0"
Apr 18 11:04:34 test-cluster-001-np6-7c447c7f4-p6n5j containerd[656]: time="2024-04-18T11:04:34Z" level=info msg="Released host-wide IPAM lock." source="ipam_plugin.go:378"
Apr 18 11:04:34 test-cluster-001-np6-7c447c7f4-p6n5j containerd[656]: 2024-04-18 11:04:34.405 [INFO][8552] k8s.go 589: Teardown processing complete. ContainerID="cb056e7f2b83ae62bf255b1d711fa5ba6196e2c1abe77924c699ba1dbbac4241"
```

One warning we saw is `CNI_CONTAINERID does not match WorkloadEndpoint ConainerID, don't delete WEP. `, does that mean something is wrong? But this behavior happens when we could reproduce the delay and we couldn't reproduce the delay.

**Comment by fasaxc** [comment]
>Could not generate persistent MAC address for calico_tmp_A: No such file or directory

That may be because that device was created an then immediately renamed to something else as part of Calico's normal processing.

I think the other logs aren't problems.  In k8s, the "workload endpoint" is backed by the Pod, so it's normal for it to "already exist".

> One warning we saw is CNI_CONTAINERID does not match WorkloadEndpoint ConainerID, don't delete WEP. , does that mean something is wrong? 

Kubelet can be trying to create a pod and delete a pod with the same name at the same time, we use the container ID to disambiguate the parallel requests since Calico (for historic reasons) uses the name of the pod instead of the container ID in its datamodel.  So yes, there is a race, but we handle the race correctly AFAIK.  Please file a new issue if you see any actual problems; the log is saying "yep, handling the expected race".

**Comment by superleo** [comment]
> Yeah removing that invalid udev rule solves the issue.
> 
> But we also observe this error inside `systemd-udevd` when the VM boot up
> 
> ```
> Apr 17 22:34:57 wl-calico-md-0-fxxkr-bc86f696cxbfhsn-799w4 systemd-udevd[1903]: Could not generate persistent MAC address for calico_tmp_B: No such file or directory
> Apr 17 22:34:57 wl-calico-md-0-fxxkr-bc86f696cxbfhsn-799w4 systemd-udevd[1904]: link_config: autonegotiation is unset or enabled, the speed and duplex are not writable.
> Apr 17 22:34:57 wl-calico-md-0-fxxkr-bc86f696cxbfhsn-799w4 systemd-udevd[1904]: Could not generate persistent MAC address for calico_tmp_A: No such file or directory
> ```
> 
> According to [here](https://github.com/systemd/systemd/issues/3374#issuecomment-223753264), persistent MAC can't be set virtual devices since they don't have `ID_NET_NAME_` systemd netword probably shouldn't set that MAC since it's calico it's managing it
> 
> But does it impact ARP proxy case?

hello, could advice which udev rule has impact of calico? we hit the same problem.
