### ISSUE TITLE
enable ipsec, packet capture using tcpdump does not encrypt packets

### ISSUE THREAD

**Issue by Charlottell** [projectcalico/calico#6231]
i deploy caicovpp and enable ipsec, i use tcpdump to capture packet, but traffic is not encrypted

## Expected Behavior

enable ipsec, packets captured using tcpdump can be encrypted

The following output is faked by me,I think this is what I should expect when I use tcpdump

```
tcpdump -n -i  eth0 esp

10:47:08.184082 IP 172.16.180.45 > 172.16.137.117,ESP(spi=0x000000003,seq=0x1a2),length 72
```

## Current Behavior

enable ipsec, no encrypted packet was caught using tcpdump

## Context

deply caicovpp and enable ipsec
```
root@master1:~# kubectl get pod -A | grep calico
calico-vpp-dataplane   calico-vpp-node-fwr6z                     2/2     Running   2          53m
calico-vpp-dataplane   calico-vpp-node-n4wnx                     2/2     Running   2          53m
calico-vpp-dataplane   calico-vpp-node-pkmg9                     2/2     Running   0          53m
calico-vpp-dataplane   calico-vpp-node-vk52v                     2/2     Running   3          53m
kube-system            calico-kube-controllers-b79f47d67-qtfr9   1/1     Running   49         18h
kube-system            calico-node-c6874                         1/1     Running   0          19h
kube-system            calico-node-f95tn                         1/1     Running   2          19h
kube-system            calico-node-nq86h                         1/1     Running   0          18h
kube-system            calico-node-wkzg2                         1/1     Running   1          19h
```

use calivppctl to verify that the traffic is encrypted
```
root@master1:~# calivppctl vppctl master1
    _______    _        _   _____  ___
 __/ __/ _ \  (_)__    | | / / _ \/ _ \
 _/ _// // / / / _ \   | |/ / ___/ ___/
 /_/ /____(_)_/\___/   |___/_/  /_/

vpp# show ikev2 profile
profile pr_192_168_122_241_to_192_168_122_244
  auth-method shared-key-mic auth data n5obcyWp+3jtuELvW9/air/Uc+hn69X/a9As3ArXrD33NF7t
  local id-type ip4-addr data 192.168.122.241
  remote id-type ip4-addr data 192.168.122.244
  protected tunnel ipip0
  lifetime 0 jitter 0 handover 0 maxdata 0
profile pr_192_168_122_241_to_192_168_122_242
  auth-method shared-key-mic auth data n5obcyWp+3jtuELvW9/air/Uc+hn69X/a9As3ArXrD33NF7t
  local id-type ip4-addr data 192.168.122.241
  remote id-type ip4-addr data 192.168.122.242
  protected tunnel ipip1
  lifetime 0 jitter 0 handover 0 maxdata 0
profile pr_192_168_122_241_to_192_168_122_243
  auth-method shared-key-mic auth data n5obcyWp+3jtuELvW9/air/Uc+hn69X/a9As3ArXrD33NF7t
  local id-type ip4-addr data 192.168.122.241
  remote id-type ip4-addr data 192.168.122.243
  protected tunnel ipip2
  lifetime 0 jitter 0 handover 0 maxdata 0
vpp# show ipsec sa
[0] sa 2147483648 (0x80000000) spi 4283296472 (0xff4dead8) protocol:esp flags:[esn anti-replay aead ctr ]
[1] sa 3221225472 (0xc0000000) spi 105912626 (0x06501932) protocol:esp flags:[esn anti-replay inbound aead ctr ]
[2] sa 2147487744 (0x80001000) spi 1672052681 (0x63a97fc9) protocol:esp flags:[esn anti-replay aead ctr ]
[3] sa 3221229568 (0xc0001000) spi 1871413043 (0x6f8b7f33) protocol:esp flags:[esn anti-replay inbound aead ctr ]
[4] sa 2147491840 (0x80002000) spi 4174256640 (0xf8ce1a00) protocol:esp flags:[esn anti-replay aead ctr ]
[5] sa 3221233664 (0xc0002000) spi 1403210011 (0x53a3491b) protocol:esp flags:[esn anti-replay inbound aead ctr ]
vpp# show interface
              Name               Idx    State  MTU (L3/IP4/IP6/MPLS)     Counter          Count
host-ens3                         1      up          1500/0/0/0     rx packets               1378307
                                                                    rx bytes               349843615
                                                                    tx packets               1491809
                                                                    tx bytes               449036748
                                                                    drops                      19635
                                                                    punt                           3
                                                                    ip4                      1368378
                                                                    ip6                           93
ipip0                             11     up          9000/0/0/0     rx packets                     1
                                                                    rx bytes                     104
                                                                    tx packets                     1
                                                                    tx bytes                     124
                                                                    ip4                            1
ipip1                             12     up          9000/0/0/0     rx packets                  1994
                                                                    rx bytes                  245384
                                                                    tx packets                  1704
                                                                    tx bytes                  241500
                                                                    drops                        292
                                                                    ip4                         1994
ipip2                             13     up          9000/0/0/0     rx packets                 26839
                                                                    rx bytes                 2887208
                                                                    tx packets                 65170
                                                                    tx bytes                74593336
                                                                    ip4                        26839
local0                            0     down          0/0/0/0       drops                          2
loop0                             3     down         9000/0/0/0
loop1                             5     down         9000/0/0/0
loop2                             7     down         9000/0/0/0
loop3                             9     down         9000/0/0/0
loop4                             14    down         9000/0/0/0
loop5                             15    down         9000/0/0/0
loop6                             16    down         9000/0/0/0
loop7                             17    down         9000/0/0/0
tap0                              2      up          9216/0/0/0     rx packets               1382143
                                                                    rx bytes               438682826
                                                                    tx packets               1361309
                                                                    tx bytes               338459936
                                                                    drops                       6573
                                                                    ip4                      1378826
                                                                    ip6                            9
tun1                              4      up          9216/0/0/0     rx packets                   380
                                                                    rx bytes                   28900
                                                                    tx packets                   376
                                                                    tx bytes                   92581
                                                                    ip4                          380
tun2                              6      up          9216/0/0/0
tun3                              8      up          9216/0/0/0
tun4                              10     up          9216/0/0/0
```

use tcpdump to verify that the traffic is encrypted

```
root@master2:~# ping 172.16.137.117
PING 172.16.137.117 (172.16.137.117) 56(84) bytes of data.
64 bytes from 172.16.137.117: icmp_seq=1 ttl=63 time=0.559 ms
64 bytes from 172.16.137.117: icmp_seq=2 ttl=63 time=0.596 ms
64 bytes from 172.16.137.117: icmp_seq=3 ttl=63 time=0.805 ms
64 bytes from 172.16.137.117: icmp_seq=4 ttl=63 time=0.406 ms
64 bytes from 172.16.137.117: icmp_seq=5 ttl=63 time=0.549 ms
64 bytes from 172.16.137.117: icmp_seq=6 ttl=63 time=0.501 ms
64 bytes from 172.16.137.117: icmp_seq=7 ttl=63 time=0.550 ms
64 bytes from 172.16.137.117: icmp_seq=8 ttl=63 time=0.550 ms
64 bytes from 172.16.137.117: icmp_seq=9 ttl=63 time=0.471 ms
64 bytes from 172.16.137.117: icmp_seq=10 ttl=63 time=0.493 ms
64 bytes from 172.16.137.117: icmp_seq=11 ttl=63 time=0.419 ms
64 bytes from 172.16.137.117: icmp_seq=12 ttl=63 time=0.395 ms
64 bytes from 172.16.137.117: icmp_seq=13 ttl=63 time=0.627 ms
64 bytes from 172.16.137.117: icmp_seq=14 ttl=63 time=0.499 ms
64 bytes from 172.16.137.117: icmp_seq=15 ttl=63 time=0.628 ms
64 bytes from 172.16.137.117: icmp_seq=16 ttl=63 time=0.777 ms
64 bytes from 172.16.137.117: icmp_seq=17 ttl=63 time=0.710 ms
64 bytes from 172.16.137.117: icmp_seq=18 ttl=63 time=0.568 ms
64 bytes from 172.16.137.117: icmp_seq=19 ttl=63 time=0.412 ms
64 bytes from 172.16.137.117: icmp_seq=20 ttl=63 time=0.362 ms
64 bytes from 172.16.137.117: icmp_seq=21 ttl=63 time=0.588 ms
```
use nsenter to attach to the pod’s network namespace and use the host’s tcpdump on the container’s interface

```
root@master1:~# kubectl get pod -owide
NAME      READY   STATUS    RESTARTS   AGE   IP               IPV6     NODE      NOMINATED NODE   READINESS GATES
nginx-1   1/1     Running   0          33s   172.16.137.117   <none>   master1   <none>           <none>
root@master1:~# docker ps | grep nginx
7ac22c9f3d8c        168e7b2f83bb                                                                      "nginx -g 'daemon of…"   41 seconds ago      Up 41 seconds                           k8s_nginx-1_nginx-1_default_03a63ec9-b590-419a-914a-f7bc2a9593c4_0
db5989a1f474        registry-jinan-lab.inspurcloud.cn/library/cke/kubernetes/pause:3.1                "/pause"                 43 seconds ago      Up 42 seconds                           k8s_POD_nginx-1_default_03a63ec9-b590-419a-914a-f7bc2a9593c4_0
ee63f864eb8c        c60945441fdc                                                                      "/kube-apiserver-hea…"   4 days ago          Up 4 days                               k8s_kube-apiserver-healthcheck_nginx-proxy-master1_kube-system_3266558db3908d359a01ae20c903dfcc_5
78682aec3c47        c070ea46c3d1                                                                      "nginx -g 'daemon of…"   4 days ago          Up 4 days                               k8s_nginx-proxy_nginx-proxy-master1_kube-system_3266558db3908d359a01ae20c903dfcc_5
c18632cf2490        registry-jinan-lab.inspurcloud.cn/library/cke/kubernetes/pause:3.1                "/pause"                 4 days ago          Up 4 days                               k8s_POD_nginx-proxy-master1_kube-system_3266558db3908d359a01ae20c903dfcc_4
root@master1:~# docker inspect 7ac22c9f3d8c | grep Pid
            "Pid": 1741101,
            "PidMode": "",
            "PidsLimit": null,

root@master1:~# nsenter -n -t 1741101
root@master1:~# ip a
1: lo: <LOOPBACK,UP,LOWER_UP> mtu 65536 qdisc noqueue state UNKNOWN group default qlen 1000
    link/loopback 00:00:00:00:00:00 brd 00:00:00:00:00:00
    inet 127.0.0.1/8 scope host lo
       valid_lft forever preferred_lft forever
2: eth0: <POINTOPOINT,MULTICAST,NOARP,UP,LOWER_UP> mtu 1480 qdisc mq state UNKNOWN group default qlen 500
    link/none
    inet 172.16.137.117/32 scope global eth0
       valid_lft forever preferred_lft forever
```

Use tcpdump to capture packets,  Esp was first filtered, but there was no output.

```
root@master1:~# tcpdump -n -i eth0 esp
tcpdump: verbose output suppressed, use -v or -vv for full protocol decode
listening on eth0, link-type RAW (Raw IP), capture size 262144 bytes
^X^Z
[1]+  Stopped                 tcpdump -n -i eth0 esp
root@master1:~# tcpdump -n -i eth0
tcpdump: verbose output suppressed, use -v or -vv for full protocol decode
listening on eth0, link-type RAW (Raw IP), capture size 262144 bytes
10:41:34.008022 IP 192.168.122.242 > 172.16.137.117: ICMP echo request, id 46497, seq 80, length 64
10:41:34.008056 IP 172.16.137.117 > 192.168.122.242: ICMP echo reply, id 46497, seq 80, length 64
10:41:35.032140 IP 192.168.122.242 > 172.16.137.117: ICMP echo request, id 46497, seq 81, length 64
10:41:35.032168 IP 172.16.137.117 > 192.168.122.242: ICMP echo reply, id 46497, seq 81, length 64
10:41:36.056086 IP 192.168.122.242 > 172.16.137.117: ICMP echo request, id 46497, seq 82, length 64
10:41:36.056132 IP 172.16.137.117 > 192.168.122.242: ICMP echo reply, id 46497, seq 82, length 64
10:41:37.080087 IP 192.168.122.242 > 172.16.137.117: ICMP echo request, id 46497, seq 83, length 64
10:41:37.080117 IP 172.16.137.117 > 192.168.122.242: ICMP echo reply, id 46497, seq 83, length 64
10:41:38.104072 IP 192.168.122.242 > 172.16.137.117: ICMP echo request, id 46497, seq 84, length 64
10:41:38.104103 IP 172.16.137.117 > 192.168.122.242: ICMP echo reply, id 46497, seq 84, length 64
^C
10 packets captured
10 packets received by filter
0 packets dropped by kernel
```

I think esp encryption can be seen using tcpdump packet capture, but that doesn't seem to be the case
I don't know why, please give me some suggestions, thank you in advance 

## Your Environment

* Calico version  3.21
* Orchestrator version (e.g. kubernetes, mesos, rkt):  v1.20.13-30
* Operating System and version:Linux master1 5.4.187-0504187-generic #202203230944 SMP Wed Mar 23 09:58:21 UTC 2022 x86_64 x86_64 x86_64 GNU/Linux
* Link to your project (optional):

**Comment by coutinhop** [comment]
Hi @Charlottell, I'm not 100% sure as I lack some context on VPP and IPSec, but it looks to me as if it's possible that you are capturing the traffic with tcpdump before it is encrypted? Could you try a tcpdump outside the pod namespace?

@AloysAugustin @sknat maybe you folks could take a look at this?

**Comment by AloysAugustin** [comment]
Hi @Charlottell , thank you for the detailed report, unfortunately the doc you followed is not entirely up to date (I made a note to update it). We changed the network model for the `af-packet` driver that you are using, and now the original host interface (`ens3` here) is parked in a separate netns so it will be harder to use tcpdump to capture packets on it.

What you can do to verify encryption is to collect a vpp trace while a ping is running between two containers as described here: https://projectcalico.docs.tigera.io/maintenance/troubleshoot/vpp#tracing-packets . Follow the "Traffic from the phy" section, in your case the node name to use is `af-packet-input`.
If IPsec is properly enabled, you should see the icmp echo / reply packets going through the esp-encrypt / esp-decrypt nodes before being forwarded. Let us know if you run into any issues while doing that.

You might also be able to capture traffic on the physical network if you have access to the switch or router the servers are connected to, you should be able to see the esp packets there as well.
