### ISSUE TITLE
Allow configuration of source address for host->pod traffic

### ISSUE THREAD

**Issue by HaveFun83** [projectcalico/calico#2271]
We use calico as Kubernetes CNI  within our Leaf and Spine Layer 3 only setup.
The Calico ippools are configured without NAT or IPIPMode.
The hosts have multiple interface and use a loopback interface for the nodeip / bgp peering

```
eno1 "10.6.16.13 "> cooper mgt
loe0  "10.6.251.5" > loopback
enp65s0f0 > leaf1
enp65s0f1 > leaf2
```

Per default all cali interfaces use the wrong host interface eno1 as src ip address
```
ip r get 10.6.244.103
10.6.244.103 dev calif2badd712b3 src 10.6.16.13 
    cache
```
instead it should look like
```
ip r get 10.6.244.103
10.6.244.103 dev calif2badd712b3 src 10.6.251.5
    cache
```

## Expected Behavior

All cali interfaces should use the configured nodeip as src address
## Current Behavior

All cali interfaces use eno1 as src ip address
## Possible Solution

manual route change fix this behaviour ex:
`ip route change 10.6.244.103 dev calif2badd712b3 scope link  src 10.6.251.5`
To get this persistent. 
There must be a felix config value which add the correct src statement during cali interface creation on the host nodes.

## Context

We want to separate the mgt traffic from the prod k8s traffic via pbr policies. 
As the cali interfaces use the mgt interface ip as source the k8s traffic gets also affected from the pbr rules. Which leads to failed liveness and readiness probes within the local pods. 
Example. The kubernetes-dashboard has a probe on port 8443 but the cali interface from this pod use the wrong src ip / interface for the probe connection.
```
10:24:47.007577 IP 10.6.16.13.43536 > 10.6.244.103.8443: Flags [S], seq 1135817324, win 29200, options [mss 1460,sackOK,TS val 4200266556 ecr 0,nop,wscale 7], length 0
10:24:47.007763 IP 10.6.16.13.43536 > 10.6.244.103.8443: Flags [S], seq 1135817324, win 29200, options [mss 1460,sackOK,TS val 4200266556 ecr 0,nop,wscale 7], length 0
10:24:48.008735 IP 10.6.16.13.43536 > 10.6.244.103.8443: Flags [S], seq 1135817324, win 29200, options [mss 1460,sackOK,TS val 4200267558 ecr 0,nop,wscale 7], length 0
10:24:48.008938 IP 10.6.16.13.43536 > 10.6.244.103.8443: Flags [S], seq 1135817324, win 29200, options [mss 1460,sackOK,TS val 4200267558 ecr 0,nop,wscale 7], length 0
```
When i change the src address to the loopback interface everything is working.
Many thanks in advanced for your help.

## Your Environment

* Calico version 3.3
* Orchestrator version (e.g. kubernetes, mesos, rkt): K8s
* Operating System and version: Debian
* Link to your project (optional):

**Comment by caseydavenport** [comment]
Hm, I don't think Calico sets the `src` attribute on the routes it programs. This code seems to confirm that: https://github.com/projectcalico/felix/blob/e0ce0bca201da59671dd166e80a9c96f2bca6201/routetable/route_table.go#L465-L471

So, it looks like the source that is showing up in your `ip r get` is the source chosen by linux for that route.

Need to think about the options here a bit more, but I suspect it may be solvable with configuration changes on the host to make it select the desired source address.

**Comment by HaveFun83** [comment]
i tried to solve this via a pbr rule which set the loopback ip as default route for the pod network. 
But then i see only arp requests from the pod:
```
10:33:51.880733 ARP, Request who-has 169.254.1.1 tell 10.6.244.103, length 28
10:33:52.904733 ARP, Request who-has 169.254.1.1 tell 10.6.244.103, length 28
10:34:00.482752 ARP, Request who-has 169.254.1.1 tell 10.6.244.103, length 28
10:34:01.512731 ARP, Request who-has 169.254.1.1 tell 10.6.244.103, length 28
```
I also tried the the proxy_arp flag for the loopback interface but i got the same result an saw only arp request in the tcpdump.
Any kind of help is highly appreciated

**Comment by maxstr** [comment]
I faced(am facing) this same issue and ended up modifying felix to accept a parameter to use for the device route source address. (This can't do anything about the route the CNI plugin sets up, but for us the time between the route existing and the source update occurring is small enough that it is okay for us). A smarter solution may be to try and get the source address for a default route and use that one or add a flag for using the BGP address, but I'm wondering if there are any thoughts from the Calico side. Otherwise I'd like to submit the PRs that include our changes for this.

**Comment by caseydavenport** [comment]
Added here: https://github.com/projectcalico/calico/pull/2779

**Comment by HaveFun83** [comment]
Thanks a lot for the fix @maxstr
