### ISSUE TITLE
Felix removing route to non-cluster host

### ISSUE THREAD

**Issue by Cynerva** [projectcalico/calico#4697]
## Expected Behavior
Non-cluster Calico hosts should be able to reach workloads on in-cluster Calico hosts. Felix should not remove the route to the non-cluster host that's needed for this to work.

## Current Behavior
I have two Calico nodes, both of which have an ipv4VXLANTunnelAddr:

```
$ calicoctl get node -o yaml
apiVersion: projectcalico.org/v3
items:
- apiVersion: projectcalico.org/v3
  kind: Node
  metadata:
    creationTimestamp: "2021-06-23T19:56:03Z"
    name: juju-7b65e4-3
    resourceVersion: "584"
    uid: 467e2681-8902-44c9-897c-68258e257727
  spec:
    bgp:
      ipv4Address: 10.246.154.149/24
    ipv4VXLANTunnelAddr: 192.168.201.0
  status: {}
- apiVersion: projectcalico.org/v3
  kind: Node
  metadata:
    creationTimestamp: "2021-06-23T19:55:42Z"
    name: juju-7b65e4-4
    resourceVersion: "1181"
    uid: f9113ad2-5fd6-4d1c-ae45-051a1423cf23
  spec:
    bgp:
      ipv4Address: 10.246.154.207/24
    ipv4VXLANTunnelAddr: 192.168.220.0
  status: {}
kind: NodeList
metadata:
  resourceVersion: "3844"
```

`juju-7b65e4-4` is a Kubernetes node that is capable of running workloads. `juju-7b65e4-3` is a non-cluster host that does not run workloads.

On `juju-7b65e4-3` (non-cluster), everything looks OK, there is a route to the other node across VXLAN:

```
ubuntu@juju-7b65e4-3:~$ ip route
default via 10.246.154.1 dev ens192 proto dhcp src 10.246.154.149 metric 100
10.246.154.0/24 dev ens192 proto kernel scope link src 10.246.154.149
10.246.154.1 dev ens192 proto dhcp scope link src 10.246.154.149 metric 100
192.168.220.0/26 via 192.168.220.0 dev vxlan.calico onlink
```

But on `juju-7b65e4-4` (cluster), there is no route back to the non-cluster host:

```
ubuntu@juju-7b65e4-4:~$ ip route
default via 10.246.154.1 dev ens192 proto dhcp src 10.246.154.207 metric 100
10.246.154.0/24 dev ens192 proto kernel scope link src 10.246.154.207
10.246.154.1 dev ens192 proto dhcp scope link src 10.246.154.207 metric 100
192.168.220.1 dev caliee654aa1a2f scope link
192.168.220.2 dev calib639eafa0b2 scope link
192.168.220.3 dev cali2a635247b03 scope link
192.168.220.4 dev calic5e614ce7eb scope link
192.168.220.5 dev cali89614d79c8e scope link
```

From Felix logs on `juju-7b65e4-4` (cluster), it looks like the route was originally created, but later removed:

```
ubuntu@juju-7b65e4-4:~$ cat /var/log/calico/felix/current | grep 192.168.201.0
2021-06-23 19:56:03.911 [INFO][53] felix/int_dataplane.go 1447: Received *proto.RouteUpdate update from calculation graph msg=type:REMOTE_WORKLOAD ip_pool_type:VXLAN dst:"192.168.201.0/26" dst_node_name:"juju-7b65e4-3" dst_node_ip:"10.246.154.149" nat_outgoing:true
2021-06-23 19:56:03.931 [INFO][53] felix/int_dataplane.go 1447: Received *proto.VXLANTunnelEndpointUpdate update from calculation graph msg=node:"juju-7b65e4-3" mac:"66:18:d9:ff:69:6b" ipv4_addr:"192.168.201.0" parent_device_ip:"10.246.154.149"
2021-06-23 19:56:03.932 [INFO][53] felix/int_dataplane.go 1447: Received *proto.RouteUpdate update from calculation graph msg=type:REMOTE_WORKLOAD ip_pool_type:VXLAN dst:"192.168.201.0/26" dst_node_name:"juju-7b65e4-3" dst_node_ip:"10.246.154.149" nat_outgoing:true
2021-06-23 19:56:03.932 [INFO][53] felix/int_dataplane.go 1447: Received *proto.RouteUpdate update from calculation graph msg=type:REMOTE_TUNNEL ip_pool_type:VXLAN dst:"192.168.201.0/32" dst_node_name:"juju-7b65e4-3" dst_node_ip:"10.246.154.149" nat_outgoing:true tunnel_type:<vxlan:true >
2021-06-23 19:57:15.439 [INFO][53] felix/int_dataplane.go 1447: Received *proto.RouteRemove update from calculation graph msg=dst:"192.168.201.0/26"
2021-06-23 19:57:15.469 [INFO][53] felix/conntrack.go 90: Removing conntrack flows ip=192.168.201.0
```

Both Calico nodes appear to be healthy as far as I can tell:

```
ubuntu@juju-7b65e4-4:~$ sudo calicoctl node status
Calico process is running.

IPv4 BGP status
+----------------+-------------------+-------+----------+-------------+
|  PEER ADDRESS  |     PEER TYPE     | STATE |  SINCE   |    INFO     |
+----------------+-------------------+-------+----------+-------------+
| 10.246.154.149 | node-to-node mesh | up    | 19:56:07 | Established |
+----------------+-------------------+-------+----------+-------------+

IPv6 BGP status
No IPv6 peers found.
```

```
ubuntu@juju-7b65e4-3:~$ sudo calicoctl node status
Calico process is running.

IPv4 BGP status
+----------------+-------------------+-------+----------+-------------+
|  PEER ADDRESS  |     PEER TYPE     | STATE |  SINCE   |    INFO     |
+----------------+-------------------+-------+----------+-------------+
| 10.246.154.207 | node-to-node mesh | up    | 19:56:07 | Established |
+----------------+-------------------+-------+----------+-------------+

IPv6 BGP status
No IPv6 peers found.
```

If I restart calico-node on `juju-7b65e4-3` (non-cluster), then the route on `juju-7b65e4-4` (cluster) to 192.168.114.0/26 gets re-added and persists:

```
ubuntu@juju-7b65e4-3:~$ sudo systemctl restart calico-node
```

```
ubuntu@juju-7b65e4-4:~$ ip route
default via 10.246.154.1 dev ens192 proto dhcp src 10.246.154.207 metric 100
10.246.154.0/24 dev ens192 proto kernel scope link src 10.246.154.207
10.246.154.1 dev ens192 proto dhcp scope link src 10.246.154.207 metric 100
192.168.201.0/26 via 192.168.201.0 dev vxlan.calico onlink
192.168.220.1 dev caliee654aa1a2f scope link
192.168.220.2 dev calib639eafa0b2 scope link
192.168.220.3 dev cali2a635247b03 scope link
192.168.220.4 dev calic5e614ce7eb scope link
192.168.220.5 dev cali89614d79c8e scope link
```

How can I find out why Felix is removing the route?

## Steps to Reproduce (for bugs)
I'm not really sure. On both hosts, calico-node is run as a systemd service via containerd.

```
[Unit]
Description=calico node

[Service]
User=root
Environment=ETCD_ENDPOINTS=https://10.246.154.135:2379
# Setting LC_ALL and LANG works around a bug that only occurs on Xenial
# https://bugs.launchpad.net/bugs/1911220
Environment=LC_ALL=C.UTF-8
Environment=LANG=C.UTF-8
PermissionsStartOnly=true
ExecStartPre=-/usr/local/sbin/charm-env --charm calico conctl delete calico-node
ExecStartPre=/bin/mkdir -p /var/run/calico /var/log/calico /var/lib/calico
ExecStart=/usr/local/sbin/charm-env --charm calico conctl run \
  --rm \
  --net-host \
  --privileged \
  --env DATASTORE_TYPE=etcdv3 \
  --env ETCD_ENDPOINTS=https://10.246.154.135:2379 \
  --env ETCD_CA_CERT_FILE=/opt/calicoctl/etcd-ca \
  --env ETCD_CERT_FILE=/opt/calicoctl/etcd-cert \
  --env ETCD_KEY_FILE=/opt/calicoctl/etcd-key \
  --env NODENAME=juju-7b65e4-4 \
  --env IP=10.246.154.207 \
  --env KUBECONFIG=/opt/calicoctl/kubeconfig \
  --env IP6=none \
  --env NO_DEFAULT_POOLS=true \
  --env AS= \
  --env CALICO_LIBNETWORK_ENABLED=true \
  --env CALICO_NETWORKING_BACKEND=bird \
  --env FELIX_DEFAULTENDPOINTTOHOSTACTION=ACCEPT \
  --env FELIX_IGNORELOOSERPF=true \
  --mount /lib/modules:/lib/modules \
  --mount /var/run/calico:/var/run/calico \
  --mount /var/log/calico:/var/log/calico \
  --mount /var/lib/calico:/var/lib/calico \
  --mount /opt/calicoctl:/opt/calicoctl \
  --name calico-node \
  rocks.canonical.com:443/cdk/calico/node:v3.19.1
ExecStop=-/usr/local/sbin/charm-env --charm calico conctl delete calico-node
Restart=always
RestartSec=10

[Install]
WantedBy=multi-user.target
```

## Context
I am trying to update the version of Calico that we support in Charmed Kubernetes, from Calico 3.10.1 to 3.19.1, but this issue is giving me some trouble.

## Your Environment

* Calico version 3.19.1
* Orchestrator version (e.g. kubernetes, mesos, rkt): Kubernetes 1.22.0-alpha.2
* Operating System and version: Ubuntu 20.04

**Comment by song-jiang** [comment]
@Cynerva Thanks for all the details. VXLAN routes are related to how Calico sees IPAM block affinity to the node. One possible scenario is that somehow Calico `kube-controllers` did not recognise IPAM block allocated to non-cluster node and release the affinity. This would trigger a route remove action on Felix. 

Could you try to repo this and get `kube-controllers` logs? It is also helpful to turn log-level to `debug` for Felix and get its' log too.

**Comment by Cynerva** [comment]
Hey, thanks for the info. I've attached the requested logs here: [logs.tar.gz](https://github.com/projectcalico/calico/files/6736557/logs.tar.gz).

What jumps out to me now is these messages from kube-controllers:

```
2021-06-29 21:09:57.704 [INFO][1] ipam.go 251: Cleaning up IPAM resources for deleted node calicoNode="juju-1373b4-3" k8sNode=""
2021-06-29 21:09:57.704 [INFO][1] ipam.go 1410: Releasing all IPs with handle 'vxlan-tunnel-addr-juju-1373b4-3'
...
2021-06-29 21:09:57.748 [INFO][1] ipam.go 251: Cleaning up IPAM resources for deleted node calicoNode="juju-1373b4-4" k8sNode=""
2021-06-29 21:09:57.748 [INFO][1] ipam.go 1410: Releasing all IPs with handle 'vxlan-tunnel-addr-juju-1373b4-4'
```

I'm not sure why it thinks the nodes have been deleted, but I'm guessing that's leading to the RouteRemove in Felix. It might be a problem with my deployment code. I'll investigate further tomorrow and see if I can figure out what's causing this.

**Comment by Cynerva** [comment]
The cleanup happens whenever calico/kube-controllers starts. If I reschedule the calico-kube-controllers pod, then the new instance will clean up IPAM resources again.

The Node controller considers these nodes to be deleted because they do not have k8s node references.

For the in-cluster node, I can fix that by passing CALICO_K8S_NODE_REF to calico/node. But for the non-cluster host, there is no corresponding k8s node so there is no value that can help there.

I removed the Node controller from ENABLED_CONTROLLERS on calico/kube-controllers, and that resolved the issue for me. VXLAN routes are no longer being deleted.

Would it make sense to call out in the [non-cluster host documentation](https://docs.projectcalico.org/archive/v3.19/getting-started/bare-metal/) that the Node controller should be disabled?

**Comment by song-jiang** [comment]
I don't think disabling node-controller is the right solution since it is a critical component of Calico for IPAM management. 

Actually when I looked into this issue again, it was working as expected that an in-cluster host has no VXLAN routes to non-cluster host as non-cluster host is not part of the cluster and has no workload (pod). Hence no IPAM block should be allocated for it. 

Calico provide non-cluster host <-> workload connection. As long as non-cluster host has the route to the workload, it should be OK. Do you see a problem of the connection between non-cluster host and the workloads?

By the way, the BGP status is not relevant here as you are using VXLAN.

**Comment by Cynerva** [comment]
> I don't think disabling node-controller is the right solution since it is a critical component of Calico for IPAM management.

Good to know, thanks.

> Calico provide non-cluster host <-> workload connection. As long as non-cluster host has the route to the workload, it should be OK. Do you see a problem of the connection between non-cluster host and the workloads?

Yes. If I try to reach a workload from the non-cluster host, the connection times out:

```
ubuntu@juju-a965f6-3:~$ curl --connect-timeout 10 http://192.168.149.65
curl: (28) Connection timed out after 10001 milliseconds
```

The non-cluster host has a route to the workload IP over VXLAN:

```
ubuntu@juju-a965f6-3:~$ ip route
default via 10.246.154.1 dev ens192 proto dhcp src 10.246.154.167 metric 100
10.246.154.0/24 dev ens192 proto kernel scope link src 10.246.154.167
10.246.154.1 dev ens192 proto dhcp scope link src 10.246.154.167 metric 100
192.168.149.64/26 via 192.168.149.64 dev vxlan.calico onlink
```

The vxlan.calico interface has an IP of 192.168.98.192 associated with it:
```
ubuntu@juju-a965f6-3:~$ ip addr
...
5: vxlan.calico: <BROADCAST,MULTICAST,UP,LOWER_UP> mtu 1450 qdisc noqueue state UNKNOWN group default
    link/ether 66:79:fc:79:78:71 brd ff:ff:ff:ff:ff:ff
    inet 192.168.98.192/32 scope global vxlan.calico
       valid_lft forever preferred_lft forever
    inet6 fe80::6479:fcff:fe79:7871/64 scope link
       valid_lft forever preferred_lft forever
```

On the in-cluster host that has the workload, I see the packets come in on the vxlan.calico interface, but no replies:

```
ubuntu@juju-a965f6-4:~$ sudo tcpdump -ni vxlan.calico
20:39:32.796482 IP 192.168.98.192.39702 > 192.168.149.65.80: Flags [S], seq 867711655, win 64860, options [mss 1410,sackOK,TS val 204373242 ecr 0,nop,wscale 7], length 0
20:39:33.825021 IP 192.168.98.192.39702 > 192.168.149.65.80: Flags [S], seq 867711655, win 64860, options [mss 1410,sackOK,TS val 204374270 ecr 0,nop,wscale 7], length 0
20:39:35.841082 IP 192.168.98.192.39702 > 192.168.149.65.80: Flags [S], seq 867711655, win 64860, options [mss 1410,sackOK,TS val 204376286 ecr 0,nop,wscale 7], length 0
```

On the cali interface of the workload, I see the requests come in, and replies go out:
```
ubuntu@juju-a965f6-4:~$ sudo tcpdump -ni cali8b56182ddcf
20:39:32.796598 IP 192.168.98.192.39702 > 192.168.149.65.80: Flags [S], seq 867711655, win 64860, options [mss 1410,sackOK,TS val 204373242 ecr 0,nop,wscale 7], length 0
20:39:32.796657 IP 192.168.149.65.80 > 192.168.98.192.39702: Flags [S.], seq 1390633781, ack 867711656, win 64308, options [mss 1410,sackOK,TS val 3416931664 ecr 204373242,nop,wscale 7], length 0
20:39:33.798353 IP 192.168.149.65.80 > 192.168.98.192.39702: Flags [S.], seq 1390633781, ack 867711656, win 64308, options [mss 1410,sackOK,TS val 3416932665 ecr 204373242,nop,wscale 7], length 0
20:39:33.825098 IP 192.168.98.192.39702 > 192.168.149.65.80: Flags [S], seq 867711655, win 64860, options [mss 1410,sackOK,TS val 204374270 ecr 0,nop,wscale 7], length 0
20:39:33.825122 IP 192.168.149.65.80 > 192.168.98.192.39702: Flags [S.], seq 1390633781, ack 867711656, win 64308, options [mss 1410,sackOK,TS val 3416932692 ecr 204373242,nop,wscale 7], length 0
20:39:35.841156 IP 192.168.98.192.39702 > 192.168.149.65.80: Flags [S], seq 867711655, win 64860, options [mss 1410,sackOK,TS val 204376286 ecr 0,nop,wscale 7], length 0
20:39:35.841189 IP 192.168.149.65.80 > 192.168.98.192.39702: Flags [S.], seq 1390633781, ack 867711656, win 64308, options [mss 1410,sackOK,TS val 3416934708 ecr 204373242,nop,wscale 7], length 0
20:39:37.862339 IP 192.168.149.65.80 > 192.168.98.192.39702: Flags [S.], seq 1390633781, ack 867711656, win 64308, options [mss 1410,sackOK,TS val 3416936729 ecr 204373242,nop,wscale 7], length 0
20:39:41.894365 IP 192.168.149.65.80 > 192.168.98.192.39702: Flags [S.], seq 1390633781, ack 867711656, win 64308, options [mss 1410,sackOK,TS val 3416940761 ecr 204373242,nop,wscale 7], length 0
20:39:50.086338 IP 192.168.149.65.80 > 192.168.98.192.39702: Flags [S.], seq 1390633781, ack 867711656, win 64308, options [mss 1410,sackOK,TS val 3416948953 ecr 204373242,nop,wscale 7], length 0
20:40:06.214391 IP 192.168.149.65.80 > 192.168.98.192.39702: Flags [S.], seq 1390633781, ack 867711656, win 64308, options [mss 1410,sackOK,TS val 3416965081 ecr 204373242,nop,wscale 7], length 0
```

But the in-cluster host has no route back to 192.168.98.192 over VXLAN:

```
ubuntu@juju-a965f6-4:~$ ip route
default via 10.246.154.1 dev ens192 proto dhcp src 10.246.154.163 metric 100
10.246.154.0/24 dev ens192 proto kernel scope link src 10.246.154.163
10.246.154.1 dev ens192 proto dhcp scope link src 10.246.154.163 metric 100
192.168.149.64 dev calief9de1c6fe2 scope link
192.168.149.65 dev cali8b56182ddcf scope link
192.168.149.66 dev calif79913a430d scope link
192.168.149.67 dev cali96094cd69af scope link
192.168.149.68 dev cali7d7d85f6112 scope link
192.168.149.70 dev cali9c152906e2b scope link
```

So the replies go out the default route to ens192 instead:

```
ubuntu@juju-a965f6-4:~$ sudo tcpdump -ni ens192 host 192.168.98.192
20:39:32.796671 IP 192.168.149.65.80 > 192.168.98.192.39702: Flags [S.], seq 1390633781, ack 867711656, win 64308, options [mss 1410,sackOK,TS val 3416931664 ecr 204373242,nop,wscale 7], length 0
20:39:33.798408 IP 192.168.149.65.80 > 192.168.98.192.39702: Flags [S.], seq 1390633781, ack 867711656, win 64308, options [mss 1410,sackOK,TS val 3416932665 ecr 204373242,nop,wscale 7], length 0
20:39:33.825132 IP 192.168.149.65.80 > 192.168.98.192.39702: Flags [S.], seq 1390633781, ack 867711656, win 64308, options [mss 1410,sackOK,TS val 3416932692 ecr 204373242,nop,wscale 7], length 0
20:39:35.841202 IP 192.168.149.65.80 > 192.168.98.192.39702: Flags [S.], seq 1390633781, ack 867711656, win 64308, options [mss 1410,sackOK,TS val 3416934708 ecr 204373242,nop,wscale 7], length 0
20:39:37.862378 IP 192.168.149.65.80 > 192.168.98.192.39702: Flags [S.], seq 1390633781, ack 867711656, win 64308, options [mss 1410,sackOK,TS val 3416936729 ecr 204373242,nop,wscale 7], length 0
20:39:41.894452 IP 192.168.149.65.80 > 192.168.98.192.39702: Flags [S.], seq 1390633781, ack 867711656, win 64308, options [mss 1410,sackOK,TS val 3416940761 ecr 204373242,nop,wscale 7], length 0
20:39:50.086406 IP 192.168.149.65.80 > 192.168.98.192.39702: Flags [S.], seq 1390633781, ack 867711656, win 64308, options [mss 1410,sackOK,TS val 3416948953 ecr 204373242,nop,wscale 7], length 0
20:40:06.214499 IP 192.168.149.65.80 > 192.168.98.192.39702: Flags [S.], seq 1390633781, ack 867711656, win 64308, options [mss 1410,sackOK,TS val 3416965081 ecr 204373242,nop,wscale 7], length 0
```

But 192.168.98.192 is not routable on my physical network. It needs to go through the VXLAN tunnel, and a route to vxlan.calico is needed to make that happen, right?

**Comment by Cynerva** [comment]
The problem appears to be specific to VXLAN. If I use no encapsulation, or I use IP-in-IP instead, then the connection works.

**Comment by song-jiang** [comment]
> But the in-cluster host has no route back to 192.168.98.192 over VXLAN:
AFAIU, for non-cluster host, there should not be any VXLAN route to workload at all. Packet will be encapped via VXLAN for in-cluster traffic only. Probably we need to update Calico doc that BGP is the only network backend option which supports non-cluster host. @fasaxc Could you help to see if my understanding is correct?

**Comment by fasaxc** [comment]
Yes, if you're using an overlay (VXLAN in this case) then the intention is that the Calico network is private and traffic:

* From pods to external hosts will be SNATted to the pod's host IP so that the response can return
* From external hosts to the cluster should be handled with NodePorts/LoadBalancers etc.  

You can use your own VXLAN device with a different VNI to connect to an external host and Calico won't remove any routes on that device.  Or, you can use BGP mode and peer with your fabric if you want your pods to be reachable from outside.

**Comment by lwr20** [comment]
Closing due to inactivity. Please re-open if necessary.
