### ISSUE TITLE
Maglev hashing doesnt seem to work as intended

### ISSUE THREAD

**Issue by rohitm-telnyx** [projectcalico/calico#12432]
Our setup and problem:
* We use ebpf as dataplane
* We have our own BGP using TOR which advertises a Public VIP as a K8s Loadbalancer service
* We were running into timeout issues connecting to traefik backed instance with this public VIP
* We think the timeout issue is because of BGP loadbalancing per packet instead of per connection

In order to alleviate this issue we tried the maglev hashing from the main branch,  updated all CRDs and implemented the annotation in our k8s LB service

This however hasnt changed the current behavior and we still seem to get packet based loadbalancing 

## Expected Behavior

* Even though packet based ECMP happens in front of our calico based VIP, maglev should keep flow based load balancing from the pod perspective

## Current Behavior

* We still get our timeout issues and seems maglev flow based hashing is not working as expected
* I have confirmed the implementation based on Calico nat and conntrack dumps and its implemented correctly

```
 kubectl -n calico-system exec calico-node-qd796 -- calico-node -bpf nat dump|grep maglev
Defaulted container "calico-node" out of: calico-node, flexvol-driver (init), ebpf-bootstrap (init), install-cni (init)
64.16.236.2 port 443 proto 6 id 1224 count 3 local 1 flags maglev
64.16.236.2 port 80 proto 6 id 1225 count 3 local 1 flags maglev
10.226.19.92 port 443 proto 6 id 1224 count 3 local 1 flags maglev
10.226.19.92 port 80 proto 6 id 1225 count 3 local 1 flags maglev
```
* Based on the prerequisites we have ` externalTrafficPolicy: Cluster` and also ` bpfExternalServiceMode: DSR`

## Steps to Reproduce (for bugs)

Reproducing this is a bit hard but currently we see the issue in a specific case:

* We have a github webhook which points to the VIP
* We get timeouts on this webhook when we have multiple backend traefik pods (the ingress is defined in traefik)
* These timeouts are intermittent and based on our packet capture it does seem to be because of packet based routing because of ECMP
* We have implemented maglev but nothing has changed and we still get similar timeouts, based on our tcpdumps the behavior is similar to what we had before maglev
* I can attach the dumps if you folks think that can help with better troubleshooting 

## Your Environment

* Calico version:
   ```
   Client Version:    v3.31.4
   Git commit:        6d8c39b0ef01cdf92960e08f704c7198ffe42eac
   Cluster Version:   v3.32.0-0.dev-1092-gc840e32e59eb
   Cluster Type:      typha,kdd,k8s,operator,bgp,kubeadm
   ```
* Calico dataplane (bpf, nftables, iptables, windows etc.)
   bpf
* Orchestrator version (e.g. kubernetes, openshift, etc.):
   Kubernetes
* Operating System and version:
   Ubuntu 24.04 LTS
* Link to your project (optional):

**Comment by aaaaaaaalex** [comment]
Hi, thanks for trying out Maglev! I can try to help investigate this...

Just to understand your network better...
 - So your ToR is a BGP speaker, and is advertising your VIP to the outside world.
 - And it's a Linux machine using ECMP routing to direct external service traffic via Calico nodes, correct?
 - And just to be really explicit, the service address being advertised is a Calico-allocated IP (and we're not connecting via NodePort), with Traefik as the backend endpoints?

Regarding the timeouts:
 - Is it a single connection which works for a time, and then suddenly breaks?
 - Or is it that one connection out of many just never works?
 - What did the tcpdump show, to be exact? Did you notice particular packets getting lost, or arriving in strange places, etc?

More broadly:

 - I'm curious about the per-packet ECMP. Is this something that you've explicitly configured your router to do? The norm with Linux ECMP is that its flow-based if I recall correctly. Are you able to force flow-based ECMP and if so, does the problem go away?
 - Do you have any policies in place?

What role is Traefik serving in your cluster, can you provide any detail about how Traefik is handling traffic and directing it to the workload?

As-goes verifying that all Calico nodes are generating the same hash, it is possible to do with bpf debug logs (enabled via the FelixConfiguration), but it comes with a performance penalty, and the logs should be [filtered](https://docs.tigera.io/calico-cloud/reference/resources/felixconfig#bpfLogFilters) to avoid drowning in logs - ideally they would be filtered down to just the service IP traffic as it's coming in to the host.

**Comment by rohitm-telnyx** [comment]
Thank you so much for the quick reply Alex, let me answer your questions with the info I have:

> - So your ToR is a BGP speaker, and is advertising your VIP to the outside world.

ToR is a switch, not a linux machine, and yes, it receives the prefix/ip from k8s and advertises to the fabric.

> - And it's a Linux machine using ECMP routing to direct external service traffic via Calico nodes, correct?

On border LEAF(switch connected to outside of fabric we see all paths available)

> - And just to be really explicit, the service address being advertised is a Calico-allocated IP (and we're not connecting via NodePort), with Traefik as the backend endpoints?

There is no nodePort its a LB k8s service with an external IP, we also use the setting ` allocateLoadBalancerNodePorts: false`
```
apiVersion: v1
kind: Service
metadata:
  name: traefik
  namespace: traefik
spec:
  externalIPs:
    - <external IP>
```


> - Is it a single connection which works for a time, and then suddenly breaks?
> - Or is it that one connection out of many just never works?
> - What did the tcpdump show, to be exact? Did you notice particular packets getting lost, or arriving in strange places, etc?

- Its one connection out of many which never works, basically a webhook request that fails with a timeout on Github side.
- This is quite random, because when we retry it, it works almost all the time
- Tcpdump doesnt show mismatched packets, it shows however  that some packets are silently dropped, and then the client sends a RST after the timeout period

This is a claude overview of our capture

```
Evidence from the dual captures:
Connections that show both VIP + pod IP on the SAME node (locally handled) — all work:
* .253:58984 on Node 1 (both) → FIN
* .173:23048 on Node 2 (both) → FIN
* .80:47210 on Node 2 (both) → FIN
* .48:30118 on Node 2 (both) → FIN
* .100:54816 on Node 2 (both) → FIN
Connections that show VIP on one node, pod IP on the other (cross-node forwarded):
* .77:25454 — Node 2 VIP → Node 1 pod → retransmissions, RST after 60s
* .78:52994 — Node 1 VIP → Node 2 pod → missing segments
* .253:18306 — Node 2 VIP → Node 1 pod → retransmissions
* .24:64002 — Node 2 VIP → Node 1 pod → retransmissions
* .249:30412 — Node 2 VIP → Node 1 pod → works
* .78:32540 — Node 1 VIP → Node 2 pod → works
```
I can attach the captures as well, with a fresh capture if you want me to


> - I'm curious about the per-packet ECMP. Is this something that you've explicitly configured your router to do? The norm with Linux ECMP is that its flow-based if I recall correctly. Are you able to force flow-based ECMP and if so, does the problem go away?

This was wrong info, sorry about that , we do indeed use flow based ECMP in our switches , we do per-flow 5-tuple, but its not configureable. 
> - Do you have any policies in place?

Nope, none

This is our packet flow 
```
INBOUND (Internet → Host with public IP):
  Internet → EDGE01 (receives 64.16.236.2/32 from fabric via Border LEAF)
           → Border LEAF02 
           → SPINE (ECMP)
           → LEAF15/16/21/22 (K8s nodes advertising /32 via Calico BGP)
           → K8s worker → Traefik pod
  Note: VPP is NOT in the inbound path for hosts with public IPs.
OUTBOUND (Host → Internet, default route, we also have DSR enabled in Calico):
  K8s worker → LEAF (anycast gateway)
            → SPINE → Border LEAF
            → VPP01 (default route, highest local-pref via BGP)
            → NAT44 + TCP MSS clamp
            → EDGE01 → ISP → Internet
  Note: VPP originates the default route to the fabric. All egress traffic
  passes through VPP for NAT44 and MSS clamping.
```

> What role is Traefik serving in your cluster, can you provide any detail about how Traefik is handling traffic and directing it to the workload?

- Traefik is our ingress, so we have an ingress defined and traefik is the backend supporting that, it just forwards to an external service which is in another cluster

>but it comes with a performance penalty, and the logs should be [filtered](https://docs.tigera.io/calico-cloud/reference/resources/felixconfig#bpfLogFilters) to avoid drowning in logs - ideally they would be filtered down to just the service IP traffic as it's coming in to the host.

I can enable this and provide you with the logs, what should I filter in this scenario?

Thanks again for the reply.

**Comment by aaaaaaaalex** [comment]
The BPF log filters should allow you to see BPF prog logs for packets with the service IP. And BTW Claude is usually OK with scanning through logs if that makes it easier :)

If you then grep BPF prog debug-logs for "Maglev", you should be able to see if:

a) maglev is definitely enabled
b) it's picking the same hash and forwarding to the right backend every time

It will also become clearer if the packet is definitely reaching the node where the packet seems to disappear.

Off the top of my head, the felixconfig fields would be something like:
```
    bpfLogLevel: Debug
    bpfLogFilters:
      all: "dst <SERVICE_CLUSTER_IP>"
```
Replacing <SERVICE_CLUSTER_IP> with your service IP being handled.


Some other things worth trying, if its feasible:
 - `calico-node` pod's debug logs to ensure the bpf proxy/syncer package is programming your service correctly (feel free to dump some files into this thread, at your own discretion)
 -  `calico-node` pod can dump bpf counters which might hint if the packets are being dropped for an unexpected reason.


Overall though, something gives me pause, which is that you mentioned the issue happened both with & without Maglev.
I do wonder if there is something else altogether going undetected here. Some more questions so I get a clear picture:

 - Do your nodes definitely all have connectivity to eachother? It's worth pointing out here also then when BPF nodes bounce service traffic to one-another, they use a VXLAN tunnel, in-case something might interfere with VXLAN packets/ports.
 - Are all nodes in the cluster definitely capable of DSR? They should be sending packets back through the TOR even if they were originally forwarded the serviceIP traffic from another calico-node - can we determine if the TOR is seeing a response packet?
 -  Can we rule-out that the packet is not progressing to the next step before its lost, i.e. can we check if Traefik ever sees the packets, or if the workload behind Traefik sees them?

Thx

**Comment by tomastigera** [comment]
> There is no nodePort its a LB k8s service with an external IP, we also use the setting  allocateLoadBalancerNodePorts: false

It effectively creates nodeports on the nodes.

> It's worth pointing out here also then when BPF nodes bounce service traffic to one-another, they use a VXLAN tunnel, in-case something might interfere with VXLAN packets/ports.

note that this is a "custom" vxlan crafted within the ebpf dataplane, it is always there and is not related to any vxlan device you might see within your system.

**Comment by rohitm-telnyx** [comment]
Thanks folks for the info.

While I collect all the logs and tcpdump, can you folks explain to me about the VXLAN device.
>note that this is a "custom" vxlan crafted within the ebpf dataplane, it is always there and is not related to any vxlan device you might see within your system.

Is there any logs I can check to see if the cross connection between nodes is working as expected?

Is it possible to use any of the existing device to peek into this using tcpdump?

**Comment by tomastigera** [comment]
Variables: $CLIENT = external client IP, $VIP = the LB external IP, $SVC_PORT = 443/80, $UPLINK = physical NIC (e.g. eno1), $POD_IFACE = the caliXXXX veth toward the backend pod, $POD_PORT = backend container port.                                      
                                                                                                                                                                                                                                                              
  Node-A (first-hop, chosen by ToR ECMP)                                                                                                                                                                                                                      
                                                                                                                                                                                                                                                              
  1. Client traffic arriving from ToR (pre-BPF on RX)                                                                                                                                                                                                       
  tcpdump -nni $UPLINK -w nodeA-in.pcap "host $CLIENT and tcp port $SVC_PORT"                                                                                                                                                                                 
                                                                                                                                                                                                                                                              
   2. Bounced VXLAN leaving toward node-B (post-BPF on TX)                                                                                                                                                                                                   
  tcpdump -nni $UPLINK -w nodeA-vxlan-tx.pcap "udp port 4789"                                                                                                                                                                                                 
                                                                                                                                                                                                                                                              
  Node-B (backend, runs the traefik pod)                    
                                                                                                                                                                                                                                                              
  3. VXLAN arriving from node-A (pre-BPF on RX)           
  tcpdump -nni $UPLINK -w nodeB-vxlan-rx.pcap "udp port 4789"                                                                                                                                                                                                 
                                                                                                                                                                                                                                                              
  4. Decapsulated + DNAT'd packet delivered to the pod                                                                                                                                                                                                      
  tcpdump -nni $POD_IFACE -w nodeB-pod.pcap "tcp port $POD_PORT"                                                                                                                                                                                              
                                                                                                                                                                                                                                                              
  Filter to the BPF nodeport/DSR VXLAN only (VNI 0xca11c0 = 13242816)                 

 udp[8:4] = flags(1) + vni(3) + reserved(0) = 0x08ca11c0 for a valid VNI=0xca11c0 packet                                                                                                                                                                   
 
tcpdump -nni $UPLINK -w nodeA-vxlan-tx.pcap  'udp port 4789 and udp[8:4] = 0x08ca11c0'                                                                                                                                                                                                                 
                                                                                                                                                      

You can refine the vxlan dumps to the expected nodes IPs

**Comment by tomastigera** [comment]
@rohitm-telnyx any update?

**Comment by rohitm-telnyx** [comment]
Hey team, sorry for the delayed response, the original cluster we were using for this was decommissioned and we set up a new cluster from scratch in a different region

I tried running the tcpdump on the VXLAN using the command Tomas has posted but I get zero vxlan traffic, and any packets being sent to other nodes via VXLAN is dropped.

Is there a setting that I need to enable for this to work?

This is my current Felix config:
```
   apiVersion: projectcalico.org/v3
     kind: FelixConfiguration
     metadata:
       creationTimestamp: "2024-10-16T17:06:13Z"
       generation: 24
       name: default
       resourceVersion: "1189559831"
       uid: cd6bb65f-a1d9-4391-a2bd-a350d2791d4f
     spec:
       bpfConnectTimeLoadBalancing: TCP
       bpfEnabled: true
       bpfEnforceRPF: Loose
       bpfExternalServiceMode: DSR
       bpfHostNetworkedNATWithoutCTLB: Enabled
       bpfLogLevel: ""
       bpfRedirectToPeer: L2Only
       floatingIPs: Disabled
       healthPort: 9099
       logSeverityScreen: Info
       nftablesMode: Enabled
       programClusterRoutes: Disabled
       reportingInterval: 0s
       vxlanPort: 4789
       vxlanVNI: 4096`
```

**Comment by aaaaaaaalex** [comment]
Since you run your own BGP setup, are you certain that nodes can communicate properly with one-another?

> I get zero vxlan traffic, and any packets being sent to other nodes via VXLAN is dropped.

We should find out which side it's dropped on (sender, receiver, or a middlebox?) Could the switch in the middle of the path be causing issues?

It is also worth playing around with your tcpdump filter just to see what you _can_ see. And definitely worth posting here the exact cmd you ran, so we can help a bit more.

**Comment by rohitm-telnyx** [comment]
Thanks for the pointers Alex and Tomas, I followed the tcpdumps Tomas has linked before, specifically for Node B which is the tarefik pods and the nodes they are on


```
  tcpdump -nni enp6s16 -w /tmp/uplink.pcap 'udp port 4789'                                                                                                                                                         
                                                                                                                                                                                                                     
  For scenario 4 (traffic delivered to pod):                                                                                                                                                                         
  tcpdump -nni cali* -w /tmp/pod.pcap 'tcp port 8443'   # zq9hr                                                                                                                                            
  tcpdump -nni cali* -w /tmp/pod.pcap 'tcp port 8443'   # js5js                                                                                                                                            
  tcpdump -nni cali* -w /tmp/pod.pcap 'tcp port 8443'   # v6rk9 
```

The commented Ids are the k8s nodes. One important think which I realized I havent mentioned is that the k8s nodes are proxmox VMs on the hardware nodes which are connected to the switch so, our setup is:

Worker nodes:

- zq9hr - proxmox VM on hardware node HN122
- js5js  - proxmox VM on hardware node HN 120
- v6rk9 - proxmox VM on hardware node HN 123


Some tcpdump lines human readable format from the Node B command that Tomas suggested, we have 3 traefik instances and these are the VMs which have these pods

- **zq9hr**

```
 ⎿  === zq9hr UPLINK (udp port 4789) ===
     11:39:10.299749 IP 10.226.0.110.57052 > 10.226.0.100.4789: VXLAN, flags [I] (0x08), vni 13242816
     IP 10.2.88.20.38516 > 10.226.2.152.18600: Flags [P.], seq 4087586667:4087586737, ack 1288690569, win 502, options [nop,nop,TS val 3977080040 ecr 3122592387], length 70
     11:39:10.374761 IP 10.226.0.110.49510 > 10.226.0.100.4789: VXLAN, flags [I] (0x08), vni 13242816
     IP 10.2.92.24.35278 > 10.226.2.152.18600: Flags [.], ack 1050836264, win 499, options [nop,nop,TS val 140294733 ecr 1088992806], length 0
     11:39:10.444330 IP 10.226.0.119.38862 > 10.226.0.100.4789: VXLAN, flags [I] (0x08), vni 13242816

     === zq9hr POD (tcp port 8443) ===
     11:45:05.639698 IP 10.96.16.58.51610 > 10.228.47.228.8443: Flags [.], ack 3432749231, win 2048, length 0
     11:45:05.639716 IP 10.228.47.228.8443 > 10.96.16.58.51610: Flags [.], ack 1, win 2256, options [nop,nop,TS val 1521865787 ecr 1016471426], length 0
     11:45:19.721801 IP 10.96.16.58.51610 > 10.228.47.228.8443: Flags [P.], seq 1:63, ack 1, win 2048, options [nop,nop,TS val 1016530677 ecr 1521865787], length 62
     11:45:19.721811 IP 10.96.16.58.51610 > 10.228.47.228.8443: Flags [P.], seq 63:102, ack 1, win 2048, options [nop,nop,TS val 1016530677 ecr 1521865787], length 39
     11:45:19.721841 IP 10.228.47.228.8443 > 10.96.16.58.51610: Flags [.], ack 63, win 2256, options [nop,nop,TS val 1521879869 ecr 1016530677], length 0
```
- **js5js**

```
     === js5js UPLINK (udp port 4789) ===
     11:39:13.012802 IP 10.226.0.110.64834 > 10.226.0.97.4789: VXLAN, flags [I] (0x08), vni 13242816
     IP 10.2.88.20.46570 > 10.226.2.152.18600: Flags [.], ack 972896167, win 501, options [nop,nop,TS val 3977082754 ecr 3007665792], length 0
     11:39:14.436387 IP 10.226.0.110.55248 > 10.226.0.97.4789: VXLAN, flags [I] (0x08), vni 13242816
     IP 10.2.88.20.40824 > 10.226.2.152.18600: Flags [P.], seq 693144040:693144094, ack 3793206580, win 501, options [nop,nop,TS val 3977084177 ecr 3007663881], length 54
     11:39:14.478508 IP 10.226.0.110.55248 > 10.226.0.97.4789: VXLAN, flags [I] (0x08), vni 13242816

     === js5js POD (tcp port 8443) ===
     11:45:06.459895 IP 140.82.115.101.37766 > 10.228.46.156.8443: Flags [.], seq 759126590:759127948, ack 2195984853, win 73, options [nop,nop,TS val 756247767 ecr 863865025], length 1358
     11:45:06.459905 IP 140.82.115.101.37766 > 10.228.46.156.8443: Flags [.], seq 1358:2716, ack 1, win 73, options [nop,nop,TS val 756247767 ecr 863865025], length 1358
     11:45:06.459911 IP 140.82.115.101.37766 > 10.228.46.156.8443: Flags [P.], seq 2716:2816, ack 1, win 73, options [nop,nop,TS val 756247767 ecr 863865025], length 100
     11:45:06.459933 IP 10.228.46.156.8443 > 140.82.115.101.37766: Flags [.], ack 1358, win 501, options [nop,nop,TS val 863865070 ecr 756247767,nop,nop,sack 1 {2816:7711}], length 0
     11:45:06.459945 IP 10.228.46.156.8443 > 140.82.115.101.37766: Flags [.], ack 2716, win 501, options [nop,nop,TS val 863865070 ecr 756247767,nop,nop,sack 1 {2816:7711}], length 0
```

- **v6rk9**
```
     === v6rk9 UPLINK (udp port 4789) ===
     11:39:14.567346 IP 10.226.0.119.64844 > 10.226.0.101.4789: VXLAN, flags [I] (0x08), vni 13242816
     IP 10.2.88.20.46564 > 10.226.2.152.18600: Flags [P.], seq 2638679445:2638679520, ack 1004582285, win 501, options [nop,nop,TS val 3977084308 ecr 3551817958], length 75
     11:39:14.567530 IP 10.226.0.119.64844 > 10.226.0.101.4789: VXLAN, flags [I] (0x08), vni 13242816
     IP 10.2.88.20.46564 > 10.226.2.152.18600: Flags [F.], seq 75, ack 1, win 501, options [nop,nop,TS val 3977084308 ecr 3551817958], length 0
     11:39:14.568553 IP 10.226.0.119.51182 > 10.226.0.101.4789: VXLAN, flags [I] (0x08), vni 13242816

     === v6rk9 POD (tcp port 8443) ===
     11:39:32.119505 IP 140.82.115.254.19086 > 10.228.45.158.8443: Flags [S], seq 1767927113, win 65535, options [mss 1436,sackOK,TS val 555814283 ecr 0,nop,wscale 10], length 0
     11:39:32.119531 IP 10.228.45.158.8443 > 140.82.115.254.19086: Flags [S.], seq 14666097, ack 1767927114, win 64768, options [mss 1420,sackOK,TS val 592593231 ecr 555814283,nop,wscale 7], length 0
     11:39:32.163928 IP 140.82.115.254.19086 > 10.228.45.158.8443: Flags [.], ack 1, win 64, options [nop,nop,TS val 555814328 ecr 592593231], length 0
     11:39:32.168295 IP 140.82.115.254.19086 > 10.228.45.158.8443: Flags [.], seq 1:1359, ack 1, win 64, options [nop,nop,TS val 555814332 ecr 592593231], length 1358
     11:39:32.168302 IP 140.82.115.254.19086 > 10.228.45.158.8443: Flags [P.], seq 1359:1512, ack 1, win 64, options [nop,nop,TS val 555814332 ecr 592593231], length 153
```

This is what Claude tells me about the packet capture:

```
                                                                                                                                                                                                                   
  Setup: externalTrafficPolicy: Cluster, bpfExternalServiceMode: DSR, maglev annotation enabled.                                                                                                                     
   
  Captures (5 min each on all 3 Traefik nodes):                                                                                                                                                                      
                                                                                                                                                                                                                   
  Scenario 3 — VXLAN RX on enp6s16 (udp port 4789):                                                                                                                                                                  
                                                                                                                                                                                                                   
  ┌───────┬───────────────┬─────────────────────┬─────────────────────┬─────────────────────┐                                                                                                                        
  │ Node  │ Total packets │ From xlkd9 (worker) │ From tx8lx (worker) │ GitHub inside VXLAN │                                                                                                                      
  ├───────┼───────────────┼─────────────────────┼─────────────────────┼─────────────────────┤                                                                                                                        
  │ zq9hr │ 2674          │ 612                 │ 725                 │ 0                   │                                                                                                                      
  ├───────┼───────────────┼─────────────────────┼─────────────────────┼─────────────────────┤
  │ js5js │ 2168          │ 706                 │ 378                 │ 0                   │                                                                                                                        
  ├───────┼───────────────┼─────────────────────┼─────────────────────┼─────────────────────┤                                                                                                                        
  │ v6rk9 │ 2996          │ 952                 │ 546                 │ 0                   │                                                                                                                        
  └───────┴───────────────┴─────────────────────┴─────────────────────┴─────────────────────┘                                                                                                                        
                                                                                                                                                                                                                   
  All VXLAN traffic is internal ClusterIP service traffic (10.226.2.152:18600). Zero GitHub packets forwarded via VXLAN from worker nodes.                                                                           
   
  Scenario 4 — Pod interface (tcp port 8443):                                                                                                                                                                        
                                                                                                                                                                                                                   
  ┌───────┬─────────────────┬─────────┬────────────┬─────────────────────────────┐                                                                                                                                   
  │ Node  │    Pod iface    │ Packets │ GitHub IPs │      RSTs from GitHub       │                                                                                                                                 
  ├───────┼─────────────────┼─────────┼────────────┼─────────────────────────────┤                                                                                                                                   
  │ zq9hr │ cali590a086b8a0 │ 200     │ 0          │ 0                           │
  ├───────┼─────────────────┼─────────┼────────────┼─────────────────────────────┤                                                                                                                                   
  │ js5js │ cali43bc6cc321a │ 358     │ 6 unique   │ 12 (4 connections x 3 RSTs) │                                                                                                                                   
  ├───────┼─────────────────┼─────────┼────────────┼─────────────────────────────┤                                                                                                                                   
  │ v6rk9 │ cali5ff17e4b028 │ 326     │ 8 unique   │ 15 (5 connections x 3 RSTs) │                                                                                                                                   
  └───────┴─────────────────┴─────────┴────────────┴─────────────────────────────┘                                                                                                                                   
                                                                                                                                                                                                                   
  GitHub traffic that lands on Traefik nodes arrives directly (not via VXLAN) and is DNAT'd locally — DSR works. But GitHub also sends triple RSTs to the pods — these are from connections that initially landed on 
  a worker node (black-holed), GitHub timed out and reset, then ECMP rehashed to a Traefik node where the RST arrives for a connection the pod never saw.
```

[js5js-uplink.pcap.yaml](https://github.com/user-attachments/files/28097084/js5js-uplink.pcap.yaml)
[zq9hr-uplink.pcap.yaml](https://github.com/user-attachments/files/28097085/zq9hr-uplink.pcap.yaml)

[js5js-pod.pcap.yaml](https://github.com/user-attachments/files/28097126/js5js-pod.pcap.yaml)
[v6rk9-pod.pcap.yaml](https://github.com/user-attachments/files/28097127/v6rk9-pod.pcap.yaml)
[v6rk9-uplink.pcap.yaml](https://github.com/user-attachments/files/28097129/v6rk9-uplink.pcap.yaml)
[zq9hr-pod.pcap.yaml](https://github.com/user-attachments/files/28097128/zq9hr-pod.pcap.yaml)


Ive attached the raw pcap files that I have captured as well, Ive changed the extension because for some reason github wasnt allowing me to upload a pcap file.


Once again thanks for your patience and effort to help me with this.

**Comment by aaaaaaaalex** [comment]
Thanks for the pcaps. Couple things...
 - DSR is working on the VXLAN tunnel.
 - The initiator's stream is missing a single segment (~1408 bytes?) as the connection flies through the Traefik veth.
   - This is true for two different flows analysed.
 - The packets which *are* coming in are also presumably reaching further downstream beyond Traefik, because receipt packets are coming back through Traefik, but they get stuck asking for the missing segment.
 - By the time the initiator can retransmit the missing segment, the connection FIN is already sent, and the initiator presumably has cleaned up their connection.
 - The RST is sent presumably because the receiver ACKs on the wrong `seq` number because its missing a segment. The initiator has already closed the connection so it doesn't recognize what the receiver is sending back.

That's my guess at the current state of things.

So we have all but one segment coming into the nodes correctly, bar one.
That segment is not only missing on the pod interface, but also on the VXLAN tunnel, so it's likely going missing further upstream. The next step upstream is where the packet comes into the loadbalancing node and Calico decides to fire it down the tunnel to the right node.

To verify whether or not your workers see the missing segment at all (implying Calico might be dropping it), we'll need to reproduce the issue again, but also tcpdumping the host interface, filtering by the load balancer IP. Ideally tcpdump would be running on both the host interface and the VXLAN and pod devices all at once, so we can see the flow end-to-end.

BTW I looked for signs that the "missing" segment got sent to the wrong node, indicating Calico chose the wrong backend to pass a packet to, but couldn't see anything from the provided pcaps validating that.

**Comment by rohitm-telnyx** [comment]
Thanks for the really good analysis and conclusions. Couple of questions just to clarify next steps:

>running on both the host interface and the VXLAN and pod devices all at once,

- Since this is in cluster mode and all nodes are advertising the IP, I would need to do tcpdump on all the nodes in the cluster right?

- Like you had suggested earlier, I just wanted to confirm that is this related to maglev at all or can also be because of some intricacies in our setup? Asking more so that I can play with and without maglev and get more data on whats not working

**Comment by aaaaaaaalex** [comment]
My best guess would be that this is not related to maglev, since issues had arisen before Maglev was enabled.
That being said, to be certain, we would need to see BPF program logs (can be briefly disruptive to traffic!).
Steps to get them are [here](https://docs.tigera.io/calico/latest/operations/ebpf/troubleshoot-ebpf#ebpf-program-debug-logs), but log filters should first be set up to filter the massive amounts of data.
Something like the following would at least slightly reduce the noise:
```
  spec:
    bpfLogLevel: Debug
    bpfLogFilters:
      all: "tcp and (port <traefik endpoint port> or port <load balancer endpoint port>)"

```

TCPDump is a more lightweight debugging step, though. When we mess with BPF logs and filters, traffic experiences a brief disruption! Also, if the tcpdumps indicate the missing packet is still missing on the main iface, we most-likely won't have to inspect BPF logs at all :)

**Comment by aaaaaaaalex** [comment]
One follow-up I thought of also... A very easy check would be to dump BPF counters on each node.
Counters can tell you if packets are being dropped, say if they are malformed for example.

https://docs.tigera.io/calico/latest/operations/ebpf/troubleshoot-ebpf#check-if-calico-is-dropping-packets

**Comment by rohitm-telnyx** [comment]
Hey Alex,

So I ran the tcpdump end to end as you suggested, however I used the src github IP range `140.82.112.0/20` , as the LB seems to be Dnatted and I dont get any clean output on the pod interface.

Ive set it to our original setup, which is `ExternalTrafficPolicy: Local` we had the same issue with that setup which is why we investigated Maglev hashing

I checked the Calico dropping packets but claude gave me a table indicating that there is no drop

```
  Host Interface (enp6s16) — Ingress Drops

  ┌───────────────────────────────┬───────────────┬───────────────┬───────────────┐
  │          Drop Reason          │ Node1 (zq9hr) │ Node2 (xlkd9) │ Node3 (js5js) │
  ├───────────────────────────────┼───────────────┼───────────────┼───────────────┤
  │ Blackhole route               │ 201,306       │ 5,165,145     │ 207,309       │
  ├───────────────────────────────┼───────────────┼───────────────┼───────────────┤
  │ Unknown source                │ 41            │ 63,517        │ 57            │
  ├───────────────────────────────┼───────────────┼───────────────┼───────────────┤
  │ Fragment of incomplete packet │ 2             │ 919           │ 6             │
  ├───────────────────────────────┼───────────────┼───────────────┼───────────────┤
  │ Dropped by policy             │ 0             │ 0             │ 0             │
  └───────────────────────────────┴───────────────┴───────────────┴───────────────┘
```

Ive attached the captured dumps, if this is not entirely conclusive, I'll set the filters and get back.

I realized the filters dont accept hosts as param so didnt fully do it, but can set your original request and get back with the logs I get if this doesnt work.

Sorry for the delay, and thanks again for the patience and effort.

[node1-zq9hr-host.pcap.json](https://github.com/user-attachments/files/28857513/node1-zq9hr-host.pcap.json)
[node1-zq9hr-pod.pcap.json](https://github.com/user-attachments/files/28857512/node1-zq9hr-pod.pcap.json)
[node2-xlkd9-host.pcap.json](https://github.com/user-attachments/files/28857510/node2-xlkd9-host.pcap.json)
[node2-xlkd9-pod.pcap.json](https://github.com/user-attachments/files/28857515/node2-xlkd9-pod.pcap.json)
[node3-js5js-host.pcap.json](https://github.com/user-attachments/files/28857511/node3-js5js-host.pcap.json)
[node3-js5js-pod.pcap.json](https://github.com/user-attachments/files/28857514/node3-js5js-pod.pcap.json)

**Comment by tomastigera** [comment]
@rohitm-telnyx what do you mean by this?
> I realized the filters dont accept hosts as param

**Comment by rohitm-telnyx** [comment]
Initially when I tried to setup log filters with host IP that is I tried
```
bpfLogFilters:
   all: tcp and dst host 64.16.236.2 and src net 140.82.112.0/20
```
This was not working and I got an error `failed to load BPF log filter program: invalid argument`

But seems its working now without the network range, let me get some Debug logs and update you folks with what I see

**Comment by aaaaaaaalex** [comment]
Thanks @rohitm-telnyx ,

From your second batch of caps:
 - the missing segment issue only arises when a LB node bounces the packet to a backing node, and
 - the missing segment is always present on the LB node prior to bouncing.
 - the missing segment gets retransmitted repeatedly from the LB node, but never arrives.
 - *!!!! the missing packet is always full-sized - 1408bytes, while all delivered, bounced packets are 1358bytes or less.*
   - VXLAN requires ~50bytes of overhead in the packet size to do encap.
   - This caps your actual packet size at 50bytes less than your network's supported packet size (1408-50 = 1358 ).

This leads me to believe that the network is dropping the packets which exceed the maximum packet size.

@tomastigera you might know off-hand what levers we can pull to help with packet size limits, or confirm for certain this is the issue?

**Comment by rohitm-telnyx** [comment]
Hey Alex,

I have also collected the filter logs now as well.
My analysis with claude doesnt say anything about VXLAN, but I'm attaching it here anyway.


I updated the filter to this
`src net 64.16.236.2/32 or dst net 64.16.236.2/32) and tcp and (port 8080 or port 8443 or port 80 or port 443`

Because it was giving me info about other namespaces as well, which I dont need in this scenario.

Let me know if you need more info, thanks for all the help.

[bpf-trace-c-8xlarge-xlkd9-filtered.log](https://github.com/user-attachments/files/29211359/bpf-trace-c-8xlarge-xlkd9-filtered.log)
[bpf-trace-js5js-filtered.log](https://github.com/user-attachments/files/29211358/bpf-trace-js5js-filtered.log)
[bpf-trace-zq9hr-filtered.log](https://github.com/user-attachments/files/29211360/bpf-trace-zq9hr-filtered.log)

**Comment by aaaaaaaalex** [comment]
Thx again @rohitm-telnyx .

The BPF traces report the uplink `enp6s16` as having an MTU of 1472. This leads me to double-down that there's an accounting issue in the MTU settings for this cluster and-or underlay.

Client sends a full segment:
   - TCP payload: 1408 B
   - TCP header (with timestamps):   32 B
   - IP header: 20 B
   - inner IP packet: 1460 B. <- this is the "1408 segment" that goes missing when tunneled to another backing node.

On `enp6s16` Ingress (MTU 1472):  1460 ≤ 1472 , so the packet fits, and continues on its journey.

On bounce, to another backing node, Calico wraps it for the cross-node tunnel (+50 B VXLAN):
    - encapsulated frame = 1510 B

On `enp6s16` Egress (MTU 1472):   1510 > 1472 , so the packet doesn't fit and is dropped.

And the segments that do survive the bounce:
- 1358 B payload
- inner metadata 1410, 
- encapsulated 1460 ≤ 1472 (delivers)

Two levers you can pull to verify if this is the smoking gun (confirmed if either of these fix the issue):
 - Increase your physical network's MTU if it's within your control, to 1550 or higher. This might be a heavy lift, so another option is to tell Calico to lower its MTU so it fits through a smaller pinhole:
 - By patching the `default` Installation's `spec.calicoNetwork.mtu`, and waiting for calico DaemonSet to settle, and then restarting your Traefik pods. Given the log dump shows the NIC MTU as 1472, I would try subtracting 50 (VXLAN overhead) and setting it to `1422`.


For reference, the general guide to setting MTU is available [here](https://docs.tigera.io/calico/latest/networking/configuring/mtu).

**Comment by rohitm-telnyx** [comment]
Hi Alex,

Thanks for the detailed explanation.
Let me try these out and report back to you.

**Comment by rohitm-telnyx** [comment]
Hey Folks,

Its working now!!! ☺️ 
I did the MTU change and havent had one bad request 🥳 

Thank you so much for putting up with such long thread to fix this issue, much appreciated.

**Comment by aaaaaaaalex** [comment]
Good to hear, thanks for using Calico!  🚀
