### ISSUE TITLE
Connection refused on one of the pods (extreme case with 1039 pods on one node)

### ISSUE THREAD

**Issue by RichardSufliarsky** [projectcalico/calico#7579]
We have 1024 instances of the redis on one bare-metal kubernetes node and 2052 services defined that expose these instances to internal and VPN network using metallb loadbalancer. Only one instance is refusing connections and 1023 instances are working OK.
We are using Calico and IPVS.
```
node008 ~]$ kubectl get pod -A -owide|grep node008|wc -l
1039

[node008 ~]$ kubectl get svc -A -owide|grep 'redis-stack-7-.-embeddings'|wc -l
2052
```

## Expected Behavior
We can connect to the redis instance.

## Current Behavior
We are receiving `Connection refused` message.
Restart of calico-node, kube-proxy or redis pod does not help.

## Possible Solution
It seems that it does not work only with first IP address from the allocated IP pools for the pods and all the next IP addresses are working just fine. This IP should not be assigned to any pod maybe.
First IP is `172.18.172.0` in our case:
```
[node008 ~]$ ip r|grep blackhole
blackhole 172.18.172.0/26 proto bird 
blackhole 172.18.172.64/26 proto bird 
blackhole 172.18.172.128/26 proto bird 
blackhole 172.18.172.192/26 proto bird 
blackhole 172.18.173.0/26 proto bird 
blackhole 172.18.173.64/26 proto bird 
blackhole 172.18.173.128/26 proto bird 
blackhole 172.18.173.192/26 proto bird 
blackhole 172.18.174.0/26 proto bird 
blackhole 172.18.174.64/26 proto bird 
blackhole 172.18.174.128/26 proto bird 
blackhole 172.18.174.192/26 proto bird 
blackhole 172.18.175.0/26 proto bird 
blackhole 172.18.175.64/26 proto bird 
blackhole 172.18.175.128/26 proto bird 
blackhole 172.18.175.192/26 proto bird 
blackhole 172.18.176.0/26 proto bird
```

## Context
It is strange that packets don't even reach cali interface for `172.18.172.0` as I am testing it with telnet to a bogus port 1234:
```
[node008 ~]$ ip r|grep '172.18.172.0 '
172.18.172.0 dev cali6b54a8a00c9 scope link

[node008 ~]$ telnet 172.18.172.0 1234
Trying 172.18.172.0...
telnet: connect to address 172.18.172.0: Connection refused

[node008 ~]$ sudo tcpdump -i cali6b54a8a00c9 -A -n -s0
dropped privs to tcpdump
tcpdump: verbose output suppressed, use -v[v]... for full protocol decode
listening on cali6b54a8a00c9, link-type EN10MB (Ethernet), snapshot length 262144 bytes
^C
0 packets captured
0 packets received by filter
0 packets dropped by kernel
```
Packets are delivered for the next IP `172.18.172.1`:
```
[node008 ~]$ ip r|grep '172.18.172.1 '
172.18.172.1 dev cali856237fcd25 scope link

[node008 ~]$ telnet 172.18.172.1 1234
Trying 172.18.172.1...
telnet: connect to address 172.18.172.1: Connection refused

[node008 ~]$ sudo tcpdump -i cali856237fcd25 -A -n -s0
dropped privs to tcpdump
tcpdump: verbose output suppressed, use -v[v]... for full protocol decode
listening on cali856237fcd25, link-type EN10MB (Ethernet), snapshot length 262144 bytes
09:05:33.768123 IP 172.16.2.28.60680 > 172.18.172.1.search-agent: Flags [S], seq 3004506457, win 62720, options [mss 8960,sackOK,TS val 1024756603 ecr 0,nop,wscale 7], length 0
E..<U.@.@..Z..............!Y.........o....#....
=..{........
09:05:33.768159 IP 172.18.172.1.search-agent > 172.16.2.28.60680: Flags [R.], seq 0, ack 3004506458, win 0, length 0
E..(..@.@.4...................!ZP....E..
09:05:39.171182 ARP, Request who-has 172.18.172.1 tell 172.16.2.28, length 28
............................
09:05:39.171188 ARP, Request who-has 169.254.1.1 tell 172.18.172.1, length 28
........r...................
09:05:39.171205 ARP, Reply 169.254.1.1 is-at ee:ee:ee:ee:ee:ee, length 28
..................r.........
09:05:39.171217 ARP, Reply 172.18.172.1 is-at 72:fb:8b:ac:8e:be, length 28
........r...................
^C
6 packets captured
6 packets received by filter
0 packets dropped by kernel
```
## Your Environment
Calico version: 3.25
Kubernetes: 1.24.2
cri-o: 1.24.5
RHEL: 9.1
Kernel: 5.14.0-162.18.1.el9_1.x86_64
Server: 128 cores (2 x AMD EPYC), 1TB RAM

## More details
Functioning IP address `172.18.172.1` is listed in virtual server table only as a destination and you can see that also ports from IP address with issues `172.18.172.0` are  pointing to it:
```
[node008 ~]$ sudo ipvsadm -ln|grep -B1 '172.18.172.1:'
TCP  172.16.2.28:30050 rr
  -> 172.18.172.1:24000           Masq    1      0          0         
--
TCP  172.16.2.28:30904 rr
  -> 172.18.172.1:24000           Masq    1      0          0         
--
TCP  172.16.2.101:24002 rr
  -> 172.18.172.1:24000           Masq    1      0          0         
--
TCP  172.18.172.0:30050 rr
  -> 172.18.172.1:24000           Masq    1      0          0         
--
TCP  172.18.172.0:30904 rr
  -> 172.18.172.1:24000           Masq    1      0          0         
--
TCP  10.0.2.18:30050 rr
  -> 172.18.172.1:24000           Masq    1      0          0         
--
TCP  10.0.2.18:30904 rr
  -> 172.18.172.1:24000           Masq    1      0          0         
--
TCP  10.0.2.65:24002 rr
  -> 172.18.172.1:24000           Masq    1      0          0         
--
TCP  10.107.56.53:24002 rr
  -> 172.18.172.1:24000           Masq    1      0          0         
--
TCP  10.107.165.166:24002 rr
  -> 172.18.172.1:24000           Masq    1      0          0
```
For the `172.18.172.0` IP address there are thousands of records in the table and only these where it is destination are listed below:
```
[node008 ~]$ sudo ipvsadm -ln|grep -B1 '172.18.172.0:'|wc -l
5101

[node008 ~]$ sudo ipvsadm -ln|grep -B1 '172.18.172.0:2'
TCP  172.16.2.28:31191 rr
  -> 172.18.172.0:24256           Masq    1      0          0         
--
TCP  172.16.2.28:31768 rr
  -> 172.18.172.0:24256           Masq    1      0          0         
--
TCP  172.16.2.101:24510 rr
  -> 172.18.172.0:24256           Masq    1      0          0         
--
TCP  172.18.172.0:31191 rr
  -> 172.18.172.0:24256           Masq    1      0          0         
--
TCP  172.18.172.0:31768 rr
  -> 172.18.172.0:24256           Masq    1      0          0         
--
TCP  10.0.2.18:31191 rr
  -> 172.18.172.0:24256           Masq    1      0          0         
--
TCP  10.0.2.18:31768 rr
  -> 172.18.172.0:24256           Masq    1      0          0         
--
TCP  10.0.2.65:24510 rr
  -> 172.18.172.0:24256           Masq    1      0          0         
--
TCP  10.97.202.116:24510 rr
  -> 172.18.172.0:24256           Masq    1      0          0         
--
TCP  10.107.242.69:24510 rr
  -> 172.18.172.0:24256           Masq    1      0          0 
```
Service description:
```
[node008 ~]$ kubectl describe svc -n redis-stack-7-embeddings redis-stack-7-2-embeddings-statefulset-254
Name:                     redis-stack-7-2-embeddings-statefulset-254
Namespace:                redis-stack-7-embeddings
Labels:                   app=redis-service-per-pod
Annotations:              metacontroller.k8s.io/decorator-controller: redis-service-per-pod
                          metacontroller.k8s.io/last-applied-configuration:
                            {"apiVersion":"v1","kind":"Service","metadata":{"annotations":{"metacontroller.k8s.io/decorator-controller":"redis-service-per-pod","metal...
                          metallb.universe.tf/address-pool: default
                          metallb.universe.tf/allow-shared-ip: ip-172.16.2.101
                          metallb.universe.tf/loadBalancerIPs: 172.16.2.101
Selector:                 statefulset.kubernetes.io/pod-name=redis-stack-7-2-embeddings-statefulset-254
Type:                     LoadBalancer
IP Family Policy:         SingleStack
IP Families:              IPv4
IP:                       10.97.202.116
IPs:                      10.97.202.116
LoadBalancer Ingress:     172.16.2.101
Port:                     port-24510  24510/TCP
TargetPort:               24256/TCP
NodePort:                 port-24510  31768/TCP
Endpoints:                172.18.172.0:24256
Session Affinity:         None
External Traffic Policy:  Cluster
Events:                   <none>

[node008 ~]$ kubectl describe svc -n redis-stack-7-embeddings redis-stack-7-2-embeddings-statefulset-254-vpn
Name:                     redis-stack-7-2-embeddings-statefulset-254-vpn
Namespace:                redis-stack-7-embeddings
Labels:                   app=redis-service-per-pod
Annotations:              metacontroller.k8s.io/decorator-controller: redis-service-per-pod
                          metacontroller.k8s.io/last-applied-configuration:
                            {"apiVersion":"v1","kind":"Service","metadata":{"annotations":{"metacontroller.k8s.io/decorator-controller":"redis-service-per-pod","metal...
                          metallb.universe.tf/address-pool: vpn
                          metallb.universe.tf/allow-shared-ip: vpn
                          metallb.universe.tf/loadBalancerIPs: 10.0.2.65
Selector:                 statefulset.kubernetes.io/pod-name=redis-stack-7-2-embeddings-statefulset-254
Type:                     LoadBalancer
IP Family Policy:         SingleStack
IP Families:              IPv4
IP:                       10.107.242.69
IPs:                      10.107.242.69
LoadBalancer Ingress:     10.0.2.65
Port:                     port-24510  24510/TCP
TargetPort:               24256/TCP
NodePort:                 port-24510  31191/TCP
Endpoints:                172.18.172.0:24256
Session Affinity:         None
External Traffic Policy:  Cluster
Events:                   <none>
```

**Comment by Josh-Tigera** [comment]
Can you include the Pod (with NodePort) configuration, as well as IP Pool configuration?

**Comment by RichardSufliarsky** [comment]
Sorry, don't know exactly what is meant by Pod with NodePort config so I include kubectl describe of one of the pods below.
IP pool:
```
apiVersion: operator.tigera.io/v1
kind: Installation
metadata:
  name: default
spec:
  calicoNetwork:
    ipPools:
    - blockSize: 26
      cidr: 172.18.0.0/16
      encapsulation: VXLANCrossSubnet
      natOutgoing: Enabled
      nodeSelector: all()
```
What I found out is that it was happening also when I started 128 pods on one node. I had to overcome it somehow, so I don't have this non responding pod yet. What I did was that I deleted pod that was not working and it got different IP address assigned when recreated and then it worked.

It seems that it happens only if first address that is listed in routes as a blackhole is assigned to the pod. But for the second address it works. Clearly this address is used for something else:
```
ip r|grep blackhole
blackhole 172.18.167.64/26 proto bird 
blackhole 172.18.167.128/26 proto bird 
blackhole 172.18.167.192/26 proto bird

sudo ipvsadm -ln|grep -B1 '172.18.167.64:'|wc -l
1520
sudo ipvsadm -ln|grep -B1 '172.18.167.128:'|wc -l
20
sudo ipvsadm -ln|grep -B1 '172.18.167.192:'|wc -l
20

telnet 172.18.167.128 24000
Trying 172.18.167.128...
Connected to 172.18.167.128.
Escape character is '^]'.
PING
+PONG
QUIT
+OK
Connection closed by foreign host.
```
Services are created as `type: LoadBalancer` and have `allocateLoadBalancerNodePorts: false` set.

```
kubectl describe po -n redis-stack-7-embeddings redis-stack-7-embeddings-statefulset-205
Name:         redis-stack-7-embeddings-statefulset-205
Namespace:    redis-stack-7-embeddings
Priority:     0
Node:         node006.lab.company1.io/172.16.2.26
Start Time:   Mon, 15 May 2023 18:48:35 +0200
Labels:       app=redis-stack-7-embeddings
              controller-revision-hash=redis-stack-7-embeddings-statefulset-559db77677
              statefulset.kubernetes.io/pod-name=redis-stack-7-embeddings-statefulset-205
Annotations:  cni.projectcalico.org/containerID: f4bf90d5869b89d20bf3fd960604132539a63b5cdf8bb268df20e7bc330053ac
              cni.projectcalico.org/podIP: 172.18.167.189/32
              cni.projectcalico.org/podIPs: 172.18.167.189/32
Status:       Running
IP:           172.18.167.189
IPs:
  IP:           172.18.167.189
Controlled By:  StatefulSet/redis-stack-7-embeddings-statefulset
Containers:
  redis-stack-7:
    Container ID:   cri-o://7c86e47a1d2305ad634517749a326ad4e8db304f9ad81d695eddddfa5a671415
    Image:          harbor.lab.company1.io/library/redis-stack-server-7:7.0.6-rc8
    Image ID:       harbor.lab.company1.io/library/redis-stack-server-7@sha256:ede171f278c15eb10213fe2a6d8ee9dca5f2895569bd3a99b337107bbfe7e16f
    Port:           24000/TCP
    Host Port:      0/TCP
    State:          Running
      Started:      Mon, 15 May 2023 18:48:45 +0200
    Ready:          True
    Restart Count:  0
    Limits:
      memory:  90Gi
    Requests:
      memory:  512Mi
    Environment:
      REDIS_START_PORT:  24000
    Mounts:
      /data from data (rw)
      /entrypoint.sh from config (rw,path="entrypoint.sh")
      /redis-stack.conf from config (rw,path="redis-stack.conf")
      /var/run/secrets/kubernetes.io/serviceaccount from kube-api-access-xpp9d (ro)
Conditions:
  Type              Status
  Initialized       True 
  Ready             True 
  ContainersReady   True 
  PodScheduled      True 
Volumes:
  data:
    Type:       PersistentVolumeClaim (a reference to a PersistentVolumeClaim in the same namespace)
    ClaimName:  data-redis-stack-7-embeddings-statefulset-205
    ReadOnly:   false
  config:
    Type:      ConfigMap (a volume populated by a ConfigMap)
    Name:      redis-stack-7-config
    Optional:  false
  kube-api-access-xpp9d:
    Type:                    Projected (a volume that contains injected data from multiple sources)
    TokenExpirationSeconds:  3607
    ConfigMapName:           kube-root-ca.crt
    ConfigMapOptional:       <nil>
    DownwardAPI:             true
QoS Class:                   Burstable
Node-Selectors:              <none>
Tolerations:                 node.kubernetes.io/not-ready:NoExecute op=Exists for 300s
                             node.kubernetes.io/unreachable:NoExecute op=Exists for 300s
                             workload=redis:NoSchedule
Events:                      <none>
```

**Comment by RichardSufliarsky** [comment]
Maybe I should mention that we are using MetalLB as a load balancer and kube-proxy has `mode: ipvs`.

**Comment by RichardSufliarsky** [comment]
Seems that it was caused by combination of MetalLB and kube-proxy in IPVS mode. Not sure. Closing the issue.
