### ISSUE TITLE
Service IP not reachable from host, pod IPs work fine

### ISSUE THREAD

**Issue by dimm0** [projectcalico/calico#2026]
## Expected Behavior
Being able to have nodes in the cluster having different MTU settings and have connectivity between those

## Current Behavior
My k8s nodes all work fine with MTU 9000 (calico MTU set to 8960), but one node is only connected with MTU 1500.

All normal pods on this 1500 node work fine, but ones attached to host networking can’t access service IPs. Accessing other pods balanced by this service IP directly works fine, but `curl service_IP` from host network-attached pod hangs.

`curl -I service_IP` works fine (only get header, less than 1500 bytes). So it’s clearly the MTU setting issue.

## Possible Solution
I tried lowering the tunnel MTU and network adapter MTU up to 1400, with no effect.

Doing tcpdump with curl showed:

On sending side:

```22:23:25.315091 IP 128.171.123.10.44601 > 139.182.103.10.bgp: Flags [P.], seq 19:38, ack 20, win 3, options [nop,nop,TS val 396828137 ecr 494171775], length 19: BGP
22:23:27.235368 IP 128.171.123.10 > 139.182.103.10: IP 10.244.23.31.http > 10.244.72.1.38164: Flags [S.], seq 2145858943, ack 1264262419, win 35792, options [mss 8960,sackOK,TS val 2759876101 ecr 1612975711,nop,wscale 14], length 0 (ipip-proto-4)
22:23:27.286170 IP 128.171.123.10 > 139.182.103.10: IP 10.244.23.31.http > 10.244.72.1.38164: Flags [.], ack 77, win 3, options [nop,nop,TS val 2759876152 ecr 1612975762], length 0 (ipip-proto-4)
22:23:27.596109 IP 128.171.123.10 > 139.182.103.10: IP 10.244.23.31.http > 10.244.72.1.38164: Flags [P.], seq 2817:4097, ack 77, win 3, options [nop,nop,TS val 2759876462 ecr 1612975762], length 1280: HTTP (ipip-proto-4)
22:23:27.596274 IP 128.171.123.10 > 139.182.103.10: IP 10.244.23.31.http > 10.244.72.1.38164: Flags [P.], seq 6913:8193, ack 77, win 3, options [nop,nop,TS val 2759876462 ecr 1612975762], length 1280: HTTP (ipip-proto-4)
22:23:27.596532 IP 128.171.123.10 > 139.182.103.10: IP 10.244.23.31.http > 10.244.72.1.38164: Flags [P.], seq 11009:12289, ack 77, win 3, options [nop,nop,TS val 2759876462 ecr 1612975762], length 1280: HTTP (ipip-proto-4)
^C13844 packets captured
13849 packets received by filter
0 packets dropped by kernel
```

On recieving side:

```12:23:25.290113 IP 128.171.123.10.44601 > 139.182.103.10.bgp: Flags [P.], seq 1831837759:1831837778, ack 3267476823, win 3, options [nop,nop,TS val 396828137 ecr 494171775], length 19: BGP
12:23:27.210193 IP 128.171.123.10 > 139.182.103.10: IP 10.244.23.31.http > 10.244.72.1.38164: Flags [S.], seq 2145858943, ack 1264262419, win 35792, options [mss 8960,sackOK,TS val 2759876101 ecr 1612975711,nop,wscale 14], length 0 (ipip-proto-4)
12:23:27.260973 IP 128.171.123.10 > 139.182.103.10: IP 10.244.23.31.http > 10.244.72.1.38164: Flags [.], ack 77, win 3, options [nop,nop,TS val 2759876152 ecr 1612975762], length 0 (ipip-proto-4)
12:23:27.571105 IP 128.171.123.10 > 139.182.103.10: IP 10.244.23.31.http > 10.244.72.1.38164: Flags [P.], seq 2817:4097, ack 77, win 3, options [nop,nop,TS val 2759876462 ecr 1612975762], length 1280: HTTP (ipip-proto-4)
12:23:27.571296 IP 128.171.123.10 > 139.182.103.10: IP 10.244.23.31.http > 10.244.72.1.38164: Flags [P.], seq 6913:8193, ack 77, win 3, options [nop,nop,TS val 2759876462 ecr 1612975762], length 1280: HTTP (ipip-proto-4)
12:23:27.571492 IP 128.171.123.10 > 139.182.103.10: IP 10.244.23.31.http > 10.244.72.1.38164: Flags [P.], seq 11009:12289, ack 77, win 3, options [nop,nop,TS val 2759876462 ecr 1612975762], length 1280: HTTP (ipip-proto-4)
```

I'm trying to figure out where do packets go if those are targeted at 10.244.72.1. There's no such POD on the node

## Your Environment
* Calico version
3.1
* Orchestrator version (e.g. kubernetes, mesos, rkt):
kubernetes
* Operating System and version:
Centos 7.4

**Comment by ozdanborne** [comment]
I think this is the same issue as https://github.com/projectcalico/calico/issues/1709

**Comment by dimm0** [comment]
I saw that issue, and it looks like it is the same one, although I'm not completely understanding that other one.

**Comment by dimm0** [comment]
Is there a way to set a custom MTU for cni config file for the nodes with different MTU? I'm now doing it manually, and it's a pain...

**Comment by tmjd** [comment]
Assuming you don't need a custom MTU for every node but maybe have only like 2 different values to set you could create multiple configMaps and calico-node Daemonsets, one for each configuration you need then set labels on the K8s nodes then the appropriate Daemonset could select the correct nodes to run on based on the labels.

**Comment by dimm0** [comment]
It worked, thanks!
The first issue still remains

**Comment by Viral-** [comment]
I am also Facing the same issue with Kubeadm and calico. I have a cluster of 7 nodes. Every time I recreate cluster 2 calico nodes out of 7 has this issue. Pods deployed as part of these nodes cannot access services. Also, they cannot connect to the internet.

**Comment by tmjd** [comment]
@Viral- Are the pods that are not working host networked like the OP? Do regular (non-host networked) pods work as expected?  If it is all pods that are not working on those nodes, I think you should open a new issue and fill out the template and give any useful information about your setup.

@dimm0 Is 10.244.72.1 the address of one of the tunl0 interfaces on one of the hosts?  I'm not sure why it would be used without you specifying the address.

**Comment by Viral-** [comment]
I tried setting MTU to 1400 And it still doesn't seem to work.

**Comment by Viral-** [comment]
@tmjd  All pods are on hosts on the same network. Pod on which the calico nodes work as expected have no issues. but on the 2 nodes that go down. No pods deployed on those nodes with bad calico pods work.

**Comment by dimm0** [comment]
My case is fixed. The advise https://github.com/projectcalico/calico/issues/2026#issuecomment-411807715 worked for 1500 MTU hosts, and the hsot in question was fixed to support 9000. Should I close the ticket?
