### ISSUE TITLE
eBPF does not honor 0.0.0.0/0 in .spec.loadBalancerSourceRanges and drops packets

### ISSUE THREAD

**Issue by jonatasbaldin** [projectcalico/calico#11020]
Hi there 👋 

I have a curious situation here.

When deploying a Service (type LoadBalancer) with a public IP address in our managed infrastructure, the communication works with the following flow.

The traffic leaves the Pod directly to the Pod behind the Service LB. First question, **is this how it is supposed to be? Shouldn't the traffic be SNATed with the Node IP address?**

tcpdump from the Pod:
```
14:23:37.185793 eth0  Out IP 192.168.23.5.57046 > 192.168.23.4.80: Flags [S], seq 2565572660, win 64860, options [mss 1410,sackOK,TS val 1805107530 ecr 0,nop,wscale 7], length 0
14:23:37.185855 eth0  In  IP 192.168.23.4.80 > 192.168.23.5.57046: Flags [S.], seq 3531056027, ack 2565572661, win 64308, options [mss 1410,sackOK,TS val 1477306024 ecr 1805107530,nop,wscale 7], length 0
14:23:37.185864 eth0  Out IP 192.168.23.5.57046 > 192.168.23.4.80: Flags [.], ack 1, win 507, options [nop,nop,TS val 1805107531 ecr 1477306024], length 0
14:23:37.185916 eth0  Out IP 192.168.23.5.57046 > 192.168.23.4.80: Flags [P.], seq 1:76, ack 1, win 507, options [nop,nop,TS val 1805107531 ecr 1477306024], length 75: HTTP: GET / HTTP/1.1
14:23:37.185924 eth0  In  IP 192.168.23.4.80 > 192.168.23.5.57046: Flags [.], ack 76, win 502, options [nop,nop,TS val 1477306024 ecr 1805107531], length 0
...
```

Even when making a HTTP request to the LB public IP _directly from the Node_, the traffic goes directly to the Pod IP.

tcpdump from the Node where the Pod is:
```
14:27:52.322962 calid201d3ce0f7 Out IP 172.18.33.2.49338 > 192.168.23.4.http: Flags [S], seq 273384354, win 42340, options [mss 1460,sackOK,TS val 1854229871 ecr 0,nop,wscale 14], length 0
14:27:52.322988 calid201d3ce0f7 In  IP 192.168.23.4.http > 172.18.33.2.49338: Flags [S.], seq 420647958, ack 273384355, win 64308, options [mss 1410,sackOK,TS val 1313079763 ecr 1854229871,nop,wscale 7], length 0
14:27:52.324800 calid201d3ce0f7 Out IP 172.18.33.2.49338 > 192.168.23.4.http: Flags [.], ack 1, win 3, options [nop,nop,TS val 1854229873 ecr 1313079763], length 0
...
```

If I take a look at the BGP NAT map, I get this:
```
201.23.70.1 port 80 proto 6 id 22 count 1 local 1
        22:0     192.168.23.4:80
```

---

Now, when I create a second Service (type LoadBalancer) with a public IP address AND populating the `spec.loadBalancerSourceRanges` field **with values, including 0.0.0.0/0** (that's the only difference), the traffic goes _ from the the Pod directly to the LB public IP_:

tcpdump from the Pod:
```
14:20:04.501899 eth0  Out IP 192.168.23.5.40776 > 201.23.67.168.80: Flags [S], seq 3555663923, win 64860, options [mss 1410,sackOK,TS val 1719157930 ecr 0,nop,wscale 7], length 0
14:20:05.532821 eth0  Out IP 192.168.23.5.40776 > 201.23.67.168.80: Flags [S], seq 3555663923, win 64860, options [mss 1410,sackOK,TS val 1719158961 ecr 0,nop,wscale 7], length 0
14:20:06.556821 eth0  Out IP 192.168.23.5.40776 > 201.23.67.168.80: Flags [S], seq 3555663923, win 64860, options [mss 1410,sackOK,TS val 1719159985 ecr 0,nop,wscale 7], length 0
14:20:07.580823 eth0  Out IP 192.168.23.5.40776 > 201.23.67.168.80: Flags [S], seq 3555663923, win 64860, options [mss 1410,sackOK,TS val 1719161009 ecr 0,nop,wscale 7], length 0
```

tcpdump from the Node where the Pod is:
```
14:20:04.501904 cali76de21212d3 In  IP 192.168.23.5.40776 > 201.23.67.168.80: Flags [S], seq 3555663923, win 64860, options [mss 1410,sackOK,TS val 1719157930 ecr 0,nop,wscale 7], length 0
14:20:05.532834 cali76de21212d3 In  IP 192.168.23.5.40776 > 201.23.67.168.80: Flags [S], seq 3555663923, win 64860, options [mss 1410,sackOK,TS val 1719158961 ecr 0,nop,wscale 7], length 0
14:20:06.556836 cali76de21212d3 In  IP 192.168.23.5.40776 > 201.23.67.168.80: Flags [S], seq 3555663923, win 64860, options [mss 1410,sackOK,TS val 1719159985 ecr 0,nop,wscale 7], length 0
14:20:07.580840 cali76de21212d3 In  IP 192.168.23.5.40776 > 201.23.67.168.80: Flags [S], seq 3555663923, win 64860, options [mss 1410,sackOK,TS val 1719161009 ecr 0,nop,wscale 7], length 0
```

If I take a look at the BGP NAT map, I get the following. Differently from the previous LB, no NAT entry is created.
```
201.23.67.168 port 80 proto 6 id 20 count -1 local 0
```

---

Some debug info:

Tigera Operator `Installation`:
```spec:
  calicoNetwork:
    bgp: Enabled
    hostPorts: Enabled
    ipPools:
    - allowedUses:
      - Workload
      - Tunnel
      assignmentMode: Automatic
      blockSize: 24
      cidr: 192.168.0.0/16
      disableBGPExport: false
      disableNewAllocations: false
      encapsulation: VXLANCrossSubnet
      name: default-ipv4-ippool
      natOutgoing: Enabled
      nodeSelector: all()
    linuxDataplane: BPF
    multiInterfaceMode: None
    nodeAddressAutodetectionV4:
      kubernetes: NodeInternalIP
    windowsDataplane: Disabled
  cni:
    ipam:
      type: Calico
    type: Calico
  controlPlaneReplicas: 2
  flexVolumePath: /usr/libexec/kubernetes/kubelet-plugins/volume/exec/
  imagePullSecrets: []
  kubeletVolumePluginPath: None
  kubernetesProvider: ""
  logging:
    cni:
      logFileMaxAgeDays: 30
      logFileMaxCount: 10
      logFileMaxSize: 100Mi
      logSeverity: Info
  nodeUpdateStrategy:
    rollingUpdate:
      maxUnavailable: 1
    type: RollingUpdate
  nonPrivileged: Disabled
  registry: <redacted>
  variant: Calico
```

Each CP Node has a `FelixConfiguration`:
```
apiVersion: projectcalico.org/v3
kind: FelixConfiguration
metadata:
  name: <redacted>
spec:
  bpfLogLevel: ""
  deviceRouteSourceAddress: 172.40.1.123
```

---

1. Does anyone have any clue on what is happening here?
2. Is the first scenario how it is supposed to be?
3. Any places to look at/debug?
4. Any more information needed?

**Comment by jonatasbaldin** [comment]
**UPDATE**

I added the ClusterCIDR range to the `.spec.loadBalancerSourceRanges` and everything worked just fine.

That BFP NAT table gets updated:
```
201.23.67.168 port 80 proto 6 id 31 count 1 local 0
        31:0     192.168.20.3:80
```

Now, is this how it is supposed to work? Is there any magic behind Calico BPF that demands this configuration?

**Comment by jonatasbaldin** [comment]
**UPDATE**

I checked with `calico-node -bpf counters dump` that the `packets with unknown source` increments when the `.spec.loadBalancerSourceRanges` does not have the ClusterCIDR applied. When it has, the counter doesn't increment anymore.

```
+----------+--------------------------------+---------+--------+-----+
| CATEGORY |              TYPE              | INGRESS | EGRESS | XDP |
+----------+--------------------------------+---------+--------+-----+
| Accepted | by another program             |       0 |      6 | N/A |
|          | by failsafe                    |       0 |      0 | N/A |
|          | by policy                      |      65 |      0 | N/A |
| Dropped  | NAT source collision           |       0 |      0 | N/A |
|          | resolution failed              |         |        |     |
|          | by policy                      |       0 |      0 | N/A |
|          | failed decapsulation           |       0 |      0 | N/A |
|          | failed encapsulation           |       0 |      0 | N/A |
|          | failed to create conntrack     |       0 |      0 | N/A |
|          | incorrect checksum             |       0 |      0 | N/A |
|          | malformed IP packets           |       0 |      0 | N/A |
|          | packets hitting blackhole      |       0 |      0 | N/A |
|          | route                          |         |        |     |
|          | packets with unknown route     |       0 |      0 | N/A |
|          | packets with unknown source    |     252 |      0 | N/A |
|          | packets with unsupported IP    |       0 |      0 | N/A |
|          | options                        |         |        |     |
|          | too short packets              |       0 |      0 | N/A |
| Other    | packets hitting NAT source     |       0 |      0 | N/A |
|          | collision                      |         |        |     |
| Total    | packets                        |     737 |    244 | N/A |
+----------+--------------------------------+---------+--------+-----+
dumped cali76de21212d3 counters.
```

Now, I'd like to understand if Calico is indeed creating a DROP policy somewhere when the `loadBalancerSourceRanges` is populated and how I could check it (or disable it).

Thanks!

**Comment by tomastigera** [comment]
> The traffic leaves the Pod directly to the Pod behind the Service LB. First question, is this how it is supposed to be? Shouldn't the traffic be SNATed with the Node IP address?

Yes, pod to pod traffic is supposed to work like that. When [bpfConnectTimeLoadBalancing](https://docs.tigera.io/calico/latest/reference/resources/felixconfig#bpfConnectTimeLoadBalancing) is enabled (it is for TCP by default), the destination is resolved in the connect time and so it saves translating every single packet all the time.

There is no reason to SNAT with node IP even for *tables dataplanes, or is there?

**Comment by jonatasbaldin** [comment]
> Yes, pod to pod traffic is supposed to work like that. When [bpfConnectTimeLoadBalancing](https://docs.tigera.io/calico/latest/reference/resources/felixconfig#bpfConnectTimeLoadBalancing) is enabled (it is for TCP by default), the destination is resolved in the connect time and so it saves translating every single packet all the time.

Got it.

> There is no reason to SNAT with node IP even for *tables dataplanes, or is there?
Could you explain what you mean by `tables dataplanes`?

Also, a couple of questions:
1. When enabling the .spec.loadBalancerSourceRanges, I _believe_ Calico is creating policies to DROP egress traffic to addresses not listed there. Is this assumption correct? If so, how could I verify this policy existence?
2. If the above is true, is there a way to disable this policy and let the LB do the work? (that's how our CCM implements the .spec.loadBalancerSourceRanges, we create the ALLOW/DENY rules at the LB level)
3. In our tests, we verify that the address `0.0.0.0/0` is not respected in the `.spec.loadBalancerSourceRanges` field (traffic is not fully allowed to pass). I noticed this line on the [Calico's codebase](https://github.com/projectcalico/calico/blob/master/felix/bpf/proxy/syncer.go#L1009). I don't understand much of Calico's code, but it seems that it won't create a rule for this address. Is that correct? If so, why? During a debug, allowing this address might be super useful.

Thanks for all the help!

**Comment by tomastigera** [comment]
> 1. When enabling the .spec.loadBalancerSourceRanges, I _believe_ Calico is creating policies to DROP egress traffic to addresses not listed there. Is this assumption correct? If so, how could I verify this policy existence?

> `201.23.67.168 port 80 proto 6 id 20 count -1 local 0`

https://github.com/projectcalico/calico/blob/master/felix/bpf-gpl/nat_lookup.h#L107-L110

> 2. If the above is true, is there a way to disable this policy and let the LB do the work? (that's how our CCM implements the .spec.loadBalancerSourceRanges, we create the ALLOW/DENY rules at the LB level)

No, not possible to disable that other than removing the source ranges. Afaict specifying the source ranges is a request to drop other traffic, kind of poor man's firewalling. I guess if you do not specify the source ranges, but create a policy to allow/deny specific source, you get the same, but you are in full control.

> 3. In our tests, we verify that the address `0.0.0.0/0` is not respected in the `.spec.loadBalancerSourceRanges` field (traffic is not fully allowed to pass). I noticed this line on the [Calico's codebase](https://github.com/projectcalico/calico/blob/master/felix/bpf/proxy/syncer.go#L1009). I don't understand much of Calico's code, but it seems that it won't create a rule for this address. Is that correct? If so, why? During a debug, allowing this address might be super useful.> > Thanks for all the help!

This code is only excercised during startup when we are trying to reconcile what is written in the dataplane before we get all the updates from kubernetes. After we get a new service update from k8s, this is not relevant anymore.

This said, we may not be correctly implementing `0.0.0.0/0` I am looking into it.

Do I understand correctly that including the 0.0.0.0/0 the expected result it that any source is allowed while debugging, right?

**Comment by jonatasbaldin** [comment]
For all the answers, thanks!

> Do I understand correctly that including the 0.0.0.0/0 the expected result it that any source is allowed while debugging, right?

Yes.

**Comment by tomastigera** [comment]
The fix wil be in the upcoming 3.31. It may get into some older version, but you can also achieve the desired behaviour by deleting the source ranges while debugging.

**Comment by jonatasbaldin** [comment]
Thanks @tomastigera!

Just one more thing: since we cannot change this behavior, should Calico add the ClusterCIDR to the policy's allow list to allow traffic coming from within the Cluster to the LoadBalancer when the source ranges are enabled? 

It seems counter intuitive that, if the source range is enabled, I lose access to the LB from my internal Pods.

WDYT?
